title,link,item_text,date_published,google_alert_name
"Columbus Community Hospital says it""s providing breakdown of testing costs",https://www.google.com/url?rct=j&sa=t&url=https://plattevalley.newschannelnebraska.com/story/42143461/columbus-community-hospital-says-its-providing-breakdown-of-testing-costs&ct=ga&cd=CAIyHDQ1NzZkZjdlYTEzZTg0YTA6Y29tOmVuOlVTOlI&usg=AFQjCNHgIX0yMLmpeBMvdpUu-W2J1uq8SQ,"CCH""s charges for COVID-19 tests reflect the actual cost of the testing ... to $80 for the University of Nebraska Medical Center and Regional Pathology ... with the cost-sharing portion waived (i.e. copays, deductibles, coinsurance).",2020-05-18,Health Cost Sharing
The Medicare hospital payment system is broken: Coronavirus shows just how badly,https://www.google.com/url?rct=j&sa=t&url=https://www.nydailynews.com/opinion/ny-oped-the-medicare-hospital-payment-system-is-broken-20200518-px5nc3wbjrdk7mxf7kxua274kq-story.html&ct=ga&cd=CAIyHDQ1NzZkZjdlYTEzZTg0YTA6Y29tOmVuOlVTOlI&usg=AFQjCNE6EsepiLY_cGFyIf7tytMU4EFgPw,Patient cost-sharing measures like deductibles and copayments require the beneficiary to pay some portion of their medical bill. There is evidence...,2020-05-18,Health Cost Sharing
"They""re Coming for Our Birth Control—and Lying About It",https://www.google.com/url?rct=j&sa=t&url=https://msmagazine.com/2020/05/18/supreme-court-birth-control-trump-v-pennsylvania-theyre-coming-for-our-birth-control-and-lying-about-it/&ct=ga&cd=CAIyHDQ1NzZkZjdlYTEzZTg0YTA6Y29tOmVuOlVTOlI&usg=AFQjCNHFpSNeeuiaR4gZNdak2z5q4j2qUg,... mandate—the provision that requires employers to provide health insurance that covers a full range of birth control options without cost sharing.,2020-05-18,Health Cost Sharing
Health and Economy Baseline Estimates,https://www.google.com/url?rct=j&sa=t&url=https://www.americanactionforum.org/research/health-and-economy-baseline-estimates-2/&ct=ga&cd=CAIyHDQ1NzZkZjdlYTEzZTg0YTA6Y29tOmVuOlVTOlI&usg=AFQjCNGB7pbprUOZKTnuc3XOlOYXuiegLA,"As premiums and health care costs rise, H&amp;E expects plan choices in the ... It is important to note that, because of additional cost-sharing assistance,...",2020-05-18,Health Cost Sharing
"US slams WHO response to the coronavirus pandemic, says a failure by the UN ""cost many lives""",https://www.google.com/url?rct=j&sa=t&url=https://www.cnbc.com/2020/05/18/coronavirus-us-says-who-response-to-covid-19-cost-many-lives.html&ct=ga&cd=CAIyHDQ1NzZkZjdlYTEzZTg0YTA6Y29tOmVuOlVTOlI&usg=AFQjCNHvCNy87WGDhKby9NxhhVU5epVJZg,"""That failure cost many lives,"" Secretary of Health and Human Services Alex Azar said on the first ... ""We saw that WHO failed at its core mission of information sharing and transparency when member states do not act in good faith.",2020-05-18,Health Cost Sharing
The Unsung Benefits of the Inland Waterways,https://www.google.com/url?rct=j&sa=t&url=https://www.marinelink.com/news/unsung-benefits-inland-waterways-478589&ct=ga&cd=CAIyHDQ1NzZkZjdlYTEzZTg0YTA6Y29tOmVuOlVTOlI&usg=AFQjCNEDovAuDn3C4I5NRvnKWdv2IQySBQ,With developments in the current health crisis almost entirely consuming nearly ... If the deep water ports warrant a 75-25 cost share because of their...,2020-05-18,Health Cost Sharing
New COVID-19 screening and test app to help streamline safe return of workers,https://www.google.com/url?rct=j&sa=t&url=https://www.techrepublic.com/article/new-covid-19-screening-and-test-app-to-help-streamline-safe-return-of-workers/&ct=ga&cd=CAIyHDQ1NzZkZjdlYTEzZTg0YTA6Y29tOmVuOlVTOlI&usg=AFQjCNF0ZlHv1AmSX1wyeGPyfgzCpws06Q,"Health care information is managed by UnitedHealth Group and employers in accordance with occupational health laws, the company said. ... $2 billion; waiving cost-sharing for COVID-19 testing and treatment for US members of...",2020-05-18,Health Cost Sharing
Priority Health works to lower costs,https://www.google.com/url?rct=j&sa=t&url=https://grbj.com/news/health-care/priority-health-works-to-lower-costs/&ct=ga&cd=CAIyHDQ1NzZkZjdlYTEzZTg0YTA6Y29tOmVuOlVTOlI&usg=AFQjCNGi3cgwi7m9kIywqRAdejXKP9LK1g,Waiving cost-sharing for all Medicare Advantage members for in-person and telehealth primary care services from May 1 to Dec. 31; A 15% premium...,2020-05-18,Health Cost Sharing
Massive House Bill Proposes Mandatory Coverage of COVID-19 Vaccines and Therapies,https://www.google.com/url?rct=j&sa=t&url=https://www.jdsupra.com/legalnews/massive-house-bill-proposes-mandatory-78896/&ct=ga&cd=CAIyHDQ1NzZkZjdlYTEzZTg0YTA6Y29tOmVuOlVTOlI&usg=AFQjCNHgEExY_T3yP0qBoo6XoHsLifo83g,"As the COVID-19 public health crisis continues, it is sometimes easy to ... It would also prohibit such individuals from being charged any cost-sharing...",2020-05-18,Health Cost Sharing
Blue Cross and Blue Shield of Minnesota Increases Access to Care for Medicare Advantage ...,https://www.google.com/url?rct=j&sa=t&url=https://www.prnewswire.com/news-releases/blue-cross-and-blue-shield-of-minnesota-increases-access-to-care-for-medicare-advantage-members-301060860.html&ct=ga&cd=CAIyHDQ1NzZkZjdlYTEzZTg0YTA6Y29tOmVuOlVTOlI&usg=AFQjCNF3vXzyE1_GmqVcY4aeY-nLq2a9jA,"... to care for Medicare Advantage members by waiving member cost-sharing for in-network primary care, mental health and substance use office visits...",2020-05-18,Health Cost Sharing
States Lead The Way in Responding To COVID-19 And Advancing Innovative Health Policy ...,https://www.google.com/url?rct=j&sa=t&url=https://www.healthaffairs.org/do/10.1377/hblog20200513.980735/full&ct=ga&cd=CAIyHDQ1NzZkZjdlYTEzZTg0YTA6Y29tOmVuOlVTOlI&usg=AFQjCNGbGoMNUtVyOBLNYC1a1xba4lNO5g,New Jersey Governor Phil Murphy signed legislation requiring health insurers to offer plans that limit patient cost-sharing on prescription drugs. Price...,2020-05-18,Health Cost Sharing
"I""ve Been Calling For Greater Private Insurance Coverage Of COVID-19 Testing. I""ve Been Wrong.",https://www.google.com/url?rct=j&sa=t&url=https://www.healthaffairs.org/do/10.1377/hblog20200513.267462/full&ct=ga&cd=CAIyHDQ1NzZkZjdlYTEzZTg0YTA6Y29tOmVuOlVTOlI&usg=AFQjCNEutnHi_wF6qOxFMj-W3wHXb0KEVw,"... companies to cover and waive cost-sharing for COVID-19 tests, I cheered. ... protection in the event of unanticipated medical events or health issues.",2020-05-18,Health Cost Sharing
"Growing popularity of telehealth casts uncertainty over CT""s stable medical office market",https://www.google.com/url?rct=j&sa=t&url=https://www.hartfordbusiness.com/article/growing-popularity-of-telehealth-casts-uncertainty-over-cts-stable-medical-office-market&ct=ga&cd=CAIyHDQ1NzZkZjdlYTEzZTg0YTA6Y29tOmVuOlVTOlI&usg=AFQjCNEo016BV54sZbodi6n-veEqqxyFpw,"Like many hospital systems, Trinity Health Of New England has ... It""s not just that property is expensive (operating leases cost Trinity Health about $24 ... including Aetna and Cigna, have temporarily waived member cost-sharing for...",2020-05-18,Health Cost Sharing
How to save money and take control of your health care costs,https://www.google.com/url?rct=j&sa=t&url=https://www.inman.com/2020/05/18/how-to-save-money-and-take-control-of-your-healthcare-costs/&ct=ga&cd=CAIyHDQ1NzZkZjdlYTEzZTg0YTA6Y29tOmVuOlVTOlI&usg=AFQjCNHobdcmIjrq7h0B7KQIpT8SwBEjSQ,"With telemedicine, creatively blending traditional insurance and medical-cost-sharing, utilizing free discount drug memberships, and shopping for...",2020-05-18,Health Cost Sharing
Commentary on “Health spending under single-payer approaches”,https://www.google.com/url?rct=j&sa=t&url=https://www.brookings.edu/opinions/commentary-on-health-spending-under-single-payer-approaches/&ct=ga&cd=CAIyHDQ1NzZkZjdlYTEzZTg0YTA6Y29tOmVuOlVTOlI&usg=AFQjCNHRKGa7uZd6wH6W1mx1v_286Nohyg,Confusion over differences between federal and total spending and effects of lower patient cost sharing gets in the way of “apples-to-apples”...,2020-05-10,Health Cost Sharing
COVID-19 data sharing with law enforcement sparks concern,https://www.google.com/url?rct=j&sa=t&url=https://www.clickorlando.com/news/politics/2020/05/19/covid-19-data-sharing-with-law-enforcement-sparks-concern/&ct=ga&cd=CAIyGmU4MWY4MmViNmViOTg5MTE6Y29tOmVuOlVT&usg=AFQjCNHAbLzW1i-JuMj-vn_rY9l5-iUfWA,"Sharing the information does not violate medical privacy laws, under guidance issued by the U.S. Department of Health and Human Services. Law...",2020-05-19,Health Sharing
"Hotels revise touchpoints, service delivery to reflect new health, safety measures",https://www.google.com/url?rct=j&sa=t&url=https://www.ttgasia.com/2020/05/19/hotels-revise-touchpoints-service-delivery-to-reflect-new-health-safety-measures/&ct=ga&cd=CAIyGmU4MWY4MmViNmViOTg5MTE6Y29tOmVuOlVT&usg=AFQjCNEfUDIKJimnMP_RrdNuVcpkC-lXBw,"Among the changes, according to hoteliers who spoke to TTG Asia, are reduced sharing opportunities at F&amp;B outlets, increased availability of digital...",2020-05-19,Health Sharing
US Says WHO Failed at Core Mission of Information Sharing,https://www.google.com/url?rct=j&sa=t&url=https://www.bloomberg.com/news/videos/2020-05-19/u-s-says-who-failed-at-core-mission-of-information-sharing-video&ct=ga&cd=CAIyGmU4MWY4MmViNmViOTg5MTE6Y29tOmVuOlVT&usg=AFQjCNECZCkIi-ji-MBf3fRjkuRSsGPzIg,"U.S. Health and Human Services Secretary Alex Azar says the World Health Organization ""failed at its core mission of information sharing"" amid the...",2020-05-19,Health Sharing
Commentary: Beating COVID-19 in solidarity for health of all,https://www.google.com/url?rct=j&sa=t&url=http://www.xinhuanet.com/english/2020-05/19/c_139068848.htm&ct=ga&cd=CAIyGmU4MWY4MmViNmViOTg5MTE6Y29tOmVuOlVT&usg=AFQjCNFVaeDevpqVf8D23feRppaD4S3kdQ,"Beijing released the genome sequence at the earliest possible time, and has been sharing information and experience on epidemic containment with...",2020-05-19,Health Sharing
Ride share drivers fear driving during the pandemic,https://www.google.com/url?rct=j&sa=t&url=https://www.wqad.com/article/news/health/coronavirus/ride-share-drivers-fear-driving-during-the-pandemic/526-fecdf2fc-65c8-4c40-a22f-7fe6829605df&ct=ga&cd=CAIyGmU4MWY4MmViNmViOTg5MTE6Y29tOmVuOlVT&usg=AFQjCNGDFCAcft_QNhrpi6kGjwPShye1Ng,"He says many Quad City drivers have stopped working for ride-sharing apps. ""Many of them are hesitant to come outside and risk their health and...",2020-05-19,Health Sharing
Health Officials Expect More COVID-19 Outbreaks in Nursing Homes,https://www.google.com/url?rct=j&sa=t&url=https://www.kqed.org/science/1964548/health-officials-expect-more-covid-19-outbreaks-in-nursing-homes&ct=ga&cd=CAIyGmU4MWY4MmViNmViOTg5MTE6Y29tOmVuOlVT&usg=AFQjCNGmGib1UYr33MlumFa_3HkbKWNHqg,"share your story! KQED""s Ted Goldberg interviewed Science reporter Molly Peterson about the problem. These excerpts have been edited for length and...",2020-05-18,Health Sharing
Execs share key trends in healthcare marketing amid pandemic: 3 insights,https://www.google.com/url?rct=j&sa=t&url=https://www.beckershospitalreview.com/digital-marketing/execs-share-key-trends-in-healthcare-marketing-amid-pandemic-3-insights.html&ct=ga&cd=CAIyGmU4MWY4MmViNmViOTg5MTE6Y29tOmVuOlVT&usg=AFQjCNH38M3HuBVqL2XpsK2hfbXCwxYN6g,"Now, three healthcare marketing professionals share key trends in their marketing efforts during the pandemic. Cynthia Neiman. Chief Marketing...",2020-05-18,Health Sharing
Health-care workers share our trauma during the coronavirus pandemic – on top of their own,https://www.google.com/url?rct=j&sa=t&url=https://theconversation.com/health-care-workers-share-our-trauma-during-the-coronavirus-pandemic-on-top-of-their-own-137887&ct=ga&cd=CAIyGmU4MWY4MmViNmViOTg5MTE6Y29tOmVuOlVT&usg=AFQjCNHyDun9YctL_LgEgAWh1YWibKmD5g,Health-care staff are trained to deal with whatever comes through the hospital doors. But COVID-19 is a completely different ballgame. During this...,2020-05-18,Health Sharing
"LunaPBC, Genetic Alliance create drug discovery platform for rare epilepsy",https://www.google.com/url?rct=j&sa=t&url=https://medcitynews.com/2020/05/lunapbc-genetic-alliance-create-drug-discovery-platform-for-rare-epilepsy/&ct=ga&cd=CAIyGmU4MWY4MmViNmViOTg5MTE6Y29tOmVuOlVT&usg=AFQjCNGz3tqJuSML_SlPbK9bO8phbzxY2g,"If they choose to enroll, they are then asked to take an initial survey and upload any medical data they are comfortable sharing, including health...",2020-05-18,Health Sharing
"Guide to Healthcare""s Security Tactical Crisis Response, Amid COVID-19",https://www.google.com/url?rct=j&sa=t&url=https://healthitsecurity.com/news/guide-to-healthcares-security-tactical-crisis-response-amid-covid-19&ct=ga&cd=CAIyGmU4MWY4MmViNmViOTg5MTE6Y29tOmVuOlVT&usg=AFQjCNGAnjMpd2eKSTIjaAj8OGZH1vXiXg,"May 18, 2020 - The Healthcare and Public Health Sector Coordinating Council (HSCC) and the Health Information Sharing and Analysis Center...",2020-05-18,Health Sharing
Aled Davies praises Craig Bellamy for sharing mental health struggle,https://www.google.com/url?rct=j&sa=t&url=https://www.bbc.co.uk/sport/athletics/52713846&ct=ga&cd=CAIyGmU4MWY4MmViNmViOTg5MTE6Y29tOmVuOlVT&usg=AFQjCNEQIoEJG_ilA9whvNy3PZW5YXE2sQ,Paralympic and world champion shot put and discus athlete Aled Davies has praised Craig Bellamy for revealing he has been diagnosed with...,2020-05-18,Health Sharing
"One of the country""s top health information exchanges adds image-sharing capabilities",https://www.google.com/url?rct=j&sa=t&url=https://www.healthimaging.com/topics/imaging-informatics/top-health-information-exchanges-adds-image-sharing&ct=ga&cd=CAIyGmU4MWY4MmViNmViOTg5MTE6Y29tOmVuOlVT&usg=AFQjCNHN2A8RDwf384bMwyUVwvOkxx8pfA,One of the largest health information exchanges in the country has expanded its offerings to allow healthcare providers across Colorado to share...,2020-05-18,Health Sharing
"Instagram Debuts Guides Feature With Initial Focus on Wellness, Mental Health",https://www.google.com/url?rct=j&sa=t&url=https://www.adweek.com/digital/instagram-debuts-guides-feature-with-initial-focus-on-wellness-mental-health/&ct=ga&cd=CAIyGmU4MWY4MmViNmViOTg5MTE6Y29tOmVuOlVT&usg=AFQjCNEjoBFUauupVHjhariKjjk6wf7_TQ,"Guides can also be shared in users"" Stories or via Instagram Direct messages by tapping the share button in the upper-right corner. Instagram. Instagram...",2020-05-18,Health Sharing
"AI Deployed To Help Expand India""s Healthcare Services",https://www.google.com/url?rct=j&sa=t&url=https://www.pymnts.com/news/artificial-intelligence/2020/ai-helps-expand-india-healthcare-services/&ct=ga&cd=CAIyGmU4MWY4MmViNmViOTg5MTE6Y29tOmVuOlVT&usg=AFQjCNHfh7aNfzo4KS_uc0ZXYy8qv5FqYg,"Healthcare personnel shortages in India are being filled by artificial ... to stop hospitals from sharing data with AI healthcare companies, according to...",2020-05-18,Health Sharing
Azar Blames Deaths On WHO In Fiery Speech To World Health Assembly,https://www.google.com/url?rct=j&sa=t&url=https://www.forbes.com/sites/nicholasreimann/2020/05/18/azar-blames-deaths-on-who-in-fiery-speech-to-world-health-assembly/&ct=ga&cd=CAIyGmU4MWY4MmViNmViOTg5MTE6Y29tOmVuOlVT&usg=AFQjCNFj-HIfXya5CgrtM2jNloclqKCQcw,"In a virtual address to the World Health Assembly, Azar said that the WHO ""failed at its core mission of sharing and transparency” as coronavirus...",2020-05-18,Health Sharing
"Volunteers plant ""health and holiness"" garden",https://www.google.com/url?rct=j&sa=t&url=https://www.selmatimesjournal.com/2020/05/18/volunteers-plant-health-and-holiness-garden/&ct=ga&cd=CAIyGmU4MWY4MmViNmViOTg5MTE6Y29tOmVuOlVT&usg=AFQjCNGPTLNzBN3NUubrtB6kVVAIngC0cw,"“They won""t just be getting healthy food though,” said Grayson. “We""ll be sharing lifestyle tips with them as well. We""re taking care of the whole person.”",2020-05-18,Health Sharing
Kroger Health will provide free COVID-19 testing at Camp Jordan this week,https://www.google.com/url?rct=j&sa=t&url=https://www.timesfreepress.com/news/local/story/2020/may/18/kroger-health-provide-free-covid-19-drive-thru-testing-camp-jordan-week/523220/&ct=ga&cd=CAIyGmU4MWY4MmViNmViOTg5MTE6Y29tOmVuOlVT&usg=AFQjCNHqMK-MA9urNskQ6GeyVudJOTWnyg,"Kroger Health is partnering with the City of East Ridge, Cherokee Health ... Free Press login credentials to begin sharing your thoughts and opinion.",2020-05-18,Health Sharing
VeChain and I-Dante Partnered to Create Blockchain Enabled Medical Data Management Platform ...,https://www.google.com/url?rct=j&sa=t&url=https://finance.yahoo.com/news/vechain-dante-partnered-create-blockchain-150000793.html&ct=ga&cd=CAIyGmU4MWY4MmViNmViOTg5MTE6Y29tOmVuOlVT&usg=AFQjCNHxj3LZdmBtYoIh39CdcBchYZ0guw,Data can only be shared to 3rd parties with the permission of the owner. Bridging Trust In The Healthcare Sector Blockchain is being posited as the next...,2020-05-18,Health Sharing
"Xi Defends China""s COVID-19 Actions, Backs ""Impartial"" Review Of Pandemic Response",https://www.google.com/url?rct=j&sa=t&url=https://wamu.org/story/20/05/18/xi-defends-chinas-covid-19-actions-backs-impartial-review-of-pandemic-response/&ct=ga&cd=CAIyGmU4MWY4MmViNmViOTg5MTE6Y29tOmVuOlVT&usg=AFQjCNFCMED3xKmqkzRjxdUIPsRRr6toTQ,"Speaking at a World Health Organization conference via video, Xi said that if China succeeds in developing a vaccine, it will share it widely. “All along...",2020-05-18,Health Sharing
"Texas hospital district deploys system to collect, share COVID-19 data in real time",https://www.google.com/url?rct=j&sa=t&url=https://www.beckershospitalreview.com/data-analytics/texas-hospital-district-deploys-system-to-collect-share-covid-19-data-in-real-time.html&ct=ga&cd=CAIyGmU4MWY4MmViNmViOTg5MTE6Y29tOmVuOlVT&usg=AFQjCNH1QRZlmmVDBVntDvdII_lcNS63Dw,"The online symptom screener creates medical records data on every hospital district employee before, during and after each shift. Once the employee...",2020-05-18,Health Sharing
LGBTQ+ fights for equal healthcare,https://www.google.com/url?rct=j&sa=t&url=https://www.cuestonian.com/lgbtq-fights-for-equal-healthcare/&ct=ga&cd=CAIyHDcyMWE5ZGFiNjRlZGE3MTM6Y29tOmVuOlVTOlI&usg=AFQjCNErp4xoocsDka-v7YSk91vrJ85lyA,"... utilizing the principles of collectively pooled underwriting, risk sharing, shared expenses, health management, and cost-containment services.",2020-05-18,Healthcare Cost Sharing
New COVID-19 screening and test app to help streamline safe return of workers,https://www.google.com/url?rct=j&sa=t&url=https://www.techrepublic.com/article/new-covid-19-screening-and-test-app-to-help-streamline-safe-return-of-workers/&ct=ga&cd=CAIyHDcyMWE5ZGFiNjRlZGE3MTM6Y29tOmVuOlVTOlI&usg=AFQjCNF0ZlHv1AmSX1wyeGPyfgzCpws06Q,"Health care information is managed by UnitedHealth Group and employers in accordance with occupational health laws, the company said. ... $2 billion; waiving cost-sharing for COVID-19 testing and treatment for US members of...",2020-05-18,Healthcare Cost Sharing
VeChain and I-Dante Partnered to Create Blockchain Enabled Medical Data Management Platform ...,https://www.google.com/url?rct=j&sa=t&url=https://finance.yahoo.com/news/vechain-dante-partnered-create-blockchain-150000793.html&ct=ga&cd=CAIyHDcyMWE5ZGFiNjRlZGE3MTM6Y29tOmVuOlVTOlI&usg=AFQjCNHxj3LZdmBtYoIh39CdcBchYZ0guw,"This dilemma has led to an urgent need for a low-cost yet highly-efficient ... while complying with regulations on the use and sharing of patient data,...",2020-05-18,Healthcare Cost Sharing
Blue Cross and Blue Shield of Minnesota Increases Access to Care for Medicare Advantage ...,https://www.google.com/url?rct=j&sa=t&url=https://www.prnewswire.com/news-releases/blue-cross-and-blue-shield-of-minnesota-increases-access-to-care-for-medicare-advantage-members-301060860.html&ct=ga&cd=CAIyHDcyMWE5ZGFiNjRlZGE3MTM6Y29tOmVuOlVTOlI&usg=AFQjCNF3vXzyE1_GmqVcY4aeY-nLq2a9jA,"... to care for Medicare Advantage members by waiving member cost-sharing for in-network primary care, mental health and substance use office visits...",2020-05-18,Healthcare Cost Sharing
"Growing popularity of telehealth casts uncertainty over CT""s stable medical office market",https://www.google.com/url?rct=j&sa=t&url=https://www.hartfordbusiness.com/article/growing-popularity-of-telehealth-casts-uncertainty-over-cts-stable-medical-office-market&ct=ga&cd=CAIyHDcyMWE5ZGFiNjRlZGE3MTM6Y29tOmVuOlVTOlI&usg=AFQjCNEo016BV54sZbodi6n-veEqqxyFpw,"Like many hospital systems, Trinity Health Of New England has ... It""s not just that property is expensive (operating leases cost Trinity Health about $24 ... including Aetna and Cigna, have temporarily waived member cost-sharing for...",2020-05-18,Healthcare Cost Sharing
How to save money and take control of your health care costs,https://www.google.com/url?rct=j&sa=t&url=https://www.inman.com/2020/05/18/how-to-save-money-and-take-control-of-your-healthcare-costs/&ct=ga&cd=CAIyHDcyMWE5ZGFiNjRlZGE3MTM6Y29tOmVuOlVTOlI&usg=AFQjCNHobdcmIjrq7h0B7KQIpT8SwBEjSQ,"With telemedicine, creatively blending traditional insurance and medical-cost-sharing, utilizing free discount drug memberships, and shopping for...",2020-05-18,Healthcare Cost Sharing
COVID-19 data sharing with law enforcement sparks concern,https://www.google.com/url?rct=j&sa=t&url=https://www.startribune.com/covid-19-data-sharing-with-law-enforcement-sparks-concern/570585212/&ct=ga&cd=CAIyHDc5M2E3YWM0ZTJjZTM4OWY6Y29tOmVuOlVTOlI&usg=AFQjCNGHs-doYE5_gllcFjE2DRbeOd8I2w,"Sharing the information does not violate medical privacy laws, under guidance issued by the U.S. Department of Health and Human Services.",2020-05-19,Medical Sharing
UW Medicine announces furloughs due to COVID-19 costs,https://www.google.com/url?rct=j&sa=t&url=https://newsroom.uw.edu/news/uw-medicine-announces-furloughs-due-covid-19-costs&ct=ga&cd=CAIyHDc5M2E3YWM0ZTJjZTM4OWY6Y29tOmVuOlVTOlI&usg=AFQjCNF9E0mManjque6lHxLrkTu2CJOiOQ,"... University of Washington Medical Center campuses, UW Neighborhood Clinics, Faculty Practice Plan Services, UW Medicine shared services and...",2020-05-18,Medical Sharing
Execs share key trends in healthcare marketing amid pandemic: 3 insights,https://www.google.com/url?rct=j&sa=t&url=https://www.beckershospitalreview.com/digital-marketing/execs-share-key-trends-in-healthcare-marketing-amid-pandemic-3-insights.html&ct=ga&cd=CAIyHDc5M2E3YWM0ZTJjZTM4OWY6Y29tOmVuOlVTOlI&usg=AFQjCNH38M3HuBVqL2XpsK2hfbXCwxYN6g,"Now, three healthcare marketing professionals share key trends in their marketing efforts during the pandemic. Cynthia Neiman. Chief Marketing...",2020-05-18,Medical Sharing
Health-care workers share our trauma during the coronavirus pandemic – on top of their own,https://www.google.com/url?rct=j&sa=t&url=https://theconversation.com/health-care-workers-share-our-trauma-during-the-coronavirus-pandemic-on-top-of-their-own-137887&ct=ga&cd=CAIyHDc5M2E3YWM0ZTJjZTM4OWY6Y29tOmVuOlVTOlI&usg=AFQjCNHyDun9YctL_LgEgAWh1YWibKmD5g,Health-care staff are trained to deal with whatever comes through the hospital doors. But COVID-19 is a completely different ballgame. During this...,2020-05-18,Medical Sharing
"One of the country""s top health information exchanges adds image-sharing capabilities",https://www.google.com/url?rct=j&sa=t&url=https://www.healthimaging.com/topics/imaging-informatics/top-health-information-exchanges-adds-image-sharing&ct=ga&cd=CAIyHDc5M2E3YWM0ZTJjZTM4OWY6Y29tOmVuOlVTOlI&usg=AFQjCNHN2A8RDwf384bMwyUVwvOkxx8pfA,One of the largest health information exchanges in the country has expanded its offerings to allow healthcare providers across Colorado to share...,2020-05-18,Medical Sharing
"AI Deployed To Help Expand India""s Healthcare Services",https://www.google.com/url?rct=j&sa=t&url=https://www.pymnts.com/news/artificial-intelligence/2020/ai-helps-expand-india-healthcare-services/&ct=ga&cd=CAIyHDc5M2E3YWM0ZTJjZTM4OWY6Y29tOmVuOlVTOlI&usg=AFQjCNHfh7aNfzo4KS_uc0ZXYy8qv5FqYg,"Healthcare personnel shortages in India are being filled by artificial ... to stop hospitals from sharing data with AI healthcare companies, according to...",2020-05-18,Medical Sharing
VeChain and I-Dante Partnered to Create Blockchain Enabled Medical Data Management Platform ...,https://www.google.com/url?rct=j&sa=t&url=https://finance.yahoo.com/news/vechain-dante-partnered-create-blockchain-150000793.html&ct=ga&cd=CAIyHDc5M2E3YWM0ZTJjZTM4OWY6Y29tOmVuOlVTOlI&usg=AFQjCNHxj3LZdmBtYoIh39CdcBchYZ0guw,Data can only be shared to 3rd parties with the permission of the owner. Bridging Trust In The Healthcare Sector Blockchain is being posited as the next...,2020-05-18,Medical Sharing
Veterans benefit from new health data sharing,https://www.google.com/url?rct=j&sa=t&url=https://www.blogs.va.gov/VAntage/74796/veterans-benefit-new-health-data-sharing/&ct=ga&cd=CAIyHDc5M2E3YWM0ZTJjZTM4OWY6Y29tOmVuOlVTOlI&usg=AFQjCNGNovJs7aVIn9gXuKxOki_uTFAPcg,VA and DOD health care providers can review records from external partners for continuity of care. The joint HIE can reduce the burden on Veterans to...,2020-05-18,Medical Sharing
How to save money and take control of your health care costs,https://www.google.com/url?rct=j&sa=t&url=https://www.inman.com/2020/05/18/how-to-save-money-and-take-control-of-your-healthcare-costs/&ct=ga&cd=CAIyHDc5M2E3YWM0ZTJjZTM4OWY6Y29tOmVuOlVTOlI&usg=AFQjCNHobdcmIjrq7h0B7KQIpT8SwBEjSQ,"With telemedicine, creatively blending traditional insurance and medical-cost-sharing, utilizing free discount drug memberships, and shopping for...",2020-05-18,Medical Sharing
