title,link,item_text,date_published,google_alert_name
Why Zomedica Stock Surged Today,https://www.google.com/url?rct=j&sa=t&url=https://www.nasdaq.com/articles/why-zomedica-stock-surged-today-2021-02-05&ct=ga&cd=CAIyHDc5M2E3YWM0ZTJjZTM4OWY6Y29tOmVuOlVTOlI&usg=AFQjCNGs548MZztjY3_JzzeXZt8xx9T6Ow,"As of 12:25 p.m. EST, the veterinary health company""s stock price was up more than 24%. So what. Zomedica appears to have caught the attention of...",2021-02-05,Medical Sharing
Sharing Super Bowl Dips During A Pandemic Should Be Illegal,https://www.google.com/url?rct=j&sa=t&url=https://www.refinery29.com/en-us/2021/02/10295945/super-bowl-party-safety-tips-covid&ct=ga&cd=CAIyHDc5M2E3YWM0ZTJjZTM4OWY6Y29tOmVuOlVTOlI&usg=AFQjCNFz-MfDQRKB-yHVfQVGMywFITi0wg,"There""s precedent for a post-Super Bowl spike in disease, notes Ginny Boos, PhD, RN, director of infection prevention at Saint Luke""s Health System in...",2021-02-05,Medical Sharing
HMS Ranked Best in KLAS for Care Management Solutions (Payer) Second Year in a Row,https://www.google.com/url?rct=j&sa=t&url=https://www.streetinsider.com/Globe%2BNewswire/HMS%2BRanked%2BBest%2Bin%2BKLAS%2Bfor%2BCare%2BManagement%2BSolutions%2B%2528Payer%2529%25C2%25A0Second%2BYear%2Bin%2Ba%2BRow/17921888.html&ct=ga&cd=CAIyHDc5M2E3YWM0ZTJjZTM4OWY6Y29tOmVuOlVTOlI&usg=AFQjCNFw3drieOMmeK6uOMeJaRDKD-V7vw,"“Each year, thousands of healthcare professionals across the globe take the time to share their voices with KLAS. They know that sharing their...",2021-02-05,Medical Sharing
Dr. Fauci shares the only safe way to eat at a restaurant during the coronavirus pandemic,https://www.google.com/url?rct=j&sa=t&url=https://bgr.com/posts/5904191/c586fc-dr-fauci-shares-the-only-safe-way-to-eat-at-a-restaurant-during-the-coronavirus-pandemic/&ct=ga&cd=CAIyHDc5M2E3YWM0ZTJjZTM4OWY6Y29tOmVuOlVTOlI&usg=AFQjCNF0xYOM7MkVW0V-UJCsWe21VMdCDw,Public health experts like White House chief medical adviser Dr. Anthony Fauci are warning people to not let their guard down right now and to...,2021-02-05,Medical Sharing
Is digital healthcare the answer in Hong Kong?,https://www.google.com/url?rct=j&sa=t&url=https://www.laingbuissonnews.com/healthcare-markets-international-content/legal-healthcare-markets-international-content/is-digital-healthcare-the-answer-in-hong-kong/&ct=ga&cd=CAIyHDc5M2E3YWM0ZTJjZTM4OWY6Y29tOmVuOlVTOlI&usg=AFQjCNFW0ssEj-V4dXfldODw3OYgOeY29Q,"Electronic Health Record Sharing System (eHRSS); DoctorNow; Pulse by ... patient and proper authorisation, to view and share the electronic health",2021-02-05,Medical Sharing
DSS Provides Update on Impact BioMedical Share Dividend,https://www.google.com/url?rct=j&sa=t&url=https://www.streetinsider.com/Globe%2BNewswire/DSS%2BProvides%2BUpdate%2Bon%2BImpact%2BBioMedical%2BShare%2BDividend/17918460.html&ct=ga&cd=CAIyHDc5M2E3YWM0ZTJjZTM4OWY6Y29tOmVuOlVTOlI&usg=AFQjCNHw44mbVLsRaqtG6cb7pU3lE1DHPg,"... direct marketing, healthcare, real estate, and securitized digital assets, today announced the record date for its previously announced special share...",2021-02-04,Medical Sharing
"Medical Terminology Sharing Market 2021-2026 SWOT Analysis, Outlook, By Top Key Players ...",https://www.google.com/url?rct=j&sa=t&url=https://neighborwebsj.com/uncategorized/2430164/medical-terminology-sharing-market-2021-2026-swot-analysis-outlook-by-top-key-playerswolters-kluwer-intelligent-medical-objects-apelon-clinical-architecture-3m-carecom-bitac-b2i-healthcare-bt-clini/&ct=ga&cd=CAIyHDc5M2E3YWM0ZTJjZTM4OWY6Y29tOmVuOlVTOlI&usg=AFQjCNHq6QP6JOy82PJqWbUGGI3h0ToeiA,“A thorough investigative guide to assess multiple market developments in Global Medical Terminology Sharing Market has been recently compiled in...,2021-02-04,Medical Sharing
Healthcare Analytics Market is expected to grow at a CAGR of 27.84% over the Forecast Period ...,https://www.google.com/url?rct=j&sa=t&url=https://ksusentinel.com/2021/02/06/healthcare-analytics-market-is-expected-to-grow-at-a-cagr-of-27-84-over-the-forecast-period-owing-to-growing-advancements-patient-data-technology-says-absolute-markets-insights/&ct=ga&cd=CAIyHDc5M2E3YWM0ZTJjZTM4OWY6Y29tOmVuOlVTOlI&usg=AFQjCNGjctZfHOiOzLOvxmrBLQyZ0mMQxw,Advances in technology that facilitate the sharing of information and enhance compliance with Health Insurance Portability and Accountability (HIPAA)...,2021-01-11,Medical Sharing
