title,link,item_text,date_published,google_alert_name
"12 Health Care Stocks Moving In Friday""s Pre-Market Session",https://www.google.com/url?rct=j&sa=t&url=https://www.benzinga.com/pre-market-outlook/21/03/20252257/12-health-care-stocks-moving-in-fridays-pre-market-session&ct=ga&cd=CAIyHDc5M2E3YWM0ZTJjZTM4OWY6Y29tOmVuOlVTOlI&usg=AFQjCNG9uofYyk-PEliqR3Qwhi_FH9YQUw,The market value of their outstanding shares is at $1.5 billion. ADC Therapeutics (NYSE:ADCT) stock moved upwards by 8.97% to $31.8. The market...,2021-03-19,Medical Sharing
"Double Medical Pendant Market 2021 Size, Share Industry Trends, Growth, Development Status ...",https://www.google.com/url?rct=j&sa=t&url=https://www.mccourier.com/double-medical-pendant-market-2021-size-share-industry-trends-growth-development-status-future-plans-analysis-by-2027-key-companies-analysis-bourbon-hunan-taiyanglong-medical-modul-technik-pa-2/&ct=ga&cd=CAIyHDc5M2E3YWM0ZTJjZTM4OWY6Y29tOmVuOlVTOlI&usg=AFQjCNHhhYHGvplYnMnrH15oA9hsUz_rFQ,Bourbon; Hunan taiyanglong medical; Modul technik; Pax Medical Instrument; Heal Force; Hill-Rom; Johnson Medical; Megasan Medical Gas Systems...,2021-03-19,Medical Sharing
"Double Medical Pendant Market 2021 Size, Share Industry Trends, Growth, Development Status ...",https://www.google.com/url?rct=j&sa=t&url=https://www.mccourier.com/double-medical-pendant-market-2021-size-share-industry-trends-growth-development-status-future-plans-analysis-by-2027-key-companies-analysis-bourbon-hunan-taiyanglong-medical-modul-technik-pa/&ct=ga&cd=CAIyHDc5M2E3YWM0ZTJjZTM4OWY6Y29tOmVuOlVTOlI&usg=AFQjCNHGY0tfCvxiXOcir2dpSI5MNfE9Sw,"Double Medical Pendant Market 2021 Size, Share Industry Trends, Growth, Development Status, Future Plans Analysis by 2027| Key Companies...",2021-03-19,Medical Sharing
"Dialysis Powder Market 2021 Industry Size, Share, Growth and Top Companies Analysis- Asahi ...",https://www.google.com/url?rct=j&sa=t&url=https://ksusentinel.com/2021/03/19/dialysis-powder-market-2021-industry-size-share-growth-and-top-companies-analysis-asahi-kasei-medical-baxter-international-b-braun-melsungen-davita-kidney-care-diaverum-etc/&ct=ga&cd=CAIyHDc5M2E3YWM0ZTJjZTM4OWY6Y29tOmVuOlVTOlI&usg=AFQjCNGV3yvGybzM8vLkd_FlJnJ23gIW6g,Some of the prominent companies that are covered in this report: Asahi Kasei Medical; Baxter International; B. Braun Melsungen; DaVita Kidney Care...,2021-03-19,Medical Sharing
"Cardiac Medical Devices Market 2021 Will Reflect Significant Growth in Future with Size, Share ...",https://www.google.com/url?rct=j&sa=t&url=https://ksusentinel.com/2021/03/19/cardiac-medical-devices-market-2021-will-reflect-significant-growth-in-future-with-size-share-growth-and-key-companies-analysis-boston-scientific-livanova-medtronic-st-jude-medical-biotronik/&ct=ga&cd=CAIyHDc5M2E3YWM0ZTJjZTM4OWY6Y29tOmVuOlVTOlI&usg=AFQjCNEqneK8-ODIvFcqnnbQbMEI-bCk7A,Boston Scientific; LivaNova; Medtronic; St. Jude Medical; Biotronik; Cardiac Science ... Which product segment will grab a substantial share?,2021-03-19,Medical Sharing
"Medical X-Ray Films Market 2021 Is Booming Across the Globe by Share, Size, Growth, Segments ...",https://www.google.com/url?rct=j&sa=t&url=https://ksusentinel.com/2021/03/19/medical-x-ray-films-market-2021-is-booming-across-the-globe-by-share-size-growth-segments-and-forecast-to-2027-top-players-analysis-fujifilm-konica-minolta-agfa-carestream-health-codonics-e/&ct=ga&cd=CAIyHDc5M2E3YWM0ZTJjZTM4OWY6Y29tOmVuOlVTOlI&usg=AFQjCNE8I9mJ0dFc0R-pH89WgEk-7Wdj6A,"Medical X-Ray Films Market 2021 Is Booming Across the Globe by Share, Size, Growth, Segments and Forecast to 2027 | Top Players Analysis-...",2021-03-19,Medical Sharing
"Deep Hyperthermia Devices Market 2021 Industry Size, Share, Growth and Top Companies ...",https://www.google.com/url?rct=j&sa=t&url=https://ksusentinel.com/2021/03/19/deep-hyperthermia-devices-market-2021-industry-size-share-growth-and-top-companies-analysis-pyrexar-medical-celsius42-oncotherm-andromedic-vinita-etc/&ct=ga&cd=CAIyHDc5M2E3YWM0ZTJjZTM4OWY6Y29tOmVuOlVTOlI&usg=AFQjCNE1giLMpGdXwDitn1kUwcVYyc8-ig,Some of the major companies that are covered in this report: Pyrexar Medical; Celsius42; Oncotherm; Andromedic; Vinita; Perseon; Nanjing Greathope...,2021-03-19,Medical Sharing
"Finger Orthotics Market 2021 Industry Size, Share, Growth and Top Companies Analysis- Becker ...",https://www.google.com/url?rct=j&sa=t&url=https://ksusentinel.com/2021/03/19/finger-orthotics-market-2021-industry-size-share-growth-and-top-companies-analysis-becker-orthopedic-bort-medical-dicarre-novamed-medical-products-oped-etc/&ct=ga&cd=CAIyHDc5M2E3YWM0ZTJjZTM4OWY6Y29tOmVuOlVTOlI&usg=AFQjCNFGTu7BopcW_QP7DPhxpdLQt6QzMA,BORT Medical; Dicarre; Novamed Medical Products; OPED; PROTUNIX; Saebo; SANTEMOL Group Medikal; Tiburon Medical Enterprises. *Note:...,2021-03-19,Medical Sharing
"Medical Vacuum Regulator Market 2021 Size, Share Industry Trends, Growth, Development Status ...",https://www.google.com/url?rct=j&sa=t&url=https://www.mccourier.com/medical-vacuum-regulator-market-2021-size-share-industry-trends-growth-development-status-future-plans-analysis-by-2027-key-companies-analysis-ohio-medical-amico-precision-medical-air-liquid/&ct=ga&cd=CAIyHDc5M2E3YWM0ZTJjZTM4OWY6Y29tOmVuOlVTOlI&usg=AFQjCNFTkvtp9u0DBP3dOCzRADJVg6wagw,Ohio Medical; Amico; Precision Medical; Air Liquid Healthcare; Integral; Allied Healthcare Products; Teko. *Note: Additional companies can be included...,2021-03-19,Medical Sharing
"Advanced Visualization Systems Market 2021 Is Booming Across the Globe by Share, Size, Growth ...",https://www.google.com/url?rct=j&sa=t&url=https://ksusentinel.com/2021/03/19/advanced-visualization-systems-market-2021-is-booming-across-the-globe-by-share-size-growth-segments-and-forecast-to-2027-top-players-analysis-ge-healthcare-olympus-philips-healthcare-siemens/&ct=ga&cd=CAIyHDc5M2E3YWM0ZTJjZTM4OWY6Y29tOmVuOlVTOlI&usg=AFQjCNFTC7eOeDX-wniUFaUBhdmouyrqNQ,Some of the prominent companies that are covered in this report: GE Healthcare; Olympus; Philips Healthcare; Siemens Heathineers; Toshiba Medical...,2021-03-19,Medical Sharing
"Neuro-Oncological Diseases Device Market 2021 Industry Size, Share, Growth and Top ...",https://www.google.com/url?rct=j&sa=t&url=https://ksusentinel.com/2021/03/19/neuro-oncological-diseases-device-market-2021-industry-size-share-growth-and-top-companies-analysis-siemens-healthcare-philips-healthcare-toshiba-medical-ge-healthcare-hitachi-medical-etc-2/&ct=ga&cd=CAIyHDc5M2E3YWM0ZTJjZTM4OWY6Y29tOmVuOlVTOlI&usg=AFQjCNGMM3akv_wcVgyviVQx4pPr75Ritg,Siemens Healthcare; Philips Healthcare; Toshiba Medical; GE Healthcare; Hitachi Medical. *Note: Additional companies can be included on request.,2021-03-19,Medical Sharing
