title,link,item_text,date_published,google_alert_name
Healthcare IT Market Newer segments of application 2025,https://www.google.com/url?rct=j&sa=t&url=https://icotodaymagazine.com/coronavirus/32995/healthcare-it-market-newer-segments-of-application-2025/&ct=ga&cd=CAIyHDQ1NzZkZjdlYTEzZTg0YTA6Y29tOmVuOlVTOlI&usg=AFQjCNEFM1x5s9eMLcM6jFiIaYLxCom3Qw,"Healthcare IT provides secured sharing of patient information for healthcare ... Healthcare IT uses electronic health records (EHRs) in place of paper medical ... management, reduce medical errors, and cut down the healthcare costs.",2020-11-09,Health Cost Sharing
"Garcetti, health officials kick off 2021 Covered California enrollment period",https://www.google.com/url?rct=j&sa=t&url=https://www.dailynews.com/garcetti-health-officials-kick-off-2021-covered-california-enrollment-period&ct=ga&cd=CAIyGmU4MWY4MmViNmViOTg5MTE6Y29tOmVuOlVT&usg=AFQjCNE-fD8GPUFfXV38J63lCe8pFmcZlQ,"“Those who are hospitalized because of COVID, and do not have health insurance and the special cost-sharing protections that have been put in...",2020-11-09,Health Sharing
"Epic to launch customer story-sharing platform, Judy Faulkner says",https://www.google.com/url?rct=j&sa=t&url=https://www.healthcareitnews.com/news/epic-launch-customer-story-sharing-platform-judy-faulkner-says&ct=ga&cd=CAIyGmU4MWY4MmViNmViOTg5MTE6Y29tOmVuOlVT&usg=AFQjCNEWTWcFLCUoZYaqJhPJZnkG5fmraQ,"Pointing to the company""s Cosmos database, Faulkner said she anticipates that all Epic customers will eventually share de-identified medical data...",2020-11-09,Health Sharing
Co-Invest in Soil Health,https://www.google.com/url?rct=j&sa=t&url=https://www.agprofessional.com/article/co-invest-soil-health&ct=ga&cd=CAIyGmU4MWY4MmViNmViOTg5MTE6Y29tOmVuOlVT&usg=AFQjCNH2g_ZLGXIjGexqoYBUovpB791e7w,"You want to align the benefits of conservation agriculture with your landlord through healthy communication and shared goals, says Drew Slattery,...",2020-11-09,Health Sharing
Shoppers asked to share festive photos and raise funds for Frightened Rabbit mental health charity ...,https://www.google.com/url?rct=j&sa=t&url=https://www.edinburghnews.scotsman.com/news/people/shoppers-asked-share-festive-photos-and-raise-funds-frightened-rabbit-mental-health-charity-livingstons-centre-3029528&ct=ga&cd=CAIyGmU4MWY4MmViNmViOTg5MTE6Y29tOmVuOlVT&usg=AFQjCNEyaOskL6lisTxP-8zXQQArZdPBjA,"Christmas 2020 might be different to the festive seasons of years gone by, but The Centre is encouraging people to indulge in a little nostalgia and dig...",2020-11-09,Health Sharing
Keke Palmer Criticized Over Comments About EBT Cards and Healthy Food,https://www.google.com/url?rct=j&sa=t&url=https://www.complex.com/pop-culture/2020/11/keke-palmer-criticized-over-comments-ebt-cards-healthy-food&ct=ga&cd=CAIyGmU4MWY4MmViNmViOTg5MTE6Y29tOmVuOlVT&usg=AFQjCNHjXjDfTqABqUdCxiZY679cH_oFUQ,"Prior to sharing this take, Palmer had been replying to fans amid a discussion on the pumped-up cost of healthier foods. The eventual ""imagine if"" tweet,...",2020-11-09,Health Sharing
Sharing food and culture showcase the 2020 International Education Week,https://www.google.com/url?rct=j&sa=t&url=https://ung.edu/news/articles/2020/11/sharing-food-and-culture-showcase-the-2020-international-education-week.php&ct=ga&cd=CAIyGmU4MWY4MmViNmViOTg5MTE6Y29tOmVuOlVT&usg=AFQjCNG7xKaw64z-B9BkUOs0sGwLb-uZaA,"The switch to mostly virtual events was to follow health and safety guidelines necessitated by the COVID-19 pandemic. ""Even though student mobility...",2020-11-09,Health Sharing
COVID-19 Risk Model Developed by Cleveland Clinic Now Available to Health Systems Around ...,https://www.google.com/url?rct=j&sa=t&url=https://newsroom.clevelandclinic.org/2020/11/09/covid-19-risk-model-developed-by-cleveland-clinic-now-available-to-health-systems-around-the-world-through-epic/&ct=ga&cd=CAIyGmU4MWY4MmViNmViOTg5MTE6Y29tOmVuOlVT&usg=AFQjCNHw-fNK46OTouKZ0J0o9Zq0znvQ3A,"“These risk scores are shared automatically with healthcare providers, who can then follow up with patients as needed. Cleveland Clinic""s model helps...",2020-11-09,Health Sharing
NHS Digital signs a deal to help improve data sharing across organisations,https://www.google.com/url?rct=j&sa=t&url=https://www.digitalhealth.net/2020/11/nhs-digital-signs-a-deal-to-help-improve-data-sharing-across-organisations/&ct=ga&cd=CAIyGmU4MWY4MmViNmViOTg5MTE6Y29tOmVuOlVT&usg=AFQjCNHgD--zgxtm4NgTG14IhuVK0JTYbg,"This will allow buyers to share code system reference data from a central ... in which data is captured, shared and analysed across health and care.",2020-11-09,Health Sharing
Technology Helps Patients Get the Right Care at the Right Time,https://www.google.com/url?rct=j&sa=t&url=https://www.prnewswire.com/news-releases/technology-helps-patients-get-the-right-care-at-the-right-time-301168342.html&ct=ga&cd=CAIyGmU4MWY4MmViNmViOTg5MTE6Y29tOmVuOlVT&usg=AFQjCNFbqS21ThuOD9iYJJv4u4Zb5GoHlg,"While most physicians now have an Electronic Health Record system, each system operates in a silo without sharing information. Even with a medical...",2020-11-09,Health Sharing
10 Biggest Price Target Changes For Monday,https://www.google.com/url?rct=j&sa=t&url=https://www.benzinga.com/analyst-ratings/price-target/20/11/18271699/10-biggest-price-target-changes-for-monday&ct=ga&cd=CAIyGmU4MWY4MmViNmViOTg5MTE6Y29tOmVuOlVT&usg=AFQjCNGNij4DZIAxQT0IDX6LMN6464HImg,"Cardinal Health shares rose 3.8% to $54.66 in pre-market trading. Needham lifted PerkinElmer, Inc. (NYSE: PKI) price target from $139 to $193.",2020-11-09,Health Sharing
"Winters, festivities may upend gains made against COVID-19, says Harsh Vardhan at review meet",https://www.google.com/url?rct=j&sa=t&url=https://www.newindianexpress.com/nation/2020/nov/09/winters-festivities-may-upend-gains-made-against-covid-19-says-harsh-vardhan-at-review-meet-2221529.html&ct=ga&cd=CAIyGmU4MWY4MmViNmViOTg5MTE6Y29tOmVuOlVT&usg=AFQjCNEurGGMCwceKhq8N9R--_bk04uXdw,"The State Health Ministers shared a brief snapshot of the actions taken for containment, surveillance and treatment of COVID-19 cases.",2020-11-09,Health Sharing
Will We Ever Get Off This Escalator?,https://www.google.com/url?rct=j&sa=t&url=https://www.healthaffairs.org/do/10.1377/hblog20201104.399214/full&ct=ga&cd=CAIyGmU4MWY4MmViNmViOTg5MTE6Y29tOmVuOlVT&usg=AFQjCNHq52KGae7y_02QeF9a75Sq7E2zlw,"The latest report in Health Affairs by Gary Claxton and colleagues, “Health ... and changes in cost sharing—the market for employer-based coverage...",2020-11-09,Health Sharing
"MIND MATTERS: Here""s how to find mental health resources in Nueces County",https://www.google.com/url?rct=j&sa=t&url=https://www.caller.com/story/news/local/2020/11/09/heres-how-find-mental-health-resources-nueces-county/5979911002/&ct=ga&cd=CAIyGmU4MWY4MmViNmViOTg5MTE6Y29tOmVuOlVT&usg=AFQjCNHG2IGE1qBNNXgLP9zXWEjupU5fKw,"I suffered with depression and anxiety for years before I felt comfortable sharing my diagnosis (except with my therapist), when I could have taken...",2020-11-09,Health Sharing
Roundtable: Health scrutiny during Covid and beyond,https://www.google.com/url?rct=j&sa=t&url=https://www.lgcplus.com/opinion/roundtables/roundtable-health-scrutiny-during-covid-and-beyond-09-11-2020/&ct=ga&cd=CAIyGmU4MWY4MmViNmViOTg5MTE6Y29tOmVuOlVT&usg=AFQjCNFUmKRPvycHfo6fVl91Dic03JwuNQ,"With face-to-face meetings proving challenging, both local government and health organisations are finding different ways to share information.",2020-11-09,Health Sharing
"Pfizer, BioNTech say Covid vaccine is more than 90% effective—""great day for science and humanity""",https://www.google.com/url?rct=j&sa=t&url=https://www.cnbc.com/2020/11/09/covid-vaccine-pfizer-drug-is-more-than-90percent-effective-in-preventing-infection.html&ct=ga&cd=CAIyGmU4MWY4MmViNmViOTg5MTE6Y29tOmVuOlVT&usg=AFQjCNFFkediy9Ez2WrGFI6Gg6eJQ699DQ,U.S. stock futures skyrocketed as investors cheered the news. ... Both industries have been significantly affected by the global health crisis as travel...,2020-11-09,Health Sharing
"Liverpool men""s mental health charity receives funding for group sessions",https://www.google.com/url?rct=j&sa=t&url=https://www.inyourarea.co.uk/news/liverpool-mens-mental-health-charity-receives-funding-for-group-sessions/&ct=ga&cd=CAIyGmU4MWY4MmViNmViOTg5MTE6Y29tOmVuOlVT&usg=AFQjCNEwnEGq_4xBr31-TL9UOpKy8RTblQ,"They also encourage the men to talk openly about their experiences while sharing learning objectives and solutions. Sandy Wilkie, of Greenhill Vista,...",2020-11-09,Health Sharing
"Allotments are good for our mental health but there aren""t enough of them, research says",https://www.google.com/url?rct=j&sa=t&url=https://metro.co.uk/2020/11/09/allotments-are-good-for-your-mental-health-says-research-13561715/&ct=ga&cd=CAIyGmU4MWY4MmViNmViOTg5MTE6Y29tOmVuOlVT&usg=AFQjCNGOwF9oFfZDdZFmIZutEinLLsfneg,"... the research showed the ""wide spectrum of mental health benefits"" such as people ""talking about community events, the nice feeling of sharing food,...",2020-11-09,Health Sharing
"Providence Joins Anthem Blue Cross"" Vivity Health Plan as Joint-Venture Partner in Southern ...",https://www.google.com/url?rct=j&sa=t&url=https://www.businesswire.com/news/home/20201109005433/en/Providence-Joins-Anthem-Blue-Cross%25E2%2580%2599-Vivity-Health-Plan-as-Joint-Venture-Partner-in-Southern-California&ct=ga&cd=CAIyGmU4MWY4MmViNmViOTg5MTE6Y29tOmVuOlVT&usg=AFQjCNFMj5DOi9hBqp-Ewxa_LJBKjk0X0w,"“Providence is proud to join the Vivity partnership, which shares our commitment to simplify access to quality care, with compassion, and affordability,”...",2020-11-09,Health Sharing
Cheshire and Wirral residents share mental health struggles for launch of suicide prevention app,https://www.google.com/url?rct=j&sa=t&url=https://www.chesterstandard.co.uk/news/18857090.cheshire-wirral-residents-share-mental-health-struggles-launch-suicide-prevention-app/&ct=ga&cd=CAIyGmU4MWY4MmViNmViOTg5MTE6Y29tOmVuOlVT&usg=AFQjCNHriqIg1-l0C19fn8ogRjStl-kejQ,"RESIDENTS of Cheshire and Merseyside have shared their stories about suicidal thoughts for a campaign launch this week, to promote the suicide...",2020-11-09,Health Sharing
Illinois starts sharing data about COVID-19 outbreaks in schools,https://www.google.com/url?rct=j&sa=t&url=https://www.mystateline.com/news/illinois-starts-sharing-data-about-covid-19-outbreaks-in-schools/&ct=ga&cd=CAIyGmU4MWY4MmViNmViOTg5MTE6Y29tOmVuOlVT&usg=AFQjCNE3ZqZGGPc8w9O_875uGBLL_IvZpg,"(WTVO)–Eight months in the pandemic, Illinois"" Public Health Department now shares the number of cases and outbreaks happening at schools.",2020-11-09,Health Sharing
"We""re getting closer to an effective COVID-19 vaccine. Here""s what it will cost to get a shot.",https://www.google.com/url?rct=j&sa=t&url=https://www.businessinsider.com/heres-what-a-future-covid-19-will-cost-americans-2020-11&ct=ga&cd=CAIyHDcyMWE5ZGFiNjRlZGE3MTM6Y29tOmVuOlVTOlI&usg=AFQjCNGmQiZ0Jg5gdL3K7DPm9jQ9yE9RrA,"A relief fund for healthcare providers will help to cover the cost of the ... and other people covered by Medicare won""t have to pay any cost-sharing,...",2020-11-09,Healthcare Cost Sharing
"What""s at Stake in the Supreme Court""s ACA Case?",https://www.google.com/url?rct=j&sa=t&url=https://labblog.uofmhealth.org/industry-dx/whats-at-stake-supreme-courts-aca-case-0&ct=ga&cd=CAIyHDcyMWE5ZGFiNjRlZGE3MTM6Y29tOmVuOlVTOlI&usg=AFQjCNFCjRvUG7F1E8yRxTl6InMU1gnnqA,"From Medicare drug costs to health insurance for the newly jobless, a wide ... having to pay out of pocket in the form of co-pays or other cost sharing.",2020-11-09,Healthcare Cost Sharing
"What""s at Stake in the Supreme Court""s ACA Case?",https://www.google.com/url?rct=j&sa=t&url=https://labblog.uofmhealth.org/industry-dx/whats-at-stake-supreme-courts-aca-case&ct=ga&cd=CAIyHDcyMWE5ZGFiNjRlZGE3MTM6Y29tOmVuOlVTOlI&usg=AFQjCNHtjzC6pl8SHty8iDbMeeZ_RycKaA,"... cost sharing. From vaccines to mammograms, this provision is designed to keep cost from being a barrier to Americans"" getting the kinds of care that...",2020-11-09,Healthcare Cost Sharing
RxAnte Clients Outperform Industry Peers on 2021 Star Ratings Performance amid Increasing ...,https://www.google.com/url?rct=j&sa=t&url=https://www.streetinsider.com/Business%2BWire/RxAnte%2BClients%2BOutperform%2BIndustry%2BPeers%2Bon%2B2021%2BStar%2BRatings%2BPerformance%2Bamid%2BIncreasing%2BPerformance%2BThresholds/17571484.html&ct=ga&cd=CAIyHDcyMWE5ZGFiNjRlZGE3MTM6Y29tOmVuOlVTOlI&usg=AFQjCNELS2_ZRfeVBmz4a_RU6-clpkfMXw,"“RxAnte is proud to help our health plan clients deliver high-quality managed pharmacy care to ... We""re seeing promising early impacts on cost of care and pharmacy quality scores, and look forward to sharing this unique model for...",2020-11-09,Healthcare Cost Sharing
Healthcare IT Market Newer segments of application 2025,https://www.google.com/url?rct=j&sa=t&url=https://icotodaymagazine.com/coronavirus/32995/healthcare-it-market-newer-segments-of-application-2025/&ct=ga&cd=CAIyHDcyMWE5ZGFiNjRlZGE3MTM6Y29tOmVuOlVTOlI&usg=AFQjCNEFM1x5s9eMLcM6jFiIaYLxCom3Qw,"Healthcare IT provides secured sharing of patient information for healthcare ... Healthcare IT uses electronic health records (EHRs) in place of paper medical ... management, reduce medical errors, and cut down the healthcare costs.",2020-11-09,Healthcare Cost Sharing
"Epic to launch customer story-sharing platform, Judy Faulkner says",https://www.google.com/url?rct=j&sa=t&url=https://www.healthcareitnews.com/news/epic-launch-customer-story-sharing-platform-judy-faulkner-says&ct=ga&cd=CAIyHDc5M2E3YWM0ZTJjZTM4OWY6Y29tOmVuOlVTOlI&usg=AFQjCNEWTWcFLCUoZYaqJhPJZnkG5fmraQ,"Pointing to the company""s Cosmos database, Faulkner said she anticipates that all Epic customers will eventually share de-identified medical data...",2020-11-09,Medical Sharing
Sony Medical Imaging Platform NUCLeUS: New Functionalities Support Remote Patient Observation,https://www.google.com/url?rct=j&sa=t&url=https://www.itnonline.com/content/sony-medical-imaging-platform-nucleus-new-functionalities-support-remote-patient-observation&ct=ga&cd=CAIyHDc5M2E3YWM0ZTJjZTM4OWY6Y29tOmVuOlVTOlI&usg=AFQjCNF_B4uSiDO0BLnoql7sDdKJbJnYhA,"New update to NUCLeUS allows medical practitioners to manage, share and store 4K, HD, SD and 3D video content across hospital networks and...",2020-11-09,Medical Sharing
Blockchain-enabled hospital can provide real-world data to understand drug outcomes,https://www.google.com/url?rct=j&sa=t&url=https://www.pharmaceutical-technology.com/comment/blockchain-enabled-hospital-china/&ct=ga&cd=CAIyHDc5M2E3YWM0ZTJjZTM4OWY6Y29tOmVuOlVTOlI&usg=AFQjCNGMrzCZ3GNOm5EdfGRwbDdaNPqimg,"In the pharmaceutical sector, this could allow, among other things, the secure storage, sharing, and analysis of sensitive patient data. Renji Hospital...",2020-11-09,Medical Sharing
Greenlight Guru Announces The 2021 State of Medical Device Virtual Summit,https://www.google.com/url?rct=j&sa=t&url=https://www.prweb.com/releases/greenlight_guru_announces_the_2021_state_of_medical_device_virtual_summit/prweb17528975.htm&ct=ga&cd=CAIyHDc5M2E3YWM0ZTJjZTM4OWY6Y29tOmVuOlVTOlI&usg=AFQjCNGlJg19IkKwCldghuFVzJHyzlN1mg,"“Part of that is coming together to share our unique experiences and accumulated knowledge, and the 2021 State of Medical Device Virtual Summit...",2020-11-09,Medical Sharing
Technology Helps Patients Get the Right Care at the Right Time,https://www.google.com/url?rct=j&sa=t&url=https://www.prnewswire.com/news-releases/technology-helps-patients-get-the-right-care-at-the-right-time-301168342.html&ct=ga&cd=CAIyHDc5M2E3YWM0ZTJjZTM4OWY6Y29tOmVuOlVTOlI&usg=AFQjCNFbqS21ThuOD9iYJJv4u4Zb5GoHlg,"While most physicians now have an Electronic Health Record system, each system operates in a silo without sharing information. Even with a medical...",2020-11-09,Medical Sharing
"Pfizer, BioNTech say Covid vaccine is more than 90% effective—""great day for science and humanity""",https://www.google.com/url?rct=j&sa=t&url=https://www.cnbc.com/2020/11/09/covid-vaccine-pfizer-drug-is-more-than-90percent-effective-in-preventing-infection.html&ct=ga&cd=CAIyHDc5M2E3YWM0ZTJjZTM4OWY6Y29tOmVuOlVTOlI&usg=AFQjCNFFkediy9Ez2WrGFI6Gg6eJQ699DQ,"“I believe this is likely the most significant medical advance in the last 100 ... The final vaccine efficacy percentage may vary, however, as safety and...",2020-11-09,Medical Sharing
Latest Study explores the Plastic Injection Molding for Medical Device Market Witness Highest ...,https://www.google.com/url?rct=j&sa=t&url=https://thedailyphiladelphian.com/uncategorized/78827/latest-study-explores-the-plastic-injection-molding-for-medical-device-market-witness-highest-growth-in-near-future/&ct=ga&cd=CAIyHDc5M2E3YWM0ZTJjZTM4OWY6Y29tOmVuOlVTOlI&usg=AFQjCNFbCThoxKnZQe-kaEY3_DSwMgv7VQ,What is the market share accrued by each of the firms in the Plastic Injection Molding for Medical Device market? What are products manufactured by...,2020-11-09,Medical Sharing
"Global Medical Terminology Sharing Market Top Company Profile: Wolters Kluwer, Intelligent ...",https://www.google.com/url?rct=j&sa=t&url=https://technoweekly.com/technologies/939276/global-medical-terminology-sharing-market-top-company-profile-wolters-kluwer-intelligent-medical-objects-apelon-clinical-architecture-3m-etc/&ct=ga&cd=CAIyHDc5M2E3YWM0ZTJjZTM4OWY6Y29tOmVuOlVTOlI&usg=AFQjCNHM2fFtWt1zYzp8UTbZXoPTLJ1M3w,3M; CareCom; Bitac; B2i Healthcare; BT Clinical Computing; HiveWorx. The Global Medical Terminology Sharing Market report takes into account the...,2020-11-09,Medical Sharing
Healthcare IT Market Newer segments of application 2025,https://www.google.com/url?rct=j&sa=t&url=https://icotodaymagazine.com/coronavirus/32995/healthcare-it-market-newer-segments-of-application-2025/&ct=ga&cd=CAIyHDc5M2E3YWM0ZTJjZTM4OWY6Y29tOmVuOlVTOlI&usg=AFQjCNEFM1x5s9eMLcM6jFiIaYLxCom3Qw,"Patients can use health IT to communicate with their doctor, care giver to share information about health and act as per instructions to improve the quality...",2020-11-09,Medical Sharing
