title,link,item_text,date_published,google_alert_name
"Division of Insurance warns of low quality, insurance like products",https://www.google.com/url?rct=j&sa=t&url=https://www.themountainmail.com/free_content/article_0067f352-6cda-11eb-9f2d-ff16a5f12310.html&ct=ga&cd=CAIyHGVmMjU5ZGE1NWJkYjU0NjU6Y29tOmVuOlVTOlI&usg=AFQjCNG8OyOTpmX7au4Q132Yl_iN4UHf6g,"Such plans can leave consumers stuck with huge medical bills from doctors and hospitals, as the plans deny and limit health care ... Is this a short-term, limited duration plan, a sharing ministry plan, or other limited-coverage plan?",2021-02-12,Health Care Sharing Ministry
"Asked and answered: Readers"" most common questions about the COVID-19 vaccines",https://www.google.com/url?rct=j&sa=t&url=https://www.victoriaadvocate.com/news/features/asked-and-answered-readers-most-common-questions-about-the-covid-19-vaccines/article_45a126e2-6a81-11eb-90e2-f7b21c15ea55.html&ct=ga&cd=CAIyHDQ1NzZkZjdlYTEzZTg0YTA6Y29tOmVuOlVTOlI&usg=AFQjCNE-Dfz5e4K5vfRFywuSVrGJwhwEBg,[https://www.kff.org/health-costs/issue-brief/gaps-in-cost-sharing-protections-for-covid-19-testing-and-treatment-could-spark-public-concerns-about-...,2021-02-13,Health Cost Sharing
The High Cost of Cheap Health Insurance,https://www.google.com/url?rct=j&sa=t&url=https://www.consumerreports.org/health-insurance/the-high-cost-of-cheap-health-insurance/&ct=ga&cd=CAIyHDQ1NzZkZjdlYTEzZTg0YTA6Y29tOmVuOlVTOlI&usg=AFQjCNHRUS3a6Mta1SpSgleFcQtLI--B4g,"About a million people in the U.S. belong to one of these groups, in which healthcare costs are shared among people with common religious or ethical...",2021-02-13,Health Cost Sharing
House drug transparency bill makes its way to Senate subcommittee next week,https://www.google.com/url?rct=j&sa=t&url=https://stateofreform.com/featured/2021/02/house-drug-transparency-bill-makes-its-way-to-senate-subcommittee-next-week/&ct=ga&cd=CAIyHDQ1NzZkZjdlYTEzZTg0YTA6Y29tOmVuOlVTOlI&usg=AFQjCNFwVvsa5LPijHmWfaHwu798f4LWSQ,"In addition, pharmacy benefit managers will have to offer a health plan enrollee""s defined cost sharing for each prescription drug. It will be calculated at...",2021-02-13,Health Cost Sharing
Obamacare Under the Microscope: A Behind-the-Scenes Look Into the Pros and Cons of the ACA,https://www.google.com/url?rct=j&sa=t&url=https://www.laprogressive.com/obamacare-under-the-microscope/&ct=ga&cd=CAIyHDQ1NzZkZjdlYTEzZTg0YTA6Y29tOmVuOlVTOlI&usg=AFQjCNEDhNmq64a5Bu3qzAG24M0Xcxs2cg,Steep prices cause already stressed citizens to avoid necessary medical care due to fear of expensive debts. Con: Loss of employer-provided...,2021-02-12,Health Cost Sharing
Oak Street Health Reaches Analyst Target Price,https://www.google.com/url?rct=j&sa=t&url=https://www.nasdaq.com/articles/oak-street-health-reaches-analyst-target-price-2021-02-12&ct=ga&cd=CAIyHDQ1NzZkZjdlYTEzZTg0YTA6Y29tOmVuOlVTOlI&usg=AFQjCNEzRokXR0y_SyixM8Fpd8FooTI95Q,"I""ll share the philosophy with a common sense approach to energy policy and regulation puts a priority on safety, reliability, affordability, and increasingly...",2021-02-12,Health Cost Sharing
"Rising prescription copays drop adherence, spike mortality, research shows",https://www.google.com/url?rct=j&sa=t&url=https://www.modernhealthcare.com/patients/rising-prescription-copays-drop-adherence-spike-mortality-research-shows&ct=ga&cd=CAIyHDQ1NzZkZjdlYTEzZTg0YTA6Y29tOmVuOlVTOlI&usg=AFQjCNHnOEyY_SXAbUmLw3itJpCs2yS3oQ,"""Those decisions lead to more people dying—health costs need to be priced into these cost-sharing policies."" Ed Schoonveld, a principal at consultancy...",2021-02-12,Health Cost Sharing
State Health Officials Seeing Low Levels of COVID-19 Transmission in Schools,https://www.google.com/url?rct=j&sa=t&url=http://www.chronline.com/community/state-health-officials-seeing-low-levels-of-covid-19-transmission-in-schools/article_f3aad62a-6e37-11eb-8e62-47796c531307.html&ct=ga&cd=CAIyGmU4MWY4MmViNmViOTg5MTE6Y29tOmVuOlVT&usg=AFQjCNH6lybF5Wlls5rC6R6PPLz2_naM9g,"""We are sharing these data so that educators, families, local public health, and communities can see and learn from what""s happening in schools with...",2021-02-13,Health Sharing
Police personnel chant the fitness mantra,https://www.google.com/url?rct=j&sa=t&url=https://www.thehindu.com/news/cities/Hyderabad/police-personnel-chant-the-fitness-mantra/article33832229.ece&ct=ga&cd=CAIyGmU4MWY4MmViNmViOTg5MTE6Y29tOmVuOlVT&usg=AFQjCNEZuA9qaEMTCZyQBESzX3t2jQyMBw,"Sharing details about the new fitness initiative which was launched in ... We will conduct research in police health pre- and post-fitness, stress levels,...",2021-02-13,Health Sharing
"Kamloops""s COVID-swab ""champion"" nurse sharing tips on social media",https://www.google.com/url?rct=j&sa=t&url=https://infotel.ca/newsitem/kamloopss-covid-swab-champion-nurse-sharing-tips-on-social-media/it80860&ct=ga&cd=CAIyGmU4MWY4MmViNmViOTg5MTE6Y29tOmVuOlVT&usg=AFQjCNHhxP5xZaicX1Q775MagYJ6mRgerA,"Her team at Interior Health has been sharing with other healthcare workers tips and tricks to administer tests well, but she hopes that her recent viral...",2021-02-13,Health Sharing
"Catalan parties talk of separation, but for voters, health is the priority",https://www.google.com/url?rct=j&sa=t&url=https://www.theguardian.com/world/2021/feb/13/catalan-parties-talk-of-separation-but-for-voters-health-is-the-priority&ct=ga&cd=CAIyGmU4MWY4MmViNmViOTg5MTE6Y29tOmVuOlVT&usg=AFQjCNGFphnlv9xy3ZZczsWnlLeT9FsSYA,"In tomorrow""s election, public services are a huge concern for the people as politicians debate independence. protest against Jusapol""s rally in...",2021-02-13,Health Sharing
Maryland Lawmakers Should Seize the Opportunity to Protect Health Care Choice,https://www.google.com/url?rct=j&sa=t&url=https://marylandreporter.com/2021/02/13/maryland-lawmakers-should-seize-the-opportunity-to-protect-health-care-choice/&ct=ga&cd=CAIyGmU4MWY4MmViNmViOTg5MTE6Y29tOmVuOlVT&usg=AFQjCNE5w6mdoWeKVzv1VxCK-QB_HnanIw,"Health Care Sharing Ministries are 501(c)(3) charitable organizations, through which individuals come together to share health care expenses that align...",2021-02-13,Health Sharing
"Health officials tracked 84 COVID-19 outbreaks at WA schools last fall. Here""s what they found",https://www.google.com/url?rct=j&sa=t&url=https://www.thenewstribune.com/news/local/article249213040.html&ct=ga&cd=CAIyGmU4MWY4MmViNmViOTg5MTE6Y29tOmVuOlVT&usg=AFQjCNH1F_2mnjMWIg3MMUfj-xUhnwZGgA,"“We are sharing these data so that educators, families, local public health, and communities can see and learn from what""s happening in schools with...",2021-02-13,Health Sharing
Half of Arizonans willing to share their health data with Big Pharma to improve COVID-19 vaccines ...,https://www.google.com/url?rct=j&sa=t&url=https://prescottenews.com/index.php/2021/02/13/half-of-arizonans-willing-to-share-their-health-data-with-big-pharma-to-improve-covid-19-vaccines-reveals-study/&ct=ga&cd=CAIyGmU4MWY4MmViNmViOTg5MTE6Y29tOmVuOlVT&usg=AFQjCNEc8U4U9THi5UjLVYfDrbuCeUfBLg,"However, 67% say they would not be happy to share their health data indefinitely. Half believe they should be financially compensated for their data.",2021-02-13,Health Sharing
CARICOM head praises members for sharing vaccines,https://www.google.com/url?rct=j&sa=t&url=https://www.nationnews.com/2021/02/13/caricom-head-praises-members-sharing-vaccines/&ct=ga&cd=CAIyGmU4MWY4MmViNmViOTg5MTE6Y29tOmVuOlVT&usg=AFQjCNFZwiaCYmt1kHuCqSRAbhU1fQM6wg,"LaRocque thanked Guyana""s President Irfaan Ali for arranging for the ministry of health to vaccinate the CARICOM Secretariat staff. He also thanked...",2021-02-13,Health Sharing
"Health officials work to build trust, bust vaccine myths",https://www.google.com/url?rct=j&sa=t&url=https://www.crainscleveland.com/health-care/health-officials-work-build-trust-bust-vaccine-myths&ct=ga&cd=CAIyGmU4MWY4MmViNmViOTg5MTE6Y29tOmVuOlVT&usg=AFQjCNE4sVM7DCaXg91pDjvPn1uydbagcA,"Similar to Tiller""s family sharing her vaccination process, Nevel""s mom wanted to share her vaccination with Nevel""s childhood friends. Through...",2021-02-13,Health Sharing
"""Victoria cannot be trusted to run quarantine"" - medical association",https://www.google.com/url?rct=j&sa=t&url=https://www.rnz.co.nz/news/world/436374/victoria-cannot-be-trusted-to-run-quarantine-medical-association&ct=ga&cd=CAIyGmU4MWY4MmViNmViOTg5MTE6Y29tOmVuOlVT&usg=AFQjCNHu69w_bgj65MK-APqrhFiwdS2SdA,"Unions frustrated information not shared with hotel quarantine. The issue was raised at a taskforce meeting this week, with members only now agreeing...",2021-02-13,Health Sharing
"""We created a spreadsheet"": how couples manage their cash",https://www.google.com/url?rct=j&sa=t&url=https://www.theguardian.com/money/2021/feb/13/we-created-a-spreadsheet-how-couples-manage-their-cash&ct=ga&cd=CAIyGmU4MWY4MmViNmViOTg5MTE6Y29tOmVuOlVT&usg=AFQjCNE9FhRd8gW98n1p5Et5uj29luak-A,"There might be some aspects you""d be happy to share but others you""d ... For many couples, this means running a joint account for shared bills, and...",2021-02-13,Health Sharing
"Pelosi issues ""rare rebuke"" after Cuomo claims feds trying to shortchange NY in coronavirus bill ...",https://www.google.com/url?rct=j&sa=t&url=https://www.foxnews.com/politics/pelosi-issues-rare-rebuke-after-cuomo-claims-feds-trying-to-shortchange-ny-in-coronavirus-bill-reports&ct=ga&cd=CAIyGmU4MWY4MmViNmViOTg5MTE6Y29tOmVuOlVT&usg=AFQjCNFT_wxWCT2mvP00t_sa8FfNsVgzXw,"... touting the federal proposal""s $50 billion in state and local funding for New York as well as $20 billion to ""support families"" health, financial security...",2021-02-13,Health Sharing
"Hafta letters: Ill-informed vaccine opinions, news and mental health, government land",https://www.google.com/url?rct=j&sa=t&url=https://www.newslaundry.com/2021/02/13/hafta-letters-ill-informed-vaccine-opinions-news-and-mental-health-government-land&ct=ga&cd=CAIyGmU4MWY4MmViNmViOTg5MTE6Y29tOmVuOlVT&usg=AFQjCNGJR9uIX9fTzDDs9dXfE3GOctbGJg,"I want to share this article with all of you and I want to know what you all think about this. Here""s the link. I feel being a liberal has become a convenient...",2021-02-13,Health Sharing
"Victoria""s hotel quarantine program left out of key taskforce on infection control for frontline workers",https://www.google.com/url?rct=j&sa=t&url=https://www.abc.net.au/news/2021-02-13/hotel-quarantine-not-on-infection-control-victoria-taskforce/13152242&ct=ga&cd=CAIyGmU4MWY4MmViNmViOTg5MTE6Y29tOmVuOlVT&usg=AFQjCNFfWBXP3F-d-kSWikrMGhGmMnF5og,Members of the healthcare taskforce told the ABC information about worker infections was not shared with COVID-19 Quarantine Victoria (CQV); The...,2021-02-13,Health Sharing
Women in north central Wis. sharing experiences and hope going through pregnancy and birth in ...,https://www.google.com/url?rct=j&sa=t&url=https://www.wsaw.com/2021/02/13/women-in-north-central-wis-sharing-experiences-and-hope-going-through-pregnancy-and-birth-in-pandemic/&ct=ga&cd=CAIyGmU4MWY4MmViNmViOTg5MTE6Y29tOmVuOlVT&usg=AFQjCNFZfEVNfPyu2n2_M0SCVoWfgUXV8Q,"As health systems managed the evolving knowledge about COVID-19 and the level of spread in the community, they created protocols. Mothers""...",2021-02-13,Health Sharing
"On WHO Trip, China Refused to Hand Over Important Data",https://www.google.com/url?rct=j&sa=t&url=https://www.nytimes.com/2021/02/12/world/asia/china-world-health-organization-coronavirus.html&ct=ga&cd=CAIyGmU4MWY4MmViNmViOTg5MTE6Y29tOmVuOlVT&usg=AFQjCNFx2lt6a8Q3vgBwDmm93s34APm6Zg,Chinese scientists refused to share raw data that might bring the world ... the team of 14 experts for the World Health Organization led the mission to...,2021-02-13,Health Sharing
Marilyn Slett and Dr. Judith Sayers: A sliver of hope amid a pandemic of false reconciliation promises,https://www.google.com/url?rct=j&sa=t&url=https://vancouversun.com/opinion/marilyn-slett-and-dr-judith-sayers-a-sliver-of-hope-amid-a-pandemic-of-false-reconciliation-promises&ct=ga&cd=CAIyGmU4MWY4MmViNmViOTg5MTE6Y29tOmVuOlVT&usg=AFQjCNG1MgIzrGjYytJP7HiU0d6x0pd5sQ,"While there is a sliver of hope in this week""s information-sharing deals, which ... we still have a long way to go in becoming true partners in health care.",2021-02-13,Health Sharing
House drug transparency bill makes its way to Senate subcommittee next week,https://www.google.com/url?rct=j&sa=t&url=https://stateofreform.com/featured/2021/02/house-drug-transparency-bill-makes-its-way-to-senate-subcommittee-next-week/&ct=ga&cd=CAIyGmU4MWY4MmViNmViOTg5MTE6Y29tOmVuOlVT&usg=AFQjCNFwVvsa5LPijHmWfaHwu798f4LWSQ,"In addition, pharmacy benefit managers will have to offer a health plan enrollee""s defined cost sharing for each prescription drug. It will be calculated at...",2021-02-13,Health Sharing
"Caricom Secretary-General praises region""s COVID-19 vaccine sharing",https://www.google.com/url?rct=j&sa=t&url=http://www.jamaicaobserver.com/latestnews/Caricom_Secretary-General_praises_regions_COVID-19_vaccine_sharing&ct=ga&cd=CAIyGmU4MWY4MmViNmViOTg5MTE6Y29tOmVuOlVT&usg=AFQjCNEOA0mU9d4p77mGQ0CaAdYNO9Bcjg,"Ambassador LaRoque thanked President Irfaan Ali of Guyana for arranging for Guyana""s Ministry of Health to vaccinate the Caricom Secretariat Staff.",2021-02-13,Health Sharing
Mercer Executive Hughes gives COVID-19 update,https://www.google.com/url?rct=j&sa=t&url=https://www.insidernj.com/press-release/mercer-executive-hughes-gives-covid-19-update-2/&ct=ga&cd=CAIyGmU4MWY4MmViNmViOTg5MTE6Y29tOmVuOlVT&usg=AFQjCNHsqIOqF6eRMPSJFmlE6WV7lUU4xQ,"I share everyone""s frustration over the current COVID-19 vaccination ... by sharing resources and working with the County team and municipal health...",2021-02-12,Health Sharing
The High Cost of Cheap Health Insurance,https://www.google.com/url?rct=j&sa=t&url=https://www.consumerreports.org/health-insurance/the-high-cost-of-cheap-health-insurance/&ct=ga&cd=CAIyHDcyMWE5ZGFiNjRlZGE3MTM6Y29tOmVuOlVTOlI&usg=AFQjCNHRUS3a6Mta1SpSgleFcQtLI--B4g,"About a million people in the U.S. belong to one of these groups, in which healthcare costs are shared among people with common religious or ethical...",2021-02-13,Healthcare Cost Sharing
Obamacare Under the Microscope: A Behind-the-Scenes Look Into the Pros and Cons of the ACA,https://www.google.com/url?rct=j&sa=t&url=https://www.laprogressive.com/obamacare-under-the-microscope/&ct=ga&cd=CAIyHDcyMWE5ZGFiNjRlZGE3MTM6Y29tOmVuOlVTOlI&usg=AFQjCNEDhNmq64a5Bu3qzAG24M0Xcxs2cg,"However, he was able to implement several changes like eliminating individuals mandates, ending cost-sharing reduction subsidies to insurers, and...",2021-02-12,Healthcare Cost Sharing
"Rising prescription copays drop adherence, spike mortality, research shows",https://www.google.com/url?rct=j&sa=t&url=https://www.modernhealthcare.com/patients/rising-prescription-copays-drop-adherence-spike-mortality-research-shows&ct=ga&cd=CAIyHDcyMWE5ZGFiNjRlZGE3MTM6Y29tOmVuOlVTOlI&usg=AFQjCNHnOEyY_SXAbUmLw3itJpCs2yS3oQ,"""Those decisions lead to more people dying—health costs need to be priced into these cost-sharing policies."" Ed Schoonveld, a principal at consultancy...",2021-02-12,Healthcare Cost Sharing
Social Awareness about Drug De-addiction,https://www.google.com/url?rct=j&sa=t&url=https://www.greaterkashmir.com/news/opinion/social-awareness-about-drug-de-addiction/&ct=ga&cd=CAIyHDc5M2E3YWM0ZTJjZTM4OWY6Y29tOmVuOlVTOlI&usg=AFQjCNEnQDxXnp2zcjhiu7Egv-R1g6IUpw,This exercise provided an opportunity to the researcher to share his thoughts with the respondents on the evils of drug addiction. A checklist highlighting...,2021-02-13,Medical Sharing
"Global Medical Wedge Pillow Market Size, Share, Value, and Competitive Landscape 2026",https://www.google.com/url?rct=j&sa=t&url=https://neighborwebsj.com/uncategorized/3049686/global-medical-wedge-pillow-market-size-share-value-and-competitive-landscape-2026/&ct=ga&cd=CAIyHDc5M2E3YWM0ZTJjZTM4OWY6Y29tOmVuOlVTOlI&usg=AFQjCNE5jX56hdXy06cbwLlzwVogq14dTw,"Players, stakeholders, and other participants in the global Medical Wedge Pillow market will be able to gain the upper hand as they use the report as a...",2021-02-13,Medical Sharing
"Proposed health plan for farmers would fall outside of state, federal regulations",https://www.google.com/url?rct=j&sa=t&url=https://rapidcityjournal.com/news/legislature/proposed-health-plan-for-farmers-would-fall-outside-of-state-federal-regulations/article_e845bdaf-6a2d-555c-824f-ffe07b4447d9.html&ct=ga&cd=CAIyHDc5M2E3YWM0ZTJjZTM4OWY6Y29tOmVuOlVTOlI&usg=AFQjCNGcWLr-MfevEBB0N_-rXXXLtLWGzw,"... for private health insurance before joining Medi-share, a Christian medical sharing plan that is similar to the proposed Farm Bureau health plan.",2021-02-13,Medical Sharing
"Health officials work to build trust, bust vaccine myths",https://www.google.com/url?rct=j&sa=t&url=https://www.crainscleveland.com/health-care/health-officials-work-build-trust-bust-vaccine-myths&ct=ga&cd=CAIyHDc5M2E3YWM0ZTJjZTM4OWY6Y29tOmVuOlVTOlI&usg=AFQjCNE4sVM7DCaXg91pDjvPn1uydbagcA,"Similar to Tiller""s family sharing her vaccination process, Nevel""s mom wanted to share her vaccination with Nevel""s childhood friends. Through...",2021-02-13,Medical Sharing
"""We created a spreadsheet"": how couples manage their cash",https://www.google.com/url?rct=j&sa=t&url=https://www.theguardian.com/money/2021/feb/13/we-created-a-spreadsheet-how-couples-manage-their-cash&ct=ga&cd=CAIyHDc5M2E3YWM0ZTJjZTM4OWY6Y29tOmVuOlVTOlI&usg=AFQjCNE9FhRd8gW98n1p5Et5uj29luak-A,"There might be some aspects you""d be happy to share but others you""d ... For many couples, this means running a joint account for shared bills, and...",2021-02-13,Medical Sharing
Senior Care Center Publishes Article Sharing Tips About Eating Habits For Good Health,https://www.google.com/url?rct=j&sa=t&url=http://www.digitaljournal.com/pr/4973850&ct=ga&cd=CAIyHDc5M2E3YWM0ZTJjZTM4OWY6Y29tOmVuOlVTOlI&usg=AFQjCNFRxf0ZxHNa9TWAFp_9qBPjmXKZYQ,It has recently posted an article that explains the significance of healthy eating and shared tips on how to eat healthily. The article can be read in its...,2021-02-13,Medical Sharing
Gourmet Cookie owner sharing the love with health care workers by donating treats for each dozen ...,https://www.google.com/url?rct=j&sa=t&url=https://www.wate.com/news/top-stories/gourmet-cookie-owner-sharing-the-love-with-health-care-workers-by-donating-treats-for-each-dozen-cookies-sold/&ct=ga&cd=CAIyHDc5M2E3YWM0ZTJjZTM4OWY6Y29tOmVuOlVTOlI&usg=AFQjCNH7Ic_jApTFVpaXfJMKvUvR7dHRrw,"... help a local business and thank a healthcare hero. Valentine""s Day is almost here, but one cookie company is sharing the cookie love all month long...",2021-02-13,Medical Sharing
UVA Health looking to ramp up vaccinations while staying wary of new COVID-19 variants,https://www.google.com/url?rct=j&sa=t&url=https://www.nbc29.com/2021/02/12/uva-health-looking-ramp-up-vaccinations-while-staying-wary-new-covid-variants/&ct=ga&cd=CAIyHDc5M2E3YWM0ZTJjZTM4OWY6Y29tOmVuOlVTOlI&usg=AFQjCNEVTJwCzW5Dbrj6teJkj6rGv6oPvQ,"CHARLOTTESVILLE, Va. (WVIR) - The University of Virginia Health System is sharing the latest updates on vaccination efforts and new concerns...",2021-02-12,Medical Sharing
"Echocardiography Market Top key Players, Size, Share, Demand, Opportunities And Forecasts To ...",https://www.google.com/url?rct=j&sa=t&url=https://neighborwebsj.com/uncategorized/2990035/echocardiography-market-top-key-players-size-share-demand-opportunities-and-forecasts-to-2027/&ct=ga&cd=CAIyHDc5M2E3YWM0ZTJjZTM4OWY6Y29tOmVuOlVTOlI&usg=AFQjCNFv1SOL42ZST8dEylp5buDzgtR-DA,GE Healthcare Koninklijke Philips Siemens Healthcare Toshiba Medical Systems ALPINION MEDICAL SYSTEMS Bay Labs Biosense Webster,2021-02-12,Medical Sharing
Clover Health: Growth Of Quality,https://www.google.com/url?rct=j&sa=t&url=https://seekingalpha.com/article/4405839-clover-health-growth-quality&ct=ga&cd=CAIyHDc5M2E3YWM0ZTJjZTM4OWY6Y29tOmVuOlVTOlI&usg=AFQjCNERRrJt0zkm-wesxdKSlh-umx3Zog,"Market share of 25% in the markets it competes in. ... Clover Health is a disruptive company in the Medicare Advantage (MA) insurance market, which...",2021-02-12,Medical Sharing
Obamacare exchanges will reopen Monday. You may qualify for a free or low-cost plan,https://www.google.com/url?rct=j&sa=t&url=https://www.cnbc.com/2021/02/12/obamacare-exchanges-reopening-with-some-free-or-low-cost-plans.html&ct=ga&cd=CAIyHDc5M2E3YWM0ZTJjZTM4OWY6Y29tOmVuOlVTOlI&usg=AFQjCNEOz1OUek7JGxDsMyBeIrW848_1iA,"If you""re new to the process, the best place to start is healthcare.gov. ... Additionally, they may qualify for help with other cost-sharing like deductibles.",2021-02-12,Medical Sharing
Ask HR: Do I Tell HR About a Rude Boss?,https://www.google.com/url?rct=j&sa=t&url=https://www.shrm.org/resourcesandtools/hr-topics/organizational-and-employee-development/pages/ask-hr-do-i-tell-hr-about-a-rude-boss.aspx&ct=ga&cd=CAIyHDc5M2E3YWM0ZTJjZTM4OWY6Y29tOmVuOlVTOlI&usg=AFQjCNG6xEFjVjL91jfmn34txQaZe4UlYg,"Before I dive into the ""why,"" I want to briefly share that HIPAA was established to protect individuals"" medical records and personal health information.",2021-02-12,Medical Sharing
Hospital App to Share Anonymized Patient Data for Research,https://www.google.com/url?rct=j&sa=t&url=https://www.governing.com/security/Hospital-App-to-Share-Anonymized-Patient-Data-for-Research.html&ct=ga&cd=CAIyHDc5M2E3YWM0ZTJjZTM4OWY6Y29tOmVuOlVTOlI&usg=AFQjCNFGoFZCs0Sql2MaJ794kQqQ94PlDA,The health care systems will co-own a private Seattle-based startup company called Truveta that will aggregate the data and make it available to...,2021-02-11,Medical Sharing
