title,link,item_text,date_published,google_alert_name
"Status, Challenges of Information Blocking Rule Compliance - Health IT Security",https://www.google.com/url?rct=j&sa=t&url=https://healthitsecurity.com/features/status-challenges-of-information-blocking-rule-compliance&ct=ga&cd=CAIyHDc5M2E3YWM0ZTJjZTM4OWY6Y29tOmVuOlVTOlI&usg=AFQjCNEWSzBv5IO-1RHBdssZTG1UGT89Qw,"It""s been more than 6 months since the Information Blocking Rule compliance deadline, but questions about electronic health information sharing...",2021-11-16,Medical Sharing
"Stranded by the pandemic, he had only travel insurance. It left him with a $38000 bill",https://www.google.com/url?rct=j&sa=t&url=https://www.latimes.com/california/story/2021-11-16/stranded-by-the-pandemic-he-had-only-travel-insurance-it-left-him-with-a-38-000-bill&ct=ga&cd=CAIyHDc5M2E3YWM0ZTJjZTM4OWY6Y29tOmVuOlVTOlI&usg=AFQjCNFORUwgGI9ZiERTZXTynMJx_OHiBg,"Although it""s possible to buy travel insurance that provides some health coverage, the devil is in the fine print. Duy Hoa Tran and family learned...",2021-11-16,Medical Sharing
SA Health taps digital tech for faster sharing of patient info | Healthcare IT News,https://www.google.com/url?rct=j&sa=t&url=https://www.healthcareitnews.com/news/anz/sa-health-taps-digital-tech-faster-sharing-patient-info&ct=ga&cd=CAIyHDc5M2E3YWM0ZTJjZTM4OWY6Y29tOmVuOlVTOlI&usg=AFQjCNG8iEy-M1cYGBMd6npTovFB-HCn3Q,"For now, the service enables the sharing of discharge summaries with health providers across the state.",2021-11-16,Medical Sharing
Veteran weighs in on renewed push to legalize medical marijuana in Indiana - WTHR,https://www.google.com/url?rct=j&sa=t&url=https://www.wthr.com/article/news/local/veteran-weighs-in-on-renewed-push-to-legalize-medical-marijuana-in-indiana/531-8dd9eb17-f67a-4fae-a6f7-c20e4f346411&ct=ga&cd=CAIyHDc5M2E3YWM0ZTJjZTM4OWY6Y29tOmVuOlVTOlI&usg=AFQjCNF0IIywdam9ADTyLuJdsvYijCtj5Q,Indiana remains one of 14 states without medical cannabis laws.,2021-11-16,Medical Sharing
"Guernsey Health System, OhioHealth seek stronger partnership | HealthLeaders Media",https://www.google.com/url?rct=j&sa=t&url=https://www.healthleadersmedia.com/strategy/guernsey-health-system-ohiohealth-seek-stronger-partnership&ct=ga&cd=CAIyHDc5M2E3YWM0ZTJjZTM4OWY6Y29tOmVuOlVTOlI&usg=AFQjCNEVFW20olA5-7LxJtdiF1jxb4PzSQ,... providers have signed a non-binding letter of intent to explore a stronger partnership that will allow for more detailed information sharing.,2021-11-16,Medical Sharing
APEC Summit: Asia-Pacific Leaders Ramp Up COVID-19 Vaccine Sharing and Address Fossil Fuels,https://www.google.com/url?rct=j&sa=t&url=https://www.globalcitizen.org/en/content/apec-summit-asia-pacific-leaders/&ct=ga&cd=CAIyHDc5M2E3YWM0ZTJjZTM4OWY6Y29tOmVuOlVTOlI&usg=AFQjCNHSvfJQ6YIsiH7C6lqGoMQKCN7J8g,Leaders of nations in the Pacific Rim vowed to abolish tariffs on vaccines and other COVID-19 medical supplies at the virtual Asia-Pacific...,2021-11-16,Medical Sharing
Expert to focus on the wonder of hormones that control energy balance and metabolism,https://www.google.com/url?rct=j&sa=t&url=https://www.news-medical.net/news/20211115/Expert-to-focus-on-the-wonder-of-hormones-that-control-energy-balance-and-metabolism.aspx&ct=ga&cd=CAIyHDc5M2E3YWM0ZTJjZTM4OWY6Y29tOmVuOlVTOlI&usg=AFQjCNFF8qAeRswxO_Qw8RnG5gVehzQjWg,"The Royal Society of Medicine plays an important role in sharing scientific understanding of conditions such as diabetes, which affects so many...",2021-11-16,Medical Sharing
COVID-19 numbers down 90% in the Texas Medical Center - KHOU,https://www.google.com/url?rct=j&sa=t&url=https://www.khou.com/article/news/health/coronavirus/covid-numbers-down-in-the-texas-medical-center/285-9755943c-18ed-4d72-9a65-82a2231e8b41&ct=ga&cd=CAIyHDc5M2E3YWM0ZTJjZTM4OWY6Y29tOmVuOlVTOlI&usg=AFQjCNHyI-rHsvTiOaP-_dKp2GHo34SNFA,"New cases of COVID-19, the positivity rate and hospitalizations have all plummeted in Houston, according to the Texas Medical Center""s COVID-19...",2021-11-16,Medical Sharing
