title,link,item_text,date_published,google_alert_name
Alliance for Shared Health (ASH) announces the addition of two members to its Board of Directors,https://www.google.com/url?rct=j&sa=t&url=https://www.stltoday.com/pr/business/alliance-for-shared-health-ash-announces-the-addition-of-two-members-to-its-board-of/article_23466548-c613-11ea-aa99-5cb9017befe7.html&ct=ga&cd=CAIyHGVmMjU5ZGE1NWJkYjU0NjU6Y29tOmVuOlVTOlI&usg=AFQjCNFWIqx1v9g9zyP6kmTecWwj7t18Sg,"Adelle Brown, author, pastor, and co-founder of VI Christian Ministries, has a heart to serve people in the USVI and was instrumental in the...",2020-07-15,Health Care Sharing Ministry
Governor Cuomo issues extension to sign up for health insurance through state marketplace,https://www.google.com/url?rct=j&sa=t&url=https://whcuradio.com/news/025520-governor-cuomo-issues-extension-to-sign-up-for-health-insurance-through-state-marketplace/&ct=ga&cd=CAIyHDQ1NzZkZjdlYTEzZTg0YTA6Y29tOmVuOlVTOlI&usg=AFQjCNF622ppKFUK4BecmyVK_oPMBj7JeA,"... Health Plus – can enroll year-round. Finally, as directed by Governor Cuomo, all New York insurers have waived cost sharing for COVID-19 testing.",2020-07-15,Health Cost Sharing
Joan Budden to retire after 5 years leading Priority Health,https://www.google.com/url?rct=j&sa=t&url=https://www.modernhealthcare.com/providers/joan-budden-retire-after-5-years-leading-priority-health&ct=ga&cd=CAIyHDQ1NzZkZjdlYTEzZTg0YTA6Y29tOmVuOlVTOlI&usg=AFQjCNFmnSC8br7mBTHoPm61Dn-cYdrSGw,"Budden said Cigna will share Priority""s provider network but the two health insurers also will work together on evidence-based medicine and healthy...",2020-07-15,Health Cost Sharing
"Spectrum Health and Priority Health Announce Retirement of Joan Budden, Priority Health ...",https://www.google.com/url?rct=j&sa=t&url=https://us.acrofan.com/detail.php%3Fnumber%3D310575&ct=ga&cd=CAIyHDQ1NzZkZjdlYTEzZTg0YTA6Y29tOmVuOlVTOlI&usg=AFQjCNEFLXB2Fabr4jFEb2iCFmFeeaYNTA,... Health offered financial support to members and employers during the COVID-19 pandemic through premium credits and is waiving cost sharing for...,2020-07-15,Health Cost Sharing
Cuomo announces special health insurance enrollment extension through NY State of Health ...,https://www.google.com/url?rct=j&sa=t&url=https://www.wnypapers.com/news/article/current/2020/07/15/142374/cuomo-announces-special-health-insurance-enrollment-extension-through-ny-state-of-health-marketplace&ct=ga&cd=CAIyHDQ1NzZkZjdlYTEzZTg0YTA6Y29tOmVuOlVTOlI&usg=AFQjCNHsQxttpIOU65pByD-HGp-NyUFN7w,"... and Child Health Plus – can enroll year-round. Finally, as directed by Cuomo, all New York insurers have waived cost sharing for COVID-19 testing.",2020-07-15,Health Cost Sharing
"As Part of New York""s Ongoing Response to the COVID-19 Pandemic, Governor Cuomo ...",https://www.google.com/url?rct=j&sa=t&url=https://www.governor.ny.gov/news/part-new-yorks-ongoing-response-covid-19-pandemic-governor-cuomo-announces-special-health&ct=ga&cd=CAIyHDQ1NzZkZjdlYTEzZTg0YTA6Y29tOmVuOlVTOlI&usg=AFQjCNFwHPabkRiByRGFchZ7fuXRXWIr2A,"... Health Plus - can enroll year-round. Finally, as directed by Governor Cuomo, all New York insurers have waived cost sharing for COVID-19 testing.",2020-07-15,Health Cost Sharing
Why Yale students seek relief from cost sharing amid coronavirus uncertainty,https://www.google.com/url?rct=j&sa=t&url=https://www.ctinsider.com/news/nhregister/article/Why-Yale-students-seek-relief-from-cost-sharing-15410363.php&ct=ga&cd=CAIyHDQ1NzZkZjdlYTEzZTg0YTA6Y29tOmVuOlVTOlI&usg=AFQjCNF5p3O150B3i803t31Ux-ajM09dJw,"And with the increased stress of the crisis, students with mental health issues are asking for additional therapists, especially people of color and those...",2020-07-15,Health Cost Sharing
Insurance company to lower costs for maintenance medications,https://www.google.com/url?rct=j&sa=t&url=https://morganton.com/community/insurance-company-to-lower-costs-for-maintenance-medications/article_0a5c1985-f055-5ed5-aebc-1b347d67f1df.html&ct=ga&cd=CAIyHDQ1NzZkZjdlYTEzZTg0YTA6Y29tOmVuOlVTOlI&usg=AFQjCNGxELk5cdT6cROJAAtu7AVD_655dQ,"... help members during this public health crisis, including extending its expanded telehealth policy through the end of 2020 and waiving cost-sharing...",2020-07-15,Health Cost Sharing
UnitedHealth Group profit doubles to $6.6 billion with COVID-19 slowdown,https://www.google.com/url?rct=j&sa=t&url=https://www.startribune.com/unitedhealth-profit-doubles-to-6-6-billion-with-covid-19-slowdown/571774122/&ct=ga&cd=CAIyHDQ1NzZkZjdlYTEzZTg0YTA6Y29tOmVuOlVTOlI&usg=AFQjCNFcsNTRAKiBTc-v2PMTvxRrhelcYA,"COVID-19 caused unexpected medical costs during the quarter from ... in direct customer and consumer support via premium credits, cost-sharing...",2020-07-15,Health Cost Sharing
UnitedHealth profit beats views but revenue misses,https://www.google.com/url?rct=j&sa=t&url=https://www.marketwatch.com/story/unitedhealth-profit-beats-views-but-revenue-misses-2020-07-15&ct=ga&cd=CAIyHDQ1NzZkZjdlYTEzZTg0YTA6Y29tOmVuOlVTOlI&usg=AFQjCNGR0lEXqXmfbngfUFhMiqPIRlcXFg,"The parent of the nation""s largest health insurer posted net income of $6.64 billion, ... such as through cost-sharing waivers, and care-provider funding.",2020-07-15,Health Cost Sharing
Prior Authorization Changes Driven by the COVID-19 Pandemic,https://www.google.com/url?rct=j&sa=t&url=https://www.policymed.com/2020/07/prior-authorization-changes-driven-by-the-covid-19-pandemic.html&ct=ga&cd=CAIyHDQ1NzZkZjdlYTEzZTg0YTA6Y29tOmVuOlVTOlI&usg=AFQjCNHdwee1XdFlVue8bPCxOCQs5jmy6g,"Health care associations, particularly those representing physicians and ... requiring health insurance companies to waive cost-sharing charges for...",2020-07-15,Health Cost Sharing
Proposed Rules allow for More Flexibility to Grandfathered Group Health Plans,https://www.google.com/url?rct=j&sa=t&url=https://acatimes.com/proposed-rules-allow-for-more-flexibility-to-grandfathered-group-health-plans/&ct=ga&cd=CAIyHDQ1NzZkZjdlYTEzZTg0YTA6Y29tOmVuOlVTOlI&usg=AFQjCNHGqiX-b3BkdAKV1OEW2glJD1tIdQ,... health plans to make changes to certain types of cost-sharing requirements ... while also enhancing their ability to respond to rising healthcare costs.,2020-07-15,Health Cost Sharing
New Proposed Relief for Grandfathered Group Health Plans,https://www.google.com/url?rct=j&sa=t&url=https://www.jdsupra.com/legalnews/new-proposed-relief-for-grandfathered-10038/&ct=ga&cd=CAIyHDQ1NzZkZjdlYTEzZTg0YTA6Y29tOmVuOlVTOlI&usg=AFQjCNFTfS1Tary0aDENKO5SNRfNH2xaoQ,"However, grandfathered status comes at the price of reduced flexibility in setting cost-sharing amounts, among other features. It requires constant...",2020-07-14,Health Cost Sharing
7 Common medicare mistakes to avoid,https://www.google.com/url?rct=j&sa=t&url=https://www.hoosiertimes.com/7-common-medicare-mistakes-to-avoid/article_d78975b6-c47b-11ea-82eb-53b06d466324.html&ct=ga&cd=CAIyHDQ1NzZkZjdlYTEzZTg0YTA6Y29tOmVuOlVTOlI&usg=AFQjCNF5BerXR-eneTWXTHxfzWjgnBAfnw,"Delaying buying a Medigap policy: Medigaps are supplemental health ... pay the monthly Part B premium and may help with Medicare cost sharing,...",2020-07-13,Health Cost Sharing
"As People Age, They Share Fewer Memories With Others: Study",https://www.google.com/url?rct=j&sa=t&url=https://www.usnews.com/news/health-news/articles/2020-07-15/as-people-age-they-share-fewer-memories-with-others-study&ct=ga&cd=CAIyGmU4MWY4MmViNmViOTg5MTE6Y29tOmVuOlVT&usg=AFQjCNECWDo8-2GVoDVrUvjLI07pi917KA,"The Alzheimer""s Association offers tips for keeping your brain healthy. Copyright © 2020 HealthDay. All rights reserved. Tags: senior health, memory...",2020-07-15,Health Sharing
Gag Order on Health Institutions for Sharing Details with Press,https://www.google.com/url?rct=j&sa=t&url=https://kashmirobserver.net/2020/07/15/gag-order-on-health-institutions-for-sharing-details-with-press/&ct=ga&cd=CAIyGmU4MWY4MmViNmViOTg5MTE6Y29tOmVuOlVT&usg=AFQjCNEbS5Mf_zLRoYdeT7UnFmn1TvD4qw,Srinagar: The government on Wednesday barred all health institutions from sharing details on Covid-19 related testing in Jammu and Kashmir with the...,2020-07-15,Health Sharing
High coronavirus positive case rate reveals flaws in Florida Department of Health report,https://www.google.com/url?rct=j&sa=t&url=https://www.clickorlando.com/news/local/2020/07/15/high-coronavirus-positive-case-rate-reveals-flaws-in-florida-department-of-health-report/&ct=ga&cd=CAIyGmU4MWY4MmViNmViOTg5MTE6Y29tOmVuOlVT&usg=AFQjCNH1Y9E6DZzI9tkzwejjWybMAFRuKg,"As of this report, outside of Health First, only Orlando Health has responded sharing its testing numbers for all 12 of its laboratories. The hospital...",2020-07-15,Health Sharing
Joint Initiative Council Adds LOINC to Interoperability Coalition,https://www.google.com/url?rct=j&sa=t&url=https://ehrintelligence.com/news/joint-initiative-council-adds-loinc-to-interoperability-coalition&ct=ga&cd=CAIyGmU4MWY4MmViNmViOTg5MTE6Y29tOmVuOlVT&usg=AFQjCNFtACpaRMpusAOTHD-U90QCA50GZw,"Prior to LOINC standards, each health system has had its own method of coding its information, and when they share that data with another system,...",2020-07-15,Health Sharing
Why Yale students seek relief from cost sharing amid coronavirus uncertainty,https://www.google.com/url?rct=j&sa=t&url=https://www.ctinsider.com/news/nhregister/article/Why-Yale-students-seek-relief-from-cost-sharing-15410363.php&ct=ga&cd=CAIyGmU4MWY4MmViNmViOTg5MTE6Y29tOmVuOlVT&usg=AFQjCNF5p3O150B3i803t31Ux-ajM09dJw,"And with the increased stress of the crisis, students with mental health issues are asking for additional therapists, especially people of color and those...",2020-07-15,Health Sharing
Mental Health Commission states urgent action is required to prepare for potential second wave of ...,https://www.google.com/url?rct=j&sa=t&url=https://www.lexology.com/library/detail.aspx%3Fg%3D9be9b6c4-ab75-4da6-b8b5-3cbba96b1eac&ct=ga&cd=CAIyGmU4MWY4MmViNmViOTg5MTE6Y29tOmVuOlVT&usg=AFQjCNGWDoTSaoAk1p2_KoOqp8JN0-SJ2Q,"there are clearly defined points of contact and shared protocols for each facility in relation to testing, contact tracing and PPE;; clear public health...",2020-07-15,Health Sharing
Alliance for Shared Health (ASH) announces the addition of two members to its Board of Directors,https://www.google.com/url?rct=j&sa=t&url=https://www.stltoday.com/pr/business/alliance-for-shared-health-ash-announces-the-addition-of-two-members-to-its-board-of/article_23466548-c613-11ea-aa99-5cb9017befe7.html&ct=ga&cd=CAIyGmU4MWY4MmViNmViOTg5MTE6Y29tOmVuOlVT&usg=AFQjCNFWIqx1v9g9zyP6kmTecWwj7t18Sg,"Columbia, MO: Alliance for Shared Health (ASH), an IRS-approved, 501(c)3 non-profit international health sharing ministry, is honored to announce...",2020-07-15,Health Sharing
Health bosses link car sharing to rise in Covid-19 cases in Northampton and Kettering,https://www.google.com/url?rct=j&sa=t&url=https://www.northantstelegraph.co.uk/health/coronavirus/health-bosses-link-car-sharing-rise-covid-19-cases-northampton-and-kettering-2914346&ct=ga&cd=CAIyGmU4MWY4MmViNmViOTg5MTE6Y29tOmVuOlVT&usg=AFQjCNHVrpzvJn_EuDEU0HDo1vFRS-2f4A,... county health department issued a statement confirming several cases in Northamptonshire have been linked to transmission through car sharing...,2020-07-15,Health Sharing
Alliance for Shared Health (ASH) Announces the Addition of Two Members to Its Board of Directors,https://www.google.com/url?rct=j&sa=t&url=https://www.pr.com/press-release/816933&ct=ga&cd=CAIyGmU4MWY4MmViNmViOTg5MTE6Y29tOmVuOlVT&usg=AFQjCNFODX8AM9a4TkWy1cigEt5yEMs-VA,"Kansas City, MO, July 15, 2020 --(PR.com)-- Alliance for Shared Health (ASH), an IRS-approved, 501(c)3 non-profit international health sharing...",2020-07-15,Health Sharing
Health bosses link car sharing to rise in Covid-19 cases in Northampton and Kettering,https://www.google.com/url?rct=j&sa=t&url=https://www.northamptonchron.co.uk/health/coronavirus/health-bosses-link-car-sharing-rise-covid-19-cases-northampton-and-kettering-2914346&ct=ga&cd=CAIyGmU4MWY4MmViNmViOTg5MTE6Y29tOmVuOlVT&usg=AFQjCNFmSRPJE_q-qFjIXzGQ5xBbegWU7g,... health department rushed out a statement confirming several cases in Northamptonshire have been linked to transmission through car sharing and...,2020-07-15,Health Sharing
UnitedHealth Group profit doubles to $6.6 billion with COVID-19 slowdown,https://www.google.com/url?rct=j&sa=t&url=https://www.startribune.com/unitedhealth-profit-doubles-to-6-6-billion-with-covid-19-slowdown/571774122/&ct=ga&cd=CAIyGmU4MWY4MmViNmViOTg5MTE6Y29tOmVuOlVT&usg=AFQjCNFcsNTRAKiBTc-v2PMTvxRrhelcYA,"The Minnetonka-based health care company said in an earnings release ... support via premium credits, cost-sharing waivers and other measures.",2020-07-15,Health Sharing
Relationships and Wellbeing – Promoting Health Through Love,https://www.google.com/url?rct=j&sa=t&url=https://sflcn.com/relationships-and-wellbeing-promoting-health-through-love/&ct=ga&cd=CAIyGmU4MWY4MmViNmViOTg5MTE6Y29tOmVuOlVT&usg=AFQjCNFYwKiplFYTaJ38MwZJpu-WGf94mQ,Studies have it that sharing true love with your partner promotes health in many ways. Whether you are enjoying such a relationship or want to start...,2020-07-15,Health Sharing
MDClone Forms Unique Research and Innovation Network With Global Health Leaders,https://www.google.com/url?rct=j&sa=t&url=https://www.businesswire.com/news/home/20200715005225/en/MDClone-Forms-Unique-Research-Innovation-Network-Global&ct=ga&cd=CAIyGmU4MWY4MmViNmViOTg5MTE6Y29tOmVuOlVT&usg=AFQjCNHYiK8OlMDqZ-NKGTjQgY-fabNOsg,"These projects can be conducted without sharing individual patient information, utilizing synthetic data generated by MDClone at each member site...",2020-07-15,Health Sharing
Bob Harper and AstraZeneca Bring Virtual Series to Heart Attack Survivors to Inspire Others with ...,https://www.google.com/url?rct=j&sa=t&url=https://www.businesswire.com/news/home/20200715005150/en/Bob-Harper-AstraZeneca-Bring-Virtual-Series-Heart&ct=ga&cd=CAIyGmU4MWY4MmViNmViOTg5MTE6Y29tOmVuOlVT&usg=AFQjCNF3fGkUmCNyyuuLKZQ-75vhXdO9_g,Bob Harper said: “My personal mission in life has evolved to advocating for heart health and well-being by sharing my heart attack experience.,2020-07-15,Health Sharing
UnitedHealth profit beats views but revenue misses,https://www.google.com/url?rct=j&sa=t&url=https://www.marketwatch.com/story/unitedhealth-profit-beats-views-but-revenue-misses-2020-07-15&ct=ga&cd=CAIyGmU4MWY4MmViNmViOTg5MTE6Y29tOmVuOlVT&usg=AFQjCNGR0lEXqXmfbngfUFhMiqPIRlcXFg,"... largest health insurer posted net income of $6.64 billion, or $6.91 a share, ... The medical-loss ratio -- the percentage of premium revenue spent on...",2020-07-15,Health Sharing
Covid-19 highlights shared accommodation risks,https://www.google.com/url?rct=j&sa=t&url=https://www.imt.ie/news/covid-19-highlights-shared-accommodation-risks-15-07-2020/&ct=ga&cd=CAIyGmU4MWY4MmViNmViOTg5MTE6Y29tOmVuOlVT&usg=AFQjCNFeRO4WzhKJtx-1fofMQ_8Q6gjhbw,"Mental Health Commission monitoring 181 mental health services caring for more than 3,900 service users. The Covid-19 pandemic has highlighted...",2020-07-15,Health Sharing
Calls for greater investment in GP telehealth following Covid-19,https://www.google.com/url?rct=j&sa=t&url=https://www.digitalhealth.net/2020/07/calls-for-greater-investment-in-gp-telehealth-following-covid-19/&ct=ga&cd=CAIyGmU4MWY4MmViNmViOTg5MTE6Y29tOmVuOlVT&usg=AFQjCNH_oBJ_23AgsOrO8p-y02RecEJPsw,"During the pandemic a number of data sharing restrictions were relaxed to ... including Public Health England""s Covid-19 Observatory, were also able to ... “While data sharing safeguards should be restored after the pandemic,...",2020-07-15,Health Sharing
Prior Authorization Changes Driven by the COVID-19 Pandemic,https://www.google.com/url?rct=j&sa=t&url=https://www.policymed.com/2020/07/prior-authorization-changes-driven-by-the-covid-19-pandemic.html&ct=ga&cd=CAIyGmU4MWY4MmViNmViOTg5MTE6Y29tOmVuOlVT&usg=AFQjCNHdwee1XdFlVue8bPCxOCQs5jmy6g,"... First Coronavirus Response Act (FFCRA), requiring health insurance companies to waive cost-sharing charges for FDA-approved COVID-19 testing,...",2020-07-15,Health Sharing
Proposed Rules allow for More Flexibility to Grandfathered Group Health Plans,https://www.google.com/url?rct=j&sa=t&url=https://acatimes.com/proposed-rules-allow-for-more-flexibility-to-grandfathered-group-health-plans/&ct=ga&cd=CAIyGmU4MWY4MmViNmViOTg5MTE6Y29tOmVuOlVT&usg=AFQjCNHGqiX-b3BkdAKV1OEW2glJD1tIdQ,"If these rules are finalized, they would amend current rules for grandfathered group health plans to make changes to certain types of cost-sharing...",2020-07-15,Health Sharing
"Japan""s online coronavirus info sharing system sees low uptake among local gov""ts",https://www.google.com/url?rct=j&sa=t&url=https://mainichi.jp/english/articles/20200715/p2a/00m/0na/014000c&ct=ga&cd=CAIyGmU4MWY4MmViNmViOTg5MTE6Y29tOmVuOlVT&usg=AFQjCNHqyIo91aLAktcfyWwqwy4iMYDOjw,"Public health centers and medical institutions subsequently update the information at certain stages, such as when results are revealed, when a patient...",2020-07-15,Health Sharing
Governor Cuomo issues extension to sign up for health insurance through state marketplace,https://www.google.com/url?rct=j&sa=t&url=https://whcuradio.com/news/025520-governor-cuomo-issues-extension-to-sign-up-for-health-insurance-through-state-marketplace/&ct=ga&cd=CAIyHDcyMWE5ZGFiNjRlZGE3MTM6Y29tOmVuOlVTOlI&usg=AFQjCNF622ppKFUK4BecmyVK_oPMBj7JeA,"... Health Plus – can enroll year-round. Finally, as directed by Governor Cuomo, all New York insurers have waived cost sharing for COVID-19 testing.",2020-07-15,Healthcare Cost Sharing
Joan Budden to retire after 5 years leading Priority Health,https://www.google.com/url?rct=j&sa=t&url=https://www.modernhealthcare.com/providers/joan-budden-retire-after-5-years-leading-priority-health&ct=ga&cd=CAIyHDcyMWE5ZGFiNjRlZGE3MTM6Y29tOmVuOlVTOlI&usg=AFQjCNFmnSC8br7mBTHoPm61Dn-cYdrSGw,"Budden said Cigna will share Priority""s provider network but the two health insurers also will work together on evidence-based medicine and healthy...",2020-07-15,Healthcare Cost Sharing
"State revises insurance waiver request, pushes back timetable",https://www.google.com/url?rct=j&sa=t&url=https://www.northwestgeorgianews.com/rome/news/local/state-revises-insurance-waiver-request-pushes-back-timetable/article_cf5c85ce-c6bd-11ea-8c88-5f1e0fa51d91.html&ct=ga&cd=CAIyHDcyMWE5ZGFiNjRlZGE3MTM6Y29tOmVuOlVTOlI&usg=AFQjCNHwUfg55BiKMCm9B9mvtjCQ0OH56g,"That""s an effort to stabilize health insurance premiums by capping the cost that ... The waiver plan still aims to replace the state""s current healthcare.gov ... that is at least as affordable (taking into account premiums and cost sharing).",2020-07-15,Healthcare Cost Sharing
"Despite COVID Outbreak, UnitedHealth Revenues Rose $1.5B During Q2",https://www.google.com/url?rct=j&sa=t&url=https://www.healthleadersmedia.com/finance/despite-covid-outbreak-unitedhealth-revenues-rose-15b-during-q2&ct=ga&cd=CAIyHDcyMWE5ZGFiNjRlZGE3MTM6Y29tOmVuOlVTOlI&usg=AFQjCNEBMaOLPdAeo1Qw26r1rXMd2Ml5qg,"Forward looking, UnitedHealth is maintaining its EPS outlook for the rest of 2020 in a range of $15.45 to $15.75 per share. Additionally, the healthcare...",2020-07-15,Healthcare Cost Sharing
Prior Authorization Changes Driven by the COVID-19 Pandemic,https://www.google.com/url?rct=j&sa=t&url=https://www.policymed.com/2020/07/prior-authorization-changes-driven-by-the-covid-19-pandemic.html&ct=ga&cd=CAIyHDcyMWE5ZGFiNjRlZGE3MTM6Y29tOmVuOlVTOlI&usg=AFQjCNHdwee1XdFlVue8bPCxOCQs5jmy6g,"Health care associations, particularly those representing physicians and ... requiring health insurance companies to waive cost-sharing charges for...",2020-07-15,Healthcare Cost Sharing
Proposed Rules allow for More Flexibility to Grandfathered Group Health Plans,https://www.google.com/url?rct=j&sa=t&url=https://acatimes.com/proposed-rules-allow-for-more-flexibility-to-grandfathered-group-health-plans/&ct=ga&cd=CAIyHDcyMWE5ZGFiNjRlZGE3MTM6Y29tOmVuOlVTOlI&usg=AFQjCNHGqiX-b3BkdAKV1OEW2glJD1tIdQ,... health plans to make changes to certain types of cost-sharing requirements ... while also enhancing their ability to respond to rising healthcare costs.,2020-07-15,Healthcare Cost Sharing
New Proposed Relief for Grandfathered Group Health Plans,https://www.google.com/url?rct=j&sa=t&url=https://www.jdsupra.com/legalnews/new-proposed-relief-for-grandfathered-10038/&ct=ga&cd=CAIyHDcyMWE5ZGFiNjRlZGE3MTM6Y29tOmVuOlVTOlI&usg=AFQjCNFTfS1Tary0aDENKO5SNRfNH2xaoQ,"However, grandfathered status comes at the price of reduced flexibility in setting cost-sharing amounts, among other features. It requires constant...",2020-07-14,Healthcare Cost Sharing
OncLive® Adds University of Colorado Cancer Center to Its Strategic Alliance Partnership Program,https://www.google.com/url?rct=j&sa=t&url=https://finance.yahoo.com/news/onclive-adds-university-colorado-cancer-145500053.html&ct=ga&cd=CAIyHDc5M2E3YWM0ZTJjZTM4OWY6Y29tOmVuOlVTOlI&usg=AFQjCNEjtsWPdCpFI_g11Pd6LfvM4j_liQ,"As part of this joint effort, OncLive® will work with the University of Colorado Cancer Center to share exclusive clinical content and position its health care...",2020-07-15,Medical Sharing
"COVID-19 Outbreak on Medical Solid Waste Treatment, Global Market Size, Historical Growth ...",https://www.google.com/url?rct=j&sa=t&url=http://algosonline.com/news/covid-19-outbreak-on-medical-solid-waste-treatment-global-market-size-historical-growth-analysis-opportunities-and-forecast-to-2026&ct=ga&cd=CAIyHDc5M2E3YWM0ZTJjZTM4OWY6Y29tOmVuOlVTOlI&usg=AFQjCNFBzN-IG0RIl5fPpsuCMijjmgLscQ,"... share, market size, regional valuation, and business expansion plans of key players in the COVID-19 Outbreak on Medical Solid Waste Treatment,...",2020-07-15,Medical Sharing
Alliance for Shared Health (ASH) Announces the Addition of Two Members to Its Board of Directors,https://www.google.com/url?rct=j&sa=t&url=https://www.pr.com/press-release/816933&ct=ga&cd=CAIyHDc5M2E3YWM0ZTJjZTM4OWY6Y29tOmVuOlVTOlI&usg=AFQjCNFODX8AM9a4TkWy1cigEt5yEMs-VA,"Alliance for Share Health (ASH) members share a common set of ethical or religious standards and come together to help share in each other""s medical...",2020-07-15,Medical Sharing
Alliance for Shared Health (ASH) Announces the Addition of Two Members to Its Board of Directors,https://www.google.com/url?rct=j&sa=t&url=https://www.benzinga.com/pressreleases/20/07/r16630507/alliance-for-shared-health-ash-announces-the-addition-of-two-members-to-its-board-of-directors&ct=ga&cd=CAIyHDc5M2E3YWM0ZTJjZTM4OWY6Y29tOmVuOlVTOlI&usg=AFQjCNFTAj8RO3mm312jZcztVnHelb02Ow,"... and come together to help share in each other""s medical expenses. ... 1996 and has been continually sharing in medical needs since its inception.",2020-07-15,Medical Sharing
"WNBA, Elena Delle Donne share a difficult spotlight as MVP ponders next move",https://www.google.com/url?rct=j&sa=t&url=https://www.washingtonpost.com/sports/2020/07/14/wnba-elena-delle-donne-share-difficult-spotlight-mvp-ponders-next-move/&ct=ga&cd=CAIyHDc5M2E3YWM0ZTJjZTM4OWY6Y29tOmVuOlVTOlI&usg=AFQjCNE75UQdMaARZWkEfRNIaQIMduDaWA,"Should the Washington Mystics star opt out of the season without receiving a medical exemption, it is possible she won""t be paid her league-maximum...",2020-07-15,Medical Sharing
"Top hospital leaders on COVID-19: The latest facts, and what they hope happens",https://www.google.com/url?rct=j&sa=t&url=https://boisedev.com/news/2020/07/14/idahos-health-care-leaders-plea-for-mask-mandate-to-slow-the-spread-of-covid-19/&ct=ga&cd=CAIyHDc5M2E3YWM0ZTJjZTM4OWY6Y29tOmVuOlVTOlI&usg=AFQjCNFLAQ7UHihrMCA5sJdeJsUUUBfKyw,"“At the very early stages of this pandemic, we formed a healthcare collaborative. We did so with the intent of sharing information with one another, best...",2020-07-14,Medical Sharing
Saina Health and OmniHealth Partner to Launch InstaHealthTM – A First-of-its-Kind Medical ...,https://www.google.com/url?rct=j&sa=t&url=https://telecomreseller.com/2020/07/14/saina-health-and-omnihealth-partner-to-launch-instahealthtm-a-first-of-its-kind-medical-record-sharing-telehealth-platform/&ct=ga&cd=CAIyHDc5M2E3YWM0ZTJjZTM4OWY6Y29tOmVuOlVTOlI&usg=AFQjCNEbRqjGNKnbFnjXSHfnS8uXsoazsw,... InstaHealthTM – A First-of-its-Kind Medical Record Sharing TeleHealth ... Advanced Access and Sharing of Patient Records in Video Conferencing.,2020-07-14,Medical Sharing
