title,link,item_text,date_published,google_alert_name
Christians anticipate a ministry crescendo among an unreached people group,https://www.google.com/url?rct=j&sa=t&url=https://www.thealabamabaptist.org/christians-anticipate-a-ministry-crescendo-among-an-unreached-people-group/&ct=ga&cd=CAIyHDBlYjRmZTFlNDk3NWE4OGE6Y29tOmVuOlVTOlI&usg=AFQjCNHmfLm6kbEmEY1FXzSIv99TOrlijw,"Saalim is a Christian from this people group. He chose to leave Islam 10 years ago, but he was afraid to share about his faith in God for fear of...",2021-01-15,Christian Sharing Ministry
Connected Health M2M Market will touch a new level in upcoming year with Top Key Players like ...,https://www.google.com/url?rct=j&sa=t&url=https://ksusentinel.com/2021/01/17/connected-health-m2m-market-will-touch-a-new-level-in-upcoming-year-with-top-key-players-like-att-deutsche-telekom-ntt-sprint-telenor/&ct=ga&cd=CAIyHDQ1NzZkZjdlYTEzZTg0YTA6Y29tOmVuOlVTOlI&usg=AFQjCNHMMr1D8by1iA9THbRf4RpKy6QoKg,It enables the accessing and sharing of healthcare information and the ... The cost analysis of the Global Connected Health M2M Market has been...,2021-01-17,Health Cost Sharing
"How Trump""s most consequential policies have changed America",https://www.google.com/url?rct=j&sa=t&url=https://www.weny.com/story/43184914/how-trumps-most-consequential-policies-have-changed-america&ct=ga&cd=CAIyHDQ1NzZkZjdlYTEzZTg0YTA6Y29tOmVuOlVTOlI&usg=AFQjCNHvnEP2UE5E0RGceLv6Si-rOxxQoA,"Prior to the pandemic, the opioid crisis was Trump""s top public health focus. ... Though Trump has largely leaned on stock market gains, boosted ... but especially on trade -- impacting the cost of goods from around the world and...",2021-01-17,Health Cost Sharing
DR. STANLEY MARK CUTLER,https://www.google.com/url?rct=j&sa=t&url=https://www.legacy.com/obituaries/starnewsonline/obituary.aspx%3Fn%3Dstanley-mark-cutler%26pid%3D197524757&ct=ga&cd=CAIyGmU4MWY4MmViNmViOTg5MTE6Y29tOmVuOlVT&usg=AFQjCNGUg62rRk_qy7WQznLkPEj7g8sUgg,"To all the staff at Senior Health Center, New Hanover Regional Health Care, Accordius Health of Wilmington, and the Brian Center, we share the loss...",2021-01-17,Health Sharing
Plan launched to reduce risk of emerging zoonoses,https://www.google.com/url?rct=j&sa=t&url=https://www.foodsafetynews.com/2021/01/plan-launched-to-reduce-risk-of-emerging-zoonoses/&ct=ga&cd=CAIyGmU4MWY4MmViNmViOTg5MTE6Y29tOmVuOlVT&usg=AFQjCNE4n-ROJFwomFWXVYjXq27np8wCag,"“Linking the health of people, animals and our shared environment under a One Health approach can drive governments to take stronger and more...",2021-01-17,Health Sharing
World Insight: Global tech leaders share visions on post-COVID-19 era at CES 2021,https://www.google.com/url?rct=j&sa=t&url=http://www.xinhuanet.com/english/2021-01/17/c_139674235.htm&ct=ga&cd=CAIyGmU4MWY4MmViNmViOTg5MTE6Y29tOmVuOlVT&usg=AFQjCNGjKDnHnf5L9Ce5HqZbmMAQKLL86Q,"... has invited leading professionals from the technological, health and financial industries to share their unique, forward-looking visions for the future.",2021-01-17,Health Sharing
Tensions rise over sharing of cross-border passenger details,https://www.google.com/url?rct=j&sa=t&url=https://www.independent.ie/irish-news/news/tensions-rise-over-sharing-of-cross-border-passenger-details-39976373.html&ct=ga&cd=CAIyGmU4MWY4MmViNmViOTg5MTE6Y29tOmVuOlVT&usg=AFQjCNHoZYrjx4aL9W38JNQXqM0mKiB2VA,"... and continues to be, engagement between the ministers for Health in both jurisdictions on data sharing from respective passenger locator forms."".",2021-01-17,Health Sharing
"Inoculation not only option, follow health norms: Bengal docs",https://www.google.com/url?rct=j&sa=t&url=https://www.siasat.com/inoculation-not-only-option-follow-health-norms-bengal-docs-2069227/&ct=ga&cd=CAIyGmU4MWY4MmViNmViOTg5MTE6Y29tOmVuOlVT&usg=AFQjCNFprCqaA5neFX2N1iOVtEzXXBOBWg,Ten senior doctors of the Infectious Diseases and Beliaghata General Hospital have led from the front by sharing the first vial of the vaccine (each vial...,2021-01-16,Health Sharing
"Inoculation not only option, follow health norms: Bengal docs",https://www.google.com/url?rct=j&sa=t&url=https://www.daijiworld.com/news/newsDisplay.aspx%3FnewsID%3D792004&ct=ga&cd=CAIyGmU4MWY4MmViNmViOTg5MTE6Y29tOmVuOlVT&usg=AFQjCNFqjd5XzXRYB8UWX9chgSy66kmWjA,... led from the front by sharing the first vial of the vaccine (each vial has 10 doses). West Bengal health department has selected several senior doctors...,2021-01-16,Health Sharing
WhatsApp extends deadline to accept new privacy policy after people fled to other platforms,https://www.google.com/url?rct=j&sa=t&url=https://www.androidpolice.com/2021/01/16/whatsapp-extends-deadline-to-accept-new-privacy-policy-after-people-fled-to-other-platforms/&ct=ga&cd=CAIyGmU4MWY4MmViNmViOTg5MTE6Y29tOmVuOlVT&usg=AFQjCNFwtV9DgwHaP89dVXAAtsYzaQ2vmg,"After inviting users to accept its new data sharing policy with Facebook, ... WhatsApp data will remain encrypted and won""t be shared with Facebook,...",2021-01-16,Health Sharing
10 Famous Male Stars Who Love To Do Yoga,https://www.google.com/url?rct=j&sa=t&url=https://www.thethings.com/famous-male-stars-who-love-to-do-yoga/&ct=ga&cd=CAIyGmU4MWY4MmViNmViOTg5MTE6Y29tOmVuOlVT&usg=AFQjCNFAZCP4RXw-sDtMDpQRSEI29vZSfA,"Harrelson once shared, ""Yoga is the best thing for your sex life! ... on his physical and mental health, sharing that it""s helped to ""balance"" his life.",2021-01-16,Health Sharing
FPJ Explains: Why are women deleting popular period-tracking app Flo?,https://www.google.com/url?rct=j&sa=t&url=https://www.freepressjournal.in/lifestyle/fpj-explains-why-are-women-deleting-popular-period-tracking-app-flo&ct=ga&cd=CAIyGmU4MWY4MmViNmViOTg5MTE6Y29tOmVuOlVT&usg=AFQjCNFSIVoWe3az-Y8QlDmwskQtlPf73w,"This proposes that Flo Health will have to obtain independent review of its privacy practices and get users"" consent before sharing information. It would...",2021-01-16,Health Sharing
Coronavirus | Science behind COVID-19 vaccines is resolute: Health Minister,https://www.google.com/url?rct=j&sa=t&url=https://www.thehindu.com/news/national/science-behind-covid-19-vaccines-is-resolute-health-minister/article33588108.ece&ct=ga&cd=CAIyGmU4MWY4MmViNmViOTg5MTE6Y29tOmVuOlVT&usg=AFQjCNEZxMQ34WI5kUnG2z4-gqasT7Cdww,"Open your eyes, sharing photos of eminent doctors and government functionaries getting inoculated.” He quoted writer Charles Caleb Colton: “So...",2021-01-16,Health Sharing
"""We are not superhuman"": Health-care workers plead for more mental health support",https://www.google.com/url?rct=j&sa=t&url=https://q107.com/news/7578827/health-care-workers-mental-health/&ct=ga&cd=CAIyGmU4MWY4MmViNmViOTg5MTE6Y29tOmVuOlVT&usg=AFQjCNFwwrX41qhkAY64jRrfcncsmZce3A,"Similarly, providing community spaces to share the best practices on dealing with grief as well as resources for people in different health-care...",2021-01-16,Health Sharing
Withholding vaccine data from citizens is wrong,https://www.google.com/url?rct=j&sa=t&url=https://www.thespec.com/opinion/editorials/2021/01/16/withholding-vaccine-data-from-citizens-is-wrong.html&ct=ga&cd=CAIyGmU4MWY4MmViNmViOTg5MTE6Y29tOmVuOlVT&usg=AFQjCNGmtDoAkxfQ7KdFD6cFby902IT0hg,"Because the provincial government apparently issued a directive to Hamilton public health to stop sharing information about the city""s COVID vaccine...",2021-01-16,Health Sharing
"Election Commission Nods To Home Ministry""s Request Of Sharing Voter Data For Vaccination Drive",https://www.google.com/url?rct=j&sa=t&url=https://thelogicalindian.com/trending/ministry-of-home-affairs-election-commission-covid-vaccine-26177&ct=ga&cd=CAIyGmU4MWY4MmViNmViOTg5MTE6Y29tOmVuOlVT&usg=AFQjCNEJZf0IZujquCAD7OxFzhTbpCgSeg,"Last year in December, the health ministry shared the guidelines for the vaccination process with the states, which stated that the COVID-19...",2021-01-16,Health Sharing
Instagram video sparks concern of COVID spread in Northland bars,https://www.google.com/url?rct=j&sa=t&url=https://kbjr6.com/2021/01/15/instagram-video-sparks-concern-of-covid-spread-in-northland-bars/&ct=ga&cd=CAIyGmU4MWY4MmViNmViOTg5MTE6Y29tOmVuOlVT&usg=AFQjCNEjMCSxiwowcjWauoEynTod6BMrDA,"One tweet is calling on the bar to do better in regards to community health. Another tweet, sharing the video, says they are not definitely not following...",2021-01-16,Health Sharing
WhatsApp privacy controversy leads company to take out full-page adverts asking users to stay,https://www.google.com/url?rct=j&sa=t&url=https://www.independent.co.uk/life-style/gadgets-and-tech/whatsapp-privacy-adverts-india-b1787443.html&ct=ga&cd=CAIyGmU4MWY4MmViNmViOTg5MTE6Y29tOmVuOlVT&usg=AFQjCNF3NMeVT7Eg12nKsuZpG-RBiF6Tjw,"The company began sharing data with Facebook for these purposes in 2016, giving users a choice to opt-out; its new policy expands these...",2021-01-14,Health Sharing
"How Trump""s most consequential policies have changed America",https://www.google.com/url?rct=j&sa=t&url=https://www.weny.com/story/43184914/how-trumps-most-consequential-policies-have-changed-america&ct=ga&cd=CAIyHDcyMWE5ZGFiNjRlZGE3MTM6Y29tOmVuOlVTOlI&usg=AFQjCNHvnEP2UE5E0RGceLv6Si-rOxxQoA,"Prior to the pandemic, the opioid crisis was Trump""s top public health focus. ... Though Trump has largely leaned on stock market gains, boosted ... but especially on trade -- impacting the cost of goods from around the world and...",2021-01-17,Healthcare Cost Sharing
"Telemedicine may continue to grow, but only if payment, benefits and regulations remain favorable ...",https://www.google.com/url?rct=j&sa=t&url=https://www.crainsdetroit.com/special-report/telemedicine-may-continue-grow-only-if-payment-benefits-and-regulations-remain&ct=ga&cd=CAIyHDcyMWE5ZGFiNjRlZGE3MTM6Y29tOmVuOlVTOlI&usg=AFQjCNHbtNX4HiRuqMJpXs6aneza9GnYcQ,But will the virtual care growth continue past the pandemic? Tracy Watts ... While most private health insurers have temporarily waived cost sharing for...,2021-01-17,Healthcare Cost Sharing
"Responding to calls for transparency, Israel publishes contract of data-sharing deal with Pfizer","https://www.google.com/url?rct=j&sa=t&url=https://www.calcalistech.com/ctech/articles/0,7340,L-3888331,00.html&ct=ga&cd=CAIyHDc5M2E3YWM0ZTJjZTM4OWY6Y29tOmVuOlVTOlI&usg=AFQjCNGfNgCjEUxUuCdP1jAOHDB9g2OmCw","Israel""s Ministry of Health published on Sunday a redacted copy of a contract it signed with drugmaker Pfizer for the exchange of public medical data in...",2021-01-17,Medical Sharing
What exactly is the Health Ministry sharing with Pfizer?,https://www.google.com/url?rct=j&sa=t&url=https://www.jpost.com/health-science/what-exactly-is-health-minister-sharing-with-pfizer-here-is-the-deal-655757&ct=ga&cd=CAIyHDc5M2E3YWM0ZTJjZTM4OWY6Y29tOmVuOlVTOlI&usg=AFQjCNEGJDImSH_x8Gg4KPGILLxyFk9j2w,A scientist conducts research on a vaccine for the novel coronavirus (COVID-19) at the laboratories of RNA medicines company Arcturus Therapeutics in...,2021-01-17,Medical Sharing
DR. STANLEY MARK CUTLER,https://www.google.com/url?rct=j&sa=t&url=https://www.legacy.com/obituaries/starnewsonline/obituary.aspx%3Fn%3Dstanley-mark-cutler%26pid%3D197524757&ct=ga&cd=CAIyHDc5M2E3YWM0ZTJjZTM4OWY6Y29tOmVuOlVTOlI&usg=AFQjCNGUg62rRk_qy7WQznLkPEj7g8sUgg,"He attended medical school at Temple University School of Medicine (MD) ... Stan""s approach to medicine was firmly cemented early in his career. ... Accordius Health of Wilmington, and the Brian Center, we share the loss you feel...",2021-01-17,Medical Sharing
