title,link,item_text,date_published,google_alert_name
Joplin woman says Freeman COVID-19 testing bill was nearly double anticipated amount,https://www.google.com/url?rct=j&sa=t&url=https://www.koamnewsnow.com/joplin-woman-says-freeman-covid-19-testing-bill-was-nearly-double-anticipated-amount/&ct=ga&cd=CAIyHDQ1NzZkZjdlYTEzZTg0YTA6Y29tOmVuOlVTOlI&usg=AFQjCNEyxXjyyypjRIq-WMxAMZ-z-S9l9A,"All patients with no other health insurance or pay sources, such as ... with no cost-sharing for people covered by most private health plans, Medicare,...",2020-08-08,Health Cost Sharing
COVID-19 tests administered locally,https://www.google.com/url?rct=j&sa=t&url=https://www.roanoke-chowannewsherald.com/2020/08/07/covid-19-tests-administered-locally/&ct=ga&cd=CAIyHDQ1NzZkZjdlYTEzZTg0YTA6Y29tOmVuOlVTOlI&usg=AFQjCNHguhAaHz8TENS8qNW1Z96LEOqmAg,AHOSKIE – The North Carolina Department of Health and Human Services (NCDHHS) has ... will be billed but there are no co-pays or cost-sharing for anyone seeking testing. Those who are uninsured are also tested at no cost.,2020-08-07,Health Cost Sharing
Study Measures How Out-of-Pocket Caps Affect Spending,https://www.google.com/url?rct=j&sa=t&url=https://www.centerforbiosimilars.com/news/study-measures-how-outofpocket-caps-affect-spending&ct=ga&cd=CAIyHDQ1NzZkZjdlYTEzZTg0YTA6Y29tOmVuOlVTOlI&usg=AFQjCNEToGNQcA5Xtkq_dP2YR2DTuHBEtw,"Meanwhile, the use of high cost-sharing drug tiers among employer sponsored health plans has risen from 11% to 51%, with a simultaneous increase...",2020-08-07,Health Cost Sharing
Insurers saw sky-high profits in Q2. Now Congress wants to take a look at their finances,https://www.google.com/url?rct=j&sa=t&url=https://www.fiercehealthcare.com/payer/insurers-saw-sky-high-profits-q2-now-congress-wants-to-take-a-look-at-their-finances&ct=ga&cd=CAIyHDQ1NzZkZjdlYTEzZTg0YTA6Y29tOmVuOlVTOlI&usg=AFQjCNHiuaUBAZrG1ybhKJSPKZarCHplTQ,"Soaring profits was the defining trend in the second quarter among health ... For example, plans have waived member cost-sharing for testing and...",2020-08-07,Health Cost Sharing
"Global Patient Registry Software Market 2020 Top Countries Data: Industry Size, Share, Future ...",https://www.google.com/url?rct=j&sa=t&url=https://bulletinline.com/2020/08/07/global-patient-registry-software-market-2020-top-countries-data-industry-size-share-future-challenges-revenue-demand-industry-growth-and-top-players-analysis-and-forecast-by-360-market-updates/&ct=ga&cd=CAIyHDQ1NzZkZjdlYTEzZTg0YTA6Y29tOmVuOlVTOlI&usg=AFQjCNFvxAgOJVJ5-tBv0LF-fqyMuAGBPA,Increasing Adoption of Electronic Health Records ... surveillance and the push to reduce healthcare costs are also driving the growth of this market.,2020-08-07,Health Cost Sharing
"Pune Police""s coffee inspired post has an important health message for all. Seen it yet?",https://www.google.com/url?rct=j&sa=t&url=https://www.hindustantimes.com/it-s-viral/pune-police-s-coffee-inspired-post-has-an-important-health-message-for-all-seen-it-yet/story-sOY2rYiI4KMvH1kNMj9jqM.html&ct=ga&cd=CAIyGmU4MWY4MmViNmViOTg5MTE6Y29tOmVuOlVT&usg=AFQjCNE_-x9Kzy670-3LmGnQ3HuHb9NITw,"This image was shared on the Pune Police""s official Twitter and Instagram account on August 8. ... Thus, one should refrain from sharing masks.",2020-08-08,Health Sharing
Health Hack: Being Prepared For A Health Emergency,https://www.google.com/url?rct=j&sa=t&url=https://wgntv.com/living-healthy-chicago/health-hacks/health-hack-being-prepared-for-a-health-emergency/&ct=ga&cd=CAIyGmU4MWY4MmViNmViOTg5MTE6Y29tOmVuOlVT&usg=AFQjCNG92_wZEcMYi2K_quq_yT_70yCvGw,"Health Hack: Being Prepared For A Health Emergency ... So for our latest ""Health Hack"" we""re sharing some tips on ways you can promote...",2020-08-08,Health Sharing
California health officials release rules for reopening colleges,https://www.google.com/url?rct=j&sa=t&url=https://www.kcra.com/article/california-health-officials-release-rules-for-reopening-colleges/33551482&ct=ga&cd=CAIyGmU4MWY4MmViNmViOTg5MTE6Y29tOmVuOlVT&usg=AFQjCNGc8jUzSsXd4EHovTi0ZKU3BlI_Dg,Athletic departments should also consider sharing testing results with opposing teams before the game starts; Schools must have a system for notifying...,2020-08-08,Health Sharing
Intermountain welcomes 10 ICU nurses from New York as part of a collaborative COVID-19 ...,https://www.google.com/url?rct=j&sa=t&url=https://www.abc4.com/sponsored/4pm-sponsored/intermountain-welcomes-10-icu-nurses-from-new-york-as-part-of-a-collaborative-covid-19-partnership-between-two-of-the-nations-premier-health-systems/&ct=ga&cd=CAIyGmU4MWY4MmViNmViOTg5MTE6Y29tOmVuOlVT&usg=AFQjCNECeE8M7zGzqYNSbC-mjMpy_vKMMA,"... as part of a collaborative partnership between two of the nation""s premier health systems to assist each other and share best practices and protocols...",2020-08-07,Health Sharing
"Michael Phelps, Michelle Obama steer pandemic spotlight on mental health crisis",https://www.google.com/url?rct=j&sa=t&url=https://www.winknews.com/2020/08/07/michael-phelps-michelle-obama-steer-pandemic-spotlight-on-mental-health-crisis/&ct=ga&cd=CAIyGmU4MWY4MmViNmViOTg5MTE6Y29tOmVuOlVT&usg=AFQjCNEi8J7VWCi2lZz0dzUouMTxXogqCg,Phelps is not alone in sharing his mental health struggles. Obama opened up about her issues with low-grade depression stemming from the...,2020-08-07,Health Sharing
Public-health officials gather in Montreal to discuss coming second wave,https://www.google.com/url?rct=j&sa=t&url=https://montrealgazette.com/news/local-news/public-health-officials-gather-in-montreal-to-discuss-coming-second-wave&ct=ga&cd=CAIyGmU4MWY4MmViNmViOTg5MTE6Y29tOmVuOlVT&usg=AFQjCNFLhtCASBHeAfVGZgRiR0A3AsbJFw,"A new command centre where the heads of all Montreal""s public-health districts could assemble to share information is among the preparations the...",2020-08-07,Health Sharing
St. Louis Health Officials Need Contact Tracing Transparency,https://www.google.com/url?rct=j&sa=t&url=https://www.governing.com/now/St-Louis-Health-Officials-Need-Contact-Tracing-Transparency.html&ct=ga&cd=CAIyGmU4MWY4MmViNmViOTg5MTE6Y29tOmVuOlVT&usg=AFQjCNFGkootXbJbldlO753v-8Op_M42DA,(TNS) — Prominent local and national health experts are urging officials across the U.S. to begin sharing the details and locations of coronavirus...,2020-08-07,Health Sharing
The World Will Recover From COVID-19 Faster If Countries Avoid Hoarding Vaccines: WHO,https://www.google.com/url?rct=j&sa=t&url=https://www.globalcitizen.org/en/content/who-calls-for-vaccine-sharing/&ct=ga&cd=CAIyGmU4MWY4MmViNmViOTg5MTE6Y29tOmVuOlVT&usg=AFQjCNHbAz9zTNuLfem5y4prsUaTflDxxA,"... share vaccines and other resources once they become available, Dr. Tedros Adhanom Ghebreyesus, the director-general of the World Health...",2020-08-07,Health Sharing
Jackson County Health reports second COVID-19 death,https://www.google.com/url?rct=j&sa=t&url=https://ktvl.com/news/local/jackson-county-health-reports-second-covid-19-death&ct=ga&cd=CAIyGmU4MWY4MmViNmViOTg5MTE6Y29tOmVuOlVT&usg=AFQjCNHOljxeoKafJl7iE6-JI54pZy1jPg,"Adjust your food offerings to avoid sharing utensils and offer individual servings. Don""t share drinks. During and afterward, thoroughly clean all frequently...",2020-08-07,Health Sharing
"Has Healthcare Trust of America, Inc. (NYSE:HTA) Stock""s Recent Performance Got Anything to Do ...",https://www.google.com/url?rct=j&sa=t&url=https://finance.yahoo.com/news/healthcare-trust-america-inc-nyse-180520586.html&ct=ga&cd=CAIyGmU4MWY4MmViNmViOTg5MTE6Y29tOmVuOlVT&usg=AFQjCNEXuR3UNsGbeZdi8JWaz-ox8MsF4Q,"Most readers would already know that Healthcare Trust of America""s (NYSE:HTA) stock increased by 7.4% over the past three months. Given that stock...",2020-08-07,Health Sharing
"Analyzing Bausch Health""s Unusual Options Activity",https://www.google.com/url?rct=j&sa=t&url=https://www.benzinga.com/general/health-care/20/08/16992093/analyzing-bausch-healths-unusual-options-activity&ct=ga&cd=CAIyGmU4MWY4MmViNmViOTg5MTE6Y29tOmVuOlVT&usg=AFQjCNHjQlXc6KuLMVTaMpAaHpF7EHvT8w,"On Friday, shares of Bausch Health Cos (NYSE: BHC) saw unusual options activity. After the option alert, the stock price moved down to $18.14.",2020-08-07,Health Sharing
"Apple, Facebook, Microsoft Lead Stock Market Rally; Teladoc-Livongo Deal Panned; Fastly ...",https://www.google.com/url?rct=j&sa=t&url=https://www.investors.com/news/apple-facebook-microsoft-tiktok-lead-stock-market-rally-teladoc-livongo-fastly-fall/&ct=ga&cd=CAIyGmU4MWY4MmViNmViOTg5MTE6Y29tOmVuOlVT&usg=AFQjCNFLvIVC62C73x62_Z3Kp1fFCyLh4g,"Teladoc Health (TDOC) on Wednesday announced it would acquire telehealth rival Livongo (LVGO) for a stock and a little cash deal, initially valued at...",2020-08-07,Health Sharing
Why Fastly Stock Fell Again On Friday,https://www.google.com/url?rct=j&sa=t&url=https://www.nasdaq.com/articles/why-fastly-stock-fell-again-on-friday-2020-08-07&ct=ga&cd=CAIyGmU4MWY4MmViNmViOTg5MTE6Y29tOmVuOlVT&usg=AFQjCNHYGerfHt37vjZtDA8YAthOpttmGQ,"Image source: The Motley Fool. Livongo Health Inc (NASDAQ: LVGO) Q2 2020 Earnings Call Aug 05, 2020, 8:00 p.m. ET...",2020-08-07,Health Sharing
Health insurers strike gold with COVID-19,https://www.google.com/url?rct=j&sa=t&url=https://www.modernhealthcare.com/insurance/health-insurers-strike-gold-covid-19&ct=ga&cd=CAIyGmU4MWY4MmViNmViOTg5MTE6Y29tOmVuOlVT&usg=AFQjCNEqiiduGZi3fFcRyNOjX03wPyIaUw,"Humana and Centene eliminated seniors"" cost-sharing for primary care, behavioral health and telehealth services for the rest of the year. UnitedHealth...",2020-08-07,Health Sharing
Metro Health Board Approves Revised Plan To Share Limited COVID Patient Data With First ...,https://www.google.com/url?rct=j&sa=t&url=https://patch.com/tennessee/nashville/metro-health-board-approves-revised-plan-share-limited-covid-patient-data-first&ct=ga&cd=CAIyGmU4MWY4MmViNmViOTg5MTE6Y29tOmVuOlVT&usg=AFQjCNHug23EfLSkpAMoxd9QNuUmFoibzw,The Metro Public Health Department had previously shared patient names and addresses with law enforcement before the controversial data-sharing...,2020-08-07,Health Sharing
Earnings Outlook For National Health Investors,https://www.google.com/url?rct=j&sa=t&url=https://www.benzinga.com/news/earnings/20/08/16987977/earnings-outlook-for-national-health-investors&ct=ga&cd=CAIyGmU4MWY4MmViNmViOTg5MTE6Y29tOmVuOlVT&usg=AFQjCNFm7130PFb4-1mYdNA3jwtwPiY3vA,"In the same quarter last year, National Health Investors reported earnings per share of $1.36 on revenue of $78.10 million. The analyst consensus...",2020-08-07,Health Sharing
"Don""t sing in the car or you""ll spread the virus, health chiefs warn",https://www.google.com/url?rct=j&sa=t&url=https://www.expressandstar.com/news/health/coronavirus-covid19/2020/08/07/dont-sing-in-the-car-or-youll-spread-the-virus-health-chiefs-warn/&ct=ga&cd=CAIyGmU4MWY4MmViNmViOTg5MTE6Y29tOmVuOlVT&usg=AFQjCNFANvs2OJIClQftUokz1qF6SqIxcg,"Clive Wright, a West Midlands regional convenor for the Department of Health and Social Care, said car sharing had been connected to the recent...",2020-08-07,Health Sharing
"Saban, Smart, Pruitt and other SEC football coaches required to wear masks on sideline as part of ...",https://www.google.com/url?rct=j&sa=t&url=https://www.timesfreepress.com/news/sports/college/story/2020/aug/07/sec-football-virus-guidelines/529315/&ct=ga&cd=CAIyGmU4MWY4MmViNmViOTg5MTE6Y29tOmVuOlVT&usg=AFQjCNHmWDCGz_YWj_lGHMuIuOiMYK404A,"Using recommendations by the SEC""s Return to Activity and Medical ... around the virus and evolve our plan to meet the health needs of our student-athletes. ... Free Press login credentials to begin sharing your thoughts and opinion.",2020-08-07,Health Sharing
Watch Thomas Rhett Surprise Healthcare Workers With Virtual Performance (Exclusive) Makin ...,https://www.google.com/url?rct=j&sa=t&url=https://www.billboard.com/articles/columns/country/9430446/thomas-rhett-surprise-healthcare-workers&ct=ga&cd=CAIyGmU4MWY4MmViNmViOTg5MTE6Y29tOmVuOlVT&usg=AFQjCNHkT8D4twYWAk1tAYfsybN9aqHgUg,"""As I stood there and shared this moment with my work team, I was so humbled to be part of this event and share with my team a special moment that will...",2020-08-07,Health Sharing
"Korn""s Munky Clears The Air About His Health Status By Sharing Coronavirus Test Results",https://www.google.com/url?rct=j&sa=t&url=https://metalheadzone.com/korns-munky-clears-the-air-about-his-health-status-by-sharing-coronavirus-test-results/&ct=ga&cd=CAIyGmU4MWY4MmViNmViOTg5MTE6Y29tOmVuOlVT&usg=AFQjCNGdKnaTkf_BdtrOblSJZQPg_TMAMA,"James ""Munky"" Shaffer, the co-founder, and guitarist of the nu-metal band Korn has taken the coronavirus tests and shared the results on his Instagram...",2020-08-07,Health Sharing
Insurers saw sky-high profits in Q2. Now Congress wants to take a look at their finances,https://www.google.com/url?rct=j&sa=t&url=https://www.fiercehealthcare.com/payer/insurers-saw-sky-high-profits-q2-now-congress-wants-to-take-a-look-at-their-finances&ct=ga&cd=CAIyHDcyMWE5ZGFiNjRlZGE3MTM6Y29tOmVuOlVTOlI&usg=AFQjCNHiuaUBAZrG1ybhKJSPKZarCHplTQ,"Soaring profits was the defining trend in the second quarter among health ... For example, plans have waived member cost-sharing for testing and...",2020-08-07,Healthcare Cost Sharing
"MD Who Gave Patient Info To Drug Rep Can""t Nix Conviction",https://www.google.com/url?rct=j&sa=t&url=https://www.law360.com/trials/articles/1299455/md-who-gave-patient-info-to-drug-rep-can-t-nix-conviction&ct=ga&cd=CAIyHDc5M2E3YWM0ZTJjZTM4OWY6Y29tOmVuOlVTOlI&usg=AFQjCNF7Uqkmf93kbPCXzoRTcrEnyfRydg,"... gynecologist of sharing her patients"" private medical information with a sales representative at Warner Chilcott, then lying about it to federal agents.",2020-08-07,Medical Sharing
