title,link,item_text,date_published,google_alert_name
Timing proves critical to sharing gospel with refugees,https://www.google.com/url?rct=j&sa=t&url=https://www.brnow.org/news/timing-proves-critical-to-sharing-gospel-with-refugees/&ct=ga&cd=CAIyHDBlYjRmZTFlNDk3NWE4OGE6Y29tOmVuOlVTOlI&usg=AFQjCNHo3damEuvzIKfNnKL0IJNcx8oWnA,... weeks or just hours to share the hope that is found in Jesus. This is why International Mission Board (IMB) missionaries and ministry partners who...,2021-04-26,Christian Sharing Ministry
"Aliera, Trinity HealthShare agree to stop marketing plans in Connecticut",https://www.google.com/url?rct=j&sa=t&url=https://ctmirror.org/2021/04/27/aliera-trinity-healthshare-agree-to-stop-marketing-plans-in-connecticut/&ct=ga&cd=CAIyHGVmMjU5ZGE1NWJkYjU0NjU6Y29tOmVuOlVTOlI&usg=AFQjCNGwhzGl8m1i6hG1nxcUSqhcMDTf6w,"The Aliera Companies and a health care sharing ministry whose plans it promoted, Trinity HealthShare, have agreed to stop marketing in Connecticut,...",2021-04-27,Health Care Sharing Ministry
Insurance department settles with “healthcare-sharing” companies accused of scam plans,https://www.google.com/url?rct=j&sa=t&url=https://www.hartfordbusiness.com/article/insurance-department-settles-with-healthcare-sharing-companies-accused-of-scam-plans&ct=ga&cd=CAIyHGVmMjU5ZGE1NWJkYjU0NjU6Y29tOmVuOlVTOlI&usg=AFQjCNHAT7z2vsX4X4HVwWLkijN8wD5oXA,"Operating without a license, Aliera had been offering plans in Connecticut on behalf of Trinity Healthshare, a “healthcare-sharing ministry” marketed to...",2021-04-27,Health Care Sharing Ministry
Cash-Pay Healthcare Startup Sesame Raises $24 Million To Support Explosive Growth,https://www.google.com/url?rct=j&sa=t&url=https://www.forbes.com/sites/debgordon/2021/04/27/cash-pay-healthcare-startup-sesame-raises-24-million-to-support-explosive-growth/&ct=ga&cd=CAIyHGVmMjU5ZGE1NWJkYjU0NjU6Y29tOmVuOlVTOlI&usg=AFQjCNHKz_Yy2IA3YKWqA3JBWt_fUC00tw,"Instead, they joined a healthcare sharing ministry—a faith-based alternative to insurance that reimburses members for bills they pay up front.",2021-04-27,Health Care Sharing Ministry
Bringing Christianity to Your Health,https://www.google.com/url?rct=j&sa=t&url=https://www.christianpost.com/sponsored/bringing-christianity-to-your-health.html&ct=ga&cd=CAIyHGVmMjU5ZGE1NWJkYjU0NjU6Y29tOmVuOlVTOlI&usg=AFQjCNEhLGMMcyAIq2qUMc6t7N6ApiL5pQ,A great example of how firmly rooted in Christian principles these ministries truly are comes from the Member Handbook of Share HealthCare. In this...,2021-04-26,Health Care Sharing Ministry
"Joe Biden""s Big Medicare Opportunity",https://www.google.com/url?rct=j&sa=t&url=https://newrepublic.com/article/162206/medicare-advantage-biden-infrastructure-bill&ct=ga&cd=CAIyHDQ1NzZkZjdlYTEzZTg0YTA6Y29tOmVuOlVTOlI&usg=AFQjCNEBuV2-eQVzjROK1ZMZplzL5OzZfw,"Meanwhile, aging Americans will be materially relieved of staggering costs that ... It""s common to hear proponents of universal health care disparage...",2021-04-28,Health Cost Sharing
"Healthcare Supply Chain Management Market Business Scenario, Size, Share, Growth, Insights ...",https://www.google.com/url?rct=j&sa=t&url=https://www.mccourier.com/healthcare-supply-chain-management-market-business-scenario-size-share-growth-insights-industry-analysis-trends-and-forecasts-report-2027/&ct=ga&cd=CAIyHDQ1NzZkZjdlYTEzZTg0YTA6Y29tOmVuOlVTOlI&usg=AFQjCNH4GOiC_32yj7SxVIuO2rDJPZEVNw,Emergence of cloud-based solutions is also fueling the market. Increasing expenditure on healthcare requires higher efficiency in the delivery of...,2021-04-28,Health Cost Sharing
"Brazil rejects Russia""s Sputnik V vaccine, citing safety concerns",https://www.google.com/url?rct=j&sa=t&url=https://www.axios.com/brazil-sputnik-vaccine-russia-reject-80354db2-0578-4bcb-a1ab-7b7ceb9c26ad.html&ct=ga&cd=CAIyHDQ1NzZkZjdlYTEzZTg0YTA6Y29tOmVuOlVTOlI&usg=AFQjCNHvJo9Bq_tW75zGsZHZP7FH_GsDcg,Brazilian health regulators said this week they will not recommend importing ... Why it matters: Insurers waived most cost-sharing for coronavirus...,2021-04-27,Health Cost Sharing
"Cooper: County mask mandate expiring, but vaccine hesitant may get a push",https://www.google.com/url?rct=j&sa=t&url=https://www.timesfreepress.com/news/opinion/freepress/story/2021/apr/27/cooper-county-mask-mandate-expiring-vaccine-h/545859/&ct=ga&cd=CAIyHDQ1NzZkZjdlYTEzZTg0YTA6Y29tOmVuOlVTOlI&usg=AFQjCNGSK9FcZvQWs5JffebvHFvCP6ALkg,"He also asked the other six counties with independent health departments ... if they haven""t already, may come from their health insurance company. ... year when the virus set in, most insurance companies waived such cost-sharing.",2021-04-27,Health Cost Sharing
"Aliera, Trinity HealthShare agree to stop marketing plans in Connecticut",https://www.google.com/url?rct=j&sa=t&url=https://ctmirror.org/2021/04/27/aliera-trinity-healthshare-agree-to-stop-marketing-plans-in-connecticut/&ct=ga&cd=CAIyHDQ1NzZkZjdlYTEzZTg0YTA6Y29tOmVuOlVTOlI&usg=AFQjCNGwhzGl8m1i6hG1nxcUSqhcMDTf6w,The Aliera Companies and a health care sharing ministry whose plans it ... complained about denial of coverage and non-payment of medical bills.,2021-04-27,Health Cost Sharing
"Time to say goodbye to some insurers"" waivers for COVID treatment fees",https://www.google.com/url?rct=j&sa=t&url=https://www.fiercehealthcare.com/payer/time-to-say-goodbye-to-some-insurers-waivers-for-covid-treatment-fees&ct=ga&cd=CAIyHDQ1NzZkZjdlYTEzZTg0YTA6Y29tOmVuOlVTOlI&usg=AFQjCNFQ6esUiPUNOeAZDACsZJxPvqtv1A,"Guidance issued early in President Joe Biden""s term reinforced the Trump administration rule about waiving cost-sharing for testing and said it applies...",2021-04-27,Health Cost Sharing
"Twenty-something, out of work, and losing sleep worrying about health insurance",https://www.google.com/url?rct=j&sa=t&url=https://www.healthinsurance.org/blog/twenty-something-out-of-work-and-losing-sleep-worrying-about-health-insurance/&ct=ga&cd=CAIyHDQ1NzZkZjdlYTEzZTg0YTA6Y29tOmVuOlVTOlI&usg=AFQjCNHV0kgWw9SM1HvlvtyHj3_NnQTvwg,"The Essential Plan provides robust health coverage with no monthly premium, and it has much lower cost-sharing than we typically see in the...",2021-04-27,Health Cost Sharing
More Than 100 Patient Groups Advocate for Affordable Prescription Drugs,https://www.google.com/url?rct=j&sa=t&url=https://www.pharmacytimes.com/view/more-than-100-patient-groups-advocate-for-affordable-prescription-drugs&ct=ga&cd=CAIyHDQ1NzZkZjdlYTEzZTg0YTA6Y29tOmVuOlVTOlI&usg=AFQjCNGCGSHQ4S2GtVeS7EX5-sbksUoneA,"... health care system that include high deductible plans and high cost-sharing. According to the organizations, high costs have threatened treatment...",2021-04-27,Health Cost Sharing
"Clearity Health, A Crowdsourced Search Engine For Local Healthcare Prices, Launches And Calls ...",https://www.google.com/url?rct=j&sa=t&url=https://www.prnewswire.com/news-releases/clearity-health-a-crowdsourced-search-engine-for-local-healthcare-prices-launches-and-calls-for-medical-bills-301277222.html&ct=ga&cd=CAIyHDQ1NzZkZjdlYTEzZTg0YTA6Y29tOmVuOlVTOlI&usg=AFQjCNGIznqwbDXlW50ukmgY_1BvHFS1QQ,"AUSTIN, Texas, April 27, 2021 /PRNewswire/ -- Clearity Health, a new ... Its namesake healthcare cost search engine will show users exactly what other ... By sharing past medical bills at www.clearityhealth.com/fight-back, anyone...",2021-04-27,Health Cost Sharing
Khairy explains increase in cost of vaccination programme,https://www.google.com/url?rct=j&sa=t&url=https://www.freemalaysiatoday.com/category/nation/2021/04/27/khairy-explains-increase-in-cost-of-vaccination-programme/&ct=ga&cd=CAIyHDQ1NzZkZjdlYTEzZTg0YTA6Y29tOmVuOlVTOlI&usg=AFQjCNGCufTRR_Ue5hLV6YqMpqmcA5DLKQ,"The allocation also includes gifts for non-health volunteers worth RM200 million, data integration costs and appointment system (RM70 million),...",2021-04-27,Health Cost Sharing
Primer: Recent Health Care Transparency Initiatives,https://www.google.com/url?rct=j&sa=t&url=https://www.americanactionforum.org/insight/primer-recent-health-care-transparency-initiatives/&ct=ga&cd=CAIyHDQ1NzZkZjdlYTEzZTg0YTA6Y29tOmVuOlVTOlI&usg=AFQjCNFAj8uHrUEdQ5x3_z9i3p2j8OksfQ,The rule requires insurers and plans to disclose cost-sharing estimates at the request of a consumer and to publicly release negotiated rates for in- and...,2021-04-27,Health Cost Sharing
What America needs to invest to help the world reach herd immunity,https://www.google.com/url?rct=j&sa=t&url=https://thehill.com/blogs/congress-blog/healthcare/550400-what-america-needs-to-invest-to-help-the-world-reach-herd&ct=ga&cd=CAIyHDQ1NzZkZjdlYTEzZTg0YTA6Y29tOmVuOlVTOlI&usg=AFQjCNFhCdNvAdmO-Zop7gED-A9w0jC5vQ,"At the same time, the World Health Organization""s Access to COVID-19 Tools ... Building on this holistic view of needs and costs, Booz Allen and CARE ... as criteria for humanitarian cost-sharing from the Organisation for Economic...",2021-04-27,Health Cost Sharing
Centene Corporation Reports First Quarter 2021 Results And Increases 2021 Guidance,https://www.google.com/url?rct=j&sa=t&url=https://www.biospace.com/article/releases/centene-corporation-reports-first-quarter-2021-results-and-increases-2021-guidance/&ct=ga&cd=CAIyHDQ1NzZkZjdlYTEzZTg0YTA6Y29tOmVuOlVTOlI&usg=AFQjCNFpKRqOVKVAUn8o23joyyDupmSU2g,"The decrease was partially offset by higher testing and treatment costs associated with COVID-19, state premium rate adjustments and risk sharing...",2021-04-27,Health Cost Sharing
How health equity showed up in the legislature this session,https://www.google.com/url?rct=j&sa=t&url=https://washingtonstatewire.com/how-health-equity-showed-up-in-the-legislature-this-session/&ct=ga&cd=CAIyHDQ1NzZkZjdlYTEzZTg0YTA6Y29tOmVuOlVTOlI&usg=AFQjCNGLCx3ngEfkJnyXNs96X0NoCU96Sw,Some of the bills that managed to pass the packed session include: ... premium assistance and cost-sharing reduction program for qualified health...,2021-04-26,Health Cost Sharing
Millennial Money: Prepare for COVID medical bills this year,https://www.google.com/url?rct=j&sa=t&url=https://nsjonline.com/article/2021/04/millennial-money-prepare-for-covid-medical-bills-this-year/&ct=ga&cd=CAIyHDQ1NzZkZjdlYTEzZTg0YTA6Y29tOmVuOlVTOlI&usg=AFQjCNGen368ULXpOuJtVa71oczkouihsA,"During the pandemic, many private insurers have voluntarily waived cost-sharing for COVID-19-related treatments, including copays, payments toward...",2021-03-30,Health Cost Sharing
Sharing Economy International Re-launching BuddiGo Platform to Provide Local Food and Grocery ...,https://www.google.com/url?rct=j&sa=t&url=https://www.prnewswire.com/news-releases/sharing-economy-international-re-launching-buddigo-platform-to-provide-local-food-and-grocery-delivery-services-301278879.html&ct=ga&cd=CAIyGmU4MWY4MmViNmViOTg5MTE6Y29tOmVuOlVT&usg=AFQjCNEy4Pyx1-jKOaH6BDgbFrjovdqP6w,"(OTCQB: SEII) has paused the operation of the P2P food and grocery delivery platform BuddiGo, in concern of the health and the possibility of...",2021-04-28,Health Sharing
To vanquish Covid the world must get better at sharing,https://www.google.com/url?rct=j&sa=t&url=https://www.ft.com/content/46bd7420-6ae7-4984-8a85-880c5df06881&ct=ga&cd=CAIyGmU4MWY4MmViNmViOTg5MTE6Y29tOmVuOlVT&usg=AFQjCNG207DtylyEoCKDWyTqLjRqZDUdqA,"During a global health crisis, political leaders should not have to beg industry to share their IP and production knowhow. The world has been here before...",2021-04-28,Health Sharing
Sophie Albert shares current health condition of her daughter Avianna,https://www.google.com/url?rct=j&sa=t&url=https://www.gmanetwork.com/entertainment/celebritylife/family/76451/sophie-albert-shares-current-health-condition-of-her-daughter-avianna/story&ct=ga&cd=CAIyGmU4MWY4MmViNmViOTg5MTE6Y29tOmVuOlVT&usg=AFQjCNGkh8vwHUKh-yf8VEy5Avy0gwoS_g,Sophie Albert disclosed that her newborn daughter was diagnosed with gastroesophageal reflux disease or GERD. The Kapuso actress shared the...,2021-04-28,Health Sharing
"Twinkle Khanna says she was in ""bit of a hole"" due to family""s ill health as she, Akshay Kumar ...",https://www.google.com/url?rct=j&sa=t&url=https://www.hindustantimes.com/entertainment/bollywood/twinkle-khanna-says-she-was-in-bit-of-a-hole-due-to-family-s-ill-health-as-she-akshay-kumar-donate-covid-19-resources-101619580474257.html&ct=ga&cd=CAIyGmU4MWY4MmViNmViOTg5MTE6Y29tOmVuOlVT&usg=AFQjCNF0FA53XzKaqPZiCcj34mdUbLUnGQ,Twinkle Khanna and Akshay Kumar have donated 100 oxygen concentrators as India battles Covid-19. Taking to Instagram she shared a post asking...,2021-04-28,Health Sharing
Retreat Behavioral Health discusses how to overcome sexual assault trauma,https://www.google.com/url?rct=j&sa=t&url=https://local21news.com/news/local/retreat-behavioral-health-discusses-how-to-overcome-sexual-assault-trauma&ct=ga&cd=CAIyGmU4MWY4MmViNmViOTg5MTE6Y29tOmVuOlVT&usg=AFQjCNFVPaJlBoNNFSAtunX7TchBwNNKJw,"EPHRATA, Pa. — Sexual assault survivors are sharing their stories to let others know they are not alone. Survivors and therapists took part in Healing...",2021-04-28,Health Sharing
"As North Carolina sees slowdown in COVID vaccine sign-ups, health officials work to address ...",https://www.google.com/url?rct=j&sa=t&url=https://abc11.com/north-carolina-covid-vaccine-vaccination-rate-how-many-in-nc-are-vaccinated/10554679/&ct=ga&cd=CAIyGmU4MWY4MmViNmViOTg5MTE6Y29tOmVuOlVT&usg=AFQjCNEyoY6i5u2qmZOQea4U8tTdTk2U2A,"She""s now trying to convince family and friends to roll up their sleeves as well, sharing one such interaction. ""I called (my friend) and said ""Hey, they""ve...",2021-04-28,Health Sharing
"Markets rally for third day; Sensex ends 790 pts higher led by banks, financials",https://www.google.com/url?rct=j&sa=t&url=https://www.livemint.com/market/stock-market-news/share-market-live-updates-sensex-nifty-bse-nse-stock-market-today-28-04-2021-axis-bank-bajaj-finance-11619574320611.html&ct=ga&cd=CAIyGmU4MWY4MmViNmViOTg5MTE6Y29tOmVuOlVT&usg=AFQjCNGE_y0u4td-SFW4HQkbUlUmH_Veig,"Of the 30 shares on Sensex, six players ended in the red. ... covid-19, the Union health ministry on Wednesday allocated a fresh stock of imported drug...",2021-04-28,Health Sharing
"News Wrap: Biden promises India help to combat COVID, including sharing vaccines",https://www.google.com/url?rct=j&sa=t&url=https://www.pbs.org/newshour/show/news-wrap-biden-promises-india-help-to-combat-covid-including-sharing-vaccines&ct=ga&cd=CAIyGmU4MWY4MmViNmViOTg5MTE6Y29tOmVuOlVT&usg=AFQjCNFx556rAKxoV_2pns4-ZNdfCWeF0g,"Judy Woodruff: In the day""s other news: President Biden spoke with India""s prime minister, as that country""s COVID crisis kept growing. The Indian Health...",2021-04-27,Health Sharing
US to Share its AstraZeneca Vaccine Supply with the World,https://www.google.com/url?rct=j&sa=t&url=https://learningenglish.voanews.com/a/us-to-share-its-astrazeneca-vaccine-supply-with-the-world/5868715.html&ct=ga&cd=CAIyGmU4MWY4MmViNmViOTg5MTE6Y29tOmVuOlVT&usg=AFQjCNHIUiNe3BIFY0vwaSs2ffsNEZBt6Q,"Last week, the U.S. restarted use of Johnson and Johnson shots after a brief break while health officials investigated possible safety risks. ""The U.S. is...",2021-04-27,Health Sharing
Michigan GOP leader shares misinformation on masks that suggests suing employers,https://www.google.com/url?rct=j&sa=t&url=https://www.freep.com/story/news/politics/2021/04/27/michigan-gop-leader-misinformation-mask-effectiveness/4860259001/&ct=ga&cd=CAIyGmU4MWY4MmViNmViOTg5MTE6Y29tOmVuOlVT&usg=AFQjCNG9VJ8cvKHI3VLB34HprJIEy65BRA,Gretchen Whitmer and health department leaders should trust residents to do the right thing to keep themselves and others safe. More:Detroit nurse was...,2021-04-27,Health Sharing
Mayo Clinic partners with private data sharing startup,https://www.google.com/url?rct=j&sa=t&url=https://www.beckershospitalreview.com/data-analytics/mayo-clinic-partners-with-private-data-sharing-startup.html&ct=ga&cd=CAIyGmU4MWY4MmViNmViOTg5MTE6Y29tOmVuOlVT&usg=AFQjCNFGC4UvJAVLD0LdsqomKXt-sOZrJw,"""TripleBlind""s API-driven virtual exchange solution accelerates how organizations develop, test and deploy AI solutions in healthcare, and leverage third...",2021-04-27,Health Sharing
Share Your Knowledge To Uplift Your Community! Mount Vernon Chamber,https://www.google.com/url?rct=j&sa=t&url=https://patch.com/virginia/mountvernon/share-your-knowledge-uplift-your-community-mount-vernon-chamber&ct=ga&cd=CAIyGmU4MWY4MmViNmViOTg5MTE6Y29tOmVuOlVT&usg=AFQjCNFtKrRY0hIEL6_yga6nluLHv3GxTg,"Do you have a skill/talent that can be used to support adults with mental health, substance use, or homelessness issues in your community? &middot; Press...",2021-04-27,Health Sharing
"Aliera, Trinity HealthShare agree to stop marketing plans in Connecticut",https://www.google.com/url?rct=j&sa=t&url=https://ctmirror.org/2021/04/27/aliera-trinity-healthshare-agree-to-stop-marketing-plans-in-connecticut/&ct=ga&cd=CAIyGmU4MWY4MmViNmViOTg5MTE6Y29tOmVuOlVT&usg=AFQjCNGwhzGl8m1i6hG1nxcUSqhcMDTf6w,"The Aliera Companies and a health care sharing ministry whose plans it promoted, Trinity HealthShare, have agreed to stop marketing in Connecticut,...",2021-04-27,Health Sharing
ECDOH shares NYSACHO statement on COVID-19 prevention &amp; response activities in schools,https://www.google.com/url?rct=j&sa=t&url=https://www.wnypapers.com/news/article/current/2021/04/27/146378/ecdoh-shares-nysacho-statement-on-covid-19-prevention-response-activities-in-schools&ct=ga&cd=CAIyGmU4MWY4MmViNmViOTg5MTE6Y29tOmVuOlVT&usg=AFQjCNGmEgQS-TzsaUN2OBoXlxzbjqm6cQ,The Erie County Department of Health is sharing the New York State Association of County Health Officials statement from NYSACHO Executive...,2021-04-27,Health Sharing
USANA Health Sciences Reports First Quarter Results,https://www.google.com/url?rct=j&sa=t&url=https://www.businesswire.com/news/home/20210427005932/en/USANA-Health-Sciences-Reports-First-Quarter-Results&ct=ga&cd=CAIyGmU4MWY4MmViNmViOTg5MTE6Y29tOmVuOlVT&usg=AFQjCNF3birVRdQBXvVMZS9c7UvtoVEswQ,"Repurchased 721,000 shares for $69.5 million during the quarter. Raises 2021 net sales and diluted EPS outlook. Q1 2021 Financial Performance...",2021-04-27,Health Sharing
Vaccine IP Enforcement Takes Stage in Global Immunization Fight,https://www.google.com/url?rct=j&sa=t&url=https://news.bloomberglaw.com/health-law-and-business/vaccine-ip-enforcement-takes-stage-in-global-immunization-fight&ct=ga&cd=CAIyGmU4MWY4MmViNmViOTg5MTE6Y29tOmVuOlVT&usg=AFQjCNFZZfQHr-rsTatJIif_AFl3f7Lpvw,"... lucrative market, health experts say. The situation is complicating a debate over sharing manufacturing know-how to speed up global immunization.",2021-04-27,Health Sharing
Biden says he intends to share coronavirus vaccine doses with India,https://www.google.com/url?rct=j&sa=t&url=https://thehill.com/homenews/administration/550516-biden-says-he-intends-to-share-coronavirus-vaccine-doses-with-india&ct=ga&cd=CAIyGmU4MWY4MmViNmViOTg5MTE6Y29tOmVuOlVT&usg=AFQjCNHccIEZzvr-PAiz0SNC0IwYj-0vSA,Overnight Health Care: US to share millions of AstraZeneca vaccine... Medical supplies arriving in India amid surge in COVID-19 infections. “There is a...,2021-04-27,Health Sharing
Live data sharing portal tracks COVID-19 genome,https://www.google.com/url?rct=j&sa=t&url=https://www.rcinet.ca/en/2021/04/27/live-data-sharing-portal-tracks-covid-19-genome/&ct=ga&cd=CAIyGmU4MWY4MmViNmViOTg5MTE6Y29tOmVuOlVT&usg=AFQjCNFN2rJJ-7roenBAC-avSPJs-EylbQ,"It provides a single platform for researchers and public health experts to download comprehensive, standardized viral genomic data and will allow...",2021-04-27,Health Sharing
Opelousas General announces virtual health fair,https://www.google.com/url?rct=j&sa=t&url=https://www.katc.com/news/st-landry-parish/opelousas-general-announces-virtual-health-fair&ct=ga&cd=CAIyGmU4MWY4MmViNmViOTg5MTE6Y29tOmVuOlVT&usg=AFQjCNFBe5f6D4vyRndfAWDvSuMbQjkPEQ,All the same community vendors will be sharing their resources through an interactive PDF and video format. Below are three ways to join in the health...,2021-04-27,Health Sharing
May Is Mental Health Awareness Month. Here Are Some Local Sources for Help If You Need It.,https://www.google.com/url?rct=j&sa=t&url=https://www.sarasotamagazine.com/health-and-fitness/2021/04/stay-well-during-mental-health-awareness-month-with-this-sarasota-organization&ct=ga&cd=CAIyGmU4MWY4MmViNmViOTg5MTE6Y29tOmVuOlVT&usg=AFQjCNFbg3E0QR2RVu0xJkFU8oM9x7_KhQ,"“We discuss ways to cope with illness, how to have conversations with those struggling and sharing stories to make people feel less alone.” While...",2021-04-27,Health Sharing
"Joe Biden""s Big Medicare Opportunity",https://www.google.com/url?rct=j&sa=t&url=https://newrepublic.com/article/162206/medicare-advantage-biden-infrastructure-bill&ct=ga&cd=CAIyHDcyMWE5ZGFiNjRlZGE3MTM6Y29tOmVuOlVTOlI&usg=AFQjCNEBuV2-eQVzjROK1ZMZplzL5OzZfw,"Meanwhile, aging Americans will be materially relieved of staggering costs that ... It""s common to hear proponents of universal health care disparage...",2021-04-28,Healthcare Cost Sharing
"Healthcare Supply Chain Management Market Business Scenario, Size, Share, Growth, Insights ...",https://www.google.com/url?rct=j&sa=t&url=https://www.mccourier.com/healthcare-supply-chain-management-market-business-scenario-size-share-growth-insights-industry-analysis-trends-and-forecasts-report-2027/&ct=ga&cd=CAIyHDcyMWE5ZGFiNjRlZGE3MTM6Y29tOmVuOlVTOlI&usg=AFQjCNH4GOiC_32yj7SxVIuO2rDJPZEVNw,Emergence of cloud-based solutions is also fueling the market. Increasing expenditure on healthcare requires higher efficiency in the delivery of...,2021-04-28,Healthcare Cost Sharing
"Time to say goodbye to some insurers"" waivers for COVID treatment fees",https://www.google.com/url?rct=j&sa=t&url=https://www.fiercehealthcare.com/payer/time-to-say-goodbye-to-some-insurers-waivers-for-covid-treatment-fees&ct=ga&cd=CAIyHDcyMWE5ZGFiNjRlZGE3MTM6Y29tOmVuOlVTOlI&usg=AFQjCNFQ6esUiPUNOeAZDACsZJxPvqtv1A,"A few insurers continue to forgo patient cost-sharing in some types of ... That""s because insurers whose spending on direct medical care falls short of...",2021-04-27,Healthcare Cost Sharing
"Twenty-something, out of work, and losing sleep worrying about health insurance",https://www.google.com/url?rct=j&sa=t&url=https://www.healthinsurance.org/blog/twenty-something-out-of-work-and-losing-sleep-worrying-about-health-insurance/&ct=ga&cd=CAIyHDcyMWE5ZGFiNjRlZGE3MTM6Y29tOmVuOlVTOlI&usg=AFQjCNHV0kgWw9SM1HvlvtyHj3_NnQTvwg,"The Essential Plan provides robust health coverage with no monthly premium, and it has much lower cost-sharing than we typically see in the...",2021-04-27,Healthcare Cost Sharing
What America needs to invest to help the world reach herd immunity,https://www.google.com/url?rct=j&sa=t&url=https://thehill.com/blogs/congress-blog/healthcare/550400-what-america-needs-to-invest-to-help-the-world-reach-herd&ct=ga&cd=CAIyHDcyMWE5ZGFiNjRlZGE3MTM6Y29tOmVuOlVTOlI&usg=AFQjCNFhCdNvAdmO-Zop7gED-A9w0jC5vQ,"At the same time, the World Health Organization""s Access to COVID-19 Tools ... Building on this holistic view of needs and costs, Booz Allen and CARE ... as criteria for humanitarian cost-sharing from the Organisation for Economic...",2021-04-27,Healthcare Cost Sharing
Millennial Money: Prepare for COVID medical bills this year,https://www.google.com/url?rct=j&sa=t&url=https://nsjonline.com/article/2021/04/millennial-money-prepare-for-covid-medical-bills-this-year/&ct=ga&cd=CAIyHDcyMWE5ZGFiNjRlZGE3MTM6Y29tOmVuOlVTOlI&usg=AFQjCNGen368ULXpOuJtVa71oczkouihsA,"During the pandemic, many private insurers have voluntarily waived cost-sharing for COVID-19-related treatments, including copays, payments toward...",2021-03-30,Healthcare Cost Sharing
Gov. Pritzker signs healthcare reform legislation in Illinois,https://www.google.com/url?rct=j&sa=t&url=https://fox2now.com/news/gov-pritzker-signs-healthcare-reform-legislation-in-illinois/&ct=ga&cd=CAIyHDBhNGY1MzE5YzE5ODdjNzQ6Y29tOmVuOlVTOlI&usg=AFQjCNHUduoZqWZ48RmqGyOhp-tgbaI-AA,"It also establishes new programs, increases oversight and training, builds a Community Health Worker certification program, and improves transparency.",2021-04-27,Healthcare Sharing Programs
Gov. Pritzker signs healthcare reform legislation in Illinois,https://www.google.com/url?rct=j&sa=t&url=https://fox2now.com/news/gov-pritzker-signs-healthcare-reform-legislation-in-illinois/&ct=ga&cd=CAIyHDBhNGY1MzE5YzE5ODdjNzQ6Y29tOmVuOlVTOlI&usg=AFQjCNHUduoZqWZ48RmqGyOhp-tgbaI-AA,"It also establishes new programs, increases oversight and training, builds a Community Health Worker certification program, and improves transparency.",2021-04-27,Healthcare Sharing Programs
Consumer Reports: Mental health apps may not protect your privacy,https://www.google.com/url?rct=j&sa=t&url=https://www.localsyr.com/news/consumer-reports/consumer-reports-mental-health-apps-may-not-protect-your-privacy/&ct=ga&cd=CAIyHDc5M2E3YWM0ZTJjZTM4OWY6Y29tOmVuOlVTOlI&usg=AFQjCNE6RFxlAjUK8waPmBrzegLH03r0sA,"But mental health apps aren""t always covered by the same medical privacy laws, like HIPAA, that protect the information you share with a doctor in...",2021-04-27,Medical Sharing
"Aliera, Trinity HealthShare agree to stop marketing plans in Connecticut",https://www.google.com/url?rct=j&sa=t&url=https://ctmirror.org/2021/04/27/aliera-trinity-healthshare-agree-to-stop-marketing-plans-in-connecticut/&ct=ga&cd=CAIyHDc5M2E3YWM0ZTJjZTM4OWY6Y29tOmVuOlVTOlI&usg=AFQjCNGwhzGl8m1i6hG1nxcUSqhcMDTf6w,"The Aliera Companies and a health care sharing ministry whose plans it promoted, Trinity HealthShare, have agreed to stop marketing in Connecticut,...",2021-04-27,Medical Sharing
"Ashley Judd Shares an Update and Recovery Photos After ""Shattering"" Her Leg",https://www.google.com/url?rct=j&sa=t&url=https://www.self.com/story/ashley-judd-leg-injury-recovery-update&ct=ga&cd=CAIyHDc5M2E3YWM0ZTJjZTM4OWY6Y29tOmVuOlVTOlI&usg=AFQjCNGGxDGP_8QFNNpnw6Zx4xU5M-PCAg,Ashley Judd is on the mend two-and-a-half months after suffering a severe leg injury and a harrowing medical emergency abroad. Judd made an...,2021-04-27,Medical Sharing
