title,link,item_text,date_published,google_alert_name
Trinity Healthshare agrees to cease health care sharing ministry in Iowa,https://www.google.com/url?rct=j&sa=t&url=https://businessrecord.com/Content/Default/All-Latest-News/Article/Trinity-Healthshare-agrees-to-cease-health-care-sharing-ministry-in-Iowa/-3/248/92882&ct=ga&cd=CAIyHGVmMjU5ZGE1NWJkYjU0NjU6Y29tOmVuOlVTOlI&usg=AFQjCNGNRqyr48X_jEBYtEqR6mjfhbN-jg,"According to the statement of charges, Trinity purportedly operated as a health care sharing ministry and acted as an unauthorized insurer by offering...",2021-03-18,Health Care Sharing Ministry
Five ways the American Rescue Plan might slash your health insurance costs,https://www.google.com/url?rct=j&sa=t&url=https://www.healthinsurance.org/blog/2021/03/18/five-ways-the-american-rescue-plan-might-slash-your-health-insurance-costs/&ct=ga&cd=CAIyHGVmMjU5ZGE1NWJkYjU0NjU6Y29tOmVuOlVTOlI&usg=AFQjCNF8BmFnIE7S3wu7wuqit0QtlL3PQw,"If you""re in a state that uses HealthCare.gov, the new subsidies and ... insurance plan, a health care sharing ministry plan, a fixed indemnity plan,...",2021-03-18,Health Care Sharing Ministry
Blue Cross &amp; Blue Shield RI facing backlash on decision to end cost-sharing waiver,https://www.google.com/url?rct=j&sa=t&url=https://turnto10.com/news/coronavirus/blue-cross-blue-shield-ri-facing-backlash-on-decision-to-end-cost-sharing-waiver&ct=ga&cd=CAIyHDQ1NzZkZjdlYTEzZTg0YTA6Y29tOmVuOlVTOlI&usg=AFQjCNGVxeuKiW5Abj29EHBqmpfOAuhhUQ,"That decision has drawn the ire of some, including Rhode Island Health Insurance Commissioner Patrick Tigue. ""I am concerned with the announcement...",2021-03-18,Health Cost Sharing
Blue Cross &amp; Blue Shield RI facing backlash on decision to end cost-sharing waiver,https://www.google.com/url?rct=j&sa=t&url=https://turnto10.com/news/local/blue-cross-blue-shield-ri-facing-backlash-on-decision-to-end-cost-sharing-waiver&ct=ga&cd=CAIyHDQ1NzZkZjdlYTEzZTg0YTA6Y29tOmVuOlVTOlI&usg=AFQjCNH9p14WjfJsnhVrWeqqsREk2XZMNQ,... criticism after the company announced it will end its waiver to pause cost sharing and out-of-pocket expenses for treatment related to COVID-19.,2021-03-18,Health Cost Sharing
Senate bill to increase the affordability of standardized health plans heard in House Health ...,https://www.google.com/url?rct=j&sa=t&url=https://washingtonstatewire.com/senate-bill-to-increase-the-affordability-of-standardized-health-plans-heard-in-house-health-committee/&ct=ga&cd=CAIyHDQ1NzZkZjdlYTEzZTg0YTA6Y29tOmVuOlVTOlI&usg=AFQjCNGhHWZlYZOyuaoi2ZQEslWU_k00Ag,"Specifically, this bill would establish a state premium assistance and cost-sharing reduction program for qualified health plans that are purchased...",2021-03-18,Health Cost Sharing
Medicaid Provisions in the American Rescue Plan Act,https://www.google.com/url?rct=j&sa=t&url=https://www.kff.org/medicaid/issue-brief/medicaid-provisions-in-the-american-rescue-plan-act/&ct=ga&cd=CAIyHDQ1NzZkZjdlYTEzZTg0YTA6Y29tOmVuOlVTOlI&usg=AFQjCNHWcvkEQFFJa1Rm9xIOSYMCAACwBw,"The new law adds coverage of COVID-19 treatment services, without cost-sharing, for enrollees in the COVID-19 uninsured testing group and...",2021-03-18,Health Cost Sharing
Rep. Roberts introduces revamped bill that could create a Colorado public health insurance option,https://www.google.com/url?rct=j&sa=t&url=https://www.steamboatpilot.com/news/rep-roberts-introduces-revamped-bill-that-could-create-a-colorado-public-health-insurance-option/&ct=ga&cd=CAIyHDQ1NzZkZjdlYTEzZTg0YTA6Y29tOmVuOlVTOlI&usg=AFQjCNHdr-3p00FEgZ78xOUdu7wKI58nzw,But Roberts said cost sharing is a “scare tactic” heard from the health care industry on most health care bills. Not only is there already statutory...,2021-03-18,Health Cost Sharing
Five ways the American Rescue Plan might slash your health insurance costs,https://www.google.com/url?rct=j&sa=t&url=https://www.healthinsurance.org/blog/2021/03/18/five-ways-the-american-rescue-plan-might-slash-your-health-insurance-costs/&ct=ga&cd=CAIyHDQ1NzZkZjdlYTEzZTg0YTA6Y29tOmVuOlVTOlI&usg=AFQjCNF8BmFnIE7S3wu7wuqit0QtlL3PQw,"While it""s common to see Bronze HDHPs, there are also Silver and even Gold HDHPs in many areas. With the new subsidies created by the ARP, you...",2021-03-18,Health Cost Sharing
Rescue Plan Could Have Lasting Impact On Health Care,https://www.google.com/url?rct=j&sa=t&url=https://insurancenewsnet.com/innarticle/rescue-plan-could-have-lasting-impact-on-health-care&ct=ga&cd=CAIyHDQ1NzZkZjdlYTEzZTg0YTA6Y29tOmVuOlVTOlI&usg=AFQjCNEmJfIsCh-N-blujWIXInDHRKtmrw,All of the health care coverage provisions in the bill are temporary. ... including increased premium and cost-sharing assistance for Americans who...,2021-03-18,Health Cost Sharing
How Medicaid Managed Care Orgs Can Confront Care Disparities,https://www.google.com/url?rct=j&sa=t&url=https://healthpayerintelligence.com/news/how-medicaid-managed-care-orgs-can-confront-care-disparities&ct=ga&cd=CAIyHDQ1NzZkZjdlYTEzZTg0YTA6Y29tOmVuOlVTOlI&usg=AFQjCNEM78IF9f40uYr12VN4_z46RkkKIQ,"How Medicaid Managed Care Orgs Can Confront Care Disparities ... preventive screenings and contraceptives with zero cost-sharing, and more.",2021-03-18,Health Cost Sharing
COVID-19 Vaccine Incentives Without the HIPAA Headache,https://www.google.com/url?rct=j&sa=t&url=https://www.natlawreview.com/article/covid-19-vaccine-incentives-without-hipaa-headache&ct=ga&cd=CAIyHDQ1NzZkZjdlYTEzZTg0YTA6Y29tOmVuOlVTOlI&usg=AFQjCNH4IHayWmafZKt23PyOCkPCYVqG4A,An employer creates a group health plan under HIPAA when it provides medical care to its employees ... The EAP does not contain cost sharing.,2021-03-18,Health Cost Sharing
"United States: Shots In Arms, Checks In Pockets: What You Need To Know After President Biden ...",https://www.google.com/url?rct=j&sa=t&url=https://www.mondaq.com/unitedstates/operational-impacts-and-strategy/1048340/shots-in-arms-checks-in-pockets-what-you-need-to-know-after-president-biden-signed-the-american-rescue-plan-into-law&ct=ga&cd=CAIyHDQ1NzZkZjdlYTEzZTg0YTA6Y29tOmVuOlVTOlI&usg=AFQjCNHQ3GTtVSq6WaLtKdP10Sj9w9lBiA,"$24 billion for the Child Care Stabilization Fund, which states will award as ... reduces cost-sharing for individuals enrolling in qualified health plans.",2021-03-18,Health Cost Sharing
"UCHealth shares results of new ""cultural navigator"" pilot program",https://www.google.com/url?rct=j&sa=t&url=https://www.9news.com/article/news/health/coronavirus/uchealth-cultural-navigator-program/73-b967fb43-0720-44f1-865a-9cb12977efdf&ct=ga&cd=CAIyGmU4MWY4MmViNmViOTg5MTE6Y29tOmVuOlVT&usg=AFQjCNFA023mNyrgf3aG58xNp8OWQ7Sx9w,"“[There is a] lack of understanding in health literacy about what""s going on with their loved one,” Herrmann said when describing the language barriers...",2021-03-19,Health Sharing
Blue Cross &amp; Blue Shield RI facing backlash on decision to end cost-sharing waiver,https://www.google.com/url?rct=j&sa=t&url=https://turnto10.com/news/coronavirus/blue-cross-blue-shield-ri-facing-backlash-on-decision-to-end-cost-sharing-waiver&ct=ga&cd=CAIyGmU4MWY4MmViNmViOTg5MTE6Y29tOmVuOlVT&usg=AFQjCNGVxeuKiW5Abj29EHBqmpfOAuhhUQ,"That waiver is set to expire March 31. That decision has drawn the ire of some, including Rhode Island Health Insurance Commissioner Patrick Tigue. ""I...",2021-03-19,Health Sharing
Legislators urge state health officials to provide COVID doses to community-run vaccination sites,https://www.google.com/url?rct=j&sa=t&url=https://www.masslive.com/news/2021/03/legislators-urge-state-health-officials-to-provide-covid-doses-to-community-run-vaccination-sites.html&ct=ga&cd=CAIyGmU4MWY4MmViNmViOTg5MTE6Y29tOmVuOlVT&usg=AFQjCNF4riRjPoFDnEk-t5FfiTLKNRprSw,"By focusing on the large sites, it limits access to people, Domb said. “Some people don""t have a car and don""t feel comfortable sharing rides and...",2021-03-18,Health Sharing
Gov4Nano Conducting “Data Sharing and FAIR Data Use Survey”,https://www.google.com/url?rct=j&sa=t&url=https://www.natlawreview.com/article/gov4nano-conducting-data-sharing-and-fair-data-use-survey&ct=ga&cd=CAIyGmU4MWY4MmViNmViOTg5MTE6Y29tOmVuOlVT&usg=AFQjCNEy_HC7xPJD6YMo6cWjSBTUyb4FPg,"Gov4Nano states that the information provided will contribute to improvements in the availability and sharing of nanomaterial environmental, health,...",2021-03-18,Health Sharing
"Cleveland Agency Brings Mental Health Issues to ""The Table""",https://www.google.com/url?rct=j&sa=t&url=https://spectrumnews1.com/oh/columbus/news/2021/03/18/cleveland-agency-brings-mental-health-issues-to--the-table-&ct=ga&cd=CAIyGmU4MWY4MmViNmViOTg5MTE6Y29tOmVuOlVT&usg=AFQjCNGOjjfhok0v-ON7EA4hXbzsw86vEA,The inspiration came from the tradition of families gathering around the dinner table to share intellectual and physical nourishment. “Somebody had built...,2021-03-18,Health Sharing
"Weekly update, March 18, 2021",https://www.google.com/url?rct=j&sa=t&url=https://news.illinoisstate.edu/2021/03/weekly-update-march-18-2021/&ct=ga&cd=CAIyGmU4MWY4MmViNmViOTg5MTE6Y29tOmVuOlVT&usg=AFQjCNHI2G9OOGDpMXbcfad-T7RvNpVykw,Illinois State University is collaborating with the McLean County Health ... Sharing test results will ensure students have proper documentation for...,2021-03-18,Health Sharing
"Mayor Kenney""s new gun briefings must be more than police press conferences | Opinion",https://www.google.com/url?rct=j&sa=t&url=https://www.inquirer.com/opinion/commentary/gun-violence-philadelphia-kenney-briefing-danielle-outlaw-20210318.html&ct=ga&cd=CAIyGmU4MWY4MmViNmViOTg5MTE6Y29tOmVuOlVT&usg=AFQjCNFt5PSWw6v4NFjQ3kCc0zzqbncl8w,"... host “regular public briefings to share the strategies underway to address this public health crisis and create safe, healthy communities” in response...",2021-03-18,Health Sharing
5 Nurses on TikTok You Should Follow for Health Advice and Some Laughs,https://www.google.com/url?rct=j&sa=t&url=https://www.distractify.com/p/nurses-to-follow-on-tiktok&ct=ga&cd=CAIyGmU4MWY4MmViNmViOTg5MTE6Y29tOmVuOlVT&usg=AFQjCNHKQZ0VxEOCrw29r80oJDgOl-4-gw,"Avery then says, “Good, good, excellent.” Aside from Avery""s hilarious videos of her work as a nurse, she also not shy about sharing other parts of her life...",2021-03-18,Health Sharing
Watch Out for These COVID-19 Vaccination Scams,https://www.google.com/url?rct=j&sa=t&url=https://www.healthline.com/health-news/watch-out-for-these-covid-19-vaccination-scams&ct=ga&cd=CAIyGmU4MWY4MmViNmViOTg5MTE6Y29tOmVuOlVT&usg=AFQjCNFXtfLuAQ-DJ-CBZeaK1aCz7biCmA,"Do not share your personal or health information with anyone other than known, trusted medical professionals. If someone reaches out to you to set up...",2021-03-18,Health Sharing
Baldwin students win Northwell Health science contest,"https://www.google.com/url?rct=j&sa=t&url=https://www.liherald.com/stories/baldwin-students-win-northwell-health-science-contest,131170%3F&ct=ga&cd=CAIyGmU4MWY4MmViNmViOTg5MTE6Y29tOmVuOlVT&usg=AFQjCNFbXeCVIqenfmfeWoWmn4APElF4SQ","More than 150 students took part, sharing three-minute videos of their ideas to end gun violence, and attended a virtual conference on March 5. The...",2021-03-18,Health Sharing
Bringing Intel Inside,https://www.google.com/url?rct=j&sa=t&url=https://ucsdnews.ucsd.edu/pressrelease/bringing-intel-inside&ct=ga&cd=CAIyGmU4MWY4MmViNmViOTg5MTE6Y29tOmVuOlVT&usg=AFQjCNHOr9irVKcXFSyhCvDkSCiB2cqPPA,"Last January, HDSI signed a data sharing agreement with Intel, starting a partnership supporting three students working under Associate Professor...",2021-03-18,Health Sharing
The Vaccine Supply Chain Is Now the Most Valuable Cyber Target in the World,https://www.google.com/url?rct=j&sa=t&url=https://slate.com/technology/2021/03/world-health-organization-vaccine-cybersecurity-censure.html&ct=ga&cd=CAIyGmU4MWY4MmViNmViOTg5MTE6Y29tOmVuOlVT&usg=AFQjCNEssTqmboOQQg-WUuhRGtLy2gTB2Q,"The Solarwinds attack targeted the U.S. National Institutes of Health, while ... we want everyone to get vaccinated, so why not share the information?",2021-03-18,Health Sharing
Report: Fresno chicken plant got tip about virus inspection,https://www.google.com/url?rct=j&sa=t&url=https://abcnews.go.com/Health/wireStory/report-fresno-chicken-plant-tip-virus-inspection-76541248&ct=ga&cd=CAIyGmU4MWY4MmViNmViOTg5MTE6Y29tOmVuOlVT&usg=AFQjCNEvPADzowsvEBk0nLWf0lb5OP9rgQ,"A California newspaper reports that local health officials tipped off a chicken ... Health officials also discussed media talking points during the crisis, ... that he wanted see how events developed before sharing more information, and...",2021-03-18,Health Sharing
Report: Fresno chicken plant got tip about virus inspection,https://www.google.com/url?rct=j&sa=t&url=https://www.startribune.com/report-fresno-chicken-plant-got-tip-about-virus-inspection/600035853/&ct=ga&cd=CAIyGmU4MWY4MmViNmViOTg5MTE6Y29tOmVuOlVT&usg=AFQjCNFjjJ0ONB6Q8EdmoJ5lCaO7LTaqfg,Local health officials gave a heads-up to a California chicken processing ... for more data and they asked the executives to share more information.,2021-03-18,Health Sharing
"Will you soon need a ""vaccine passport"" to travel?",https://www.google.com/url?rct=j&sa=t&url=https://www.kgw.com/article/news/health/coronavirus/key-questions-about-vaccine-passports/507-d5dccdf5-35a8-4469-a938-980caeb168df&ct=ga&cd=CAIyGmU4MWY4MmViNmViOTg5MTE6Y29tOmVuOlVT&usg=AFQjCNExdGwzTMNXQLT-BE_GMV-3i-3mig,Here are some key questions about the health credentials. ... Consumers will be nervous about sharing health information that might get hacked or...,2021-03-18,Health Sharing
"Will you soon need a ""vaccine passport"" to travel?",https://www.google.com/url?rct=j&sa=t&url=https://www.9news.com/article/news/health/coronavirus/key-questions-about-vaccine-passports/507-d5dccdf5-35a8-4469-a938-980caeb168df&ct=ga&cd=CAIyGmU4MWY4MmViNmViOTg5MTE6Y29tOmVuOlVT&usg=AFQjCNGIriwTmI9ZII2UozzoLShnC3BH4A,"Consumers will be nervous about sharing health information that might get hacked or exposed in a breach, says Stephen Beck of management...",2021-03-18,Health Sharing
"The dos and don""ts of mental health interventions",https://www.google.com/url?rct=j&sa=t&url=https://www.employeebenefitadviser.com/news/the-dos-and-donts-of-mental-health-interventions&ct=ga&cd=CAIyGmU4MWY4MmViNmViOTg5MTE6Y29tOmVuOlVT&usg=AFQjCNHM6XXXF780jhvLdnOMnGl3aYhjKA,"As remote work blurs the line between professional and private life, managers have been encouraged to share their own challenges with employees,...",2021-03-18,Health Sharing
"12 Health Care Stocks Moving In Thursday""s Intraday Session",https://www.google.com/url?rct=j&sa=t&url=https://www.benzinga.com/node/20239101&ct=ga&cd=CAIyGmU4MWY4MmViNmViOTg5MTE6Y29tOmVuOlVT&usg=AFQjCNGAMG3VvjGZi1yx3RjVU_L0LlJCWA,"Neos Therapeutics (NASDAQ:NEOS) shares increased by 13.79% to $1.32. As of 12:32 EST, Neos Therapeutics""s stock is trading at a volume of 103.5...",2021-03-18,Health Sharing
Blinken can make Alaska safer and compete with China by sharing excess COVID-19 vaccines,https://www.google.com/url?rct=j&sa=t&url=https://www.adn.com/opinions/2021/03/18/blinken-can-make-alaska-safer-and-compete-with-china-by-sharing-excess-covid-19-vaccines/&ct=ga&cd=CAIyGmU4MWY4MmViNmViOTg5MTE6Y29tOmVuOlVT&usg=AFQjCNGZmlsLkTRXb5xyHeZ0c7sG4wd7Gw,"The U.S. can and must lead this global health fight, too. Not only is America""s global reputation at stake, so too is our economy. A recent International...",2021-03-18,Health Sharing
"People are sharing the useless mental health advice from their GPs and wow, it""s bad",https://www.google.com/url?rct=j&sa=t&url=https://thetab.com/uk/2021/03/18/people-are-sharing-the-useless-mental-health-advice-from-their-gps-and-wow-its-bad-199290&ct=ga&cd=CAIyGmU4MWY4MmViNmViOTg5MTE6Y29tOmVuOlVT&usg=AFQjCNFVANwMvzlpS3dTyxCOa-vX80eSng,"People are sharing the useless mental health advice from their GPs and wow, it""s bad. ""A GP told me I can solve my issues with anxiety by tearing paper"".",2021-03-18,Health Sharing
Blue Cross &amp; Blue Shield RI facing backlash on decision to end cost-sharing waiver,https://www.google.com/url?rct=j&sa=t&url=https://turnto10.com/news/local/blue-cross-blue-shield-ri-facing-backlash-on-decision-to-end-cost-sharing-waiver&ct=ga&cd=CAIyHDcyMWE5ZGFiNjRlZGE3MTM6Y29tOmVuOlVTOlI&usg=AFQjCNH9p14WjfJsnhVrWeqqsREk2XZMNQ,"That waiver is set to expire March 31. That decision has drawn the ire of some, including Rhode Island Health Insurance Commissioner Patrick Tigue. ""I...",2021-03-18,Healthcare Cost Sharing
Rep. Roberts introduces revamped bill that could create a Colorado public health insurance option,https://www.google.com/url?rct=j&sa=t&url=https://www.steamboatpilot.com/news/rep-roberts-introduces-revamped-bill-that-could-create-a-colorado-public-health-insurance-option/&ct=ga&cd=CAIyHDcyMWE5ZGFiNjRlZGE3MTM6Y29tOmVuOlVTOlI&usg=AFQjCNHdr-3p00FEgZ78xOUdu7wKI58nzw,But Roberts said cost sharing is a “scare tactic” heard from the health care industry on most health care bills. Not only is there already statutory...,2021-03-18,Healthcare Cost Sharing
Five ways the American Rescue Plan might slash your health insurance costs,https://www.google.com/url?rct=j&sa=t&url=https://www.healthinsurance.org/blog/2021/03/18/five-ways-the-american-rescue-plan-might-slash-your-health-insurance-costs/&ct=ga&cd=CAIyHDcyMWE5ZGFiNjRlZGE3MTM6Y29tOmVuOlVTOlI&usg=AFQjCNF8BmFnIE7S3wu7wuqit0QtlL3PQw,"While it""s common to see Bronze HDHPs, there are also Silver and even Gold HDHPs in many areas. With the new subsidies created by the ARP, you...",2021-03-18,Healthcare Cost Sharing
How Medicaid Managed Care Orgs Can Confront Care Disparities,https://www.google.com/url?rct=j&sa=t&url=https://healthpayerintelligence.com/news/how-medicaid-managed-care-orgs-can-confront-care-disparities&ct=ga&cd=CAIyHDcyMWE5ZGFiNjRlZGE3MTM6Y29tOmVuOlVTOlI&usg=AFQjCNEM78IF9f40uYr12VN4_z46RkkKIQ,"How Medicaid Managed Care Orgs Can Confront Care Disparities ... preventive screenings and contraceptives with zero cost-sharing, and more.",2021-03-18,Healthcare Cost Sharing
"Biden""s American Rescue Plan Act aims to bolster the ACA. Here""s how.",https://www.google.com/url?rct=j&sa=t&url=https://medcitynews.com/2021/03/bidens-american-rescue-plan-act-aims-to-bolster-the-aca-heres-how/&ct=ga&cd=CAIyHDcyMWE5ZGFiNjRlZGE3MTM6Y29tOmVuOlVTOlI&usg=AFQjCNGGj2ClFVKJxEwUCyVchtiLjGk8Qg,"The government""s share will increase by 5 percentage points. ... can receive a benchmark Silver health plan for free and enjoy cost-sharing reductions.",2021-03-17,Healthcare Cost Sharing
Congress Passes American Rescue Plan; Health Coverage Provisions Could Have Lasting Impacts,https://www.google.com/url?rct=j&sa=t&url=https://www.jdsupra.com/legalnews/congress-passes-american-rescue-plan-9599956/&ct=ga&cd=CAIyHDcyMWE5ZGFiNjRlZGE3MTM6Y29tOmVuOlVTOlI&usg=AFQjCNEpZd5G05asCbU2Nss8GmPFNJz5VA,"It includes myriad health care provisions, focused primarily in two areas: ... including increased premium and cost-sharing assistance for Americans...",2021-03-17,Healthcare Cost Sharing
"Know a caregiver who""s made an impact? Help us honor Northeast Ohio""s Healthcare Heroes by ...",https://www.google.com/url?rct=j&sa=t&url=https://www.cleveland.com/coronavirus/2021/03/know-a-caregiver-whos-made-an-impact-help-us-honor-northeast-ohios-healthcare-heroes-by-sharing-your-story.html&ct=ga&cd=CAIyHDc5M2E3YWM0ZTJjZTM4OWY6Y29tOmVuOlVTOlI&usg=AFQjCNE3iv5_NkfEAQ6oj9yXpj2d5bqPuw,"And, whether you were a patient or a health care worker, we need your help. If you are a nurse or a doctor who""d like to share your experiences or honor...",2021-03-18,Medical Sharing
5 Nurses on TikTok You Should Follow for Health Advice and Some Laughs,https://www.google.com/url?rct=j&sa=t&url=https://www.distractify.com/p/nurses-to-follow-on-tiktok&ct=ga&cd=CAIyHDc5M2E3YWM0ZTJjZTM4OWY6Y29tOmVuOlVTOlI&usg=AFQjCNHKQZ0VxEOCrw29r80oJDgOl-4-gw,"Avery then says, “Good, good, excellent.” Aside from Avery""s hilarious videos of her work as a nurse, she also not shy about sharing other parts of her life...",2021-03-18,Medical Sharing
"Pulse Oximeter Market 2021 Is Booming Across the Globe by Share, Size, Growth, Segments and ...",https://www.google.com/url?rct=j&sa=t&url=https://ksusentinel.com/2021/03/18/pulse-oximeter-market-2021-is-booming-across-the-globe-by-share-size-growth-segments-and-forecast-to-2027-top-players-analysis-masimo-medtronic-nonin-medical-smiths-medical-nihon-kohden-etc/&ct=ga&cd=CAIyHDc5M2E3YWM0ZTJjZTM4OWY6Y29tOmVuOlVTOlI&usg=AFQjCNHdmLa3v32jDtffnxV-1DCdhuFwig,Masimo; Medtronic; Nonin Medical; Smiths Medical; Nihon-Kohden; Philips; GE Healthcare; Konica Minolta; Mindray; Heal Force; Contec; Jerry Medical...,2021-03-18,Medical Sharing
US Healthcare Enterprises Speed Up Adoption of Digital Services as COVID-19 Requires ...,https://www.google.com/url?rct=j&sa=t&url=https://www.streetinsider.com/Business%2BWire/U.S.%2BHealthcare%2BEnterprises%2BSpeed%2BUp%2BAdoption%2Bof%2BDigital%2BServices%2Bas%2BCOVID-19%2BRequires%2BTelemedicine%252C%2BAutomation/18147947.html&ct=ga&cd=CAIyHDc5M2E3YWM0ZTJjZTM4OWY6Y29tOmVuOlVTOlI&usg=AFQjCNGWBFgUdmm_lyYJ_SDFtWBwDT-IZA,"... shows healthcare providers and payers turning to digital transformation and cloud to reduce costs, improve operations and streamline data sharing.",2021-03-18,Medical Sharing
eHealth Market Size To Reach USD 230640.4 Million By 2027 at a CAGR Of 14.5% - Valuates ...,https://www.google.com/url?rct=j&sa=t&url=https://www.prnewswire.com/in/news-releases/ehealth-market-size-to-reach-usd-230640-4-million-by-2027-at-a-cagr-of-14-5-valuates-reports-850453796.html&ct=ga&cd=CAIyHDc5M2E3YWM0ZTJjZTM4OWY6Y29tOmVuOlVTOlI&usg=AFQjCNFnVG2nedLpCEPauBrbiZzM8dhPPg,"Mhealth apps enable easy access and sharing of medical records and are targeted for specific medical conditions, health related education, mobile...",2021-03-18,Medical Sharing
"Seriously, stop sharing your vaccine cards on social media",https://www.google.com/url?rct=j&sa=t&url=https://journalstar.com/lifestyles/technology/seriously-stop-sharing-your-vaccine-cards-on-social-media/article_7bf769ad-11d5-5d4d-b251-540ad420a21a.html&ct=ga&cd=CAIyHDc5M2E3YWM0ZTJjZTM4OWY6Y29tOmVuOlVTOlI&usg=AFQjCNElcmBYKIcxKHaR_v2LpyQBEMywPQ,"In some cases, a person""s medical record number is listed on the card. ""To gain access to sensitive medical records over the phone, having the...",2021-03-18,Medical Sharing
"Medical Silica Gel Market 2021 Will Reflect Significant Growth in Future with Size, Share, Growth ...",https://www.google.com/url?rct=j&sa=t&url=https://ksusentinel.com/2021/03/18/medical-silica-gel-market-2021-will-reflect-significant-growth-in-future-with-size-share-growth-and-key-companies-analysis-miller-net-company-inc-memphis-net-twine-magnum-polymers-pvt-lt/&ct=ga&cd=CAIyHDc5M2E3YWM0ZTJjZTM4OWY6Y29tOmVuOlVTOlI&usg=AFQjCNHLGogvWARgQnTwfro7xGMsYGN-SQ,"Medical Silica Gel Market 2021 Will Reflect Significant Growth in Future with Size, Share, Growth, and Key Companies Analysis- Miller Net Company,...",2021-03-18,Medical Sharing
"Networked Medical Devices Market 2021 Size, Share Industry Trends, Growth, Development ...",https://www.google.com/url?rct=j&sa=t&url=https://www.mccourier.com/networked-medical-devices-market-2021-size-share-industry-trends-growth-development-status-future-plans-analysis-by-2027-key-companies-analysis-infinium-medical-lantronix-integra-systems-phoe/&ct=ga&cd=CAIyHDc5M2E3YWM0ZTJjZTM4OWY6Y29tOmVuOlVTOlI&usg=AFQjCNHsl6A-bGokBi_YmvvaaOxhntyA4Q,"Networked Medical Devices Market 2021 Size, Share Industry Trends, Growth, Development Status, Future Plans Analysis by 2027| Key Companies...",2021-03-18,Medical Sharing
"Apnea Monitors Market 2021 Industry Size, Share, Growth and Top Companies Analysis- Philips ...",https://www.google.com/url?rct=j&sa=t&url=https://ksusentinel.com/2021/03/18/apnea-monitors-market-2021-industry-size-share-growth-and-top-companies-analysis-philips-healthcare-jenson-medical-med-dyne-da-vinci-technology-golden-care-etc/&ct=ga&cd=CAIyHDc5M2E3YWM0ZTJjZTM4OWY6Y29tOmVuOlVTOlI&usg=AFQjCNEV_FAdk4KFaCerPxUno6n8grM91A,Philips Healthcare; Jenson Medical; Med-Dyne; Da Vinci Technology; Golden Care; ResMed; Fisher?Paykel Healthcare; SomnoMed; Compumedics...,2021-03-18,Medical Sharing
"Vestibular Testing Equipment Market 2021 Size, Share Industry Trends, Growth, Development ...",https://www.google.com/url?rct=j&sa=t&url=https://ksusentinel.com/2021/03/18/vestibular-testing-equipment-market-2021-size-share-industry-trends-growth-development-status-future-plans-analysis-by-2027-key-companies-analysis-natus-medical-balanceback-biomed-jena-gmbh-n/&ct=ga&cd=CAIyHDc5M2E3YWM0ZTJjZTM4OWY6Y29tOmVuOlVTOlI&usg=AFQjCNH-T0jbDBEH0EbMW44hakjBboQ2Eg,"Natus Medical; Balanceback; BioMed Jena GmbH; Neuro Kinetics, Inc (NKI); Micromedical Technologies; Difra Instrumentation; William Demant (...",2021-03-18,Medical Sharing
"3D Printing in the Medical and Dental Market 2021 Industry Size, Share, Growth and Top ...",https://www.google.com/url?rct=j&sa=t&url=https://bisouv.com/uncategorized/3239422/3d-printing-in-the-medical-and-dental-market-2021-industry-size-share-growth-and-top-companies-analysis-3d-bioprinting-solutions-vivax-bio-3d-biotek-3dynamic-systems-3ds-allevi-aspect-biosy/&ct=ga&cd=CAIyHDc5M2E3YWM0ZTJjZTM4OWY6Y29tOmVuOlVTOlI&usg=AFQjCNHykKiE84_-3CUXjyRi2LVgjI6OdA,"3D Printing in the Medical and Dental Market 2021 Industry Size, Share, Growth and Top Companies Analysis- 3D Bioprinting Solutions (Vivax Bio),...",2021-03-18,Medical Sharing
