title,link,item_text,date_published,google_alert_name
"7 Options When You""ve Lost Your Job-Sponsored Health Insurance",https://www.google.com/url?rct=j&sa=t&url=https://www.newsmax.com/finance/streettalk/health-coverage-job-sponsored/2020/07/17/id/977734&ct=ga&cd=CAIyHGVmMjU5ZGE1NWJkYjU0NjU6Y29tOmVuOlVTOlI&usg=AFQjCNEgo_1WQQw23YBdZWgRABej-FkHsQ,"Healthcare sharing ministries typically limit the amount of coverage they""ll provide, with most capping how much coverage you can receive per month,...",2020-07-17,Health Care Sharing Ministry
Is your COVID test covered? The answer is up for interpretation.,https://www.google.com/url?rct=j&sa=t&url=https://www.nbcnews.com/health/health-news/your-covid-test-covered-answer-interpretation-n1234173&ct=ga&cd=CAIyHDQ1NzZkZjdlYTEzZTg0YTA6Y29tOmVuOlVTOlI&usg=AFQjCNH7ikiIaBEqmM3Mw2RhdjLMJYq82g,"Seeing the tests as a “medical need,” the doctor said insurance would likely pay ... It made clear that insurers do not have to fully waive cost sharing for...",2020-07-18,Health Cost Sharing
NBC 5 Responds: COVID Cost Confusion,https://www.google.com/url?rct=j&sa=t&url=https://www.nbcdfw.com/news/coronavirus/nbc-5-responds-covid-cost-confusion/2407766/&ct=ga&cd=CAIyHDQ1NzZkZjdlYTEzZTg0YTA6Y29tOmVuOlVTOlI&usg=AFQjCNHZkJnuhYq3slFJgJJf0KEEXMdKkg,"NBC 5 Responds: COVID Cost Confusion ... My mother has major underlying health conditions and she depends on me for a lot of things,” said Correa. ... office-visit costs to be covered by insurance companies in a cost-sharing...",2020-07-18,Health Cost Sharing
SCC seeking comment on proposed balance billing regulations,https://www.google.com/url?rct=j&sa=t&url=http://www.cbs19news.com/story/42383623/scc-seeking-comment-on-proposed-balance-billing-regulations&ct=ga&cd=CAIyHDQ1NzZkZjdlYTEzZTg0YTA6Y29tOmVuOlVTOlI&usg=AFQjCNEvdhszNqTggOsB14IJXYOa8A-Tiw,"... a managed care health insurance plan gets billed for more than their plan""s cost-sharing amounts directly from a medical service provider who does...",2020-07-18,Health Cost Sharing
COVID-19 Resources and Support from Florida Blue,https://www.google.com/url?rct=j&sa=t&url=https://doralfamilyjournal.com/covid-19-resources-and-support-from-florida-blue/&ct=ga&cd=CAIyHDQ1NzZkZjdlYTEzZTg0YTA6Y29tOmVuOlVTOlI&usg=AFQjCNGnfmYD1dfQPEiNeF41nvDwf6RZcg,"$100 Million in health care cost relief to Florida Blue members ... for members, in addition to waiving cost-sharing for COVID-19 testing and treatment.",2020-07-17,Health Cost Sharing
Health care coverage for laid-off workers splits Republicans,https://www.google.com/url?rct=j&sa=t&url=https://www.rollcall.com/2020/07/17/health-care-coverage-for-laid-off-workers-splits-republicans/&ct=ga&cd=CAIyHDQ1NzZkZjdlYTEzZTg0YTA6Y29tOmVuOlVTOlI&usg=AFQjCNHt5zO1v8kOohkyxkgEHhnkCdgvWQ,"The House bill also would eliminate Medicaid cost sharing for COVID-19 treatment and vaccines, waive Medicare cost sharing for COVID-19 treatment...",2020-07-17,Health Cost Sharing
What current police reform efforts lack: A call to Federalize,https://www.google.com/url?rct=j&sa=t&url=https://thehill.com/opinion/criminal-justice/507847-what-current-police-reform-efforts-lack-a-call-to-federalize&ct=ga&cd=CAIyHDQ1NzZkZjdlYTEzZTg0YTA6Y29tOmVuOlVTOlI&usg=AFQjCNHhibs9fedbrJvViI9qNKsOVmp4JQ,"... policing, states could voluntarily cost-share to fund policing under the U.S. Public Health Service, an arrangement that could realize many benefits.",2020-07-17,Health Cost Sharing
"McDermottPlus Check-Up: July 17, 2020",https://www.google.com/url?rct=j&sa=t&url=https://www.natlawreview.com/article/mcdermottplus-check-july-17-2020&ct=ga&cd=CAIyHDQ1NzZkZjdlYTEzZTg0YTA6Y29tOmVuOlVTOlI&usg=AFQjCNGyiUU5qu0RqK4e1_L3qvnnb3zIXg,... Report with Implications for Private Equity-Backed Healthcare Interests. ... group health plans greater flexibility to amend cost-sharing requirements.,2020-07-17,Health Cost Sharing
This Week in Coronavirus: July 10 to July 16,https://www.google.com/url?rct=j&sa=t&url=https://www.kff.org/coronavirus-policy-watch/this-week-in-coronavirus-july-10-to-july-16/&ct=ga&cd=CAIyHDQ1NzZkZjdlYTEzZTg0YTA6Y29tOmVuOlVTOlI&usg=AFQjCNEv40bQPo9bNJMg6XR6VWBZxLOlyQ,"State COVID-19 Health Policy Actions (Includes Washington D.C.). Waive Cost Sharing for COVID-19 Treatment: 3 states require, state-insurer...",2020-07-17,Health Cost Sharing
How much will a coronavirus vaccine cost?,https://www.google.com/url?rct=j&sa=t&url=https://www.marketplace.org/2020/07/17/how-much-will-coronavirus-vaccine-cost/&ct=ga&cd=CAIyHDQ1NzZkZjdlYTEzZTg0YTA6Y29tOmVuOlVTOlI&usg=AFQjCNHIojG3bBbB_lBw1JY5JKcp1IdyuQ,"“The Affordable Care Act requires insurance to cover recommended vaccines with no cost sharing passed along to patients, so that opens the...",2020-07-17,Health Cost Sharing
"7 Options When You""ve Lost Your Job-Sponsored Health Insurance",https://www.google.com/url?rct=j&sa=t&url=https://www.newsmax.com/finance/streettalk/health-coverage-job-sponsored/2020/07/17/id/977734&ct=ga&cd=CAIyHDQ1NzZkZjdlYTEzZTg0YTA6Y29tOmVuOlVTOlI&usg=AFQjCNEgo_1WQQw23YBdZWgRABej-FkHsQ,"And, unfortunately, most of your options will be costly. The challenge of ... You might also consider signing up for a healthcare sharing ministry. But be...",2020-07-17,Health Cost Sharing
Healthcare IT Market to Witness Growth Acceleration During 2017-2025,https://www.google.com/url?rct=j&sa=t&url=https://dailyresearchchronicles.com/2020/07/17/healthcare-it-market-to-witness-growth-acceleration-during-2017-2025/&ct=ga&cd=CAIyHDQ1NzZkZjdlYTEzZTg0YTA6Y29tOmVuOlVTOlI&usg=AFQjCNHemj5Pwbs4sxPjT64SZ47MG3PQ-w,"Healthcare IT provides secured sharing of patient information for healthcare ... Healthcare IT uses electronic health records (EHRs) in place of paper ... Apart from improved medical care and lower costs, these systems that are...",2020-07-17,Health Cost Sharing
COVID-19 Impact Enterprise File Synchronization &amp; Sharing (EFSS) Market Advanced Technology ...,https://www.google.com/url?rct=j&sa=t&url=https://jewishlifenews.com/uncategorized/covid-19-impact-enterprise-file-synchronization-sharing-efss-market-advanced-technology-potential-revenue-cost-structure-analysis-and-key-players-global-future-prospects-2025/&ct=ga&cd=CAIyHDQ1NzZkZjdlYTEzZTg0YTA6Y29tOmVuOlVTOlI&usg=AFQjCNEcebeScosFlmS2yvNo5yQX6Qdw9g,"... Sharing (EFSS) Market Advanced Technology, Potential Revenue, Cost ... We comprehend that this health crisis has brought an unprecedented...",2020-07-17,Health Cost Sharing
NCDHHS to deploy up to 300 free COVID-19 testing sites in underserved communities,https://www.google.com/url?rct=j&sa=t&url=https://mountainx.com/blogwire/ncdhhs-to-deploy-up-to-300-free-covid-19-testing-sites-in-underserved-communities/&ct=ga&cd=CAIyHDQ1NzZkZjdlYTEzZTg0YTA6Y29tOmVuOlVTOlI&usg=AFQjCNHxdSYYhcW5plWWZG5TBaPHAkINaw,"The North Carolina Department of Health and Human Services today ... Insurance, if available, will be billed but no co-pays or cost-sharing will be...",2020-07-07,Health Cost Sharing
Shilpa Shetty shares the healthy and delicious recipe of Oats Sattu Upma,https://www.google.com/url?rct=j&sa=t&url=https://www.pinkvilla.com/lifestyle/food-travel/shilpa-shetty-shares-healthy-and-delicious-recipe-oats-sattu-upma-550294&ct=ga&cd=CAIyGmU4MWY4MmViNmViOTg5MTE6Y29tOmVuOlVT&usg=AFQjCNErbr3Tanp-r2_mDmpKjLCgUYcYdw,"Recently she shared a healthy recipe of Oats Sattu Upma on her YouTube channel. In the video, Shilpa revealed how oats and sattu have been her...",2020-07-18,Health Sharing
Public health officials warn of possible COVID-19 exposure,https://www.google.com/url?rct=j&sa=t&url=https://winnipegsun.com/news/local-news/public-health-officials-warn-of-possible-covid-19-exposure&ct=ga&cd=CAIyGmU4MWY4MmViNmViOTg5MTE6Y29tOmVuOlVT&usg=AFQjCNHF_P9FK4GFqsafemkyRvbW4uOuYg,"While the risk is considered low, public health is sharing this information to ensure people are aware and know to seek testing if symptoms develop.",2020-07-17,Health Sharing
"Health officials warn of potential coronavirus exposure at businesses in Winnipeg, Brandon",https://www.google.com/url?rct=j&sa=t&url=https://globalnews.ca/news/7191087/manitoba-health-officials-potential-coronavirus-exposure-winnipeg-brandon/&ct=ga&cd=CAIyGmU4MWY4MmViNmViOTg5MTE6Y29tOmVuOlVT&usg=AFQjCNH_NZATR6zHKnzrebWVEWoW9x26kw,"The province said the risk to the public is low, but public health is sharing the information to make sure people are aware and know to seek testing...",2020-07-17,Health Sharing
Livongo Health (LVGO) Outpaces Stock Market Gains: What You Should Know,https://www.google.com/url?rct=j&sa=t&url=https://www.nasdaq.com/articles/livongo-health-lvgo-outpaces-stock-market-gains%253A-what-you-should-know-2020-07-17&ct=ga&cd=CAIyGmU4MWY4MmViNmViOTg5MTE6Y29tOmVuOlVT&usg=AFQjCNEhAwMLyj37juTEE8wnjOIkE2Rkvw,"Coming into today, shares of the digital health company had gained 47.69% in the past month. In that same time, the Medical sector gained 3.14%, while...",2020-07-17,Health Sharing
"West Hartford""s 20th District Democratic Primary Candidates Debate Education, Healthcare ...",https://www.google.com/url?rct=j&sa=t&url=https://we-ha.com/west-hartfords-20th-district-democratic-primary-candidates-debate-education-healthcare-absentee-ballots-and-more/&ct=ga&cd=CAIyGmU4MWY4MmViNmViOTg5MTE6Y29tOmVuOlVT&usg=AFQjCNFQjwT581jM9csKwSPdNeXRrDhQ9Q,"Both candidates were given time to share their stances on issues facing the West Hartford community such as police accountability, absentee ballots and...",2020-07-17,Health Sharing
"Local doctor recovers from COVID, shares story",https://www.google.com/url?rct=j&sa=t&url=https://www.wndu.com/2020/07/17/local-doctor-recovers-from-covid-shares-story/&ct=ga&cd=CAIyGmU4MWY4MmViNmViOTg5MTE6Y29tOmVuOlVT&usg=AFQjCNGLJjlkAHVApNzsEAm0Wf12r5Iz3Q,I am in a low risk age group with no high risk medical problems. In sharing my experience I am not in any way trying to compare it to people who have...,2020-07-17,Health Sharing
Former WBKO reporter shares COVID-19 experience from the hospital bed,https://www.google.com/url?rct=j&sa=t&url=https://www.wbko.com/2020/07/17/former-wbko-reporter-shares-covid-19-experience-from-the-hospital-bed/&ct=ga&cd=CAIyGmU4MWY4MmViNmViOTg5MTE6Y29tOmVuOlVT&usg=AFQjCNFIy48Dl5tyBjxwOgeyJc6lgC4U1A,"Since her diagnosis, Lyndsey has been sharing her experience on social media. ... And I""m definitely not going to take my health for granted.” You can...",2020-07-17,Health Sharing
COVID reporting changes come during surge in cases in Lincoln,https://www.google.com/url?rct=j&sa=t&url=https://nebraska.tv/news/local/covid-reporting-changes-come-during-surge-in-cases-in-lincoln&ct=ga&cd=CAIyGmU4MWY4MmViNmViOTg5MTE6Y29tOmVuOlVT&usg=AFQjCNESaJ2eVYLkvTxbd33W1qoOy8L0-Q,"The concern is this data wont be as readily shared through the new Health and Human Services system, but Bryan Health has reassured the public it...",2020-07-17,Health Sharing
"APSU launches ""If Austin Peay Could Talk"" project, to share personal stories of racism",https://www.google.com/url?rct=j&sa=t&url=https://clarksvillenow.com/local/apsu-launches-if-austin-peay-could-talk-project-to-share-personal-stories-of-racism/&ct=ga&cd=CAIyGmU4MWY4MmViNmViOTg5MTE6Y29tOmVuOlVT&usg=AFQjCNE-sVrLNmfnVkaMHTk7qMeZP1NNwA,"Several mental health doctors who interviewed him for psychiatric evaluations after his arrest described him as having a history with multiple drugs,...",2020-07-17,Health Sharing
Day in the life of a nurse during Covid-19,https://www.google.com/url?rct=j&sa=t&url=https://www.bizjournals.com/portland/news/2020/07/17/day-in-the-life-of-a-nurse.html&ct=ga&cd=CAIyGmU4MWY4MmViNmViOTg5MTE6Y29tOmVuOlVT&usg=AFQjCNGPa9VMBdXdUth4MatPc5nyo8R2pw,"I work the night shift on the general Medical/Surgical acute care unit at ... health and with illness and injury is unique, but sharing those experiences...",2020-07-17,Health Sharing
Health department to share latest coronavirus cases after more counties enter red level,https://www.google.com/url?rct=j&sa=t&url=https://abc6onyourside.com/news/local/july-17-coronavirus-in-ohio-update&ct=ga&cd=CAIyGmU4MWY4MmViNmViOTg5MTE6Y29tOmVuOlVT&usg=AFQjCNFMuaAbeIXR3t2mQKsEBqv0xTIN5Q,"COLUMBUS, Ohio (WSYX/WTTE) — The Ohio Department of Health is sharing new coronavirus data after more counties entered the ""red"" level for...",2020-07-17,Health Sharing
Groups launch legal action against Ontario for sharing COVID-19 data with police,https://www.google.com/url?rct=j&sa=t&url=https://toronto.ctvnews.ca/groups-launch-legal-notice-against-ontario-for-sharing-covid-19-data-with-police-1.5028583&ct=ga&cd=CAIyGmU4MWY4MmViNmViOTg5MTE6Y29tOmVuOlVT&usg=AFQjCNEKK3_S8-jNzuxc6AmPsQLebheAzw,"Instead, she said, police should practice the same public health advice the rest of the province is following. Deshman added that sharing COVID-19 test...",2020-07-17,Health Sharing
Groups launch legal action against Ontario for sharing COVID-19 data with police,https://www.google.com/url?rct=j&sa=t&url=https://toronto.ctvnews.ca/groups-launch-legal-action-against-ontario-for-sharing-covid-19-data-with-police-1.5028583&ct=ga&cd=CAIyGmU4MWY4MmViNmViOTg5MTE6Y29tOmVuOlVT&usg=AFQjCNGNsKe1YULt0hQRWl5dHxs8qgYeVA,"Deshman added that sharing COVID-19 test results with police is “not necessary, and in fact undermines an effective public health approach to this...",2020-07-17,Health Sharing
LSR7 Update: Sharing preliminary Fall 2020 plans,https://www.google.com/url?rct=j&sa=t&url=https://lstribune.net/index.php/2020/07/17/lsr7-update-sharing-preliminary-fall-2020-plans/&ct=ga&cd=CAIyGmU4MWY4MmViNmViOTg5MTE6Y29tOmVuOlVT&usg=AFQjCNHKIVBNKSrMU9L6ipDMQ-G4wY_jdA,Our plans have been built around the need for flexibility in order to align with evolving public health guidance and include recommendations primarily...,2020-07-17,Health Sharing
Bridgeport Hospital Doctors Issue Hot Weather Health Advice,https://www.google.com/url?rct=j&sa=t&url=https://patch.com/connecticut/bridgeport/bridgeport-hospital-doctors-issue-hot-weather-health-advice&ct=ga&cd=CAIyGmU4MWY4MmViNmViOTg5MTE6Y29tOmVuOlVT&usg=AFQjCNGQBnbJp9slSN4ObXgB-bYljPzv1A,"With the hottest days so far this summer heading into Connecticut during the next few days, doctors at Bridgeport Hospital are sharing advice to keep...",2020-07-17,Health Sharing
COVID-19 disproportionately affecting Latinos; woman shares heartbreaking story of losing her father,https://www.google.com/url?rct=j&sa=t&url=https://fox6now.com/2020/07/17/covid-19-disproportionately-affecting-latinos-woman-shares-heartbreaking-story-of-losing-her-father/&ct=ga&cd=CAIyGmU4MWY4MmViNmViOTg5MTE6Y29tOmVuOlVT&usg=AFQjCNGzvB7I3DXgsF-CkBP5V-clgnc6Og,"Health officials also say Latinos are dying in higher numbers than any other ethnicity, particularly because many of them are frontline essential...",2020-07-17,Health Sharing
TX Health Information Exchange Joins Nationwide eHealth Exchange,https://www.google.com/url?rct=j&sa=t&url=https://ehrintelligence.com/news/tx-health-information-exchange-joins-nationwide-ehealth-exchange&ct=ga&cd=CAIyGmU4MWY4MmViNmViOTg5MTE6Y29tOmVuOlVT&usg=AFQjCNHN3y2e3XiGWF-h9rauybHzCZwkug,"Now connected to the nationwide HIE, HASA has access to the largest secure health data sharing network in the country, including the Department of...",2020-07-17,Health Sharing
"Healthcare Analytics Market Break Down By Leading Companies, Countries, Applications ...",https://www.google.com/url?rct=j&sa=t&url=https://3wnews.org/industry-analytics/2814473/healthcare-analytics-market-break-down-by-leading-companies-countries-applications-challenges-opportunities-and-forecast-2020-2026-2/&ct=ga&cd=CAIyGmU4MWY4MmViNmViOTg5MTE6Y29tOmVuOlVT&usg=AFQjCNG4gp2MpkIYW21vu7_Q60Ck9xQSCg,"Increasing usage of data sharing platforms such as social media platforms, blogs, and professional networks has allowed sharing health related...",2020-07-17,Health Sharing
The Stories We Share: A Social Justice Campaign,https://www.google.com/url?rct=j&sa=t&url=https://labblog.uofmhealth.org/med-u/stories-we-share-a-social-justice-campaign&ct=ga&cd=CAIyGmU4MWY4MmViNmViOTg5MTE6Y29tOmVuOlVT&usg=AFQjCNG_6MOSZTgVFRU15VVgmokbycPA1w,"The United Asian American Medical Student Association unveils a social media campaign designed to amplify diverse voices in support of diversity,...",2020-07-17,Health Sharing
How to get young adults to take COVID-19 seriously,https://www.google.com/url?rct=j&sa=t&url=https://www.wfmynews2.com/article/news/local/how-to-get-young-adults-to-take-covid19-seriously-blanca-cobb-body-language/83-cc87f12a-5e2c-4234-8661-d1788d6e9551&ct=ga&cd=CAIyGmU4MWY4MmViNmViOTg5MTE6Y29tOmVuOlVT&usg=AFQjCNHFByMBlfCNTPs7NeWjzyeYT68Pug,"Many young adults don""t believe that the coronavirus is as serious as health officials claim. Blanca Cobb shares why they don""t believe and ways to...",2020-07-17,Health Sharing
COVID-19 Resources and Support from Florida Blue,https://www.google.com/url?rct=j&sa=t&url=https://doralfamilyjournal.com/covid-19-resources-and-support-from-florida-blue/&ct=ga&cd=CAIyHDcyMWE5ZGFiNjRlZGE3MTM6Y29tOmVuOlVTOlI&usg=AFQjCNGnfmYD1dfQPEiNeF41nvDwf6RZcg,"$100 Million in health care cost relief to Florida Blue members ... for members, in addition to waiving cost-sharing for COVID-19 testing and treatment.",2020-07-17,Healthcare Cost Sharing
"McDermottPlus Check-Up: July 17, 2020",https://www.google.com/url?rct=j&sa=t&url=https://www.natlawreview.com/article/mcdermottplus-check-july-17-2020&ct=ga&cd=CAIyHDcyMWE5ZGFiNjRlZGE3MTM6Y29tOmVuOlVTOlI&usg=AFQjCNGyiUU5qu0RqK4e1_L3qvnnb3zIXg,... Report with Implications for Private Equity-Backed Healthcare Interests. ... group health plans greater flexibility to amend cost-sharing requirements.,2020-07-17,Healthcare Cost Sharing
"7 Options When You""ve Lost Your Job-Sponsored Health Insurance",https://www.google.com/url?rct=j&sa=t&url=https://www.newsmax.com/finance/personal-finance/health-coverage-job-sponsored/2020/07/17/id/977734/&ct=ga&cd=CAIyHDcyMWE5ZGFiNjRlZGE3MTM6Y29tOmVuOlVTOlI&usg=AFQjCNE9RJ03Sy_dymsCTjla4dXmGIxOnQ,"And, unfortunately, most of your options will be costly. The challenge of ... You might also consider signing up for a healthcare sharing ministry. But be...",2020-07-17,Healthcare Cost Sharing
"7 Options When You""ve Lost Your Job-Sponsored Health Insurance",https://www.google.com/url?rct=j&sa=t&url=https://www.newsmax.com/finance/streettalk/health-coverage-job-sponsored/2020/07/17/id/977734&ct=ga&cd=CAIyHDcyMWE5ZGFiNjRlZGE3MTM6Y29tOmVuOlVTOlI&usg=AFQjCNEgo_1WQQw23YBdZWgRABej-FkHsQ,"And, unfortunately, most of your options will be costly. ... Healthcare sharing ministries are faith-based nonprofits that pool the money of their members.",2020-07-17,Healthcare Cost Sharing
Healthcare IT Market to Witness Growth Acceleration During 2017-2025,https://www.google.com/url?rct=j&sa=t&url=https://dailyresearchchronicles.com/2020/07/17/healthcare-it-market-to-witness-growth-acceleration-during-2017-2025/&ct=ga&cd=CAIyHDcyMWE5ZGFiNjRlZGE3MTM6Y29tOmVuOlVTOlI&usg=AFQjCNHemj5Pwbs4sxPjT64SZ47MG3PQ-w,"Healthcare IT provides secured sharing of patient information for healthcare ... Healthcare IT uses electronic health records (EHRs) in place of paper ... Apart from improved medical care and lower costs, these systems that are...",2020-07-17,Healthcare Cost Sharing
COVID-19 Impact Enterprise File Synchronization &amp; Sharing (EFSS) Market Advanced Technology ...,https://www.google.com/url?rct=j&sa=t&url=https://jewishlifenews.com/uncategorized/covid-19-impact-enterprise-file-synchronization-sharing-efss-market-advanced-technology-potential-revenue-cost-structure-analysis-and-key-players-global-future-prospects-2025/&ct=ga&cd=CAIyHDcyMWE5ZGFiNjRlZGE3MTM6Y29tOmVuOlVTOlI&usg=AFQjCNEcebeScosFlmS2yvNo5yQX6Qdw9g,"... Sharing (EFSS) Market Advanced Technology, Potential Revenue, Cost ... We comprehend that this health crisis has brought an unprecedented...",2020-07-17,Healthcare Cost Sharing
"7 Options When You""ve Lost Your Job-Sponsored Health Insurance",https://www.google.com/url?rct=j&sa=t&url=https://www.newsmax.com/finance/personal-finance/health-coverage-job-sponsored/2020/07/17/id/977734/&ct=ga&cd=CAIyHDBhNGY1MzE5YzE5ODdjNzQ6Y29tOmVuOlVTOlI&usg=AFQjCNE9RJ03Sy_dymsCTjla4dXmGIxOnQ,"You might also consider signing up for a healthcare sharing ministry. But be warned that these aren""t health insurance, and such programs aren""t right...",2020-07-17,Healthcare Sharing Programs
"7 Options When You""ve Lost Your Job-Sponsored Health Insurance",https://www.google.com/url?rct=j&sa=t&url=https://www.newsmax.com/finance/streettalk/health-coverage-job-sponsored/2020/07/17/id/977734&ct=ga&cd=CAIyHDBhNGY1MzE5YzE5ODdjNzQ6Y29tOmVuOlVTOlI&usg=AFQjCNEgo_1WQQw23YBdZWgRABej-FkHsQ,These marketplaces -- which you can find at HealthCare.gov -- offer ... Many states expanded their Medicaid programs under the Affordable Care Act.,2020-07-17,Healthcare Sharing Programs
"7 Options When You""ve Lost Your Job-Sponsored Health Insurance",https://www.google.com/url?rct=j&sa=t&url=https://www.newsmax.com/finance/personal-finance/health-coverage-job-sponsored/2020/07/17/id/977734/&ct=ga&cd=CAIyHDBhNGY1MzE5YzE5ODdjNzQ6Y29tOmVuOlVTOlI&usg=AFQjCNE9RJ03Sy_dymsCTjla4dXmGIxOnQ,"You might also consider signing up for a healthcare sharing ministry. But be warned that these aren""t health insurance, and such programs aren""t right...",2020-07-17,Healthcare Sharing Programs
"7 Options When You""ve Lost Your Job-Sponsored Health Insurance",https://www.google.com/url?rct=j&sa=t&url=https://www.newsmax.com/finance/streettalk/health-coverage-job-sponsored/2020/07/17/id/977734&ct=ga&cd=CAIyHDBhNGY1MzE5YzE5ODdjNzQ6Y29tOmVuOlVTOlI&usg=AFQjCNEgo_1WQQw23YBdZWgRABej-FkHsQ,These marketplaces -- which you can find at HealthCare.gov -- offer ... Many states expanded their Medicaid programs under the Affordable Care Act.,2020-07-17,Healthcare Sharing Programs
"An Employer""s Guide To Managing PTO Donation Requests In The COVID-19 Age",https://www.google.com/url?rct=j&sa=t&url=https://www.jdsupra.com/legalnews/an-employer-s-guide-to-managing-pto-49484/&ct=ga&cd=CAIyHDc5M2E3YWM0ZTJjZTM4OWY6Y29tOmVuOlVTOlI&usg=AFQjCNHPVatU81tPLhr7GLxCku3doUCREA,One potential option is a traditional Medical Emergency Leave-Sharing Plan meeting the requirements of IRS Revenue Ruling 90-29. In such a...,2020-07-18,Medical Sharing
Cannabis Bill Roundup: Mo. Medical Pot Regime Takes Shape,https://www.google.com/url?rct=j&sa=t&url=https://www.law360.com/lifesciences/articles/1293350/cannabis-bill-roundup-mo-medical-pot-regime-takes-shape&ct=ga&cd=CAIyHDc5M2E3YWM0ZTJjZTM4OWY6Y29tOmVuOlVTOlI&usg=AFQjCNFpnOiU2syuVIRAjGPKYKbrxcyBbQ,"The bill would allow licensed cannabis businesses to sign a waiver allowing the state""s regulatory agencies to share information about the licensee,...",2020-07-18,Medical Sharing
"Dell Children""s Medical Center in Austin may soon offer heart transplants for kids",https://www.google.com/url?rct=j&sa=t&url=https://www.kxan.com/news/local/austin/dell-childrens-medical-center-in-austin-may-soon-offer-heart-transplants-for-kids/&ct=ga&cd=CAIyHDc5M2E3YWM0ZTJjZTM4OWY6Y29tOmVuOlVTOlI&usg=AFQjCNHIlq-imwS84AI0YbvR25oyJcKJ1g,"AUSTIN (KXAN) — Dell Children""s Medical Center will soon learn if the United Network for Organ Sharing will approve its application to perform...",2020-07-17,Medical Sharing
"7 Options When You""ve Lost Your Job-Sponsored Health Insurance",https://www.google.com/url?rct=j&sa=t&url=https://www.newsmax.com/finance/personal-finance/health-coverage-job-sponsored/2020/07/17/id/977734/&ct=ga&cd=CAIyHDc5M2E3YWM0ZTJjZTM4OWY6Y29tOmVuOlVTOlI&usg=AFQjCNE9RJ03Sy_dymsCTjla4dXmGIxOnQ,"""Member-to-member sharing health care is not for everyone, but those of faith who qualify can get quality healthcare while saving considerably on health...",2020-07-17,Medical Sharing
The Stories We Share: A Social Justice Campaign,https://www.google.com/url?rct=j&sa=t&url=https://labblog.uofmhealth.org/med-u/stories-we-share-a-social-justice-campaign&ct=ga&cd=CAIyHDc5M2E3YWM0ZTJjZTM4OWY6Y29tOmVuOlVTOlI&usg=AFQjCNG_6MOSZTgVFRU15VVgmokbycPA1w,"The United Asian American Medical Student Association unveils a social media campaign designed to amplify diverse voices in support of diversity,...",2020-07-17,Medical Sharing
The Global Network powers healthcare collaboration,https://www.google.com/url?rct=j&sa=t&url=https://www.geektime.com/global-network-collaboration-improve-healthcare/&ct=ga&cd=CAIyHDc5M2E3YWM0ZTJjZTM4OWY6Y29tOmVuOlVTOlI&usg=AFQjCNGKXNdLcXNDnAGNOUcQM40231Cjjw,"New Global Network provides healthcare personnel with a platform to share treatments and medical insight, and it""s all powered by Israeli healthcare...",2020-07-17,Medical Sharing
"Faster health data exchange starts with addressing health IT""s control concerns",https://www.google.com/url?rct=j&sa=t&url=https://medcitynews.com/2020/07/faster-health-data-exchange-starts-with-addressing-health-its-control-concerns/&ct=ga&cd=CAIyHDc5M2E3YWM0ZTJjZTM4OWY6Y29tOmVuOlVTOlI&usg=AFQjCNGq7PPfnHh3WBqUOfz7vxdRUOfLBQ,"Healthcare IT organizations are already overloaded with use cases that demand better operational and clinical value of healthcare data, pushing them to...",2020-07-17,Medical Sharing
Healthcare IT Market to Witness Growth Acceleration During 2017-2025,https://www.google.com/url?rct=j&sa=t&url=https://dailyresearchchronicles.com/2020/07/17/healthcare-it-market-to-witness-growth-acceleration-during-2017-2025/&ct=ga&cd=CAIyHDc5M2E3YWM0ZTJjZTM4OWY6Y29tOmVuOlVTOlI&usg=AFQjCNHemj5Pwbs4sxPjT64SZ47MG3PQ-w,"Patients can use health IT to communicate with their doctor, care giver to share information about health and act as per instructions to improve the quality...",2020-07-17,Medical Sharing
