title,link,item_text,date_published,google_alert_name
"Online health communities connect patients, trial teams",https://www.google.com/url?rct=j&sa=t&url=https://www.outsourcing-pharma.com/Article/2021/03/23/Online-health-communities-connect-patients-trial-teams&ct=ga&cd=CAIyHDc5M2E3YWM0ZTJjZTM4OWY6Y29tOmVuOlVTOlI&usg=AFQjCNGsUnSYm-t8mtK_KXm7xG_44P4kPw,"OSP: Could you please share the ""elevator presentation"" of Health Union—who you are, what you do, and what sets you apart from other, similar...",2021-03-23,Medical Sharing
European Commission proposes EU4Health programme in response to COVID-19,https://www.google.com/url?rct=j&sa=t&url=https://www.healthcareitnews.com/news/emea/european-commission-proposes-eu4health-programme-response-covid-19&ct=ga&cd=CAIyHDc5M2E3YWM0ZTJjZTM4OWY6Y29tOmVuOlVTOlI&usg=AFQjCNGwpsSekLxMAJ1ZcpR4uR2mxNGCPA,"Make medicines and medical devices available and affordable, advocate the ... Connecting and sharing health data for research, faster diagnosis and...",2021-03-23,Medical Sharing
"Medical Devices Vigilance Market 2021 Industry Size, Share, Growth and Top Companies Analysis ...",https://www.google.com/url?rct=j&sa=t&url=https://neighborwebsj.com/news/5047619/medical-devices-vigilance-market-2021-industry-size-share-growth-and-top-companies-analysis-ab-cube-assurx-axpharma-intel-mdi-consultants-etc/&ct=ga&cd=CAIyHDc5M2E3YWM0ZTJjZTM4OWY6Y29tOmVuOlVTOlI&usg=AFQjCNGTNMlPniYbIDoZ6oLWHMGTqKnO8w,"Medical Devices Vigilance Market 2021 Industry Size, Share, Growth and Top Companies Analysis- AB-Cube, AssurX, AXPHARMA, INTEL, MDI...",2021-03-23,Medical Sharing
Trust Stamp Competes in Hague Innovators Challenge with Medical QR Code Technology,https://www.google.com/url?rct=j&sa=t&url=https://www.prnewswire.com/news-releases/trust-stamp-competes-in-hague-innovators-challenge-with-medical-qr-code-technology-301253641.html&ct=ga&cd=CAIyHDc5M2E3YWM0ZTJjZTM4OWY6Y29tOmVuOlVTOlI&usg=AFQjCNG4j-9S2dhyc0RDEXVca2HWhKjsYg,"... leveraging accessible, patient-centric technologies to unlock the benefits that efficient access and permissioned sharing of medical information have...",2021-03-23,Medical Sharing
CloudMD Announces Closing of IDYA4 Acquisition and North American roll out of Substance Use ...,https://www.google.com/url?rct=j&sa=t&url=https://www.streetinsider.com/Globe%2BNewswire/CloudMD%2BAnnounces%2BClosing%2Bof%2BIDYA4%2BAcquisition%2Band%2BNorth%2BAmerican%2Broll%2Bout%2Bof%2BSubstance%2BUse%2BDisorder%2BPlatform%2Bto%2BAddress%2BGrowing%2BAddiction%2BCrisis/18162707.html&ct=ga&cd=CAIyHDc5M2E3YWM0ZTJjZTM4OWY6Y29tOmVuOlVTOlI&usg=AFQjCNFLz7Sd-t6IESvNNb_7LtVmWeOeCA,"... platform shares information within the bounds of policies and laws like The Health Insurance Portability and Accountability Act of 1996 (“HIPAA”),...",2021-03-23,Medical Sharing
3D Medical Imaging Services Market: GLOBAL OPPORTUNITY ANALYSIS AND INDUSTRY ...,https://www.google.com/url?rct=j&sa=t&url=https://ksusentinel.com/2021/03/23/3d-medical-imaging-services-market-global-opportunity-analysis-and-industry-forecast-2023/&ct=ga&cd=CAIyHDc5M2E3YWM0ZTJjZTM4OWY6Y29tOmVuOlVTOlI&usg=AFQjCNHmUnifARyU1ut4mR9j56ANa8IMCQ,"On the contrary, the introduction of improved data storage and information sharing systems such as medical cloud is anticipated to provide create...",2021-03-23,Medical Sharing
How a new model of health care improves outcomes while lowering costs | Opinion,https://www.google.com/url?rct=j&sa=t&url=https://www.tennessean.com/story/opinion/2021/03/23/how-new-model-health-care-improves-outcomes-while-lowering-costs/6956641002/&ct=ga&cd=CAIyHDc5M2E3YWM0ZTJjZTM4OWY6Y29tOmVuOlVTOlI&usg=AFQjCNGpMZguNhagkEuiX2K5n994KIGwLQ,"Sanitas Medical Center and BlueCross BlueShield of Tennessee aim to ... As regional medical director for Sanitas, I share this story to illustrate two...",2021-03-23,Medical Sharing
"Medical Laser Fiber Market 2021 Is Booming Across the Globe by Share, Size, Growth, Segments ...",https://www.google.com/url?rct=j&sa=t&url=https://neighborwebsj.com/news/5033972/medical-laser-fiber-market-2021-is-booming-across-the-globe-by-share-size-growth-segments-and-forecast-to-2027-top-players-analysis-boston-scientific-c-r-bard-biolitec-olympus-cook-medical/&ct=ga&cd=CAIyHDc5M2E3YWM0ZTJjZTM4OWY6Y29tOmVuOlVTOlI&usg=AFQjCNEILKvpwoGJZaLXRtCEj5SPFtBmnA,"Medical Laser Fiber Market 2021 Is Booming Across the Globe by Share, Size, Growth, Segments and Forecast to 2027 | Top Players Analysis- Boston...",2021-03-23,Medical Sharing
Kylie Jenner Responds To GoFundMe Controversy After Being Dragged Online,https://www.google.com/url?rct=j&sa=t&url=https://nowthisnews.com/news/kylie-jenner-responds-to-makeup-artist-gofundme-controversy-after-being-dragged-online&ct=ga&cd=CAIyHDc5M2E3YWM0ZTJjZTM4OWY6Y29tOmVuOlVTOlI&usg=AFQjCNHIpH-jX9r2h807FDN1eg0AWl6SYg,"... shared a makeup artist""s GoFundMe page set to cover medical expenses. ... Jenner recently shared an Instagram Story, which has expired, of a post...",2021-03-22,Medical Sharing
Atrium Health given 1 month to restore data sharing with local EMS,https://www.google.com/url?rct=j&sa=t&url=https://www.beckershospitalreview.com/ehrs/atrium-health-given-1-month-to-restore-data-sharing-with-local-ems.html&ct=ga&cd=CAIyHDc5M2E3YWM0ZTJjZTM4OWY6Y29tOmVuOlVTOlI&usg=AFQjCNFPf6jeOxwaMwHFm681TKfgYLsedA,"Charlotte, N.C.-based Atrium Health has been given a month to fix an issue with its EHR system that has prevented Atrium from sharing medical...",2021-03-22,Medical Sharing
7 Best Disposable Face Masks for Proper Double-Masking Fit,https://www.google.com/url?rct=j&sa=t&url=https://www.goodhousekeeping.com/health/g35888869/best-disposable-face-masks/&ct=ga&cd=CAIyHDc5M2E3YWM0ZTJjZTM4OWY6Y29tOmVuOlVTOlI&usg=AFQjCNHIf_HN_jzsDI1fh1ALYYM8Kiy4aA,"Below, we""re sharing disposable medical masks that are labeled to meet ASTM standards and have earned top marks from shoppers. These masks...",2021-03-22,Medical Sharing
Group Health Plan Transparency Disclosure Rules Finalized: What Plan Sponsors Should Know,https://www.google.com/url?rct=j&sa=t&url=https://www.lexology.com/library/detail.aspx%3Fg%3Dcb5d06ca-56a4-4da1-bffe-0d86923e21f2&ct=ga&cd=CAIyHDc5M2E3YWM0ZTJjZTM4OWY6Y29tOmVuOlVTOlI&usg=AFQjCNEN1upJh5tUUCH0e0BYQoHgpKGhBQ,"Among those transparency disclosures are ""information on cost-sharing and payments with respect to any out-of-network coverage"" and ""other...",2021-03-22,Medical Sharing
"17 Healthy Eating Habits To Start Today, According To Our Medical Experts",https://www.google.com/url?rct=j&sa=t&url=https://www.eatthis.com/news-healthy-eating-habits-etnt-medical-experts/&ct=ga&cd=CAIyHDc5M2E3YWM0ZTJjZTM4OWY6Y29tOmVuOlVTOlI&usg=AFQjCNFo8FlxVTeqSkqGEgo9ZMwZ1RfXMQ,Medical Expert Board members to share some of their favorite healthy eating habits that you can easily start right now. This group of certified and world-...,2021-03-22,Medical Sharing
Society of Cannabis Clinicians Launches Mobile Education Courses on Canna-Ed by Learner ...,https://www.google.com/url?rct=j&sa=t&url=https://www.prweb.com/releases/society_of_cannabis_clinicians_launches_mobile_education_courses_on_canna_ed_by_learner_mobiles_leading_learning_management_system/prweb17809448.htm&ct=ga&cd=CAIyHDc5M2E3YWM0ZTJjZTM4OWY6Y29tOmVuOlVTOlI&usg=AFQjCNERTMVbj1FEaHBP4DfRkQGo7siZKQ,"We are proud that Canna-Ed can support the mission of the Society of Cannabis Clinicians, which is dedicated to knowledge sharing so that the medical...",2021-03-22,Medical Sharing
Stanley Huff Joins Interoperability Institute Board of Managers,https://www.google.com/url?rct=j&sa=t&url=https://www.streetinsider.com/Globe%2BNewswire/Stanley%2BHuff%2BJoins%2BInteroperability%2BInstitute%2BBoard%2Bof%2BManagers/18157655.html&ct=ga&cd=CAIyHDc5M2E3YWM0ZTJjZTM4OWY6Y29tOmVuOlVTOlI&usg=AFQjCNEVBAGHvjio1ji0AIA3OfXKdbRO3g,The Institute is a limited liability company with the Michigan Health Information Network Shared Services (MiHIN) as the sole member. For more...,2021-03-22,Medical Sharing
NHSX receives £5m funding boost for teledermatology services,https://www.google.com/url?rct=j&sa=t&url=https://www.healthcareitnews.com/news/emea/nhsx-receives-5m-funding-boost-teledermatology-services&ct=ga&cd=CAIyHDc5M2E3YWM0ZTJjZTM4OWY6Y29tOmVuOlVTOlI&usg=AFQjCNGz8mAvMrfAxKKoL2Uho4VfTaZTJg,"However, Faculty of Future Healthcare, chief medical strategy officer and ... At last year""s HIMSS and Health 2.0 European Health Conference, Gavin ... use of image sharing to improve patient care across a range of other specialties.",2021-03-22,Medical Sharing
