title,link,item_text,date_published,google_alert_name
Mental health patients in shared wards despite calls for NHS to end practice - The Guardian,https://www.google.com/url?rct=j&sa=t&url=https://www.theguardian.com/society/2021/sep/06/mental-health-patients-kept-in-shared-wards-despite-calls-for-nhs-to-end-practice&ct=ga&cd=CAIyGmU4MWY4MmViNmViOTg5MTE6Y29tOmVuOlVT&usg=AFQjCNEM8AiFy_OTQu_oqUqyvF4KmSGaMQ,"People with serious mental health problems are being forced to share wards with distressed fellow patients, 20 years after the NHS was told to give them all...",2021-09-06,Health Sharing
"Over 16,000 samples sent for genome sequencing of SARS CoV2 in Jul-Aug: Govt - Mint",https://www.google.com/url?rct=j&sa=t&url=https://www.livemint.com/news/india/over-16-000-samples-sent-for-genome-sequencing-of-sars-cov2-in-jul-aug-govt-11630916740866.html&ct=ga&cd=CAIyGmU4MWY4MmViNmViOTg5MTE6Y29tOmVuOlVT&usg=AFQjCNHkAG9adQCrYlAu_9nmCKTHX_n63Q,... data for samples for WGS by sentinel sites is being shared via Integrated Health Information Platform (IHIP) portal which ensures real-time sharing of...,2021-09-06,Health Sharing
Saira Banu Discharged from the Hospital on Sunday - The Teal Mango,https://www.google.com/url?rct=j&sa=t&url=https://www.thetealmango.com/news/saira-banu-discharged-from-the-hospital-on-sunday/&ct=ga&cd=CAIyGmU4MWY4MmViNmViOTg5MTE6Y29tOmVuOlVT&usg=AFQjCNHSqW6UeCtvlEMdE_24we3oLhWMng,The official also shared that she may probably get discharged in a day or two if her health continues to be stable. The Hinduja Hospital officials while sharing...,2021-09-06,Health Sharing
"Ankita Konwar""s Monday is all about active recovery, says to be healthy listen to the body ...",https://www.google.com/url?rct=j&sa=t&url=https://www.hindustantimes.com/lifestyle/health/ankita-konwar-monday-is-all-about-active-recovery-says-to-be-healthy-listen-to-the-body-101630908112490.html&ct=ga&cd=CAIyGmU4MWY4MmViNmViOTg5MTE6Y29tOmVuOlVT&usg=AFQjCNEDAC4Kz9dcfT_m75ntKiJ0-YeWFQ,"Sharing the video, Ankita said that last Monday was intense for her. Therefore, this Monday will be all about active recovery. She added that it is vital to...",2021-09-06,Health Sharing
This is what working at a toxic workplace really feels like | Sifted,https://www.google.com/url?rct=j&sa=t&url=https://sifted.eu/articles/toxic-workplaces/&ct=ga&cd=CAIyGmU4MWY4MmViNmViOTg5MTE6Y29tOmVuOlVT&usg=AFQjCNFzMPFKeMM2ZWRKI7PtmRHUy6E4mw,"After beginning to experience mental health issues, sharing her concerns with the CEO and seeing no change in behaviour, she resigned.",2021-09-06,Health Sharing
"Teen Mom Briana DeJesus reveals she""s been diagnosed with lupus after suffering from ...",https://www.google.com/url?rct=j&sa=t&url=https://www.the-sun.com/entertainment/3607394/teen-mom-briana-dejesus-diagnosed-lupus-mystery-medical-crisis/&ct=ga&cd=CAIyGmU4MWY4MmViNmViOTg5MTE6Y29tOmVuOlVT&usg=AFQjCNEm2qzaNAsDBAjki6IdgWJgJYNJCw,"... from the mystery medical crisis for months. The reality star has been open about her health issues, sharing a personal update earlier this summer.",2021-09-06,Health Sharing
"Te Pāti Māori label Seymour""s sharing of Māori vaccine code ""low life move"" | 1 NEWS | TVNZ",https://www.google.com/url?rct=j&sa=t&url=https://www.tvnz.co.nz/one-news/new-zealand/te-p-ti-m-ori-label-seymours-sharing-vaccine-code-low-life-move&ct=ga&cd=CAIyGmU4MWY4MmViNmViOTg5MTE6Y29tOmVuOlVT&usg=AFQjCNFPakDQwDWZlkvStXrOq-kwaoEgMg,"""For absolute shame that a vaccination code, meant for Māori, was shared publicly to stuff up those health centres and staff directly for doing their essential...",2021-09-06,Health Sharing
"Social campaign that puts a human face to ""underlying health conditions"" underscores the ...",https://www.google.com/url?rct=j&sa=t&url=https://womensagenda.com.au/latest/social-campaign-that-puts-a-human-face-to-underlying-health-conditions-underscores-the-importance-of-getting-jabbed/&ct=ga&cd=CAIyGmU4MWY4MmViNmViOTg5MTE6Y29tOmVuOlVT&usg=AFQjCNEdFKyoiy1OTnSTPNRUlNHjo0jUpw,"Chloe Butler, a Gold-Coast anaesthetist, shared her story: “I have Autoimmune Polyglandular Syndrome, which includes adrenal insufficiency so I""m dependent on...",2021-09-06,Health Sharing
"WHO to G20 Health Ministers: Meet COVID-19 pledges, support regional vaccine ... - UN News",https://www.google.com/url?rct=j&sa=t&url=https://news.un.org/en/story/2021/09/1099212&ct=ga&cd=CAIyGmU4MWY4MmViNmViOTg5MTE6Y29tOmVuOlVT&usg=AFQjCNE_4LAasisse-FRVOUTtR3AkO3WfA,"Director-General of the World Health Organization (WHO) Tedros Adhanom ... by fulfilling dose-sharing pledges and sharing technology, know-how and...",2021-09-06,Health Sharing
Interview with Jim Wilson on 2GB Drive about the UK Pfizer dose sharing arrangement ...,https://www.google.com/url?rct=j&sa=t&url=https://www.health.gov.au/ministers/the-hon-greg-hunt-mp/media/interview-with-jim-wilson-on-2gb-drive-about-the-uk-pfizer-dose-sharing-arrangement-vaccinating-children-under-12-and-rapid-antigen-testing&ct=ga&cd=CAIyGmU4MWY4MmViNmViOTg5MTE6Y29tOmVuOlVT&usg=AFQjCNHkDYR1jBwJKiTHOnjL8yDZ7nyciw,"Very exciting news, this, they""ve secured another four million Pfizer doses in a swap deal with the UK. Federal Health Minister Greg Hunt joins me on the line.",2021-09-06,Health Sharing
Sloane Stephens shares abusive messages she received after U.S. Open loss - Yahoo News,https://www.google.com/url?rct=j&sa=t&url=https://news.yahoo.com/sloane-stephens-shares-abusive-messages-224025312.html&ct=ga&cd=CAIyGmU4MWY4MmViNmViOTg5MTE6Y29tOmVuOlVT&usg=AFQjCNEKmAn8Ho6OH06pXoPIuONGdOhOWw,Driving the news: Star athletes like Naomi Osaka and Simone Biles have shined a renewed spotlight on the importance of mental health in sports.,2021-09-05,Health Sharing
Toronto hospital workers share fourth wave anxieties with Justin Trudeau | CTV News,https://www.google.com/url?rct=j&sa=t&url=https://www.ctvnews.ca/politics/federal-election-2021/toronto-hospital-workers-share-fourth-wave-anxieties-with-justin-trudeau-1.5574275&ct=ga&cd=CAIyGmU4MWY4MmViNmViOTg5MTE6Y29tOmVuOlVT&usg=AFQjCNE6ij1lbnyVRarveRNqKcO5G4mjAw,TORONTO -- Health-care workers shared concerns over staff shortages and burnout with the federal Liberal leader during a Sunday campaign stop at a Toronto...,2021-09-05,Health Sharing
"Katie Thurston Says She""s Not Pregnant After Fans"" Attempts To Diagnose Her By Grace Wehniainen",https://www.google.com/url?rct=j&sa=t&url=https://www.bustle.com/entertainment/katie-thurston-says-shes-not-pregnant&ct=ga&cd=CAIyGmU4MWY4MmViNmViOTg5MTE6Y29tOmVuOlVT&usg=AFQjCNFKU7UFmG19LdEIA_n0A5jjhZzunQ,"“I just wanted to share the results, in case anyone else is experiencing the same thing, and what I""m going to do about it,” the reality TV star explained.",2021-09-05,Health Sharing
Viroqua resident gains 1M followers on TikTok by sharing his mental health experiences ...,https://www.google.com/url?rct=j&sa=t&url=https://www.winonadailynews.com/news/local/viroqua-resident-gains-1m-followers-on-tiktok-by-sharing-his-mental-health-experiences/article_4e681202-7a0f-570d-a08a-1d30c24a9a9d.html&ct=ga&cd=CAIyGmU4MWY4MmViNmViOTg5MTE6Y29tOmVuOlVT&usg=AFQjCNHklnDXagMVvPR3lvV8-SoP6mRUhA,"He shared that, similar to many people with mental health disorders, he has days where he doesn""t feel like taking his daily medications.",2021-09-05,Health Sharing
Denise Welch supported by fans as she gives update following health struggle - Hello Magazine,https://www.google.com/url?rct=j&sa=t&url=https://www.hellomagazine.com/healthandbeauty/health-and-fitness/20210905121047/loose-women-denise-welch-supported-fans-following-health-struggle/&ct=ga&cd=CAIyGmU4MWY4MmViNmViOTg5MTE6Y29tOmVuOlVT&usg=AFQjCNHTiWMYPg7nR3DT5AhdyMdv1ZletQ,"The star was clearly feeling better a few days later, however, as she revealed that she""d been to the gym – and shared its impact on her mental health.",2021-09-05,Health Sharing
Corsicana Pastor Shares Scary COVID Fight; Regrets Not Being Vaxxed - 101.5 KNUE,https://www.google.com/url?rct=j&sa=t&url=https://knue.com/corsicana-pastor-shares-scary-covid-fight-regrets-not-being-vaxxed/&ct=ga&cd=CAIyGmU4MWY4MmViNmViOTg5MTE6Y29tOmVuOlVT&usg=AFQjCNEkz4pT78EOiWsRpWEuNCcbnAAgUw,"""It ravaged my healthy body. There""s no doubt."" That""s what First Baptist Corsicana Senior Pastor Danny Reeves told NPR""s Debbie Elliot.",2021-09-05,Health Sharing
2021 climate disasters foreshadow future challenges for public health | TheHill,https://www.google.com/url?rct=j&sa=t&url=https://thehill.com/opinion/healthcare/570890-2021-climate-disasters-foreshadow-future-challenges-for-public-health&ct=ga&cd=CAIyGmU4MWY4MmViNmViOTg5MTE6Y29tOmVuOlVT&usg=AFQjCNEwScFQJVeMe_rcTmLdCmkDr1-JMQ,The Office of Climate Change and Health Equity is long overdue and must be swiftly ... that we in the public health community have been sharing for years.,2021-09-05,Health Sharing
The Nottingham doctors taking social media by storm - Nottinghamshire Live,https://www.google.com/url?rct=j&sa=t&url=https://www.nottinghampost.com/news/nottingham-news/nottingham-gps-doctors-social-media-5870140&ct=ga&cd=CAIyGmU4MWY4MmViNmViOTg5MTE6Y29tOmVuOlVT&usg=AFQjCNFa9jrlVPTJg0Dsaq7pTw0RgMBgLg,"Dr Ethan Smallwood who completed his medical training at The University of ... of followers but it wasn""t until he started sharing advice on common medical...",2021-09-05,Health Sharing
"NECC Business Resource Breakfast - North Essex Chamber-Commerce | Montclair, NJ Patch",https://www.google.com/url?rct=j&sa=t&url=https://patch.com/new-jersey/montclair/amp/cal/20210909/1243686/necc-business-resource-breakfast-north-essex-chamber-commerce&ct=ga&cd=CAIyGmU4MWY4MmViNmViOTg5MTE6Y29tOmVuOlVT&usg=AFQjCNH5-TmkJ5s-U1r-RcccipLvFJrUGQ,"Attendees will understand terms such as co-insurance, co-pay, out-of-pocket maximum, health shares, health sharing ministries, direct primary care (DPC),...",2021-09-04,Health Sharing
Four million Pfizer doses arrive to super-charge vaccine roll out | Health Portfolio Ministers,https://www.google.com/url?rct=j&sa=t&url=https://www.health.gov.au/ministers/the-hon-greg-hunt-mp/media/four-million-pfizer-doses-arrive-to-super-charge-vaccine-roll-out&ct=ga&cd=CAIyGmU4MWY4MmViNmViOTg5MTE6Y29tOmVuOlVT&usg=AFQjCNGk6E3tHW2OpjwF-YN7Iws3emj9nQ,The doses will be batch tested and immediately distributed across the country on an equal population basis. The dose sharing partnership benefits both countries...,2021-09-03,Health Sharing
Training provides boost toward medical careers - Yahoo News,https://www.google.com/url?rct=j&sa=t&url=https://news.yahoo.com/training-provides-boost-toward-medical-235200948.html&ct=ga&cd=CAIyHDc5M2E3YWM0ZTJjZTM4OWY6Y29tOmVuOlVTOlI&usg=AFQjCNF0mkhvB1KRG72QvKjC7Z1MuGy_QQ,"5—GRANITEVILLE — Ruth Ness has labored in a wide variety of situations over the course of her 30 years in medicine, and she""s now sharing her time and...",2021-09-05,Medical Sharing
Training provides boost toward medical careers | Local News | postandcourier.com,https://www.google.com/url?rct=j&sa=t&url=https://www.postandcourier.com/aikenstandard/news/local/training-provides-boost-toward-medical-careers/article_46c17d56-0cf7-11ec-aa41-bf2c80d057d0.html&ct=ga&cd=CAIyHDc5M2E3YWM0ZTJjZTM4OWY6Y29tOmVuOlVTOlI&usg=AFQjCNGD2WEjm9DoXBsYwM7-sI0FXqugMA,"GRANITEVILLE — Ruth Ness has labored in a wide variety of situations over the course of her 30 years in medicine, and she""s now sharing her time and talent to...",2021-09-05,Medical Sharing
