title,link,item_text,date_published,google_alert_name
UHSM Unveils Epic Prizes in Social Media Sweepstakes | Business Wire,https://www.google.com/url?rct=j&sa=t&url=https://www.businesswire.com/news/home/20211216005315/en/UHSM-Unveils-Epic-Prizes-in-Social-Media-Sweepstakes&ct=ga&cd=CAIyHDBhNGY1MzE5YzE5ODdjNzQ6Y29tOmVuOlVTOlI&usg=AFQjCNHFNBxh5H3pRGjMuxUFl7UquFtAXw,"UHSM Health Share is a nonprofit, faith-based health sharing ministry that ... offers its members simple, fair, and friendly healthcare programs.",2021-12-16,Healthcare Sharing Programs
"Seven Bridges Genomics to Foster Partnerships Between Health Systems, Pharmas With ...",https://www.google.com/url?rct=j&sa=t&url=https://www.genomeweb.com/informatics/seven-bridges-genomics-foster-partnerships-between-health-systems-pharmas-new&ct=ga&cd=CAIyHDc5M2E3YWM0ZTJjZTM4OWY6Y29tOmVuOlVTOlI&usg=AFQjCNEp-tksllinpI50cmSuQV_yPQpiBw,"Ledbetter said there are numerous private and academic networks for sharing data from electronic health records. ""All of them, until UPN,...",2021-12-17,Medical Sharing
"""A great Christmas gift:"" National Guard members arrive at CMMC to open temporary unit | WPFO",https://www.google.com/url?rct=j&sa=t&url=https://fox23maine.com/news/coronavirus/a-great-christmas-gift-national-guard-members-arrive-at-cmmc-to-open-temporary-unit&ct=ga&cd=CAIyHDc5M2E3YWM0ZTJjZTM4OWY6Y29tOmVuOlVTOlI&usg=AFQjCNHFdiAIWyV88f6ZeuWmQaaLtnfVTA,LEWISTON (WGME)-- The cavalry has arrived at Central Maine Medical Center. ... Joy of Sharing image. General Alert. Joy of Sharing.,2021-12-17,Medical Sharing
Long Island man charged with sharing sexually explicit images of former high school classmates,https://www.google.com/url?rct=j&sa=t&url=https://www.youtube.com/watch%3Fv%3D9hiGUOQrID4&ct=ga&cd=CAIyHDc5M2E3YWM0ZTJjZTM4OWY6Y29tOmVuOlVTOlI&usg=AFQjCNHAhA5q5L4alZo286ML4Ow3h9FuXQ,Kristin Thorne has more on the Long Island man charged with sharing sexually explicit images of former high school classmates.,2021-12-17,Medical Sharing
"""Maine CDC believes that it is here:"" Health officials stress boosters ahead of omicron | WGME",https://www.google.com/url?rct=j&sa=t&url=https://wgme.com/news/local/maine-cdc-believes-that-it-is-here-health-officials-stress-boosters-ahead-of-omicron&ct=ga&cd=CAIyHDc5M2E3YWM0ZTJjZTM4OWY6Y29tOmVuOlVTOlI&usg=AFQjCNFkre_QihbXPCAkIku2zZnU9JCM3A,Facebook Share Icon &middot; Twitter Share Icon &middot; Email Share Icon. SOUTH PORTLAND (WGME) – Maine CDC Director Dr. Nirav Shah addressed the omicron...,2021-12-17,Medical Sharing
Former customers of bankrupt N.H. health care sharing ministry unlikely to get large refunds - NHPR,https://www.google.com/url?rct=j&sa=t&url=https://www.nhpr.org/nh-news/2021-12-16/sharity-ministries-bankrupt-nh-refunds-trinity-health-share&ct=ga&cd=CAIyHDc5M2E3YWM0ZTJjZTM4OWY6Y29tOmVuOlVTOlI&usg=AFQjCNH9G5MZglKjGAIUK6fCOolZwnjOTA,"Unlike traditional health insurance, members of sharing ministries pledge to uphold certain religious values, and then pay monthly premiums with the...",2021-12-16,Medical Sharing
"Travis Scott""s Astroworld: Victims"" Cause of Death Released by Medical Examiner – The ...",https://www.google.com/url?rct=j&sa=t&url=https://www.hollywoodreporter.com/news/music-news/travis-scott-astroworld-victims-cause-of-death-released-medical-examiner-1235064023/&ct=ga&cd=CAIyHDc5M2E3YWM0ZTJjZTM4OWY6Y29tOmVuOlVTOlI&usg=AFQjCNHrjInVbyo4MZA0HDLx1jaWixctCw,Share this article on Facebook &middot; Share this article on Twitter &middot; Share this article on Email &middot; Show additional share options &middot; Share this article on Print...,2021-12-16,Medical Sharing
"Times"" sex abuse investigation triggers calls for reform of state Medical Board - Los Angeles Times",https://www.google.com/url?rct=j&sa=t&url=https://www.latimes.com/california/story/2021-12-16/medical-board-reaction-story&ct=ga&cd=CAIyHDc5M2E3YWM0ZTJjZTM4OWY6Y29tOmVuOlVTOlI&usg=AFQjCNFuKUlIFXKHRgP1f9xiB4D38AKCdA,"Lawmakers, others push for change after L.A. Times finds the California Medical Board reinstated licenses of physicians who sexually abused...",2021-12-16,Medical Sharing
"ACMG Issues Guidelines on Safeguarding Patient Genomic Data, Avoiding Genetic Discrimination",https://www.google.com/url?rct=j&sa=t&url=https://www.genomeweb.com/policy-legislation/acmg-issues-guidelines-safeguarding-patient-genomic-data-avoiding-genetic&ct=ga&cd=CAIyHDc5M2E3YWM0ZTJjZTM4OWY6Y29tOmVuOlVTOlI&usg=AFQjCNHxHf02nhL5WU8oqNpVgmfUhWd7ig,NEW YORK – The American College of Medical Genetics and Genomics (ACMG) ... solutions that can enhance the benefits of sharing genetic information...,2021-12-16,Medical Sharing
Medical examiner reports victims of Astroworld music festival crowd surge died from ...,https://www.google.com/url?rct=j&sa=t&url=https://www.inquirer.com/wires/ap/medical-examiner-reports-victims-astroworld-music-festival-crowd-surge-died-compression-asphyxia-20211216.html&ct=ga&cd=CAIyHDc5M2E3YWM0ZTJjZTM4OWY6Y29tOmVuOlVTOlI&usg=AFQjCNFWVAvTkHREQ-t-BnPt36kdUOGdVA,"Experts share tips. This is the time to give up being a control freak. Learn to enjoy positive moments and let the stuff you can""t...",2021-12-16,Medical Sharing
ACMG Provides Guidance on Protecting Patient Genomic Data and Avoiding Unfair ...,https://www.google.com/url?rct=j&sa=t&url=https://finance.yahoo.com/news/acmg-provides-guidance-protecting-patient-140000893.html&ct=ga&cd=CAIyHDc5M2E3YWM0ZTJjZTM4OWY6Y29tOmVuOlVTOlI&usg=AFQjCNHLAbCsBt8I5aqq3ZqXspC97RXgFA,"The American College of Medical Genetics and Genomics (ACMG) has just ... ""Genomic information and data sharing is essential to improving the...",2021-12-16,Medical Sharing
"Health IT Vendors Team Up for Data Integration, Interoperability - HITInfrastructure",https://www.google.com/url?rct=j&sa=t&url=https://hitinfrastructure.com/news/health-it-vendors-team-up-for-data-integration-interoperability&ct=ga&cd=CAIyHDc5M2E3YWM0ZTJjZTM4OWY6Y29tOmVuOlVTOlI&usg=AFQjCNFZAXM-bd-lhwUonB5-MmSTnNLX5g,"The partnership will support health systems and payers in securely sharing patient EHR data via applications that simplify care transitions, lower...",2021-12-16,Medical Sharing
"""Hugs for the Heart"" blends poetry, mental health advocacy, sharing and caring | Las Cruces Bulletin","https://www.google.com/url?rct=j&sa=t&url=https://lascrucesbulletin.com/stories/hugs-for-the-heart-blends-poetry-mental-health-advocacy-sharing-and-caring,9387&ct=ga&cd=CAIyHDc5M2E3YWM0ZTJjZTM4OWY6Y29tOmVuOlVTOlI&usg=AFQjCNHjvnFKGVglbkeHldZjS-JhloE_lQ","A Las Cruces art gallery was transformed into a safe and welcoming performance space Dec. 9, as Art Obscura Gallery and owner Deret Roberts...",2021-12-16,Medical Sharing
Zoll closes $538M acquisition of Itamar Medical - MassDevice,https://www.google.com/url?rct=j&sa=t&url=https://www.massdevice.com/zoll-closes-538m-acquisition-of-itamar-medical/&ct=ga&cd=CAIyHDc5M2E3YWM0ZTJjZTM4OWY6Y29tOmVuOlVTOlI&usg=AFQjCNE6W5o0c9EYnq6o0G8sEny7kh0NCw,"Zoll Medical announced today that it completed its previously announced ... at $31 per American Deposiory Share (ADS), a premium of 50.2% over the...",2021-12-16,Medical Sharing
"Don""t Be Surprised By The Federal ""No Surprises Act"" - Michigan State Medical Society",https://www.google.com/url?rct=j&sa=t&url=https://www.msms.org/About-MSMS/News-Media/dont-be-surprised-by-the-federal-no-surprises-act&ct=ga&cd=CAIyHDc5M2E3YWM0ZTJjZTM4OWY6Y29tOmVuOlVTOlI&usg=AFQjCNFEPVefIxYCmuIYjiAy2oyOQmJ4XQ,"Health plans are required to notify providers of the applicable in-network cost sharing amount, make an initial payment, and send the patient an...",2021-12-16,Medical Sharing
"With Medical Bills Soaring, Nonprofits, Crowdfunding, Payment Plans Offer Some Debt ...",https://www.google.com/url?rct=j&sa=t&url=https://ctnewsjunkie.com/2021/12/16/with-medical-bills-soaring-nonprofits-crowdfunding-payment-plans-offer-some-debt-relief/&ct=ga&cd=CAIyHDc5M2E3YWM0ZTJjZTM4OWY6Y29tOmVuOlVTOlI&usg=AFQjCNHk9uCxZdCZGT5mZR8inxMT9YsidQ,"Now, Dingwell said she""s paying out-of-pocket for her mental health care, as well as a large share of her medical treatment since leaving her job a...",2021-12-16,Medical Sharing
ZOLL Announces Closing of Acquisition of Itamar Medical | Business Wire,https://www.google.com/url?rct=j&sa=t&url=https://www.businesswire.com/news/home/20211216005170/en/ZOLL-Announces-Closing-of-Acquisition-of-Itamar-Medical&ct=ga&cd=CAIyHDc5M2E3YWM0ZTJjZTM4OWY6Y29tOmVuOlVTOlI&usg=AFQjCNGhdDDbpLGZ8bZPuUXn3MHjnIjOZQ,"ZOLL® Medical Corporation, an Asahi Kasei company that manufactures ... NIS 3.24) per ordinary share, or $31 per American Depository Share (ADS),...",2021-12-16,Medical Sharing
Call to restrict sharing of genomics data over fears of DNA-targeted weapons | Science|Business,https://www.google.com/url?rct=j&sa=t&url=https://sciencebusiness.net/news/call-restrict-sharing-genomics-data-over-fears-dna-targeted-weapons&ct=ga&cd=CAIyHDc5M2E3YWM0ZTJjZTM4OWY6Y29tOmVuOlVTOlI&usg=AFQjCNFw2_Z4IQqWBP-8XqJbY_xTISMMMg,This raises the prospect that the genomics data which in the past 20 years has become the lifeblood of large swathes of medical and public health...,2021-12-16,Medical Sharing
Philanthropists invest in medical innovation and orthopedic faculty support | Penn State University,https://www.google.com/url?rct=j&sa=t&url=https://www.psu.edu/news/medicine/story/philanthropists-invest-medical-innovation-and-orthopedic-faculty-support/&ct=ga&cd=CAIyHDc5M2E3YWM0ZTJjZTM4OWY6Y29tOmVuOlVTOlI&usg=AFQjCNHSa4KcLK_XdVu-zIKq0Y_wp4UooA,Longtime Penn State philanthropists Peter and Ann Tombros have established two endowments at Penn State College of Medicine as part of their new...,2021-12-16,Medical Sharing
Virtual health plans should worry us all | TheHill,https://www.google.com/url?rct=j&sa=t&url=https://thehill.com/opinion/healthcare/585883-virtual-health-plans-should-worry-us-all&ct=ga&cd=CAIyHDc5M2E3YWM0ZTJjZTM4OWY6Y29tOmVuOlVTOlI&usg=AFQjCNHYx91r6Z5nUd4NoFLA19MIZhV2FQ,Some health insurance companies are using telehealth technology for ... Many virtual plans entice consumers with lower premiums and cost-sharing.,2021-12-16,Medical Sharing
"In Louisiana, rape survivors are denied access to their own medical records",https://www.google.com/url?rct=j&sa=t&url=https://lailluminator.com/2021/12/16/in-louisiana-rape-survivors-are-denied-access-to-their-own-medical-records/&ct=ga&cd=CAIyHDc5M2E3YWM0ZTJjZTM4OWY6Y29tOmVuOlVTOlI&usg=AFQjCNGpXI6geCoJ-6gQojdI-bz-VxzFNQ,"Law enforcement, medical providers push back on sharing rape kit documents ... Louisiana hospitals and other medical providers have no consistent...",2021-12-16,Medical Sharing
