title,link,item_text,date_published,google_alert_name
6 important health insurance buying tips and advice for beginners,https://www.google.com/url?rct=j&sa=t&url=http://www.chicagonow.com/2020/12/health-insurance-buying-tips/&ct=ga&cd=CAIyHDcwNjg0ZGMwOTMxYjI0NDM6Y29tOmVuOlVTOlI&usg=AFQjCNFqeJK4XmTRXu8-Yg1ITEloOfVr-A,A sharing program works slightly different from a traditional health insurance provider. Christian Healthcare Ministries allow members to match the bills...,2020-12-23,Christian Health Care Sharing
6 important health insurance buying tips and advice for beginners,https://www.google.com/url?rct=j&sa=t&url=http://www.chicagonow.com/2020/12/health-insurance-buying-tips/&ct=ga&cd=CAIyHDBlYjRmZTFlNDk3NWE4OGE6Y29tOmVuOlVTOlI&usg=AFQjCNFqeJK4XmTRXu8-Yg1ITEloOfVr-A,A sharing program works slightly different from a traditional health insurance provider. Christian Healthcare Ministries allow members to match the bills...,2020-12-23,Christian Sharing Ministry
Consumers warned about illegal health plans marketed in NJ,https://www.google.com/url?rct=j&sa=t&url=https://pressofatlanticcity.com/news/consumers-warned-about-illegal-health-plans-marketed-in-nj/article_3bb92cc6-b19e-554d-8d7e-cf245130b6af.html&ct=ga&cd=CAIyHGVmMjU5ZGE1NWJkYjU0NjU6Y29tOmVuOlVTOlI&usg=AFQjCNF5aRv0IrEoidjovA-zOGXuUB3pZw,Health care sharing ministries (HCSM) are organizations in which health care costs are shared among members who have common ethical or religious...,2020-12-24,Health Care Sharing Ministry
6 important health insurance buying tips and advice for beginners,https://www.google.com/url?rct=j&sa=t&url=http://www.chicagonow.com/2020/12/health-insurance-buying-tips/&ct=ga&cd=CAIyHGVmMjU5ZGE1NWJkYjU0NjU6Y29tOmVuOlVTOlI&usg=AFQjCNFqeJK4XmTRXu8-Yg1ITEloOfVr-A,A good affordable alternative to healthcare is finding a health share program also known as a healthcare ministry. A sharing program works slightly...,2020-12-23,Health Care Sharing Ministry
Washington Insurance Commissioner Extends Emergency Order Waiving Co-Pays and ...,https://www.google.com/url?rct=j&sa=t&url=https://www.bigcountrynewsconnection.com/news/washington-insurance-commissioner-extends-emergency-order-waiving-co-pays-and-deductibles-for-covid-19-testing/article_7c324fca-4613-11eb-87d1-1fa800c1f584.html&ct=ga&cd=CAIyHDQ1NzZkZjdlYTEzZTg0YTA6Y29tOmVuOlVTOlI&usg=AFQjCNFfvpFiA4h2I-o4qjX12QhK234akQ,"Kreidler""s order waiving cost-sharing applies to all state-regulated health insurance plans and short-term, limited-duration medical plans. The order on...",2020-12-24,Health Cost Sharing
"Consumer relief: COVID-19 bill to end ""surprise"" medical bills",https://www.google.com/url?rct=j&sa=t&url=https://www.inquirer.com/health/consumer/surprise-medical-bills-consumer-protection-congress-coronavirus-bill-20201223.html&ct=ga&cd=CAIyHDQ1NzZkZjdlYTEzZTg0YTA6Y29tOmVuOlVTOlI&usg=AFQjCNHaWV2muuITn_uYmgia0gIdd58L_g,"... hospitals that are outside the network of a patient""s health insurance plan. ... patients surprise bills for more than the in-network cost sharing amount.",2020-12-24,Health Cost Sharing
"The pandemic""s effect and how brokers can help clients reduce health care costs",https://www.google.com/url?rct=j&sa=t&url=https://www.benefitspro.com/2020/12/24/the-pandemics-effect-and-how-brokers-can-help-clients-reduce-health-care-costs/&ct=ga&cd=CAIyHDQ1NzZkZjdlYTEzZTg0YTA6Y29tOmVuOlVTOlI&usg=AFQjCNE1UwvhSYZRSnPdbawx3pCv1jOlpA,"However, COBRA can be expensive, as the plan shifts more costs to the former employee. Instead of employers sharing the cost of premiums — most...",2020-12-24,Health Cost Sharing
On the 5000th page of the stimulus my Congress gave to me...meal deductions and benefit plan relief,https://www.google.com/url?rct=j&sa=t&url=https://www.jdsupra.com/legalnews/on-the-5000th-page-of-the-stimulus-my-26146/&ct=ga&cd=CAIyHDQ1NzZkZjdlYTEzZTg0YTA6Y29tOmVuOlVTOlI&usg=AFQjCNFLMgWDtlw68NzwJDlbN3yLsVGdAA,Group health plans and health care providers would have 30 days to ... Cost-sharing payments made by individuals for out-of-network emergency...,2020-12-24,Health Cost Sharing
Medica extends support for Nebraska members affected by COVID-19,https://www.google.com/url?rct=j&sa=t&url=https://theindependent.com/news/local/medica-extends-support-for-nebraska-members-affected-by-covid-19/article_244660b4-4599-11eb-8bed-7f5e026a4f86.html&ct=ga&cd=CAIyHDQ1NzZkZjdlYTEzZTg0YTA6Y29tOmVuOlVTOlI&usg=AFQjCNFX-dL3BA46ezgsnWWRsnFvu0Q0bQ,"By continuing to waive the standard cost-sharing requirements, Medica is making care more affordable and accessible during the national health crisis...",2020-12-24,Health Cost Sharing
Stark and AKS Final Rules Will Facilitate Donations of EHR and Cybersecurity Technology and ...,https://www.google.com/url?rct=j&sa=t&url=https://www.jdsupra.com/legalnews/stark-and-aks-final-rules-will-93300/&ct=ga&cd=CAIyHDQ1NzZkZjdlYTEzZTg0YTA6Y29tOmVuOlVTOlI&usg=AFQjCNEAKjXPCHoaZusjr4lokGWYGdxrjw,"On November 20, 2020, the US Department of Health &amp; Human Services (HHS) released final rules amending the ... Recipient Cost Sharing Condition.",2020-12-24,Health Cost Sharing
COVID bill to end surprise medical bills,https://www.google.com/url?rct=j&sa=t&url=http://jamaica-gleaner.com/article/business/20201224/covid-bill-end-surprise-medical-bills&ct=ga&cd=CAIyHDQ1NzZkZjdlYTEzZTg0YTA6Y29tOmVuOlVTOlI&usg=AFQjCNFeWnBe4xvlAKeM49ttZxmDmNloMQ,People with private health insurance will see the nasty shock of surprise ... patients surprise bills for more than the in-network cost-sharing amount.,2020-12-24,Health Cost Sharing
CHI: A repeal of the ACA would be “devastating” for Coloradans,https://www.google.com/url?rct=j&sa=t&url=https://stateofreform.com/featured/2020/12/chi-a-repeal-of-the-aca-would-be-devastating-for-coloradans/&ct=ga&cd=CAIyHDQ1NzZkZjdlYTEzZTg0YTA6Y29tOmVuOlVTOlI&usg=AFQjCNGZU5BdTn-r0_0Pgt0xXhy-e5GGmA,Those eligible for cost-sharing reductions would also need to pay higher out-of-pocket costs. If cap prohibitions on medical service coverage are...,2020-12-23,Health Cost Sharing
"Deal to curb ""surprise"" medical bills",https://www.google.com/url?rct=j&sa=t&url=https://www.arkansasonline.com/news/2020/dec/23/deal-to-curb-surprise-medical-bills/&ct=ga&cd=CAIyHDQ1NzZkZjdlYTEzZTg0YTA6Y29tOmVuOlVTOlI&usg=AFQjCNGhy35dHIvGfBM80_hqomGaCCstHA,WASHINGTON -- People with private health insurance will see the nasty ... patients surprise bills for more than the in-network cost sharing amount.,2020-12-23,Health Cost Sharing
"Japan sought ""quiet"" talks with US on defense cost-sharing in 1989",https://www.google.com/url?rct=j&sa=t&url=https://english.kyodonews.net/news/2020/12/d036a41243f9-japan-sought-quiet-talks-with-us-on-defense-cost-sharing-in-1989.html&ct=ga&cd=CAIyHDQ1NzZkZjdlYTEzZTg0YTA6Y29tOmVuOlVTOlI&usg=AFQjCNHHt6Rwt-O7DazE5sfp9u7QMjBPvA,"Japan sought ""quiet"" talks with U.S. on defense cost-sharing in 1989 ... to continue discussions on the cost-sharing agreement at the ministerial level, ... prime minister before stepping down in September due to health reasons, has...",2020-12-23,Health Cost Sharing
CMS Issues Guidance for COVID-19 Treatments &amp; Vaccines,https://www.google.com/url?rct=j&sa=t&url=https://www.jdsupra.com/legalnews/cms-issues-guidance-for-covid-19-69271/%3F&ct=ga&cd=CAIyHDQ1NzZkZjdlYTEzZTg0YTA6Y29tOmVuOlVTOlI&usg=AFQjCNErRoin3mc2KUVOIMbPs0fpBPJSNA,"... COVID-19 vaccines without cost-sharing obligations for Medicare beneficiaries, Medicaid recipients, and enrollees in nearly all private health plans.",2020-12-21,Health Cost Sharing
Ohio Department of Health shares new coronavirus data Thursday ahead of holiday,https://www.google.com/url?rct=j&sa=t&url=https://abc6onyourside.com/news/local/december-24-coronavirus-in-ohio-update&ct=ga&cd=CAIyGmU4MWY4MmViNmViOTg5MTE6Y29tOmVuOlVT&usg=AFQjCNHCb1ACrnZ-RgPcN8UnBxSyQMhl5Q,"COLUMBUS, Ohio (WSYX/WTTE) — The Ohio Department of Health is sharing more on the coronavirus pandemic Thursday. New data comes after...",2020-12-24,Health Sharing
Consumers warned about illegal health plans marketed in NJ,https://www.google.com/url?rct=j&sa=t&url=https://pressofatlanticcity.com/news/consumers-warned-about-illegal-health-plans-marketed-in-nj/article_3bb92cc6-b19e-554d-8d7e-cf245130b6af.html&ct=ga&cd=CAIyGmU4MWY4MmViNmViOTg5MTE6Y29tOmVuOlVT&usg=AFQjCNF5aRv0IrEoidjovA-zOGXuUB3pZw,Health care sharing ministries (HCSM) are organizations in which health care costs are shared among members who have common ethical or religious...,2020-12-24,Health Sharing
Independence Blue Cross waiving cost-sharing fees for members getting a Covid-19 vaccine,https://www.google.com/url?rct=j&sa=t&url=https://www.bizjournals.com/philadelphia/news/2020/12/24/ibc-independence-blue-cross-waived-covid-19-vaccin.html&ct=ga&cd=CAIyGmU4MWY4MmViNmViOTg5MTE6Y29tOmVuOlVT&usg=AFQjCNEviXEgAbTj6BYx9Pzt3r2dbcg5vw,Both are currently being administered to health care workers in the region and across the country who are on the front lines of treating people with Covid...,2020-12-24,Health Sharing
Local man shares story of hope and healing after losing mom to suicide,https://www.google.com/url?rct=j&sa=t&url=https://www.woodtv.com/wotv4women/live-local-give-local/i-understand/local-man-shares-story-of-hope-and-healing-after-losing-mom-to-suicide/&ct=ga&cd=CAIyGmU4MWY4MmViNmViOTg5MTE6Y29tOmVuOlVT&usg=AFQjCNHNQfkksm_Qhoqgo7flZy8Jb5KmbA,"Craig Welch sits down with Jordan Carson to share the very personal story of his mom""s mental health struggles which ended in suicide. Welch hopes...",2020-12-24,Health Sharing
"Merry Christmas 2020: Wishes, Quotes, Greetings To Share With Loved Ones",https://www.google.com/url?rct=j&sa=t&url=https://www.ndtv.com/india-news/merry-christmas-2020-wishes-quotes-greetings-to-share-with-family-and-friends-2343215&ct=ga&cd=CAIyGmU4MWY4MmViNmViOTg5MTE6Y29tOmVuOlVT&usg=AFQjCNEUXcH5MtsVlMB1m1gZ5yMCU9GqgQ,"Here""s to better times ahead for everyone. Stay healthy and safe in 2021. Wishing you and your family a year full of happiness and good health. Merry...",2020-12-24,Health Sharing
Looking Beyond the Federal Data Strategy,https://www.google.com/url?rct=j&sa=t&url=https://www.govexec.com/technology/2020/12/looking-beyond-federal-data-strategy/171028/&ct=ga&cd=CAIyGmU4MWY4MmViNmViOTg5MTE6Y29tOmVuOlVT&usg=AFQjCNE2FZHqMklXExbS6F2z_o5Z2xR4Xw,"Data were shared across state and local law enforcement, social services, judicial, and health agencies in order to better target prevention and...",2020-12-24,Health Sharing
"12 Health Care Stocks Moving In Thursday""s Pre-Market Session",https://www.google.com/url?rct=j&sa=t&url=https://www.benzinga.com/pre-market-outlook/20/12/18922543/12-health-care-stocks-moving-in-thursdays-pre-market-session&ct=ga&cd=CAIyGmU4MWY4MmViNmViOTg5MTE6Y29tOmVuOlVT&usg=AFQjCNH57AuBYPLw5V4fSRP7VWYO5r-VTQ,Biolase (NASDAQ:BIOL) stock moved upwards by 43.08% to $0.47. The market value of their outstanding shares is at $44.2 million. Tonix...,2020-12-24,Health Sharing
"Health officials credit safety measures for lack of Thanksgiving surge, hope for same at Christmas",https://www.google.com/url?rct=j&sa=t&url=https://www.mlive.com/news/ann-arbor/2020/12/health-officials-credit-safety-measures-for-lack-of-thanksgiving-surge-hope-for-same-at-christmas.html&ct=ga&cd=CAIyGmU4MWY4MmViNmViOTg5MTE6Y29tOmVuOlVT&usg=AFQjCNHvQfuaQgycyNuZa6AyygWbmbgMhg,The county health department is following the lead of the Michigan Department of Health and Human Services in sharing social gathering guidance to...,2020-12-24,Health Sharing
COVID-19 survivors: Albertans share their experiences with novel coronavirus,https://www.google.com/url?rct=j&sa=t&url=https://globalnews.ca/news/7530947/covid-19-survivors-alberta-health/&ct=ga&cd=CAIyGmU4MWY4MmViNmViOTg5MTE6Y29tOmVuOlVT&usg=AFQjCNH3yg5f6b8RwVHZizICb9NVeIF0nA,"All the top medical professionals have talked about how COVID-19 doesn""t discriminate. It has infected young and old alike, with varying symptoms...",2020-12-24,Health Sharing
"Winter holidays away from the motherland: Effects on migrants"" mental health",https://www.google.com/url?rct=j&sa=t&url=https://www.medicalnewstoday.com/articles/winter-holidays-away-from-the-motherland-effects-on-migrants-mental-health&ct=ga&cd=CAIyGmU4MWY4MmViNmViOTg5MTE6Y29tOmVuOlVT&usg=AFQjCNFFQ1d6L4yYib4sdtuBFY1hbCo5-A,"How does being unable to return to one""s country of origin affect their mental health and well-being? I share my own experience along with that of our...",2020-12-24,Health Sharing
"Rahul Roy shares pictures enjoying his yogic lunch full of veggies, dry fruits",https://www.google.com/url?rct=j&sa=t&url=https://www.indiatvnews.com/entertainment/celebrities/rahul-roy-shares-pictures-enjoying-his-yogic-lunch-full-of-veggies-dry-fruits-673677&ct=ga&cd=CAIyGmU4MWY4MmViNmViOTg5MTE6Y29tOmVuOlVT&usg=AFQjCNHunNNcA_X0rR_k_rRGL9OGbCg1Pw,The actor took to his Instagram handle on Thursday and posted a few photos of himself with his healthy breakfast. Rahul is currently admitted to a...,2020-12-24,Health Sharing
LatinX provider group has found unexpected grace and community amid tumult of 2020,https://www.google.com/url?rct=j&sa=t&url=https://www.northcarolinahealthnews.org/2020/12/24/latinx-provider-group-has-found-unexpected-grace-and-community-amid-tumult-of-2020/&ct=ga&cd=CAIyGmU4MWY4MmViNmViOTg5MTE6Y29tOmVuOlVT&usg=AFQjCNHSFjPSAC31LCVPBOkFaQJCavk6Jw,"On Dec. 2, he shared questions that came up during a conversation with his mother about people who don""t have health insurance and might...",2020-12-24,Health Sharing
Two doctors sharing their post-injection experiences to reassure public the COVID-19 vaccine is safe,https://www.google.com/url?rct=j&sa=t&url=https://www.12newsnow.com/article/news/health/coronavirus/doctors-talk-about-their-experience-after-covid-19-vaccine-injection/502-9b9259e8-5a4f-404f-a05d-b81e333b63e9&ct=ga&cd=CAIyGmU4MWY4MmViNmViOTg5MTE6Y29tOmVuOlVT&usg=AFQjCNEjKquWVo31YjzGncupsLaMxxWOiw,"BEAUMONT, Texas — It""s been a week since some of the first Southeast Texas medical workers received the vaccine. And as the state issues more...",2020-12-24,Health Sharing
"Farmworkers"" union gets temporary restraining order against Foster Farms over COVID-19 protocols",https://www.google.com/url?rct=j&sa=t&url=https://abc30.com/amp/9019387/&ct=ga&cd=CAIyGmU4MWY4MmViNmViOTg5MTE6Y29tOmVuOlVT&usg=AFQjCNHo9yiwplezgmlFQbLkvgRhSVzHPg,"Foster Farms is working closely with the Merced County Department of Public Health and is sharing its learnings, in the interest of controlling...",2020-12-24,Health Sharing
"Global Medical Terminology Sharing Market Top Company Profile: Wolters Kluwer, Intelligent ...",https://www.google.com/url?rct=j&sa=t&url=https://factorygate.co.uk/space/47074/global-medical-terminology-sharing-market-top-company-profile-wolters-kluwer-intelligent-medical-objects-apelon-clinical-architecture-3m-etc/&ct=ga&cd=CAIyGmU4MWY4MmViNmViOTg5MTE6Y29tOmVuOlVT&usg=AFQjCNFDxsSVgOP00wcyvRQR00JpzeOpqg,"Global Medical Terminology Sharing Market Top Company Profile: Wolters Kluwer, Intelligent Medical Objects, Apelon, Clinical Architecture, 3M etc.",2020-12-24,Health Sharing
Doctor Dies from Coronavirus After Saying Hospital Was Mistreating Her Because She Is Black,https://www.google.com/url?rct=j&sa=t&url=https://people.com/health/doctor-dies-from-coronavirus-after-saying-hospital-was-treating-her-differently/&ct=ga&cd=CAIyGmU4MWY4MmViNmViOTg5MTE6Y29tOmVuOlVT&usg=AFQjCNGTzBjigf_ZqBO3rwTWObV2xSAjfA,"In an update, Moore later shared on Facebook that she had spoken to the IU healthcare system""s chief medical officer and her pain was finally being...",2020-12-24,Health Sharing
Medicaid and Child Health Equity,https://www.google.com/url?rct=j&sa=t&url=https://www.nejm.org/doi/full/10.1056/NEJMp2030646&ct=ga&cd=CAIyGmU4MWY4MmViNmViOTg5MTE6Y29tOmVuOlVT&usg=AFQjCNHJCI-laMQSLYg1YG6J6H_r-KeUGA,"... coverage and cost-sharing protections. But Medicaid also has important limitations, and the imperative to achieve racial and socioeconomic health...",2020-12-23,Health Sharing
"SBC entities see God""s faithfulness in difficult year","https://www.google.com/url?rct=j&sa=t&url=https://www.kentuckytoday.com/stories/sbc-entities-see-gods-faithfulness-in-difficult-year,29690%3F&ct=ga&cd=CAIyGmU4MWY4MmViNmViOTg5MTE6Y29tOmVuOlVT&usg=AFQjCNG5vadXFN8edv85qjPvjaEKa-2JtQ","Prior to joining GuideStone, Soh served as chief operating officer for a large health sharing organization, growing it from 23,000 households in 2013 to...",2020-12-23,Health Sharing
India believes in sharing technical know-how with other countries: Harsh Vardhan,https://www.google.com/url?rct=j&sa=t&url=http://www.businessworld.in/article/India-believes-in-sharing-technical-know-how-with-other-countries-Harsh-Vardhan/24-12-2020-357565&ct=ga&cd=CAIyGmU4MWY4MmViNmViOTg5MTE6Y29tOmVuOlVT&usg=AFQjCNGPbN_c0ZsGph-iRyPcHSeOF0-TGQ,"The Union Health Minister continued saying, Science can be the unifying force that can help us in harnessing the distinctive strengths of our states and...",2020-12-23,Health Sharing
New Orleans Deploys Video Chat Option for 911 Callers,https://www.google.com/url?rct=j&sa=t&url=https://www.govtech.com/public-safety/New-Orleans-Deploys-Video-Chat-Option-for-911-Callers.html&ct=ga&cd=CAIyGmU4MWY4MmViNmViOTg5MTE6Y29tOmVuOlVT&usg=AFQjCNGsFda94zl8_md68R2K9CFnKIROrQ,"But using location sharing or allowing video and pictures, the operators will be able to gather a lot of that ... Morris said the service would also benefit residents experiencing mental health crises as a result of isolation and stress amid...",2020-12-23,Health Sharing
On the 5000th page of the stimulus my Congress gave to me...meal deductions and benefit plan relief,https://www.google.com/url?rct=j&sa=t&url=https://www.jdsupra.com/legalnews/on-the-5000th-page-of-the-stimulus-my-26146/&ct=ga&cd=CAIyHDcyMWE5ZGFiNjRlZGE3MTM6Y29tOmVuOlVTOlI&usg=AFQjCNFLMgWDtlw68NzwJDlbN3yLsVGdAA,Group health plans and health care providers would have 30 days to ... Cost-sharing payments made by individuals for out-of-network emergency...,2020-12-24,Healthcare Cost Sharing
COVID bill to end surprise medical bills,https://www.google.com/url?rct=j&sa=t&url=http://jamaica-gleaner.com/article/business/20201224/covid-bill-end-surprise-medical-bills&ct=ga&cd=CAIyHDcyMWE5ZGFiNjRlZGE3MTM6Y29tOmVuOlVTOlI&usg=AFQjCNFeWnBe4xvlAKeM49ttZxmDmNloMQ,... from sending patients surprise bills for more than the in-network cost-sharing amount. ... The problem is a direct of result of high healthcare costs.,2020-12-24,Healthcare Cost Sharing
6 important health insurance buying tips and advice for beginners,https://www.google.com/url?rct=j&sa=t&url=http://www.chicagonow.com/2020/12/health-insurance-buying-tips/&ct=ga&cd=CAIyHDcyMWE5ZGFiNjRlZGE3MTM6Y29tOmVuOlVTOlI&usg=AFQjCNFqeJK4XmTRXu8-Yg1ITEloOfVr-A,Instead of having an insurance company to relieve the financial burden from you ... A good affordable alternative to healthcare is finding a health share...,2020-12-23,Healthcare Cost Sharing
Will Medicare Add Long-Term Care Insurance? and Other Questions for 2021,https://www.google.com/url?rct=j&sa=t&url=https://www.thinkadvisor.com/2020/12/23/will-medicare-add-long-term-care-insurance-and-other-questions-for-2021/&ct=ga&cd=CAIyHDBhNGY1MzE5YzE5ODdjNzQ6Y29tOmVuOlVTOlI&usg=AFQjCNF3vvF9v2c8EhswuhPKl_7pHlQG1w,Will the Affordable Care Act public health insurance exchange programs ... Will states figure out a way to police health care cost sharing ministries?,2020-12-23,Healthcare Sharing Programs
Will Medicare Add Long-Term Care Insurance? and Other Questions for 2021,https://www.google.com/url?rct=j&sa=t&url=https://www.thinkadvisor.com/2020/12/23/will-medicare-add-long-term-care-insurance-and-other-questions-for-2021/&ct=ga&cd=CAIyHDBhNGY1MzE5YzE5ODdjNzQ6Y29tOmVuOlVTOlI&usg=AFQjCNF3vvF9v2c8EhswuhPKl_7pHlQG1w,Will the Affordable Care Act public health insurance exchange programs ... Will states figure out a way to police health care cost sharing ministries?,2020-12-23,Healthcare Sharing Programs
The COVID Vaccine Vape Is a Hoax—So Are These Viral Vaccine Posts,https://www.google.com/url?rct=j&sa=t&url=https://www.newsweek.com/coronavirus-covid-19-vaccine-hoax-1557194&ct=ga&cd=CAIyHDc5M2E3YWM0ZTJjZTM4OWY6Y29tOmVuOlVTOlI&usg=AFQjCNHXtvUUDy01Pcmr5onoQsgX56eLRw,"Since then, many people have begun sharing the image on social media. ""This is a cropped version of a photo of a ""covid vaccine vape"" which is a...",2020-12-24,Medical Sharing
Consumers warned about illegal health plans marketed in NJ,https://www.google.com/url?rct=j&sa=t&url=https://pressofatlanticcity.com/news/consumers-warned-about-illegal-health-plans-marketed-in-nj/article_3bb92cc6-b19e-554d-8d7e-cf245130b6af.html&ct=ga&cd=CAIyHDc5M2E3YWM0ZTJjZTM4OWY6Y29tOmVuOlVTOlI&usg=AFQjCNF5aRv0IrEoidjovA-zOGXuUB3pZw,Health care sharing ministries (HCSM) are organizations in which health care costs are shared among members who have common ethical or religious...,2020-12-24,Medical Sharing
Pets May Reflect the Health Status of Their Owners According to Study,https://www.google.com/url?rct=j&sa=t&url=https://www.gilmorehealth.com/pets-may-reflect-the-health-status-of-their-owners-according-to-study/&ct=ga&cd=CAIyHDc5M2E3YWM0ZTJjZTM4OWY6Y29tOmVuOlVTOlI&usg=AFQjCNHZgl8w1u9QvOevxWWaINtgY4F8MQ,"Let""s take stock. Dog. Already suspected correlations. How did these researchers come up with the idea of conducting such a study...",2020-12-24,Medical Sharing
"Vaccine plan for health care workers outside of hospitals muddled, Fayetteville health board hears",https://www.google.com/url?rct=j&sa=t&url=https://www.arkansasonline.com/news/2020/dec/24/vaccine-plan-for-health-care-workers-outside-of/%3Flatest&ct=ga&cd=CAIyHDc5M2E3YWM0ZTJjZTM4OWY6Y29tOmVuOlVTOlI&usg=AFQjCNFOWWeHlYy0zHEQrZ-1dxXpeb6kew,"Please sign in above using your site login credentials to begin sharing your thoughts and opinions. If you""re already logged into the site, the sign in form...",2020-12-24,Medical Sharing
“Women Who Win” Awarded WE Awards by New England Indian Medical Association,https://www.google.com/url?rct=j&sa=t&url=https://www.indiapost.com/women-who-win-awarded-we-awards-by-new-england-indian-medical-association/&ct=ga&cd=CAIyHDc5M2E3YWM0ZTJjZTM4OWY6Y29tOmVuOlVTOlI&usg=AFQjCNGJ7t0fgGh9G7EmbQ2tAX5_rQ0POw,"She said “I always remind myself, that anything worth having has to be worked for.” To join a global group of women around the world to share stories...",2020-12-24,Medical Sharing
Two doctors sharing their post-injection experiences to reassure public the COVID-19 vaccine is safe,https://www.google.com/url?rct=j&sa=t&url=https://www.12newsnow.com/article/news/health/coronavirus/doctors-talk-about-their-experience-after-covid-19-vaccine-injection/502-9b9259e8-5a4f-404f-a05d-b81e333b63e9&ct=ga&cd=CAIyHDc5M2E3YWM0ZTJjZTM4OWY6Y29tOmVuOlVTOlI&usg=AFQjCNEjKquWVo31YjzGncupsLaMxxWOiw,"BEAUMONT, Texas — It""s been a week since some of the first Southeast Texas medical workers received the vaccine. And as the state issues more...",2020-12-24,Medical Sharing
"Understanding Global Medical REIT""s Ex-Dividend Date",https://www.google.com/url?rct=j&sa=t&url=https://www.benzinga.com/node/18911089&ct=ga&cd=CAIyHDc5M2E3YWM0ZTJjZTM4OWY6Y29tOmVuOlVTOlI&usg=AFQjCNExu743jIFacojkVb62PaUksjWtyg,"The stock will then go ex-dividend 2 business day(s) before the record date. Global Medical REIT, whose current dividend payout is $0.2, has an...",2020-12-23,Medical Sharing
A Lightweight Internet Sharing Scheme for Sectional Medical Images according to Existing Hospital ...,https://www.google.com/url?rct=j&sa=t&url=https://www.docwirenews.com/abstracts/a-lightweight-internet-sharing-scheme-for-sectional-medical-images-according-to-existing-hospital-network-facilities-and-basic-information-security-rules-2/&ct=ga&cd=CAIyHDc5M2E3YWM0ZTJjZTM4OWY6Y29tOmVuOlVTOlI&usg=AFQjCNELe_UTFdL6Kmc2gqCzfzAIgu1PNA,"However, the transmission of hundreds of megabytes of Sectional Medical Images (SMIs) from hospital""s Intranet to the Internet has the problems of...",2020-12-07,Medical Sharing
