title,link,item_text,date_published,google_alert_name
3 payers extending COVID-19 cost-sharing waivers,https://www.google.com/url?rct=j&sa=t&url=https://www.beckershospitalreview.com/payer-issues/3-payers-extending-covid-19-cost-sharing-waivers.html&ct=ga&cd=CAIyHDQ1NzZkZjdlYTEzZTg0YTA6Y29tOmVuOlVTOlI&usg=AFQjCNGtl-20hvALsBePyIm-94GYPqKJlQ,"Several commercial health insurers will waive member cost-sharing — which includes copays, deductibles and coinsurance — for COVID-19...",2021-03-01,Health Cost Sharing
New Surprise Billing Restrictions – A Victory for Patients,https://www.google.com/url?rct=j&sa=t&url=https://www.jdsupra.com/legalnews/new-surprise-billing-restrictions-a-7686232/&ct=ga&cd=CAIyHDQ1NzZkZjdlYTEzZTg0YTA6Y29tOmVuOlVTOlI&usg=AFQjCNEJnUZJvuhx9RmMhQxMX2k3Q1B3nA,Air ambulance services provided by out-of-network helicopter or airplane medical transport services may only bill patients the in-network cost sharing...,2021-03-01,Health Cost Sharing
Medicare loophole for screening colonoscopies is fixed — What does this mean for patients?,https://www.google.com/url?rct=j&sa=t&url=https://thehill.com/blogs/congress-blog/politics/541073-medicare-loophole-for-screening-colonoscopies-is-fixed-what-does&ct=ga&cd=CAIyHDQ1NzZkZjdlYTEzZTg0YTA6Y29tOmVuOlVTOlI&usg=AFQjCNFE9Tj271AlrB0JCIEk0bjwFiZTyA,"That""s one of the reasons the Affordable Care Act required that health insurance plans cover screening colonoscopies without cost sharing. But the law...",2021-03-01,Health Cost Sharing
"In opening contract negotiations, unions accuse Ramsey County of shorting workers hazard pay ...",https://www.google.com/url?rct=j&sa=t&url=https://www.twincities.com/2021/03/01/in-opening-contract-negotiations-unions-accuse-ramsey-county-of-shorting-workers-hazard-pay-the-county-says-not-true/&ct=ga&cd=CAIyHDQ1NzZkZjdlYTEzZTg0YTA6Y29tOmVuOlVTOlI&usg=AFQjCNFtRsec5MAJEBhEx646bc-AEqEyEQ,"“We agree that nothing is more important than the health, safety and ... waived cost-sharing for testing and treatment of COVID-19, among others.",2021-03-01,Health Cost Sharing
RAND: Bundled payment models that waived cost sharing led to major savings,https://www.google.com/url?rct=j&sa=t&url=https://www.fiercehealthcare.com/payer/rand-bundled-payment-models-waived-cost-sharing-led-to-major-savings&ct=ga&cd=CAIyHDQ1NzZkZjdlYTEzZTg0YTA6Y29tOmVuOlVTOlI&usg=AFQjCNF2dQ-vMQ5VL0KI_xGqa5zGup1zfA,... that negotiates a preferred price with certain providers to cover an entire episode of care within a 30-day period and waives cost sharing for patients.,2021-03-01,Health Cost Sharing
"The Affordable Care Act""s Insurance Marketplace Subsidies Were Associated With Reduced ...",https://www.google.com/url?rct=j&sa=t&url=https://www.healthaffairs.org/doi/full/10.1377/hlthaff.2020.01106&ct=ga&cd=CAIyHDQ1NzZkZjdlYTEzZTg0YTA6Y29tOmVuOlVTOlI&usg=AFQjCNG-iYxXD-XOia7TceAgzcUBSBBOug,... changes in household health care spending among low-income adults eligible for both Marketplace premium subsidies and cost-sharing reductions...,2021-03-01,Health Cost Sharing
"Michigan Blue Cross: Aid for COVID patients, providers totaled $1.3B in 2020",https://www.google.com/url?rct=j&sa=t&url=https://www.detroitnews.com/story/business/2021/03/01/michigan-blue-cross-aid-covid-patients-providers-totaled-1-3-b/6870575002/&ct=ga&cd=CAIyHDQ1NzZkZjdlYTEzZTg0YTA6Y29tOmVuOlVTOlI&usg=AFQjCNHHeM_VlLIm6MiPQfTZ_xTegAB4Jg,"The Blues provided $1.3 billion in support to its clients and health care ... for COVID testing and treatment, waiving cost-sharing payments for people...",2021-03-01,Health Cost Sharing
Priority Health Extends $0 Cost Sharing for COVID-19 Treatment and Vaccine for All Members,https://www.google.com/url?rct=j&sa=t&url=https://finance.yahoo.com/news/priority-health-extends-0-cost-180000501.html&ct=ga&cd=CAIyHDQ1NzZkZjdlYTEzZTg0YTA6Y29tOmVuOlVTOlI&usg=AFQjCNF7Ds8-f2tKGB0XeKtHBFVNrPzLZw,Covered treatment may be inpatient or outpatient from an in-network provider. Priority Health will also continue to offer $0 cost share coverage for the...,2021-03-01,Health Cost Sharing
Year-End Appropriations Act Contains a Number of Important Provisions Impacting Group Health ...,https://www.google.com/url?rct=j&sa=t&url=https://www.jdsupra.com/legalnews/year-end-appropriations-act-contains-a-9171816/&ct=ga&cd=CAIyHDQ1NzZkZjdlYTEzZTg0YTA6Y29tOmVuOlVTOlI&usg=AFQjCNFb_0bCo6lG0fmQeQUbiCcPFZxbOQ,"... and apply any such cost-sharing amount paid to that individual""s in-network deductible or out-of-pocket maximum. The surprise medical billing rules...",2021-03-01,Health Cost Sharing
Forecasting Healthcare Regulatory Developments in a Biden Administration,https://www.google.com/url?rct=j&sa=t&url=https://www.jdsupra.com/legalnews/forecasting-healthcare-regulatory-5802148/&ct=ga&cd=CAIyHDQ1NzZkZjdlYTEzZTg0YTA6Y29tOmVuOlVTOlI&usg=AFQjCNGmV7tCJ5kK8U924uuCvGrvllYB5w,President Biden has repeatedly said that lowering healthcare costs and ... Being able to easily share data across the healthcare and public health...,2021-03-01,Health Cost Sharing
OIG Has Seven (Yes Seven!) Different National Telemedicine Audits,https://www.google.com/url?rct=j&sa=t&url=https://www.natlawreview.com/article/oig-has-seven-yes-seven-different-national-telemedicine-audits&ct=ga&cd=CAIyHDQ1NzZkZjdlYTEzZTg0YTA6Y29tOmVuOlVTOlI&usg=AFQjCNHTVygRJVhf9nzOQ2Gj3ma-g4GG5g,... “physicians and practitioners do not risk enforcement action if they waive any cost-sharing for telehealth visits during the Public Health Emergency.”...,2021-03-01,Health Cost Sharing
Your WFH Costs; Who pays?,https://www.google.com/url?rct=j&sa=t&url=https://telecomreseller.com/2021/03/01/your-wfh-costs-who-pays/&ct=ga&cd=CAIyHDQ1NzZkZjdlYTEzZTg0YTA6Y29tOmVuOlVTOlI&usg=AFQjCNEQSRoYtaTcjMsgPnuKxLPA8OWCZg,"What about the cost sharing of the hardware, software, supplies, insurance, and ... productivity and reduces worker""s comp and health insurance costs.",2021-03-01,Health Cost Sharing
"CMS moves to stop COVID-19 testing denials, cost sharing in private plans",https://www.google.com/url?rct=j&sa=t&url=https://www.healthcaredive.com/news/cms-moves-to-stop-covid-19-testing-denials-cost-sharing-in-private-plans/595892/&ct=ga&cd=CAIyHDQ1NzZkZjdlYTEzZTg0YTA6Y29tOmVuOlVTOlI&usg=AFQjCNHJzA9ATiKiHdkSC8oqUFKaDQXojA,"Congress required comprehensive health plans to cover COVID-19 tests without cost sharing, prior authorization or medical management last year,...",2021-03-01,Health Cost Sharing
Study: HDHPs tied to decrease in low-value care spending,https://www.google.com/url?rct=j&sa=t&url=https://www.benefitspro.com/2021/03/01/study-hdhps-tied-to-decrease-in-low-value-care-spending/&ct=ga&cd=CAIyHDQ1NzZkZjdlYTEzZTg0YTA6Y29tOmVuOlVTOlI&usg=AFQjCNH3E0orBpwpM46_05l2s-vYdLkwZA,Thank you for sharing! Your article was successfully shared with the contacts you provided. The authors caution that more research is needed to...,2021-03-01,Health Cost Sharing
Three Common Characteristics Among Virtual-First Health Plans,https://www.google.com/url?rct=j&sa=t&url=https://healthpayerintelligence.com/news/three-common-characteristics-among-virtual-first-health-plans&ct=ga&cd=CAIyHDQ1NzZkZjdlYTEzZTg0YTA6Y29tOmVuOlVTOlI&usg=AFQjCNGMfYVbXSfSMrLZFsyB7KQ8mAUnDA,"The payer compared costs for routine care between traditional health plans and Oscar""s virtual health care plan. In a traditional Oscar health plan, a...",2021-03-01,Health Cost Sharing
"If Protections Expire, COVID Patients Could Soon Face Big Medical Bills",https://www.google.com/url?rct=j&sa=t&url=https://consumer.healthday.com/2-25-with-protections-set-to-expire-covid-patients-could-soon-face-big-medical-bills-2650598887.html&ct=ga&cd=CAIyHDQ1NzZkZjdlYTEzZTg0YTA6Y29tOmVuOlVTOlI&usg=AFQjCNEGOUwD_tB-kYYFgliOsfzD8qaLiA,"Flu patients faced higher cost-sharing expenses if they needed intensive care or had a long hospital stay, both of which are common for severe...",2021-03-01,Health Cost Sharing
"Meat inspection, processing and sales– District 24 Sen. Mary Duvall weekly update of the SD ...",https://www.google.com/url?rct=j&sa=t&url=https://drgnews.com/2021/03/01/duvall-update-of-the-sd-legislative-session/&ct=ga&cd=CAIyHDQ1NzZkZjdlYTEzZTg0YTA6Y29tOmVuOlVTOlI&usg=AFQjCNHYMMEOzEgXvL6YhsTGrUrjUeXQjg,This program is a 50/50 cost sharing inspection program with USDA. As part of this ... State Employee Health Plans by District 24 Senator Mary Duvall.,2021-03-01,Health Cost Sharing
How President Biden Can Improve Health Data Sharing For COVID-19 And Beyond,https://www.google.com/url?rct=j&sa=t&url=https://www.healthaffairs.org/do/10.1377/hblog20210223.611803/full&ct=ga&cd=CAIyHDQ1NzZkZjdlYTEzZTg0YTA6Y29tOmVuOlVTOlI&usg=AFQjCNH-InW4T_uZZAm8wLYF98SSB5WPzg,"But society will also benefit from having public health data available at no cost. As such, HHS should require that use of APIs for public health reporting is...",2021-03-01,Health Cost Sharing
FLORIDA LEGISLATURE 2021: Bills being offered up by lawmakers from Palm Beach County,https://www.google.com/url?rct=j&sa=t&url=https://www.palmbeachpost.com/story/news/2021/03/01/florida-legislature-2021-bills-lawmakers-palm-beach-county/6750192002/&ct=ga&cd=CAIyHDQ1NzZkZjdlYTEzZTg0YTA6Y29tOmVuOlVTOlI&usg=AFQjCNFJZwzy07YKCsM9AQZGugPKCGS6gQ,SB 1038 Prohibits certain health insurance policies and health maintenance contracts from applying cost-sharing requirements to certain breast...,2021-03-01,Health Cost Sharing
People were asked about communal living – this is what they say is the biggest benefit,https://www.google.com/url?rct=j&sa=t&url=https://www.weforum.org/agenda/2021/03/co-living-communal-mental-health/&ct=ga&cd=CAIyHDQ1NzZkZjdlYTEzZTg0YTA6Y29tOmVuOlVTOlI&usg=AFQjCNHr8KB_3JSawzU87PqAPpEg8990ng,"The world""s loneliness and mental health crisis is being exacerbated by the ... of the real estate market, many turned to sharing the cost burden with strangers. ... Respondents to the One Shared House 2030 survey said the ability to...",2021-03-01,Health Cost Sharing
"""Happy to share"": Odisha CM Naveen Patnaik receives first jab of Covaxin. See pic",https://www.google.com/url?rct=j&sa=t&url=https://www.livemint.com/news/india/happy-to-share-odisha-cm-naveen-patnaik-receives-first-jab-of-covid-vaccine-covaxin-see-pic-11614584571767.html&ct=ga&cd=CAIyGmU4MWY4MmViNmViOTg5MTE6Y29tOmVuOlVT&usg=AFQjCNHptdSx5dSddb7E4Cz8g82UnV7Snw,"Grateful to our scientists, health workers for their race against time to deliver the vaccine to people."" ""Appeal to all eligible people to come forward and...",2021-03-01,Health Sharing
"Wealthy nations, pharmaceuticals must share vaccines with poorer states, MSF",https://www.google.com/url?rct=j&sa=t&url=https://www.iol.co.za/capetimes/news/wealthy-nations-pharmaceuticals-must-share-vaccines-with-poorer-states-msf-07753302-5468-4aa6-a264-d3815144fb90&ct=ga&cd=CAIyGmU4MWY4MmViNmViOTg5MTE6Y29tOmVuOlVT&usg=AFQjCNGRruN94Nag6JyW1nR9fiIw0mnIbA,"In South Africa, there weren""t enough healthcare workers in many of the hotspots and hospitals struggled to meet the demands for care. Wealthy nations,...",2021-03-01,Health Sharing
Countries call on drug companies to share vaccine know-how,https://www.google.com/url?rct=j&sa=t&url=https://abcnews.go.com/Health/wireStory/countries-call-drug-companies-share-vaccine-76177305&ct=ga&cd=CAIyGmU4MWY4MmViNmViOTg5MTE6Y29tOmVuOlVT&usg=AFQjCNFhuEEQ_aIycPOegxeZxY6cSc1wYg,"... as well as the World Health Organization, are increasingly calling on pharmaceutical companies to share their coronavirus vaccine know-how and...",2021-03-01,Health Sharing
Countries call on drug companies to share vaccine know-how,https://www.google.com/url?rct=j&sa=t&url=https://www.timesargus.com/features/health/countries-call-on-drug-companies-to-share-vaccine-know-how/article_42ff8831-36c0-5ac8-94c3-5a0125fcd5b9.html&ct=ga&cd=CAIyGmU4MWY4MmViNmViOTg5MTE6Y29tOmVuOlVT&usg=AFQjCNHCE5yHuOFj9Okf4ohjHYrLkiN2SA,"Governments and health experts offer two potential solutions to the vaccine shortage: One, supported by WHO, is a patent pool modeled after a...",2021-03-01,Health Sharing
"Swarna Khadgam actress Sanjjanaa Galrani pens a lengthy note on her health condition; says, ""I""m ...",https://www.google.com/url?rct=j&sa=t&url=https://timesofindia.indiatimes.com/tv/news/telugu/swarna-khadgam-actress-sanjjanaa-galrani-pens-a-lengthy-note-on-her-health-condition-says-im-still-insomniac-cant-express-my-trauma/articleshow/81269095.cms&ct=ga&cd=CAIyGmU4MWY4MmViNmViOTg5MTE6Y29tOmVuOlVT&usg=AFQjCNG9oIrvjZ9xm3rmc6VBs1o7mBbPpg,"In her recent Instagram stories, Sanjjanaa shared a lengthy note on her current health condition. The reality TV star mentioned that she is ""still...",2021-03-01,Health Sharing
Complete survey on mental health and substance abuse,https://www.google.com/url?rct=j&sa=t&url=http://www.tribtown.com/2021/03/01/complete_survey_on_mental_health_and_substance_abuse/&ct=ga&cd=CAIyGmU4MWY4MmViNmViOTg5MTE6Y29tOmVuOlVT&usg=AFQjCNFt7WCbu-B7ffzTQqE2K5AjeTnIdw,People are invited to share their perspectives through a brief survey at bit.ly/PUworkplace. If you know of other employers or business leaders who could...,2021-03-01,Health Sharing
National Center for School Mental Health Team,https://www.google.com/url?rct=j&sa=t&url=https://www.umaryland.edu/champions/national-center-for-school-mental-health-team/&ct=ga&cd=CAIyGmU4MWY4MmViNmViOTg5MTE6Y29tOmVuOlVT&usg=AFQjCNF1VGN31JFRd0WZQ3ZENYyOyvVSjA,And a University of Maryland School of Medicine organization — the National Center for School Mental Health (NCSMH) — is sharing its expertise to...,2021-03-01,Health Sharing
COVID-19 impacts heart health,https://www.google.com/url?rct=j&sa=t&url=https://www.wdbj7.com/2021/03/01/covid-19-impacts-heart-health/&ct=ga&cd=CAIyGmU4MWY4MmViNmViOTg5MTE6Y29tOmVuOlVT&usg=AFQjCNFqR1JGmp_RcFBWuWBkQ6ByCxjvTQ,"Now the central Virginia resident is sharing her survival story on a national platform, after being selected as one of the American Heart Association""s...",2021-03-01,Health Sharing
"No sharing of vaccine recipients"" personal data with supplier - Khairy",https://www.google.com/url?rct=j&sa=t&url=https://www.thesundaily.my/home/no-sharing-of-vaccine-recipients-personal-data-with-supplier-khairy-KG6976950&ct=ga&cd=CAIyGmU4MWY4MmViNmViOTg5MTE6Y29tOmVuOlVT&usg=AFQjCNFYM90xvVO05NmPCggJjGLSae8Nig,He said the shots for both phases need more health personnel including private hospitals and facilities to implement the programme in the country. “It...,2021-02-28,Health Sharing
Amitabh Bachchan Health Update: Megastar Undergoes Laser Eye Surgery to Remove Cataract ...,https://www.google.com/url?rct=j&sa=t&url=https://www.india.com/entertainment/amitabh-bachchan-health-update-megastar-undergoes-laser-eye-surgery-to-remove-cataract-will-not-be-discharged-today-4457851/&ct=ga&cd=CAIyGmU4MWY4MmViNmViOTg5MTE6Y29tOmVuOlVT&usg=AFQjCNHjjR4_igmuI9nwT2uOeW0uqDxxkQ,"A day before surgery, Amitabh Bachchan shared a cryptic post on his blog that reads, “There is just time for some imagery in the testing for the next and ..",2021-02-28,Health Sharing
"Amitabh Bachchan Shares Health Update , Says ""Undergoing Surgery""",https://www.google.com/url?rct=j&sa=t&url=https://www.india.com/entertainment/amitabh-bachchan-shares-health-update-says-undergoing-surgery-4457082/&ct=ga&cd=CAIyGmU4MWY4MmViNmViOTg5MTE6Y29tOmVuOlVT&usg=AFQjCNGurzG2u9TVbvo7T0ydyi61eg0Aug,Amitabh Bachchan has shared his health update on Saturday. The 78-year-old actor wrote on his blog that he is undergoing surgery but did not reveal...,2021-02-28,Health Sharing
"Countries, WHO call on pharmaceutical companies to share COVID-19 vaccine know-how",https://www.google.com/url?rct=j&sa=t&url=https://ktla.com/news/countries-who-call-on-pharmaceutical-companies-to-share-covid-19-vaccine-know-how/&ct=ga&cd=CAIyHDc5M2E3YWM0ZTJjZTM4OWY6Y29tOmVuOlVTOlI&usg=AFQjCNE3rg3mZfW8-MIsSKHVKxaVZBcdpA,Pharmaceutical companies that took taxpayer money from the U.S. or Europe to develop inoculations at unprecedented speed say they are negotiating...,2021-03-01,Medical Sharing
Countries call on drug companies to share vaccine know-how,https://www.google.com/url?rct=j&sa=t&url=https://www.washingtonpost.com/world/europe/countries-call-on-drug-companies-to-share-vaccine-know-how/2021/03/01/94946c3a-7a5f-11eb-8c5e-32e47b42b51b_story.html&ct=ga&cd=CAIyHDc5M2E3YWM0ZTJjZTM4OWY6Y29tOmVuOlVTOlI&usg=AFQjCNH8A-mCbtLr7LzwKhpahycZB3mbSg,Countries call on drug companies to share vaccine know-how. Production personnel perform...,2021-03-01,Medical Sharing
"UP: Man arrested for raping girl, sharing video of act on social media",https://www.google.com/url?rct=j&sa=t&url=https://www.outlookindia.com/newsscroll/up-man-arrested-for-raping-girl-sharing-video-of-act-on-social-media/2038227&ct=ga&cd=CAIyHDc5M2E3YWM0ZTJjZTM4OWY6Y29tOmVuOlVTOlI&usg=AFQjCNE_ztYV0LO-KxGhFv_EB_D9VvaIOQ,"... one year and threatened of her dire consequences if she reported the matter to anyone. The girl has been sent for medical examination, police said,...",2021-03-01,Medical Sharing
"Medical Battery Market 2021 Industry Size, Share, Growth and Top Companies Analysis- Texas ...",https://www.google.com/url?rct=j&sa=t&url=https://www.nymarketreports.com/news/1722938/medical-battery-market-2021-industry-size-share-growth-and-top-companies-analysis-texas-instruments-quallion-panasonic-toshiba-siemens-etc/&ct=ga&cd=CAIyHDc5M2E3YWM0ZTJjZTM4OWY6Y29tOmVuOlVTOlI&usg=AFQjCNGoCYEixsD-IWgxIFGMYVD-OEW_xA,"Medical Battery Market 2021 Industry Size, Share, Growth and Top Companies Analysis- Texas Instruments, Quallion, Panasonic, Toshiba, Siemens,...",2021-03-01,Medical Sharing
Amitabh Bachchan Health Update: Megastar Undergoes Laser Eye Surgery to Remove Cataract ...,https://www.google.com/url?rct=j&sa=t&url=https://www.india.com/entertainment/amitabh-bachchan-health-update-megastar-undergoes-laser-eye-surgery-to-remove-cataract-will-not-be-discharged-today-4457851/&ct=ga&cd=CAIyHDc5M2E3YWM0ZTJjZTM4OWY6Y29tOmVuOlVTOlI&usg=AFQjCNHjjR4_igmuI9nwT2uOeW0uqDxxkQ,"A day before surgery, Amitabh Bachchan shared a cryptic post on his blog that reads, “There is just time for some imagery in the testing for the next and ..",2021-02-28,Medical Sharing
"Amitabh Bachchan Shares Health Update , Says ""Undergoing Surgery""",https://www.google.com/url?rct=j&sa=t&url=https://www.india.com/entertainment/amitabh-bachchan-shares-health-update-says-undergoing-surgery-4457082/&ct=ga&cd=CAIyHDc5M2E3YWM0ZTJjZTM4OWY6Y29tOmVuOlVTOlI&usg=AFQjCNGurzG2u9TVbvo7T0ydyi61eg0Aug,Amitabh Bachchan has shared his health update on Saturday. The 78-year-old actor wrote on his blog that he is undergoing surgery but did not reveal...,2021-02-28,Medical Sharing
