title,link,item_text,date_published,google_alert_name
"Opthalmic Pharmaceutical Drugs Market 2021 Is Booming Across the Globe by Share, Size ...",https://www.google.com/url?rct=j&sa=t&url=https://bisouv.com/uncategorized/3238736/opthalmic-pharmaceutical-drugs-market-2021-is-booming-across-the-globe-by-share-size-growth-segments-and-forecast-to-2027-top-players-analysis-johnson-johnson-carl-zeiss-ellex-medical-la/&ct=ga&cd=CAIyHDc5M2E3YWM0ZTJjZTM4OWY6Y29tOmVuOlVTOlI&usg=AFQjCNHFnUW0wCLWG1voKxelbs16uIYMKg,Johnson &amp; Johnson; Carl-Zeiss; Ellex Medical Lasers; Essilor International; Hoya Corporation; Insight Vision; Nidek; Novagali Pharma; Topcon...,2021-03-18,Medical Sharing
"Medical Terminology Sharing Market 2021 Global Trends, Market Share, Industry Size, Growth ...",https://www.google.com/url?rct=j&sa=t&url=https://bisouv.com/uncategorized/3235308/medical-terminology-sharing-market-2021-global-trends-market-share-industry-size-growth-opportunities-analysis-and-forecast-to-2026/&ct=ga&cd=CAIyHDc5M2E3YWM0ZTJjZTM4OWY6Y29tOmVuOlVTOlI&usg=AFQjCNH6E3HwwLVFlVw46TU7UjhHdvkaqA,Along with that the report also analyzes all the factors influencing the development in the Medical Terminology Sharing industry. The Medical...,2021-03-18,Medical Sharing
"Medical Grade Gels Market 2021 Industry Size, Share, Growth and Top Companies Analysis ...",https://www.google.com/url?rct=j&sa=t&url=https://bisouv.com/uncategorized/3234422/medical-grade-gels-market-2021-industry-size-share-growth-and-top-companies-analysis-parker-laboratoriesi%25C2%25BCoeinc-hr-pharmaceuticals-ultragel-hungary-2000-kft-eco-med-pharmaceuticali%25C2%25BCoei/&ct=ga&cd=CAIyHDc5M2E3YWM0ZTJjZTM4OWY6Y29tOmVuOlVTOlI&usg=AFQjCNHuhWYh83108QndDP0BU9pBgQNn7Q,"Medical Grade Gels Market 2021 Industry Size, Share, Growth and Top Companies Analysis- Parker Laboratoriesï¼ŒInc, HR Pharmaceuticals, Ultragel...",2021-03-18,Medical Sharing
Medical Alcohol Disinfectant Market Will Grow at a Healthy With Top Key Players – Haishi Hainuo ...,https://www.google.com/url?rct=j&sa=t&url=https://bisouv.com/world/3235826/medical-alcohol-disinfectant-market-will-grow-at-a-healthy-with-top-key-players-haishi-hainuo-renhe-pharmacy-lircon-cofco-group-chengdu-bionovo-shenzhen-pango-aofeite-guangzhou-greens/&ct=ga&cd=CAIyHDc5M2E3YWM0ZTJjZTM4OWY6Y29tOmVuOlVTOlI&usg=AFQjCNFmAir2gKZp92Z7zf8jJY4oK3pYSA,What are the long-lasting defects of the industry? How share market changes their values by different manufacturing brands? What are the qualities and...,2021-03-15,Medical Sharing
"Blood Donor Chair Market 2021 Size, Share Industry Trends, Growth, Development Status, Future ...",https://www.google.com/url?rct=j&sa=t&url=https://ksusentinel.com/2021/03/18/blood-donor-chair-market-2021-size-share-industry-trends-growth-development-status-future-plans-analysis-by-2027-key-companies-analysis-inmoclinc-malvestio-villard-lemi-seers-medical-etc/&ct=ga&cd=CAIyHDc5M2E3YWM0ZTJjZTM4OWY6Y29tOmVuOlVTOlI&usg=AFQjCNGcy28Y_s7V3nCQ9dqGkbdh_t9XWg,Malvestio; VILLARD; LEMI; SEERS Medical; Hidemar; AGA Sanit?tsartikel GmbH; EUROCLINIC; Wego; Hetech; Techmed; Nanning Passion medical...,2021-03-05,Medical Sharing
"Medical Adhesives Therapeutics Market 2021 Size, Share Industry Trends, Growth, Development ...",https://www.google.com/url?rct=j&sa=t&url=https://www.mccourier.com/medical-adhesives-therapeutics-market-2021-size-share-industry-trends-growth-development-status-future-plans-analysis-by-2027-key-companies-analysis-3m-adhesion-biomedical-adhesives-research/&ct=ga&cd=CAIyHDc5M2E3YWM0ZTJjZTM4OWY6Y29tOmVuOlVTOlI&usg=AFQjCNFUvl46Nc0LDnk6Mcwd-FIPnIdo_Q,"Medical Adhesives Therapeutics Market 2021 Size, Share Industry Trends, Growth, Development Status, Future Plans Analysis by 2027| Key...",2021-03-03,Medical Sharing
"Urinary Drainage Bags Market 2021 Is Booming Across the Globe by Share, Size, Growth ...",https://www.google.com/url?rct=j&sa=t&url=https://ksusentinel.com/2021/03/18/urinary-drainage-bags-market-2021-is-booming-across-the-globe-by-share-size-growth-segments-and-forecast-to-2027-top-players-analysis-bard-medical-cook-medical-coloplast-pahsco-flexicare-med/&ct=ga&cd=CAIyHDc5M2E3YWM0ZTJjZTM4OWY6Y29tOmVuOlVTOlI&usg=AFQjCNF11U8Isfl_Cx6eJiH5i9gMkHRWZA,Bard Medical; Cook Medical; Coloplast; Pahsco; Flexicare Medical; Medline; Asid Bonz; Plasti-Med; Sarstedt; Securmed; Boomingshing Medical; Amico...,2021-03-03,Medical Sharing
