title,link,item_text,date_published,google_alert_name
Countries worldwide share perspectives on pandemic-era digital innovation,https://www.google.com/url?rct=j&sa=t&url=https://www.healthcareitnews.com/news/europe/countries-worldwide-share-perspectives-pandemic-era-digital-innovation&ct=ga&cd=CAIyHGVmMjU5ZGE1NWJkYjU0NjU6Y29tOmVuOlVTOlI&usg=AFQjCNE7IoToJ5TBheKmrxqKSTqA7EdcpQ,"But certain best practices are universal, and by sharing perspectives ... sharing between governments is helping agencies and health ministries better...",2020-09-07,Health Care Sharing Ministry
"Marcos Santiago MD: While politicians slept, American health care became a monster",https://www.google.com/url?rct=j&sa=t&url=https://www.laconiadailysun.com/opinion/letters_to_editor/marcos-santiago-md-while-politicians-slept-american-health-care-became-a-monster/article_c68ac5f0-eeef-11ea-b252-ff7a1819fc2a.html&ct=ga&cd=CAIyHDQ1NzZkZjdlYTEzZTg0YTA6Y29tOmVuOlVTOlI&usg=AFQjCNGSpxlDyIg6JlbvqgRzSrKJv_DR4w,"For the last ten years, the employer sponsored and individual insurance market has increased the amount of cost sharing of offered plans by deductibles...",2020-09-07,Health Cost Sharing
"Telehealth""s post-pandemic future: Where do we go from here?",https://www.google.com/url?rct=j&sa=t&url=https://www.ama-assn.org/practice-management/digital/telehealth-s-post-pandemic-future-where-do-we-go-here&ct=ga&cd=CAIyHDQ1NzZkZjdlYTEzZTg0YTA6Y29tOmVuOlVTOlI&usg=AFQjCNFC4mtAAmh7cvR4KbLn04k4q0l8xQ,... and other cost sharing for telehealth. The AMA is diving deeper on state legislative and regulatory solutions and working closely with state medical...,2020-09-07,Health Cost Sharing
Pay More for Your House Than Your Health Care,https://www.google.com/url?rct=j&sa=t&url=https://townhall.com/columnists/chadsavage/2020/09/07/pay-more-for-your-house-than-your-health-care-n2575667&ct=ga&cd=CAIyHDQ1NzZkZjdlYTEzZTg0YTA6Y29tOmVuOlVTOlI&usg=AFQjCNH4cKJCdXClDcSs8haWO5dmJaCutg,This bypasses the costly insurance company bureaucracy and allows health sharing ministries to provide great coverage with less intrusion at less cost.,2020-09-07,Health Cost Sharing
"Shilpa Shetty Kundra""s mantra for health: ""Focus, willpower, consistency, but not at risk of mental ...",https://www.google.com/url?rct=j&sa=t&url=https://www.hindustantimes.com/fitness/shilpa-shetty-kundra-s-mantra-for-health-focus-willpower-consistency-but-not-at-risk-of-mental-physical-health/story-gqo7atBIYqqNPra5SAAIcJ.html&ct=ga&cd=CAIyGmU4MWY4MmViNmViOTg5MTE6Y29tOmVuOlVT&usg=AFQjCNEfQVo0CrShlMNSF9fH6ityzmDd0g,"... sharing her fitness routine, healthy recipes and health tips on social media ... In her latest social media post, Shilpa shared with her fans why it was...",2020-09-08,Health Sharing
Holm Auto Good News: OCCK relaunches bike share program,https://www.google.com/url?rct=j&sa=t&url=https://www.dodgeglobe.com/news/20200908/holm-auto-good-news-occk-relaunches-bike-share-program&ct=ga&cd=CAIyGmU4MWY4MmViNmViOTg5MTE6Y29tOmVuOlVT&usg=AFQjCNGX10ZSk-msE1uqOk2kPeTG56JjRQ,“Bike share encourages both active living and provides a means for community members to access resources they need to stay healthy. Blue Cross...,2020-09-08,Health Sharing
Mental Health Foundation warning over distressing TikTok video,https://www.google.com/url?rct=j&sa=t&url=https://www.nzherald.co.nz/nz/news/article.cfm%3Fc_id%3D1%26objectid%3D12363261&ct=ga&cd=CAIyGmU4MWY4MmViNmViOTg5MTE6Y29tOmVuOlVT&usg=AFQjCNE1NVzAmpK5SEsxw3AG-9p-0RROXw,"Foundation chief executive Shaun Robinson said there was ""no reason whatsoever"" to share the concerning video. Advertisement. Advertise with NZME.",2020-09-08,Health Sharing
TikTok is trying to stop people from sharing a graphic video,https://www.google.com/url?rct=j&sa=t&url=https://mashable.com/article/tiktok-suicide-video-mental-health-warning/&ct=ga&cd=CAIyGmU4MWY4MmViNmViOTg5MTE6Y29tOmVuOlVT&usg=AFQjCNH8YnL-DTeFm1yTtp3anJ6M32DHnA,"For the sake of your mental health, please consider staying off TikTok — at least for a little while. Graphic footage of a man killing himself has been...",2020-09-08,Health Sharing
Big Sean Relies on Faith as He Struggles With Mental Health Issue,https://www.google.com/url?rct=j&sa=t&url=https://upnewsinfo.com/2020/09/07/big-sean-relies-on-faith-as-he-struggles-with-mental-health-issue/&ct=ga&cd=CAIyGmU4MWY4MmViNmViOTg5MTE6Y29tOmVuOlVT&usg=AFQjCNHWSj5VuqWHTPPwDwWuWpe0dsjtXA,Big Sean has taken to Twitter to share about his struggle with mental health. The 32-year-old rapper said that he learned about his own mental health...,2020-09-08,Health Sharing
"Following Apple""s approach: Niti Aayog""s DEPA draft is a step towards user empowerment",https://www.google.com/url?rct=j&sa=t&url=https://www.financialexpress.com/opinion/following-apples-approach-niti-aayogs-depa-draft-is-a-step-towards-user-empowerment/2077349/&ct=ga&cd=CAIyGmU4MWY4MmViNmViOTg5MTE6Y29tOmVuOlVT&usg=AFQjCNHJJ3-hr5lBMlZa2ysGQ-1RmZjnAA,"... this in its draft policy for health data released last month, where it said the user would have to provide consent each time her data is shared. Also, the...",2020-09-08,Health Sharing
"New social media guide for public servants highlights risks of posting, sharing, and even ""liking ...",https://www.google.com/url?rct=j&sa=t&url=https://www.themandarin.com.au/139184-new-social-media-guide-for-public-servants-highlights-risks-of-posting-sharing-and-even-liking-online-content/&ct=ga&cd=CAIyGmU4MWY4MmViNmViOTg5MTE6Y29tOmVuOlVT&usg=AFQjCNESY-H2kz8csK_N8BXfxZ1PkNJDhw,"Earlier this year, Victorian deputy chief health officer Dr Annaliese van Diemen was accused by a Liberal MP of undermining public confidence when...",2020-09-08,Health Sharing
Establishing a Regional Disaster Health Response System in the US,https://www.google.com/url?rct=j&sa=t&url=https://globalbiodefense.com/2020/09/07/establishing-a-regional-disaster-health-response-system-in-the-u-s/&ct=ga&cd=CAIyGmU4MWY4MmViNmViOTg5MTE6Y29tOmVuOlVT&usg=AFQjCNHm_7ZB6bcTqkgll7GsB-_PmNlLyA,"At the multi-state level, the Regional Disaster Health Response System (RDHRS) will cultivate and establish mechanisms for sharing the clinical...",2020-09-07,Health Sharing
"UK""s first Youth Mental Health Day Launches",https://www.google.com/url?rct=j&sa=t&url=https://www.fenews.co.uk/press-releases/54421-uk-s-first-youth-mental-health-day-launches&ct=ga&cd=CAIyGmU4MWY4MmViNmViOTg5MTE6Y29tOmVuOlVT&usg=AFQjCNGfJhfcwCEqSYlDPcGjL_CX5B4MwA,"... health, and that you can bounce back by finding something that helps you cope. stem4 invites everyone to get thinking about resilience and share...",2020-09-07,Health Sharing
WCD asks people to share traditional recipes for database of indigenous nutritious food,https://www.google.com/url?rct=j&sa=t&url=https://www.outlookindia.com/newsscroll/wcd-asks-people-to-share-traditional-recipes-for-database-of-indigenous-nutritious-food/1931336&ct=ga&cd=CAIyGmU4MWY4MmViNmViOTg5MTE6Y29tOmVuOlVT&usg=AFQjCNFsR1ATB6hF3sKgbUg6SQH2FRmQBA,"Contribute towards Bharatiya Poshan Krish Kosh by sharing traditional ... the health of a child and go a long way in improving India""""s nutrition indices.",2020-09-07,Health Sharing
"A class act, gentleman and hero: Cardinals fans remember Lou Brock",https://www.google.com/url?rct=j&sa=t&url=https://www.ksdk.com/article/sports/mlb/stl-cardinals/st-louis-cardinals-fans-lou-brock-memories-photos/63-70046ea6-5177-4e5a-9f36-65b1d602e61e&ct=ga&cd=CAIyGmU4MWY4MmViNmViOTg5MTE6Y29tOmVuOlVT&usg=AFQjCNHbrctgXyD3NFcF7MIAUYKtsDN1uw,Brock passed away Sunday at the age of 81 after battling multiple health ... Hundreds of Cardinals fans have shared their memories of Lou with 5 On...,2020-09-07,Health Sharing
Countries worldwide share perspectives on pandemic-era digital innovation,https://www.google.com/url?rct=j&sa=t&url=https://www.healthcareitnews.com/news/europe/countries-worldwide-share-perspectives-pandemic-era-digital-innovation&ct=ga&cd=CAIyGmU4MWY4MmViNmViOTg5MTE6Y29tOmVuOlVT&usg=AFQjCNE7IoToJ5TBheKmrxqKSTqA7EdcpQ,"Today, as part of the HIMSS &amp; Health 2.0 European Digital Conference, healthcare leaders from Australia, India and the UK compared notes about...",2020-09-07,Health Sharing
Bebe Rexha On Anxiety and How She Keeps Her Mental Health in Shape with Exercise,https://www.google.com/url?rct=j&sa=t&url=https://www.radio.com/im-listening/bebe-rexha-on-anxiety-and-keeping-her-mental-health-in-shape&ct=ga&cd=CAIyGmU4MWY4MmViNmViOTg5MTE6Y29tOmVuOlVT&usg=AFQjCNHywiRwmvARU2gD5IjM01HkmZdpXA,"By sharing stories, and having healthy conversations around the topic of ... In advance of the broadcast, we encourage you to share your story about...",2020-09-07,Health Sharing
Shared Commitment is Key to a Green Hospitality Recovery,https://www.google.com/url?rct=j&sa=t&url=https://www.hospitalitynet.org/opinion/4100514.html&ct=ga&cd=CAIyGmU4MWY4MmViNmViOTg5MTE6Y29tOmVuOlVT&usg=AFQjCNEW089ixJ7oGcXAVS3BV1irivNeaQ,"With a health crisis turned into an economic catastrophe with humanitarian consequences at our doorstep, it is essential to have recovery plans in...",2020-09-07,Health Sharing
"For Long-Haulers, Covid-19 Takes a Toll on Mind as Well as Body",https://www.google.com/url?rct=j&sa=t&url=https://www.nytimes.com/2020/09/07/health/coronavirus-mental-health-long-hauler.html&ct=ga&cd=CAIyGmU4MWY4MmViNmViOTg5MTE6Y29tOmVuOlVT&usg=AFQjCNF_Wni8l9fm775adn3pCraM93Q91A,"Along with sharing their physical symptoms, many in the support group have opened up about how their mental health has suffered because of the...",2020-09-07,Health Sharing
South Korean digital solutions to be showcased at HIMSS &amp; Health 2.0 European Digital Conference,https://www.google.com/url?rct=j&sa=t&url=https://www.healthcareitnews.com/news/europe/south-korean-digital-solutions-be-showcased-himss-health-20-european-digital-conference&ct=ga&cd=CAIyGmU4MWY4MmViNmViOTg5MTE6Y29tOmVuOlVT&usg=AFQjCNFWd1txCEtD_0zqoDq30iHrLqdiqw,"U-Shin C&amp;C: Provide telemedicine and patient management solutions, which enable users to share pictures, medical images and test results remotely...",2020-09-07,Health Sharing
Himansh Kohli tests positive for COVID-19; shares health update,https://www.google.com/url?rct=j&sa=t&url=https://newslagoon.com/himansh-kohli-tests-positive-for-covid-19-shares-health-update/294446/&ct=ga&cd=CAIyGmU4MWY4MmViNmViOTg5MTE6Y29tOmVuOlVT&usg=AFQjCNGCNzaOwLYzmLs_GhrjB370KLizFg,"Sharing the update on his social media handle, he stated that his family is taking precautions at a higher-level, “By god""s grace and your prayers, my...",2020-09-07,Health Sharing
New pharmacist-led network is sharing best practice in medicines for neurodiverse patients,https://www.google.com/url?rct=j&sa=t&url=https://www.pharmaceutical-journal.com/news-and-analysis/opinion/correspondence/new-pharmacist-led-network-is-sharing-best-practice-in-medicines-for-neurodiverse-patients/20208328.article&ct=ga&cd=CAIyGmU4MWY4MmViNmViOTg5MTE6Y29tOmVuOlVT&usg=AFQjCNFyKes20WWh40f4dQOSE3f1Vo5ctg,"Among people with both learning disabilities and autism, there are health inequalities compared with the general population: reduced positive health...",2020-09-07,Health Sharing
Beijing Initiative calls for joint combat against COVID-19,https://www.google.com/url?rct=j&sa=t&url=http://www.china.org.cn/world/2020-09/07/content_76679273.htm&ct=ga&cd=CAIyGmU4MWY4MmViNmViOTg5MTE6Y29tOmVuOlVT&usg=AFQjCNHxlOLPzC6d23_VbbcgQd1R4s1-Xg,... health departments and international health organizations on Sunday in Beijing for fighting against global disease threats with shared anti-epidemic...,2020-09-07,Health Sharing
"Bellingham police find new avenue to share perspective, but some calling it propaganda",https://www.google.com/url?rct=j&sa=t&url=https://www.bellinghamherald.com/news/local/article245033165.html&ct=ga&cd=CAIyGmU4MWY4MmViNmViOTg5MTE6Y29tOmVuOlVT&usg=AFQjCNHDXRxH-clXMvxsSXn8y56fhWHY_A,"A Bellingham Police Department Youtube series on topical issues, ranging from defunding the police to behavioral health outreach, has drawn critical...",2020-09-07,Health Sharing
"Marcos Santiago MD: While politicians slept, American health care became a monster",https://www.google.com/url?rct=j&sa=t&url=https://www.laconiadailysun.com/opinion/letters_to_editor/marcos-santiago-md-while-politicians-slept-american-health-care-became-a-monster/article_c68ac5f0-eeef-11ea-b252-ff7a1819fc2a.html&ct=ga&cd=CAIyHDcyMWE5ZGFiNjRlZGE3MTM6Y29tOmVuOlVTOlI&usg=AFQjCNGSpxlDyIg6JlbvqgRzSrKJv_DR4w,"For the last ten years, the employer sponsored and individual insurance market has increased the amount of cost sharing of offered plans by deductibles...",2020-09-07,Healthcare Cost Sharing
Global 3D Medical Imaging Industry,https://www.google.com/url?rct=j&sa=t&url=https://finance.yahoo.com/news/global-3d-medical-imaging-industry-030100659.html&ct=ga&cd=CAIyHDc5M2E3YWM0ZTJjZTM4OWY6Y29tOmVuOlVTOlI&usg=AFQjCNF4szE--s-I9rds5E60TD7mgc_8sg,3D Medical Imaging Competitor Market Share Scenario Worldwide (in %): 2018 &amp; ... Medical Cloud: A New Chapter in Information Sharing Developing...,2020-09-08,Medical Sharing
"Video of a Intense Cat Fight on Rooftop is Going Viral: Trending Topics, Viral Videos &amp; Funny ...",https://www.google.com/url?rct=j&sa=t&url=https://www.latestly.com/social-viral/trending-topics-viral-videos-funny-memes-of-the-day-watch-out-what-netizens-are-sharing-on-september-8-2-2013604.html&ct=ga&cd=CAIyHDc5M2E3YWM0ZTJjZTM4OWY6Y29tOmVuOlVTOlI&usg=AFQjCNHfC0SeXOqgXUDe0mm74kCEuSktrQ,"A famous peeing statue i n Brussels, Belgium has been dressed in a get up of a doctor to honour medical workers. Video of it has been shared online.",2020-09-08,Medical Sharing
"Auto-retractable Safety Syringes Market Report Reviews Drivers, Analysis, Share, Growth, Trends ...",https://www.google.com/url?rct=j&sa=t&url=https://www.marketwatch.com/story/auto-retractable-safety-syringes-market-report-reviews-drivers-analysis-share-growth-trends-forecast-to-2026-2020-09-07&ct=ga&cd=CAIyHDc5M2E3YWM0ZTJjZTM4OWY6Y29tOmVuOlVTOlI&usg=AFQjCNHulPofvdNvEWc3Src7EC3OtBcwoQ,"Major industry players with significant revenue share include Medtronic, Retractable Technologies, Globe Medical Tech, Revolutions Medical, DMC...",2020-09-07,Medical Sharing
South Korean digital solutions to be showcased at HIMSS &amp; Health 2.0 European Digital Conference,https://www.google.com/url?rct=j&sa=t&url=https://www.healthcareitnews.com/news/europe/south-korean-digital-solutions-be-showcased-himss-health-20-european-digital-conference&ct=ga&cd=CAIyHDc5M2E3YWM0ZTJjZTM4OWY6Y29tOmVuOlVTOlI&usg=AFQjCNFWd1txCEtD_0zqoDq30iHrLqdiqw,"U-Shin C&amp;C: Provide telemedicine and patient management solutions, which enable users to share pictures, medical images and test results remotely...",2020-09-07,Medical Sharing
"Implantable Medical Devices Market Global Production, Growth, Share, Demand and Applications ...",https://www.google.com/url?rct=j&sa=t&url=https://clarkscarlet.com/news/299375/implantable-medical-devices-market-global-production-growth-share-demand-and-applications-forecast-to-2025/&ct=ga&cd=CAIyHDc5M2E3YWM0ZTJjZTM4OWY6Y29tOmVuOlVTOlI&usg=AFQjCNGh7whFWD1AAX7Gchgj45bov22njA,"The report is a comprehensive research study that provides the scope of Implantable Medical Devices market size, industry growth opportunities and...",2020-09-07,Medical Sharing
Medical Terminology Sharing Market (Covid-19 Updated) Analysis 2020 High Growth Prospects ...,https://www.google.com/url?rct=j&sa=t&url=https://www.sgresearchsphere.com/business/medical-terminology-sharing-market-covid-19-updated-analysis-2020-high-growth-prospects-explored-by-wolters-kluwer-hiveworx-intelligent-medical-objects-clinical-architecture-3m/&ct=ga&cd=CAIyHDc5M2E3YWM0ZTJjZTM4OWY6Y29tOmVuOlVTOlI&usg=AFQjCNE3w4nFhwcy9XPV1syzJIfnod4kBQ,Medical Terminology Sharing Market has been growing exponentially over time and has shown great potential in the near future. The growth of...,2020-09-07,Medical Sharing
"Rhea files police complaint against Sushant""s sister Priyanka over bogus prescription",https://www.google.com/url?rct=j&sa=t&url=https://www.daijiworld.com/news/newsDisplay.aspx%3FnewsID%3D748582&ct=ga&cd=CAIyHDc5M2E3YWM0ZTJjZTM4OWY6Y29tOmVuOlVTOlI&usg=AFQjCNGJ7DlzwwGTJHh4JulEeGmC3sndog,... including others for sharing bogus medical prescription for the late actor. ... It is a misconduct under 3.7.1.4 of the Tele Medicine Practice Guidelines.,2020-09-07,Medical Sharing
Medical Device Security Market Will Revenue To Cross Usd In 2022 Top Companies Report ...,https://www.google.com/url?rct=j&sa=t&url=http://kyn24.com/2020/09/07/medical-device-security-market-will-revenue-to-cross-usd-in-2022-top-companies-report-covers-market-specific-challenges-new-opportunities-planning-share-growth-consumption-by-regional-data/&ct=ga&cd=CAIyHDc5M2E3YWM0ZTJjZTM4OWY6Y29tOmVuOlVTOlI&usg=AFQjCNH5-R5IzOK29aFZ7-QQebkMSPUplw,This report covers the global market for medical device security ... CIO for the National Health Information Sharing and Analysis Center (NH-ISAC).,2020-09-07,Medical Sharing
