title,link,item_text,date_published,google_alert_name
Should health insurers offer rebates? And other health insurance questions in the age of COVID-19,https://www.google.com/url?rct=j&sa=t&url=https://www.post-gazette.com/business/healthcare-business/2020/05/11/COVID-19-health-insurance-rebate-auto-insurance-elective-procedure-premiums-rate/stories/202005070137&ct=ga&cd=CAIyHDcyMWE5ZGFiNjRlZGE3MTM6Y29tOmVuOlVTOlI&usg=AFQjCNGrK_5n0R8HN8QYfqzDNiBpaQfKkw,"So, she wondered, why aren""t health insurers giving rebates too? ... and waiving physician cost sharing for its Medicare Advantage members at least ... “At least for the next two years, health care spending will go down because the...",2020-05-11,Healthcare Cost Sharing
"Outlook into the Worldwide Virtual Healthcare Delivery Industry to 2026 - Shares, Strategy, and ...",https://www.google.com/url?rct=j&sa=t&url=https://www.benzinga.com/pressreleases/20/05/g15997387/outlook-into-the-worldwide-virtual-healthcare-delivery-industry-to-2026-shares-strategy-and-foreca&ct=ga&cd=CAIyHDcyMWE5ZGFiNjRlZGE3MTM6Y29tOmVuOlVTOlI&usg=AFQjCNFRBEjjxMVrU01XwnrojUiAMvQfXg,Virtual Healthcare Delivery Market Shares and Forecasts 2.1 Virtual Healthcare Delivery ... 4.3.1 Medicare Patient Cost-Sharing 4.4 Virtual Healthcare...,2020-05-08,Healthcare Cost Sharing
Tracking Telehealth Changes State-by-State in Response to COVID-19,https://www.google.com/url?rct=j&sa=t&url=https://www.jdsupra.com/legalnews/tracking-telehealth-changes-state-by-98894/&ct=ga&cd=CAIyHDcyMWE5ZGFiNjRlZGE3MTM6Y29tOmVuOlVTOlI&usg=AFQjCNETJEQRWk3KilyGH21NF9ogQmhteQ,"20 states have waived or lowered cost sharing for telehealth. 40 states plus Washington, D.C., offer behavioral health services through telehealth.",2020-05-05,Healthcare Cost Sharing
Williamson Medical thanks health care heroes during National Hospital Week,https://www.google.com/url?rct=j&sa=t&url=http://www.williamsonherald.com/features/williamson-medical-thanks-health-care-heroes-during-national-hospital-week/article_57e9589e-93f2-11ea-9947-dffb42660b4a.html&ct=ga&cd=CAIyHDc5M2E3YWM0ZTJjZTM4OWY6Y29tOmVuOlVTOlI&usg=AFQjCNEPYTgyUVgR7Eb8gQ-ujEsbX5tkqg,"In acknowledgement of National Hospital Week from May 10-16, Williamson Medical Center is sharing a video honoring their own healthcare heroes...",2020-05-12,Medical Sharing
"Intel, UPenn Launch Massive Multi-center AI Effort to Refine Brain Cancer Models",https://www.google.com/url?rct=j&sa=t&url=https://www.hpcwire.com/2020/05/11/intel-upenn-launch-massive-multi-center-ai-effort-to-refine-brain-cancer-models/&ct=ga&cd=CAIyHDc5M2E3YWM0ZTJjZTM4OWY6Y29tOmVuOlVTOlI&usg=AFQjCNG9Ov4fUz-MaHRDNJc6-FsSQsM1Tg,"Labeling medical image data requires expert knowledge. Collaboration between institutions could address this challenge, but sharing medical data to...",2020-05-11,Medical Sharing
Expansive Interoperability and Data-Sharing Requirements Require Attention Despite Delays in ...,https://www.google.com/url?rct=j&sa=t&url=https://www.jdsupra.com/legalnews/expansive-interoperability-and-data-70321/&ct=ga&cd=CAIyHDc5M2E3YWM0ZTJjZTM4OWY6Y29tOmVuOlVTOlI&usg=AFQjCNH8joG1q8EBGz1liQEo7ktCa_fmig,"Together, these final Interoperability Rules are intended to support and increase patients"" control over their health care and medical records through the...",2020-05-11,Medical Sharing
"Virtual Healthcare Delivery Market 2020-2026: Shares, Strategies and Forecasts - Global Market ...",https://www.google.com/url?rct=j&sa=t&url=https://www.prnewswire.com/news-releases/virtual-healthcare-delivery-market-2020-2026-shares-strategies-and-forecasts---global-market-anticipated-to-reach-95-billion-by-2026-301056607.html&ct=ga&cd=CAIyHDc5M2E3YWM0ZTJjZTM4OWY6Y29tOmVuOlVTOlI&usg=AFQjCNH8xSOVaPj-TMkTvchs2clbOUwMaw,"Virtual Healthcare Delivery Market 2020-2026: Shares, Strategies and Forecasts - Global Market Anticipated to Reach $95 Billion by 2026. Research...",2020-05-11,Medical Sharing
Black Caucus seeks end of COVID-19 identity sharing with law enforcement,https://www.google.com/url?rct=j&sa=t&url=https://dailymemphian.com/article/13857/black-caucus-seeks-end-of-covid-19-identity&ct=ga&cd=CAIyHDc5M2E3YWM0ZTJjZTM4OWY6Y29tOmVuOlVTOlI&usg=AFQjCNHJBwDzWWxydPvxhIpbVvky-8Rapw,"He pointed out healthcare professionals have lived up to their duty to care for people even though it has put them at risk. “This kind of decision, though,...",2020-05-11,Medical Sharing
AMA issues new principles to restore trust in data privacy,https://www.google.com/url?rct=j&sa=t&url=https://www.ama-assn.org/press-center/press-releases/ama-issues-new-principles-restore-trust-data-privacy&ct=ga&cd=CAIyHDc5M2E3YWM0ZTJjZTM4OWY6Y29tOmVuOlVTOlI&usg=AFQjCNFEieihUvGj2jgZtANnY9bugpWwBQ,"Out of all health care stakeholders, consumers were most willing to share their health data with physicians, but that sentiment has slipped since 2017.",2020-05-11,Medical Sharing
Bronx Hospital Investigating Nurse Who Shared Video of Medical Staff Speaking Out About Lack of ...,https://www.google.com/url?rct=j&sa=t&url=https://www.democracynow.org/2020/5/11/headlines/bronx_hospital_investigating_nurse_who_shared_video_of_medical_staff_speaking_out_about_lack_of_ppe&ct=ga&cd=CAIyHDc5M2E3YWM0ZTJjZTM4OWY6Y29tOmVuOlVTOlI&usg=AFQjCNHSFy78aWq6fFXYTc72GgJWpVvlzw,The Intercept is reporting that Lincoln Hospital in the Bronx is investigating a nurse for sharing footage with the website that shows medical workers...,2020-05-11,Medical Sharing
"During pandemic, states could save lives by sharing ventilators",https://www.google.com/url?rct=j&sa=t&url=https://medicalxpress.com/news/2020-05-pandemic-states-ventilators.html&ct=ga&cd=CAIyHDc5M2E3YWM0ZTJjZTM4OWY6Y29tOmVuOlVTOlI&usg=AFQjCNGokjYRRaHYR3NUFHmN14dOVN4iBA,But ramping up production of complex medical equipment in facilities ... If the federal government were to coordinate the sharing of ventilators among...,2020-05-08,Medical Sharing
"Outlook into the Worldwide Virtual Healthcare Delivery Industry to 2026 - Shares, Strategy, and ...",https://www.google.com/url?rct=j&sa=t&url=https://www.benzinga.com/pressreleases/20/05/g15997387/outlook-into-the-worldwide-virtual-healthcare-delivery-industry-to-2026-shares-strategy-and-foreca&ct=ga&cd=CAIyHDc5M2E3YWM0ZTJjZTM4OWY6Y29tOmVuOlVTOlI&usg=AFQjCNFRBEjjxMVrU01XwnrojUiAMvQfXg,"for medical consultations. During the COVID-19 national emergency, which also constitutes a nationwide public health emergency, covered health care...",2020-05-08,Medical Sharing
