title,link,item_text,date_published,google_alert_name
Hospital Prices Are Unpredictable. One Type of Health Coverage Often Gets the Worst Rates. - WSJ,https://www.google.com/url?rct=j&sa=t&url=https://www.wsj.com/articles/hospital-prices-healthcare-insurance-rental-networks-11640188729&ct=ga&cd=CAIyHDcwNjg0ZGMwOTMxYjI0NDM6Y29tOmVuOlVTOlI&usg=AFQjCNHUZ8BrcxTh28YmedZw3qj_hslEMA,"Hospitals"" highest rates often go to rental networks of healthcare ... because its Christian values and message of sharing appealed to them,...",2021-12-22,Christian Health Care Sharing
Hospital Prices Are Unpredictable. One Type of Health Coverage Often Gets the Worst Rates. - WSJ,https://www.google.com/url?rct=j&sa=t&url=https://www.wsj.com/articles/hospital-prices-healthcare-insurance-rental-networks-11640188729&ct=ga&cd=CAIyHGVmMjU5ZGE1NWJkYjU0NjU6Y29tOmVuOlVTOlI&usg=AFQjCNHUZ8BrcxTh28YmedZw3qj_hslEMA,"Hospitals"" highest rates often go to rental networks of healthcare ... according to the Alliance of Health Care Sharing Ministries, a trade group.",2021-12-22,Health Care Sharing Ministry
Argentine Ministry of Health builds national digital data network with Red Hat - Intelligent CIO LATAM,https://www.google.com/url?rct=j&sa=t&url=https://www.intelligentcio.com/latam/2021/12/22/argentine-ministry-of-health-builds-national-digital-data-network-with-red-hat/&ct=ga&cd=CAIyHGVmMjU5ZGE1NWJkYjU0NjU6Y29tOmVuOlVTOlI&usg=AFQjCNFL3Kso8__DhRa5A1RE6WxwJNxzew,"To improve patient experiences with universal healthcare, the Argentine Ministry of Health decided to build a national digital health network that...",2021-12-22,Health Care Sharing Ministry
"Surprising medical expenses will be banned on January 1, 2022 | Life - Pennsylvania News Today",https://www.google.com/url?rct=j&sa=t&url=https://pennsylvanianewstoday.com/no-more-surprises-surprising-medical-expenses-will-be-banned-on-january-1-2022-life/292461/&ct=ga&cd=CAIyHDQ1NzZkZjdlYTEzZTg0YTA6Y29tOmVuOlVTOlI&usg=AFQjCNGcQf8vVRuQizbG9OyfsOJ1KdfmIA,Surprise invoices are often defined as the medical costs a patient ... than the normal network cost sharing (deductions and out-of-pocket costs).,2021-12-23,Health Cost Sharing
"An Anesthesiology Practice""s Busy Day in Court Collecting on Surprise Bills | Kaiser Health News",https://www.google.com/url?rct=j&sa=t&url=https://khn.org/news/article/anesthesiology-practice-surprise-bills-collections-lawsuits/&ct=ga&cd=CAIyHDQ1NzZkZjdlYTEzZTg0YTA6Y29tOmVuOlVTOlI&usg=AFQjCNHZHtVL5My31cQhHtbvab5rzON3uw,"Insurance covered most of the cost of the hospital stay, he said. He didn""t pay much attention to a bill he received from Commonwealth Anesthesia...",2021-12-23,Health Cost Sharing
How Will Hospitals Have Doctors and Nurses? | ThinkAdvisor,https://www.google.com/url?rct=j&sa=t&url=https://www.thinkadvisor.com/2021/12/22/how-will-hospitals-have-doctors-and-nurses/&ct=ga&cd=CAIyHDQ1NzZkZjdlYTEzZTg0YTA6Y29tOmVuOlVTOlI&usg=AFQjCNH2nD8bWy8BpyF_yZrDr8LEa2bztw,"State insurance regulators, including those in states such as Texas, cracked down on health care cost-sharing ministries that have tried to reach...",2021-12-22,Health Cost Sharing
How the Build Back Better legislation might affect your coverage | healthinsurance.org,https://www.google.com/url?rct=j&sa=t&url=https://www.healthinsurance.org/blog/how-the-build-back-better-legislation-might-affect-your-coverage/&ct=ga&cd=CAIyHDQ1NzZkZjdlYTEzZTg0YTA6Y29tOmVuOlVTOlI&usg=AFQjCNHHNTC0iPkKhwv08wWkNr3RE5UX0w,"Louise Norris; Health insurance &amp; health reform authority; December 22, 2021 ... for a $0 benchmark plan and full cost-sharing reductions (CSR).",2021-12-22,Health Cost Sharing
Using game theory to thwart multistage privacy intrusions when sharing data - Phys.org,https://www.google.com/url?rct=j&sa=t&url=https://phys.org/news/2021-12-game-theory-thwart-multistage-privacy.html&ct=ga&cd=CAIyGmU4MWY4MmViNmViOTg5MTE6Y29tOmVuOlVT&usg=AFQjCNEZ5B9LC0r2XnX5SsTeBjpKqC_YKQ,The data subject selects a sharing strategy based on a game model only ... data is routinely clinically stored as electronical health records.,2021-12-23,Health Sharing
Sundance Film Festival reacts to Omicron with health policy updates - Los Angeles Times,https://www.google.com/url?rct=j&sa=t&url=https://www.latimes.com/entertainment-arts/movies/story/2021-12-23/sundance-film-festival-health-policy-covid-omicron&ct=ga&cd=CAIyGmU4MWY4MmViNmViOTg5MTE6Y29tOmVuOlVT&usg=AFQjCNEMGuSlkK_1plCKtOehzxAxxhmlhg,Facebook &middot; Twitter &middot; Show more sharing options.,2021-12-23,Health Sharing
Season of Sharing helps North Port nurse &amp; mom with rent and utilities - Sarasota Herald-Tribune,https://www.google.com/url?rct=j&sa=t&url=https://www.heraldtribune.com/story/news/local/season-of-sharing/2021/12/23/season-sharing-helps-north-port-nurse-mom-rent-and-utilities/6430852001/&ct=ga&cd=CAIyGmU4MWY4MmViNmViOTg5MTE6Y29tOmVuOlVT&usg=AFQjCNEEWBu6oRyUTv1OJmsfb9-iHLoK1A,Already in debt from medical and education bills plus the exorbitant cost of child care – $250 a week for one child alone – now more of the household...,2021-12-23,Health Sharing
"Here""s what SC health officials say about using rapid home COVID-19 testing kits before ... - WSPA",https://www.google.com/url?rct=j&sa=t&url=https://www.wspa.com/news/state-news/heres-what-sc-health-officials-say-about-using-rapid-home-covid-19-testing-kits-before-holiday-gatherings/&ct=ga&cd=CAIyGmU4MWY4MmViNmViOTg5MTE6Y29tOmVuOlVT&usg=AFQjCNEuFxghC1zqYxV35tp1ro4h3CdydA,"State health officials say ""at home"" rapid tests are an extra tool in the toolbox in the fight against COVID-19. ... Share this story.",2021-12-23,Health Sharing
MOST READ OF 2021: Madison Beer on feeling consumed and sharing her mental health ...,https://www.google.com/url?rct=j&sa=t&url=https://www.hotpress.com/music/most-read-of-2021-madison-beer-on-feeling-consumed-and-sharing-her-mental-health-struggles-22886300&ct=ga&cd=CAIyGmU4MWY4MmViNmViOTg5MTE6Y29tOmVuOlVT&usg=AFQjCNHW4yIYci2ATlk3xV2I8903Lo_Dag,"Social media has been criticised as a cesspit of negativity for those coping with mental health struggles, and Beer has had her fair share of online...",2021-12-23,Health Sharing
Creating Safe Sites in a COVID-19 World: The Road Map for 2022 - Sportico.com,https://www.google.com/url?rct=j&sa=t&url=https://www.sportico.com/business/tech/2021/covid-safe-sports-sites-1234650710/&ct=ga&cd=CAIyGmU4MWY4MmViNmViOTg5MTE6Y29tOmVuOlVT&usg=AFQjCNEegroO8cw9KeJdL0aVe6vea0F5Kg,"In other words, the QR code will be able to notify the business that the customer is compliant with their COVID-19 health requirements without sharing...",2021-12-23,Health Sharing
Cloud companies are expanding from sharing photos to medical records - Marketplace.org,https://www.google.com/url?rct=j&sa=t&url=https://www.marketplace.org/shows/marketplace-tech/cloud-companies-are-expanding-from-sharing-photos-to-medical-records&ct=ga&cd=CAIyGmU4MWY4MmViNmViOTg5MTE6Y29tOmVuOlVT&usg=AFQjCNHDjTgdylVpVql3F4RYj3KCpcjkig,"Sharing medical records between doctors and hospitals can be pretty difficult. That""s because there""s no universal, digital system in the United...",2021-12-23,Health Sharing
Better awarded £3.1m for London-wide shared care solution - Digital Health,https://www.google.com/url?rct=j&sa=t&url=https://www.digitalhealth.net/2021/12/better-awarded-3-1m-for-london-wide-shared-care-solution/&ct=ga&cd=CAIyGmU4MWY4MmViNmViOTg5MTE6Y29tOmVuOlVT&usg=AFQjCNF3S9t2SKLoQQUqyrrc1-KOceyGhw,Open EHR company Better has been awarded a £3.1million contract to provide a shared care solution for the regions in London.,2021-12-23,Health Sharing
"""It is okay to not go"" | Experts urge people to care for their mental health over the holidays | wbir.com",https://www.google.com/url?rct=j&sa=t&url=https://www.wbir.com/article/life/holidays/it-is-okay-to-not-go-experts-urge-people-to-care-for-their-mental-health-over-the-holidays/51-7742a88c-452a-4158-b2ba-0b8a73b8c4a5&ct=ga&cd=CAIyGmU4MWY4MmViNmViOTg5MTE6Y29tOmVuOlVT&usg=AFQjCNFrGQUvW1V15hysRO4TSYM3EPf9oA,"The holidays are usually thought of as a time of joy and wonder. But for many families, it can cause a lot of sadness, stress and grief.",2021-12-23,Health Sharing
Texas has the highest share of uninsured residents in the nation. Another COVID-19 wave ...,https://www.google.com/url?rct=j&sa=t&url=https://www.ksat.com/news/texas/2021/12/22/texas-has-the-highest-share-of-uninsured-residents-in-the-nation-another-covid-19-wave-puts-them-at-risk/&ct=ga&cd=CAIyGmU4MWY4MmViNmViOTg5MTE6Y29tOmVuOlVT&usg=AFQjCNG-aC39RKyLaE9gz94V9lyQFH7tGw,"Untreated medical conditions, lack of access to testing and limited paid time off leave uninsured Texans particularly vulnerable to the disease.",2021-12-23,Health Sharing
Omicron variant expected to cause rise in COVID-19 cases in Knox Co. according to local ...,https://www.google.com/url?rct=j&sa=t&url=https://www.wbir.com/article/news/health/omicron-variant-expected-to-cause-rise-in-covid-19-cases-in-knox-co-according-to-local-health-leaders/51-67201061-8bce-41c4-9cc9-101038d1f9c6&ct=ga&cd=CAIyGmU4MWY4MmViNmViOTg5MTE6Y29tOmVuOlVT&usg=AFQjCNGwKuyOsWh3OKOWnFvErIJjMrctzw,"Dr. Martha Buchanan stepped down as the director of the Knox County Health Department in early August. She is still the county""s Public Health...",2021-12-23,Health Sharing
"Biden says he will run for reelection if he is ""in good health"" - New York Post",https://www.google.com/url?rct=j&sa=t&url=https://nypost.com/2021/12/22/biden-says-he-will-run-for-reelection-if-he-is-in-good-health/&ct=ga&cd=CAIyGmU4MWY4MmViNmViOTg5MTE6Y29tOmVuOlVT&usg=AFQjCNFeYJg1hdENhR_Sd8ob89HC5--_rg,"“If I""m in the health I""m in now – I""m in good health – then, in fact, ... Blood Screening Market Share 2021 Growth, Future Investments,...",2021-12-23,Health Sharing
"Kareena Kapoor shares pic in pyjamas on day 12 of quarantine: ""Still trying to figure out if we ...",https://www.google.com/url?rct=j&sa=t&url=https://www.hindustantimes.com/entertainment/bollywood/kareena-kapoor-shares-a-post-on-day-12-of-quarantine-still-trying-to-figure-out-if-we-are-in-covid-19-times-or-not-101640237018456.html&ct=ga&cd=CAIyGmU4MWY4MmViNmViOTg5MTE6Y29tOmVuOlVT&usg=AFQjCNHKzhO8dx62IBbNWwkZaCgJjrkgqA,"Kareena Kapoor shared a selfie and an update about her health. ... Amid her Covid-19 quarantine, Kareena Kapoor has been sharing posts on her...",2021-12-23,Health Sharing
"Medplus Health shares make a strong debut, list at over 30 - The Economic Times",https://www.google.com/url?rct=j&sa=t&url=https://economictimes.indiatimes.com/markets/stocks/news/medplus-health-shares-make-a-strong-debut-list-at-over-30-premium-over-ipo-price/articleshow/88445035.cms&ct=ga&cd=CAIyGmU4MWY4MmViNmViOTg5MTE6Y29tOmVuOlVT&usg=AFQjCNGo0RfeKt6uK-otJsGc18kZoQl1Gg,The company sold its shares in the range of Rs 780-796 per share. Getty Images Medplus Health Services stock got listed on the exchanges today.,2021-12-23,Health Sharing
Prisma Health employees giving back to Columbia kids with mobility challenges - WLTX,https://www.google.com/url?rct=j&sa=t&url=https://www.wltx.com/article/news/local/prisma-health-employees-columbia-kids-mobility-challenges/101-9f433588-48b0-4ca6-aeb8-14e606e25294&ct=ga&cd=CAIyGmU4MWY4MmViNmViOTg5MTE6Y29tOmVuOlVT&usg=AFQjCNF98P8hEZeEPjslV-xA8SG58UOx-w,"Prisma Health is giving children with mobility challenges a new ride to get around, all thanks to the generosity of hospital employees.",2021-12-23,Health Sharing
EXPLAINER: What to do if you test positive for COVID-19 - KSAT 12,https://www.google.com/url?rct=j&sa=t&url=https://www.ksat.com/health/2021/12/22/explainer-what-to-do-if-you-test-positive-for-covid-19/&ct=ga&cd=CAIyGmU4MWY4MmViNmViOTg5MTE6Y29tOmVuOlVT&usg=AFQjCNFVv3ROxQ-vScxsdxnHgsnRcM34-w,"Spencer Savitz gets tested for COVID-19 on the Lower East Side of Manhattan, Tuesday, Dec. 21, 2021, in New York. U.S. health officials are...",2021-12-23,Health Sharing
Japan confirms first known local omicron transmissions - KSAT.com,https://www.google.com/url?rct=j&sa=t&url=https://www.ksat.com/health/2021/12/22/japan-confirms-first-known-local-omicron-transmissions/&ct=ga&cd=CAIyGmU4MWY4MmViNmViOTg5MTE6Y29tOmVuOlVT&usg=AFQjCNHcVtmBAMlN6Au27_n7zoC5yiBoiw,"Health Minister Shigeyuki Goto, responding to the confirmation of the ... for the omicron variant and share results with Japanese authorities.",2021-12-23,Health Sharing
"Gaza""s old battery pileups pose risk to health, environment - Los Angeles Times",https://www.google.com/url?rct=j&sa=t&url=https://www.latimes.com/world-nation/story/2021-12-22/gazas-old-battery-pileups-pose-risk-to-health-environment&ct=ga&cd=CAIyGmU4MWY4MmViNmViOTg5MTE6Y29tOmVuOlVT&usg=AFQjCNHUGf5frS_IIkS8lff9HQ-nsy3gHA,Virtually every household in the Gaza Strip relies on batteries to keep their home running — a result of years of chronic power outages.,2021-12-23,Health Sharing
How Technology Can Help Eliminate Racial Disparities In Breast Health - Blavity News,https://www.google.com/url?rct=j&sa=t&url=https://blavity.com/how-technology-can-help-eliminate-racial-disparities-in-breast-health&ct=ga&cd=CAIyGmU4MWY4MmViNmViOTg5MTE6Y29tOmVuOlVT&usg=AFQjCNGmzfi9CbP3vfOijuv9uqzoX_ROtg,"Mammography technology and health disparities in breast care. ... If you""re interested in sharing your opinion on any cultural, political or...",2021-12-23,Health Sharing
Commentary: Taking teen mental health seriously - Los Angeles Times,https://www.google.com/url?rct=j&sa=t&url=https://www.latimes.com/socal/daily-pilot/opinion/story/2021-12-22/commentary-taking-teen-mental-health-seriously&ct=ga&cd=CAIyGmU4MWY4MmViNmViOTg5MTE6Y29tOmVuOlVT&usg=AFQjCNHj4Kg8mTeY4u3-qTc0C32mIdziTg,"COVID-19 has precipitated a mental health crisis, fueled by social ... Many times, teens do not feel comfortable sharing these potentially deep...",2021-12-23,Health Sharing
"Don""t Be Surprised – The No Surprises Act Takes Effect January 1, 2022 | King &amp; Spalding - JDSupra",https://www.google.com/url?rct=j&sa=t&url=https://www.jdsupra.com/legalnews/don-t-be-surprised-the-no-surprises-act-9822613/&ct=ga&cd=CAIyHDcyMWE5ZGFiNjRlZGE3MTM6Y29tOmVuOlVTOlI&usg=AFQjCNG_rso6cYpSdXr5RcHA8k7NJ6yA-w,"A health care facility is defined as (1) a hospital; (2) a hospital ... Under the Act, a patient""s cost sharing is generally calculated as if the...",2021-12-23,Healthcare Cost Sharing
"Global Healthcare ERP Consulting Services Market (2021 to 2028) - Size, Share &amp; Trends ...",https://www.google.com/url?rct=j&sa=t&url=https://www.businesswire.com/news/home/20211223005180/en/Global-Healthcare-ERP-Consulting-Services-Market-2021-to-2028---Size-Share-Trends-Analysis-Report---ResearchAndMarkets.com&ct=ga&cd=CAIyHDcyMWE5ZGFiNjRlZGE3MTM6Y29tOmVuOlVTOlI&usg=AFQjCNH50Q3JNKIUAQUAUOQRCDxmcKeahQ,The growing healthcare expenditure and rising adoption levels of advanced technological solutions are driving facilities to successfully implement...,2021-12-23,Healthcare Cost Sharing
Hospital Prices Are Unpredictable. One Type of Health Coverage Often Gets the Worst Rates. - WSJ,https://www.google.com/url?rct=j&sa=t&url=https://www.wsj.com/articles/hospital-prices-healthcare-insurance-rental-networks-11640188729&ct=ga&cd=CAIyHDcyMWE5ZGFiNjRlZGE3MTM6Y29tOmVuOlVTOlI&usg=AFQjCNHUZ8BrcxTh28YmedZw3qj_hslEMA,"She verified that Baptist Health was included and signed up, at a cost of ... religious affiliations, known as healthcare sharing ministry plans.",2021-12-22,Healthcare Cost Sharing
How the Build Back Better legislation might affect your coverage | healthinsurance.org,https://www.google.com/url?rct=j&sa=t&url=https://www.healthinsurance.org/blog/how-the-build-back-better-legislation-might-affect-your-coverage/&ct=ga&cd=CAIyHDcyMWE5ZGFiNjRlZGE3MTM6Y29tOmVuOlVTOlI&usg=AFQjCNHHNTC0iPkKhwv08wWkNr3RE5UX0w,"Currently, the federal government pays 90% of the cost of Medicaid ... used to determine eligibility for premium tax credits and cost-sharing...",2021-12-22,Healthcare Cost Sharing
"""Hope ambassadors"" program expanded in schools to promote student mental health | The ...","https://www.google.com/url?rct=j&sa=t&url=https://theapopkavoice.com/stories/hope-ambassadors-program-expanded-in-schools-to-promote-student-mental-health,12636&ct=ga&cd=CAIyHDBhNGY1MzE5YzE5ODdjNzQ6Y29tOmVuOlVTOlI&usg=AFQjCNFZTcraZTblMbBhES3BbaVOtHfV0A","Ron DeSantis, the first lady hosted a a number of children during a round-table discussion last Friday about the program. “Participants were sharing...",2021-12-23,Healthcare Sharing Programs
ACA Health Insurance Exchange Programs Increase Signups 17% | ThinkAdvisor,https://www.google.com/url?rct=j&sa=t&url=https://www.thinkadvisor.com/2021/12/22/aca-health-insurance-exchange-programs-increase-signups-17/&ct=ga&cd=CAIyHDBhNGY1MzE5YzE5ODdjNzQ6Y29tOmVuOlVTOlI&usg=AFQjCNGtw3jqjYgNhuhZaMAMqpIAGmvwjQ,HealthCare.gov signed 9.7 million consumers. State-based exchanged programs attracted 3.9 million enrollees. Managers of the public health insurance...,2021-12-22,Healthcare Sharing Programs
"""Hope ambassadors"" program expanded in schools to promote student mental health | The ...","https://www.google.com/url?rct=j&sa=t&url=https://theapopkavoice.com/stories/hope-ambassadors-program-expanded-in-schools-to-promote-student-mental-health,12636&ct=ga&cd=CAIyHDBhNGY1MzE5YzE5ODdjNzQ6Y29tOmVuOlVTOlI&usg=AFQjCNFZTcraZTblMbBhES3BbaVOtHfV0A","Ron DeSantis, the first lady hosted a a number of children during a round-table discussion last Friday about the program. “Participants were sharing...",2021-12-23,Healthcare Sharing Programs
ACA Health Insurance Exchange Programs Increase Signups 17% | ThinkAdvisor,https://www.google.com/url?rct=j&sa=t&url=https://www.thinkadvisor.com/2021/12/22/aca-health-insurance-exchange-programs-increase-signups-17/&ct=ga&cd=CAIyHDBhNGY1MzE5YzE5ODdjNzQ6Y29tOmVuOlVTOlI&usg=AFQjCNGtw3jqjYgNhuhZaMAMqpIAGmvwjQ,HealthCare.gov signed 9.7 million consumers. State-based exchanged programs attracted 3.9 million enrollees. Managers of the public health insurance...,2021-12-22,Healthcare Sharing Programs
You tested positive for COVID. You have roommates. LA County may be able to help,https://www.google.com/url?rct=j&sa=t&url=https://www.latimes.com/california/story/2021-12-23/tested-positive-for-covid-19-youve-got-roommates&ct=ga&cd=CAIyHDc5M2E3YWM0ZTJjZTM4OWY6Y29tOmVuOlVTOlI&usg=AFQjCNHMSOjMhguDg4HSmo1CEOuikdXunw,"The medical sheltering sites have provided rooms for people who cannot ... wearing masks whenever in shared spaces, and ensuring that air can flow...",2021-12-23,Medical Sharing
Using game theory to thwart multistage privacy intrusions when sharing data - Phys.org,https://www.google.com/url?rct=j&sa=t&url=https://phys.org/news/2021-12-game-theory-thwart-multistage-privacy.html&ct=ga&cd=CAIyHDc5M2E3YWM0ZTJjZTM4OWY6Y29tOmVuOlVTOlI&usg=AFQjCNEZ5B9LC0r2XnX5SsTeBjpKqC_YKQ,"Biomedical data is widely collected in the field of medicine, although sharing such data can raise privacy concerns about the re-identification of...",2021-12-23,Medical Sharing
"How bad is Omicron? Here""s what to watch for - Los Angeles Times",https://www.google.com/url?rct=j&sa=t&url=https://www.latimes.com/science/story/2021-12-23/how-bad-is-omicron-heres-what-to-watch-for&ct=ga&cd=CAIyHDc5M2E3YWM0ZTJjZTM4OWY6Y29tOmVuOlVTOlI&usg=AFQjCNEXuT6r08N8E2S_NvaUslTOz9DL9Q,And a preliminary study released Wednesday on the science-sharing site MedRxiv found that vaccinated South African healthcare workers who had...,2021-12-23,Medical Sharing
"""Made for Medicine"" initiative helps Black kids get a start in the medical field - 10TV.com",https://www.google.com/url?rct=j&sa=t&url=https://www.10tv.com/article/news/local/made-for-medicine-initiative-helps-black-kids-get-a-start-in-the-medical-field-columbus/530-9ce6e9fc-40e5-4684-aeea-10e62f86eda6&ct=ga&cd=CAIyHDc5M2E3YWM0ZTJjZTM4OWY6Y29tOmVuOlVTOlI&usg=AFQjCNFagnK5DCZ7wTi0qP0t2V30W45zjA,"Local doctors, many with Columbus roots, are taking time from doing rounds and check-ups to bring their field into focus for a new generation.",2021-12-23,Medical Sharing
Cloud companies are expanding from sharing photos to medical records - Marketplace.org,https://www.google.com/url?rct=j&sa=t&url=https://www.marketplace.org/shows/marketplace-tech/cloud-companies-are-expanding-from-sharing-photos-to-medical-records&ct=ga&cd=CAIyHDc5M2E3YWM0ZTJjZTM4OWY6Y29tOmVuOlVTOlI&usg=AFQjCNHDjTgdylVpVql3F4RYj3KCpcjkig,"Sharing medical records between doctors and hospitals can be pretty difficult. That""s because there""s no universal, digital system in the United...",2021-12-23,Medical Sharing
"Global Healthcare ERP Consulting Services Market (2021 to 2028) - Size, Share &amp; Trends ...",https://www.google.com/url?rct=j&sa=t&url=https://www.businesswire.com/news/home/20211223005180/en/Global-Healthcare-ERP-Consulting-Services-Market-2021-to-2028---Size-Share-Trends-Analysis-Report---ResearchAndMarkets.com&ct=ga&cd=CAIyHDc5M2E3YWM0ZTJjZTM4OWY6Y29tOmVuOlVTOlI&usg=AFQjCNH50Q3JNKIUAQUAUOQRCDxmcKeahQ,"“Healthcare ERP Consulting Services Market Size, Share &amp; Trends Analysis Report By Functionality (Implementation, Training &amp; Education),...",2021-12-23,Medical Sharing
Texas has the highest share of uninsured residents in the nation. Another COVID-19 wave ...,https://www.google.com/url?rct=j&sa=t&url=https://www.ksat.com/news/texas/2021/12/22/texas-has-the-highest-share-of-uninsured-residents-in-the-nation-another-covid-19-wave-puts-them-at-risk/&ct=ga&cd=CAIyHDc5M2E3YWM0ZTJjZTM4OWY6Y29tOmVuOlVTOlI&usg=AFQjCNG-aC39RKyLaE9gz94V9lyQFH7tGw,"Untreated medical conditions, lack of access to testing and limited paid time off leave uninsured Texans particularly vulnerable to the disease.",2021-12-23,Medical Sharing
Commentary: Taking teen mental health seriously - Los Angeles Times,https://www.google.com/url?rct=j&sa=t&url=https://www.latimes.com/socal/daily-pilot/opinion/story/2021-12-22/commentary-taking-teen-mental-health-seriously&ct=ga&cd=CAIyHDc5M2E3YWM0ZTJjZTM4OWY6Y29tOmVuOlVTOlI&usg=AFQjCNHj4Kg8mTeY4u3-qTc0C32mIdziTg,"Mental health issues are medical issues and need to be treated as such. ... Many times, teens do not feel comfortable sharing these potentially...",2021-12-23,Medical Sharing
Medical examiner says 7 people found dead in Minnesota home died of ... - Philadelphia Inquirer,https://www.google.com/url?rct=j&sa=t&url=https://www.inquirer.com/wires/ap/medical-examiner-says-7-people-found-dead-minnesota-home-died-carbon-monoxide-poisoning-20211222.html&ct=ga&cd=CAIyHDc5M2E3YWM0ZTJjZTM4OWY6Y29tOmVuOlVTOlI&usg=AFQjCNHUTBt-mETVMFjQ4gzePRAtFsTp4A,"Pennsylvania""s health department found an array of policy failures, staffing issues and shoddy facilities at Episcopal that contributed to a series of...",2021-12-22,Medical Sharing
Hospital Prices Are Unpredictable. One Type of Health Coverage Often Gets the Worst Rates. - WSJ,https://www.google.com/url?rct=j&sa=t&url=https://www.wsj.com/articles/hospital-prices-healthcare-insurance-rental-networks-11640188729&ct=ga&cd=CAIyHDc5M2E3YWM0ZTJjZTM4OWY6Y29tOmVuOlVTOlI&usg=AFQjCNHUZ8BrcxTh28YmedZw3qj_hslEMA,"Hospitals"" highest rates often go to rental networks of healthcare ... Dr. Saroughian""s healthcare sharing plan relied on a rental network of...",2021-12-22,Medical Sharing
Air Force supports US global health policy priorities of 2021 - DVIDS,https://www.google.com/url?rct=j&sa=t&url=https://www.dvidshub.net/news/411660/air-force-supports-us-global-health-policy-priorities-2021&ct=ga&cd=CAIyHDc5M2E3YWM0ZTJjZTM4OWY6Y29tOmVuOlVTOlI&usg=AFQjCNF5YSDP_42x5WALGoYooIjajaXrRQ,The Department of Defense employs global health engagement collaboratively with allies and partners to meet mutually shared national security...,2021-12-22,Medical Sharing
Mercy Health Muskegon to receive federal help in staffing hospital - WZZM 13,https://www.google.com/url?rct=j&sa=t&url=https://www.wzzm13.com/article/news/local/muskegon/mercy-health-muskegon-to-receive-federal-help/69-a3819d20-6621-41c4-81f2-16bc6358e01b&ct=ga&cd=CAIyHDc5M2E3YWM0ZTJjZTM4OWY6Y29tOmVuOlVTOlI&usg=AFQjCNEHeIib8Bq9IqsBIGvi0Zun-Zdi7Q,— A team of federal medical workers is coming to help alleviate strained staff at Mercy Health Muskegon. The Michigan Department of Health and Human...,2021-12-22,Medical Sharing
Cleveland Clinic performs surgery on 26-week-old fetus to remove rare heart tumor - WKYC,https://www.google.com/url?rct=j&sa=t&url=https://www.wkyc.com/article/news/health/cleveland-clinic-surgery-26-week-old-fetus-heart-tumor/95-1dc4a412-77c0-4a77-80b3-a9f735124662&ct=ga&cd=CAIyHDc5M2E3YWM0ZTJjZTM4OWY6Y29tOmVuOlVTOlI&usg=AFQjCNGSd11z04Q0ZpJzB3IJxUczvlSTpQ,CLEVELAND — The Cleveland Clinic is sharing news of a procedure that was done ... to fetal heart failure – have been reported in medical journals.,2021-12-22,Medical Sharing
"Thomas Wentzien Obituary (2021) - Resident Of Los Gatos, CA - Mercury News - Legacy.com",https://www.google.com/url?rct=j&sa=t&url=https://www.legacy.com/us/obituaries/mercurynews/name/thomas-wentzien-obituary%3Fid%3D31976558&ct=ga&cd=CAIyHDc5M2E3YWM0ZTJjZTM4OWY6Y29tOmVuOlVTOlI&usg=AFQjCNEQ0LtACcD_0EKaAjSsnUuZPB3Yhw,"After graduating from medical school, he completed an Internal Medicine ... going on frequent hikes, runs and sharing long music playlists.",2021-12-22,Medical Sharing
