title,link,item_text,date_published,google_alert_name
"INSIGHT: Health-Care Providers"" Challenge—Risks of Copay Waivers, Discounts",https://www.google.com/url?rct=j&sa=t&url=https://news.bloomberglaw.com/us-law-week/insight-health-care-providers-challenge-risks-of-copay-waivers-discounts&ct=ga&cd=CAIyHDQ1NzZkZjdlYTEzZTg0YTA6Y29tOmVuOlVTOlI&usg=AFQjCNFi--LGEY3Vb2InL9U2ORCgKzpmDg,"Alternatively, insurers argue that health plans require a patient to pay their cost-sharing responsibility (copays, deductibles, and co-insurance), and a...",2020-07-23,Health Cost Sharing
Senate hopefuls debate in Sheridan,https://www.google.com/url?rct=j&sa=t&url=https://www.jhnewsandguide.com/jackson_hole_daily/state_and_regional/wynews/senate-hopefuls-debate-in-sheridan/article_0a2a53d4-bc8b-5b90-a82d-3bc8fe4120e9.html&ct=ga&cd=CAIyHDQ1NzZkZjdlYTEzZTg0YTA6Y29tOmVuOlVTOlI&usg=AFQjCNGgSmPfNu7nMzP5OmjnQEM_-sIysw,"Donna Rice, a Casper attorney, supported expanded medical cost-sharing plans, which are largely run by faith-based groups and allow people to...",2020-07-23,Health Cost Sharing
Partnerships for better soil health and water quality,https://www.google.com/url?rct=j&sa=t&url=https://www.ocj.com/2020/07/partnerships-for-better-soil-health-and-water-quality/&ct=ga&cd=CAIyHDQ1NzZkZjdlYTEzZTg0YTA6Y29tOmVuOlVTOlI&usg=AFQjCNFROsmzL4ma8dMWc8sS58wwFPT0sQ,"“It could be contacting them about pulling cores for a soil health study,” she said. ... Meanwhile, the six new associates are continuing their work: sharing ... long-term adoption of practices, even when cost-share funds may no longer...",2020-07-23,Health Cost Sharing
State to provide billing protections for uninsured getting COVID-19 tests,https://www.google.com/url?rct=j&sa=t&url=https://www.wwlp.com/news/health/coronavirus-local-impact/state-to-provide-billing-protections-for-uninsured-getting-covid-19-tests/&ct=ga&cd=CAIyHDQ1NzZkZjdlYTEzZTg0YTA6Y29tOmVuOlVTOlI&usg=AFQjCNGyTHwCxk6eShlL-04nbe2iwTZMow,"BOSTON, Mass. (WWLP)– The state has issued a public health order to prevent uninsured individuals from receiving surprise bills and copays...",2020-07-22,Health Cost Sharing
Is Medical Insurance Oone of the Most Important Covers That You Should Get in 2020?,https://www.google.com/url?rct=j&sa=t&url=https://www.techtimes.com/articles/251318/20200722/is-medical-insurance-oone-of-the-most-important-covers-that-you-should-get-in-2020.htm&ct=ga&cd=CAIyHDQ1NzZkZjdlYTEzZTg0YTA6Y29tOmVuOlVTOlI&usg=AFQjCNGcIIJoOGRMthfRcDSGBU2W1VP8Jw,"Anyone with a Medicare Advantage plan, their coronavirus treatment cost-sharing will depend on the type of plan that they have. Medicare Part A and...",2020-07-22,Health Cost Sharing
"Employers give insurers so-so grade in push to drive healthcare quality, value",https://www.google.com/url?rct=j&sa=t&url=https://www.healthcarefinancenews.com/news/employers-give-insurers-so-so-grade-push-drive-healthcare-quality-value&ct=ga&cd=CAIyHDQ1NzZkZjdlYTEzZTg0YTA6Y29tOmVuOlVTOlI&usg=AFQjCNExkOzgBgyCRbPm0dAjufgaaoJj9w,"Aetna recently announced that it is waiving cost-sharing and co-pays for inpatient hospital admissions related to COVID-19. The Coronavirus Aid, Relief...",2020-07-22,Health Cost Sharing
Effects of COVID on Health Insurance,https://www.google.com/url?rct=j&sa=t&url=https://abc7amarillo.com/news/local/affects-of-covid-on-health-insurance&ct=ga&cd=CAIyHDQ1NzZkZjdlYTEzZTg0YTA6Y29tOmVuOlVTOlI&usg=AFQjCNENXN0FhIl_WeiLThEjqDCPDJ191Q,"Butler says there are avenues to pursue like cost sharing programs. ""They are like a big risk pool,"" said Butler. ""You don""t have to have a qualifying...",2020-07-22,Health Cost Sharing
ACA Litigation Round-Up: Part III,https://www.google.com/url?rct=j&sa=t&url=https://www.healthaffairs.org/do/10.1377/hblog20200722.558356/full&ct=ga&cd=CAIyHDQ1NzZkZjdlYTEzZTg0YTA6Y29tOmVuOlVTOlI&usg=AFQjCNHlVpOlRhZSE9D8hwGGrSKfZGWNoA,"... overpaid advance premium tax credits and cost-sharing reductions, user fees, and interest.) The government and Maine Community Health Options...",2020-07-22,Health Cost Sharing
"County, city COVID meeting yields promising results for citizen health",https://www.google.com/url?rct=j&sa=t&url=https://www.navasotaexaminer.com/article/news/county-city-covid-meeting-yields-promising-results-citizen-health&ct=ga&cd=CAIyHDQ1NzZkZjdlYTEzZTg0YTA6Y29tOmVuOlVTOlI&usg=AFQjCNEiV3YeRfNyOFLd4vvsx6sbxBEktw,"Stafford explained that in COVID funding discussions with city staff, the idea of cost-sharing a county health services coordinator and a county health...",2020-07-22,Health Cost Sharing
HealthWell Foundation Appoints Cathleen Bennett To Board,https://www.google.com/url?rct=j&sa=t&url=https://dc.citybizlist.com/article/620156/healthwell-foundation-appoints-cathleen-bennett-to-board&ct=ga&cd=CAIyHDQ1NzZkZjdlYTEzZTg0YTA6Y29tOmVuOlVTOlI&usg=AFQjCNH15nosz44Fw521jl0QeQKi2TYtBg,Bringing over 24 years of experience in health and human services to the ... HealthWell assists with the treatment-related cost-sharing obligations of...,2020-07-22,Health Cost Sharing
HealthWell Foundation Welcomes New Member to its Board of Directors,https://www.google.com/url?rct=j&sa=t&url=https://finance.yahoo.com/news/healthwell-foundation-welcomes-member-board-140000531.html&ct=ga&cd=CAIyHDQ1NzZkZjdlYTEzZTg0YTA6Y29tOmVuOlVTOlI&usg=AFQjCNEPvOqgIhf3I_vSwPvjR_TlRVeMrQ,... cause out-of-pocket medical expenses to escalate rapidly. HealthWell assists with the treatment-related cost-sharing obligations of these patients.,2020-07-22,Health Cost Sharing
Medicare Telehealth Post-PHE: Expiring Flexibilities and Preparing to Return to “Normal”,https://www.google.com/url?rct=j&sa=t&url=https://www.jdsupra.com/legalnews/medicare-telehealth-post-phe-expiring-50191/%3F&ct=ga&cd=CAIyHDQ1NzZkZjdlYTEzZTg0YTA6Y29tOmVuOlVTOlI&usg=AFQjCNEiMey7wgG3mkSnbT-WOjjKL-1sKA,"... for healthcare providers to reduce or waive cost-sharing for telehealth visits paid by federal healthcare programs during the PHE.15 After the PHE,...",2020-07-22,Health Cost Sharing
COVID-19 Test Prices Set by Hospitals Range from $20 to $850,https://www.google.com/url?rct=j&sa=t&url=https://revcycleintelligence.com/news/covid-19-test-prices-set-by-hospitals-range-from-20-to-850&ct=ga&cd=CAIyHDQ1NzZkZjdlYTEzZTg0YTA6Y29tOmVuOlVTOlI&usg=AFQjCNHNWbrSv1SDYha50x264skGOGX-0g,"Most health plans must cover COVID-19 testing with no cost-sharing, ... Researchers found that the median price for a COVID-19 diagnostic test was...",2020-07-22,Health Cost Sharing
Experts say pandemic reveals big cracks in health care data sharing,https://www.google.com/url?rct=j&sa=t&url=https://m.citizensvoice.com/news/coronavirus/experts-say-pandemic-reveals-big-cracks-in-health-care-data-sharing/article_e36f9441-769b-5b5a-8a53-49ec4190437c.html&ct=ga&cd=CAIyHDQ1NzZkZjdlYTEzZTg0YTA6Y29tOmVuOlVTOlI&usg=AFQjCNH7ca-NYayZtRgCti4a489Bau83SQ,"Broken links in communication make health care cost more, panelists agreed. Doctors, clinical staff and pharmacists burn away hours digging for...",2020-07-21,Health Cost Sharing
Virus patient fights to make $80K air ambulance charge go away,https://www.google.com/url?rct=j&sa=t&url=https://hayspost.com/posts/7ef1df2c-fcd7-4c39-99bf-fbed3aaaf50e&ct=ga&cd=CAIyHDQ1NzZkZjdlYTEzZTg0YTA6Y29tOmVuOlVTOlI&usg=AFQjCNGhqj45rmSc995krunbCxja4FUstQ,Do you have a medical bill from Kansas that you want to share with a ... treatment without any cost-sharing for patients with qualifying health plans.,2020-07-21,Health Cost Sharing
COVID-19 Daily Insurance Regulatory Updates To Keep You Informed During The Lockdown (July ...,https://www.google.com/url?rct=j&sa=t&url=https://www.jdsupra.com/legalnews/covid-19-daily-insurance-regulatory-13884/&ct=ga&cd=CAIyHDQ1NzZkZjdlYTEzZTg0YTA6Y29tOmVuOlVTOlI&usg=AFQjCNECl7-oJoVSDIjFt7CwcLFcdj92GQ,The Emergency Regulation governs coverage and cost sharing requirements for commercial insurance market coverage of COVID-19 claims.,2020-07-21,Health Cost Sharing
"Board of Health: Social gatherings, people letting their guard down causing rise in Knox County",https://www.google.com/url?rct=j&sa=t&url=https://www.wbir.com/article/news/health/coronavirus/board-of-health-social-gatherings-people-letting-their-guard-down-causing-rise-in-knox-county/51-66bb98d9-ea0f-4978-ab9f-332836b7c9db&ct=ga&cd=CAIyGmU4MWY4MmViNmViOTg5MTE6Y29tOmVuOlVT&usg=AFQjCNHE842wmASMOLcYj0uIOTmG8QNwhw,"The Knox County Board of Health met Wednesday afternoon, sharing that the virus is spreading when people are letting their guard down. RELATED:...",2020-07-23,Health Sharing
International collaboration on digital health best practice supports global response to COVID-19 ...,https://www.google.com/url?rct=j&sa=t&url=https://www.miragenews.com/international-collaboration-on-digital-health-best-practice-supports-global-response-to-covid-19-pandemic/&ct=ga&cd=CAIyGmU4MWY4MmViNmViOTg5MTE6Y29tOmVuOlVT&usg=AFQjCNF4Llz4cVfUtlo5FuHMp0ADFg30lA,"Since then we""ve benefitted from the opportunity to share valuable insights on digital health service delivery for our citizens that have been informed by...",2020-07-23,Health Sharing
New relationship founders over sharing of offensive video,https://www.google.com/url?rct=j&sa=t&url=https://www.theday.com/dear-abby/20200723/new-relationship-founders-over-sharing-of-offensive-video&ct=ga&cd=CAIyGmU4MWY4MmViNmViOTg5MTE6Y29tOmVuOlVT&usg=AFQjCNFF2dUeUMys4deHKLFtVBFFXaKM3w,"DEAR ABBY: My wife had some health issues over the last four years and gained 40 pounds. She keeps saying she wants to lose the weight, but doesn""t...",2020-07-23,Health Sharing
"Lake Charles Memorial doctor featured in Men""s Health",https://www.google.com/url?rct=j&sa=t&url=https://www.kplctv.com/2020/07/22/lake-charles-memorial-doctor-featured-mens-health/&ct=ga&cd=CAIyGmU4MWY4MmViNmViOTg5MTE6Y29tOmVuOlVT&usg=AFQjCNFeHQ2XxIB990WzqlYqg6_eusquGw,"Lake Charles Memorial doctor featured in Men""s Health ... sharing his experience on fighting against COVID-19 both as a doctor and a patient. Gallien...",2020-07-22,Health Sharing
Maine families share stories of addiction at roundtable,https://www.google.com/url?rct=j&sa=t&url=https://wgme.com/news/local/maine-families-share-stories-of-addiction-at-roundtable&ct=ga&cd=CAIyGmU4MWY4MmViNmViOTg5MTE6Y29tOmVuOlVT&usg=AFQjCNF1v0OMJjRwYlYHnsyZUhQ9-YoC0g,"She says Maine needs more mental health support for people in recovery. “We""d go someplace for her mental health issues, ""Well she needs to address...",2020-07-22,Health Sharing
"This country""s coronavirus tracing app is so good others want to use it",https://www.google.com/url?rct=j&sa=t&url=https://thehill.com/changing-america/well-being/prevention-cures/508590-this-countrys-coronavirus-tracing-app-is-so-good&ct=ga&cd=CAIyGmU4MWY4MmViNmViOTg5MTE6Y29tOmVuOlVT&usg=AFQjCNEL2xnrGO1P7x-TeyGNKPTQzuInjQ,"Ireland""s public health agency developed a COVID Tracker app as part of ... So to track the potential spread of coronavirus, Ireland""s public health ... to sharing location data with Google and Apple, the app could also be sharing a...",2020-07-22,Health Sharing
"Minnesota""s health department wants to reveal your positive COVID-19 test results to first ...",https://www.google.com/url?rct=j&sa=t&url=https://sahanjournal.com/health/covid-19-minnesota-first-responders-privacy/&ct=ga&cd=CAIyGmU4MWY4MmViNmViOTg5MTE6Y29tOmVuOlVT&usg=AFQjCNEIuFAdmZpt4JA9Gt87DQwv6ACCZg,An April order from Governor Tim Walz allows contact tracers to share coronavirus information with emergency responders. Immigration activists want...,2020-07-22,Health Sharing
Pandemic Reveals Inefficiencies with Patient Data Sharing,https://www.google.com/url?rct=j&sa=t&url=https://www.governing.com/security/Pandemic-Reveals-Inefficiencies-with-Patient-Data-Sharing.html&ct=ga&cd=CAIyGmU4MWY4MmViNmViOTg5MTE6Y29tOmVuOlVT&usg=AFQjCNEmUTbkYkZDtLPidBQQ7DUL0NAtuQ,"“At the end of the day, the patients are paying for it through their health care premiums,” said Dr. Jignesh Sheth, the Wright Center""s chief medical officer,...",2020-07-22,Health Sharing
The Pandemic Has Magnified Gaps in Health-Care Data Sharing,https://www.google.com/url?rct=j&sa=t&url=https://www.govtech.com/health/The-Pandemic-Has-Magnified-Gaps-in-Health-Care-Data-Sharing.html&ct=ga&cd=CAIyGmU4MWY4MmViNmViOTg5MTE6Y29tOmVuOlVT&usg=AFQjCNGd8ELA4Hqwj2ZGQgGqmbshOQRSFQ,"The Pandemic Has Magnified Gaps in Health-Care Data Sharing. Doctors, clinical staff and pharmacists burn away hours digging for records, calling...",2020-07-22,Health Sharing
Engineers unveil new self-powered heart monitor made with polyvinyl alcohol,https://www.google.com/url?rct=j&sa=t&url=https://www.cardiovascularbusiness.com/topics/acute-coronary-syndrome/self-powered-heart-monitors-polyvinyl-alcohol-cad&ct=ga&cd=CAIyGmU4MWY4MmViNmViOTg5MTE6Y29tOmVuOlVT&usg=AFQjCNH6FgBVVhK2YO4cm9eOtYBJTw30Dg,"... self-powered triboelectric nanogenerators (TENG) that can monitor a patient""s cardiovascular health, sharing their findings in Advanced Materials.",2020-07-22,Health Sharing
"Employers give insurers so-so grade in push to drive healthcare quality, value",https://www.google.com/url?rct=j&sa=t&url=https://www.healthcarefinancenews.com/news/employers-give-insurers-so-so-grade-push-drive-healthcare-quality-value&ct=ga&cd=CAIyGmU4MWY4MmViNmViOTg5MTE6Y29tOmVuOlVT&usg=AFQjCNExkOzgBgyCRbPm0dAjufgaaoJj9w,Aetna recently announced that it is waiving cost-sharing and co-pays for inpatient hospital admissions related to COVID-19. The Coronavirus Aid...,2020-07-22,Health Sharing
Hamilton County Health Dept Changes Isolation Guidelines for COVID-19,https://www.google.com/url?rct=j&sa=t&url=https://wdef.com/2020/07/22/hamilton-county-health-dept-changes-isolation-guidelines-covid-19/&ct=ga&cd=CAIyGmU4MWY4MmViNmViOTg5MTE6Y29tOmVuOlVT&usg=AFQjCNH1928Jtt7PjoosoYGc-1sfc6Q17w,Public health needs your assistance in sharing these important messages to reduce transmission.Strictly adhering to these guidelines will reduce...,2020-07-22,Health Sharing
"Kim Kardashian West Shares Statement Asking For ""Compassion And Empathy"" For Kanye",https://www.google.com/url?rct=j&sa=t&url=https://www.scarymommy.com/kim-kardashian-statement-kanye/&ct=ga&cd=CAIyGmU4MWY4MmViNmViOTg5MTE6Y29tOmVuOlVT&usg=AFQjCNHrLWeClrn13CleDQHXu8vY91-cZQ,"Kim Kardashian is speaking up about her husband""s mental health in the aftermath of some troubling comments and tweets he""s been sharing in...",2020-07-22,Health Sharing
"Palantir""s pandemic contracts stir concern ahead of IPO",https://www.google.com/url?rct=j&sa=t&url=https://www.nbcnews.com/tech/tech-news/palantir-s-pandemic-contracts-stir-concern-ahead-ipo-n1234537&ct=ga&cd=CAIyGmU4MWY4MmViNmViOTg5MTE6Y29tOmVuOlVT&usg=AFQjCNE1vPfavLFcxJZdfr5CAmv55CmN1w,But in recent months and with the debut of its stock on public markets ... and public health experts worried that a company that specializes in sharing...,2020-07-22,Health Sharing
How to find love during a health crisis,https://www.google.com/url?rct=j&sa=t&url=https://www.cbs17.com/my-carolina/how-to-find-love-during-a-health-crisis/&ct=ga&cd=CAIyGmU4MWY4MmViNmViOTg5MTE6Y29tOmVuOlVT&usg=AFQjCNEiKNHXdEzqdv3oJdrcjctq8-0_xQ,"We""re sharing some expert advice today on how to find love during a health crisis. Copyright 2020 Nexstar Broadcasting, Inc. All rights reserved.",2020-07-22,Health Sharing
“Sister I Love You!” Facebook users engage more with social posts than health misinformation,https://www.google.com/url?rct=j&sa=t&url=http://blogs.biomedcentral.com/on-society/2020/07/22/sister-i-love-you-facebook-users-engage-more-with-social-posts-than-health-misinformation/&ct=ga&cd=CAIyGmU4MWY4MmViNmViOTg5MTE6Y29tOmVuOlVT&usg=AFQjCNFmxRZk46CJqFQf4pOozAOo7qTp_A,"Sharing is not believing. People may share and interact with content they know to be inaccurate for a nexus of reasons, such as creating bonds with...",2020-07-22,Health Sharing
"India, US are two vibrant democracies with shared values: PM Modi | Highlights",https://www.google.com/url?rct=j&sa=t&url=https://www.hindustantimes.com/india-news/pm-narendra-modi-at-india-ideas-summit/story-WgbnOcoXAe7mHKPRSQm52J.html&ct=ga&cd=CAIyGmU4MWY4MmViNmViOTg5MTE6Y29tOmVuOlVT&usg=AFQjCNHJa9qfxD6ga1Hy5WkUrHjumPKVpw,"Will be sharing my views on ""Building a Better Future."" Do watch,” PM ... The Healthcare sector in India is growing faster than 22 percent every year.",2020-07-22,Health Sharing
Uber is sharing user data on drivers or riders who may have come into contact with coronavirus ...,https://www.google.com/url?rct=j&sa=t&url=https://www.businessinsider.com/uber-shares-contact-tracing-data-with-public-health-officials-2020-7&ct=ga&cd=CAIyGmU4MWY4MmViNmViOTg5MTE6Y29tOmVuOlVT&usg=AFQjCNFDswiLdxJUr8VZymSHA4zu5L6Prg,This story was delivered to Insider Intelligence Digital Health Briefing subscribers earlier this morning. Insider Intelligence publishes hundreds of...,2020-07-22,Health Sharing
"County, city COVID meeting yields promising results for citizen health",https://www.google.com/url?rct=j&sa=t&url=https://www.navasotaexaminer.com/article/news/county-city-covid-meeting-yields-promising-results-citizen-health&ct=ga&cd=CAIyGmU4MWY4MmViNmViOTg5MTE6Y29tOmVuOlVT&usg=AFQjCNEiV3YeRfNyOFLd4vvsx6sbxBEktw,"He added, “We needed to share what some of the departments and elected officials were trying to get refunded for, or spend money on, and make sure it...",2020-07-22,Health Sharing
AdvaMed launches COVID-19 test registry to address shortages,https://www.google.com/url?rct=j&sa=t&url=https://www.medtechdive.com/news/advamed-launches-covid-19-test-registry-to-address-shortages/582074/&ct=ga&cd=CAIyGmU4MWY4MmViNmViOTg5MTE6Y29tOmVuOlVT&usg=AFQjCNGWF3BNgpx8PFIZKHFY1Bu-vS2FWQ,"... information sharing, and distribution of health and medical resources. ... AdvaMed will use the data to share weekly state and national-level updates...",2020-07-22,Health Sharing
Is Medical Insurance Oone of the Most Important Covers That You Should Get in 2020?,https://www.google.com/url?rct=j&sa=t&url=https://www.techtimes.com/articles/251318/20200722/is-medical-insurance-oone-of-the-most-important-covers-that-you-should-get-in-2020.htm&ct=ga&cd=CAIyHDcyMWE5ZGFiNjRlZGE3MTM6Y29tOmVuOlVTOlI&usg=AFQjCNGcIIJoOGRMthfRcDSGBU2W1VP8Jw,"Anyone with a Medicare Advantage plan, their coronavirus treatment cost-sharing will depend on the type of plan that they have. Medicare Part A and...",2020-07-22,Healthcare Cost Sharing
"Employers give insurers so-so grade in push to drive healthcare quality, value",https://www.google.com/url?rct=j&sa=t&url=https://www.healthcarefinancenews.com/news/employers-give-insurers-so-so-grade-push-drive-healthcare-quality-value&ct=ga&cd=CAIyHDcyMWE5ZGFiNjRlZGE3MTM6Y29tOmVuOlVTOlI&usg=AFQjCNExkOzgBgyCRbPm0dAjufgaaoJj9w,"Aetna recently announced that it is waiving cost-sharing and co-pays for inpatient hospital admissions related to COVID-19. The Coronavirus Aid, Relief...",2020-07-22,Healthcare Cost Sharing
Effects of COVID on Health Insurance,https://www.google.com/url?rct=j&sa=t&url=https://abc7amarillo.com/news/local/affects-of-covid-on-health-insurance&ct=ga&cd=CAIyHDcyMWE5ZGFiNjRlZGE3MTM6Y29tOmVuOlVTOlI&usg=AFQjCNENXN0FhIl_WeiLThEjqDCPDJ191Q,"Butler says there are avenues to pursue like cost sharing programs. ""They are like a big risk pool,"" said Butler. ""You don""t have to have a qualifying...",2020-07-22,Healthcare Cost Sharing
HealthWell Foundation Welcomes New Member to its Board of Directors,https://www.google.com/url?rct=j&sa=t&url=https://finance.yahoo.com/news/healthwell-foundation-welcomes-member-board-140000531.html&ct=ga&cd=CAIyHDcyMWE5ZGFiNjRlZGE3MTM6Y29tOmVuOlVTOlI&usg=AFQjCNEPvOqgIhf3I_vSwPvjR_TlRVeMrQ,... cause out-of-pocket medical expenses to escalate rapidly. HealthWell assists with the treatment-related cost-sharing obligations of these patients.,2020-07-22,Healthcare Cost Sharing
COVID-19 Test Prices Set by Hospitals Range from $20 to $850,https://www.google.com/url?rct=j&sa=t&url=https://revcycleintelligence.com/news/covid-19-test-prices-set-by-hospitals-range-from-20-to-850&ct=ga&cd=CAIyHDcyMWE5ZGFiNjRlZGE3MTM6Y29tOmVuOlVTOlI&usg=AFQjCNHNWbrSv1SDYha50x264skGOGX-0g,"Most health plans must cover COVID-19 testing with no cost-sharing, ... Researchers found that the median price for a COVID-19 diagnostic test was...",2020-07-22,Healthcare Cost Sharing
"Kuwait emir, 91, flies to US for medical care after surgery",https://www.google.com/url?rct=j&sa=t&url=https://www.washingtonpost.com/world/the_americas/kuwait-emir-91-flies-to-us-for-medical-care-after-surgery/2020/07/23/d8c4982a-cc9b-11ea-99b0-8426e26d203b_story.html&ct=ga&cd=CAIyHDc5M2E3YWM0ZTJjZTM4OWY6Y29tOmVuOlVTOlI&usg=AFQjCNFlu-Sb2nhoRgs9olTcPXJ8Z5djDA,"Meanwhile, video shared widely on social media in Kuwait appeared to show an ambulance escorted by heavy security pull up to a U.S. military Boeing...",2020-07-23,Medical Sharing
"Medical Beds and Chairs Market Share, Growth, Statistics, By Application, Production, Revenue ...",https://www.google.com/url?rct=j&sa=t&url=https://jewishlifenews.com/uncategorized/medical-beds-and-chairs-market-share-growth-statistics-by-application-production-revenue-forecast-to-2026/&ct=ga&cd=CAIyHDc5M2E3YWM0ZTJjZTM4OWY6Y29tOmVuOlVTOlI&usg=AFQjCNGexDqqyaRosp7tBwdPVOxPCSggEw,"Medical Beds and Chairs Market Share, Growth, Statistics, By Application, Production, Revenue &amp; Forecast To 2026. Post author By Alex; Post date...",2020-07-22,Medical Sharing
"Sharing Is Caring: Collaboration, Not Competition, In Health Care",https://www.google.com/url?rct=j&sa=t&url=https://www.forbes.com/sites/forbestechcouncil/2020/07/22/sharing-is-caring-collaboration-not-competition-in-health-care/&ct=ga&cd=CAIyHDc5M2E3YWM0ZTJjZTM4OWY6Y29tOmVuOlVTOlI&usg=AFQjCNFL6JqWmLCFcnB6FOdL8QM--ZXEFA,"Because of this shared objective, there has always been an understanding between competing health systems that any useful medical advances and...",2020-07-22,Medical Sharing
Experts say pandemic reveals big cracks in health care data sharing,https://www.google.com/url?rct=j&sa=t&url=https://m.citizensvoice.com/news/coronavirus/experts-say-pandemic-reveals-big-cracks-in-health-care-data-sharing/article_e36f9441-769b-5b5a-8a53-49ec4190437c.html&ct=ga&cd=CAIyHDc5M2E3YWM0ZTJjZTM4OWY6Y29tOmVuOlVTOlI&usg=AFQjCNH7ca-NYayZtRgCti4a489Bau83SQ,"The special, titled “Sharing Data, Saving Lives: The Health Care Interoperability Agenda,” is part of the Wright Center""s Advocacy Day, a national...",2020-07-21,Medical Sharing
