title,link,item_text,date_published,google_alert_name
"Canada still counting on US to share its AstraZeneca stockpile, Trudeau says",https://www.google.com/url?rct=j&sa=t&url=https://www.chroniclejournal.com/news/national/canada-still-counting-on-u-s-to-share-its-astrazeneca-stockpile-trudeau-says/article_6a1dfc30-5693-5bab-8e2b-9e388e024422.html&ct=ga&cd=CAIyHDc5M2E3YWM0ZTJjZTM4OWY6Y29tOmVuOlVTOlI&usg=AFQjCNHl9u_P7iBcFRkppS_L9uxYgGqUSA,"None of those will be available for export until cleared by the Food and Drug Administration. ""I think we""ll be in a position to be able to share vaccines as...",2021-04-27,Medical Sharing
Deploying an Agile Method in Digital Medical Device Design,https://www.google.com/url?rct=j&sa=t&url=https://www.mddionline.com/design-engineering/deploying-agile-method-digital-medical-device-design&ct=ga&cd=CAIyHDc5M2E3YWM0ZTJjZTM4OWY6Y29tOmVuOlVTOlI&usg=AFQjCNEFd1XjMM6MMJC7J8U8q0prDM_Jxg,"Such an iterative approach to medical device design could help identify unmet needs and new solutions, shared an MD&amp;M BIOMEDigital speaker.",2021-04-27,Medical Sharing
Insurance department settles with “healthcare-sharing” companies accused of scam plans,https://www.google.com/url?rct=j&sa=t&url=https://www.hartfordbusiness.com/article/insurance-department-settles-with-healthcare-sharing-companies-accused-of-scam-plans&ct=ga&cd=CAIyHDc5M2E3YWM0ZTJjZTM4OWY6Y29tOmVuOlVTOlI&usg=AFQjCNHAT7z2vsX4X4HVwWLkijN8wD5oXA,"Operating without a license, Aliera had been offering plans in Connecticut on behalf of Trinity Healthshare, a “healthcare-sharing ministry” marketed to...",2021-04-27,Medical Sharing
"Centene (CNC) Q1 Earnings Miss Estimates, Hikes ""21 View",https://www.google.com/url?rct=j&sa=t&url=https://www.nasdaq.com/articles/centene-cnc-q1-earnings-miss-estimates-hikes-21-view-2021-04-27&ct=ga&cd=CAIyHDc5M2E3YWM0ZTJjZTM4OWY6Y29tOmVuOlVTOlI&usg=AFQjCNFY_wgFzc2P3pwoHLvCfk5poIyY5w,The reason can primarily be attributed to reduced medical utilization trends ... Tenet Healthcare Corporation (THC): Free Stock Analysis Report,2021-04-27,Medical Sharing
"Clearity Health, A Crowdsourced Search Engine For Local Healthcare Prices, Launches And Calls ...",https://www.google.com/url?rct=j&sa=t&url=https://www.prnewswire.com/news-releases/clearity-health-a-crowdsourced-search-engine-for-local-healthcare-prices-launches-and-calls-for-medical-bills-301277222.html&ct=ga&cd=CAIyHDc5M2E3YWM0ZTJjZTM4OWY6Y29tOmVuOlVTOlI&usg=AFQjCNGIznqwbDXlW50ukmgY_1BvHFS1QQ,"Share this article ... AUSTIN, Texas, April 27, 2021 /PRNewswire/ -- Clearity Health, a new organization created by successful local founders and medical...",2021-04-27,Medical Sharing
Globus Medical (GMED) to Release Earnings on Tuesday,https://www.google.com/url?rct=j&sa=t&url=https://www.marketbeat.com/instant-alerts/nyse-gmed-earnings-date-2021-04-2-3/&ct=ga&cd=CAIyHDc5M2E3YWM0ZTJjZTM4OWY6Y29tOmVuOlVTOlI&usg=AFQjCNFOsv_aKJgRTQIKi4-bWYfycVbegA,"Analysts expect Globus Medical to post earnings of $0.36 per share for the quarter. Persons that are interested in registering for the company""s...",2021-04-27,Medical Sharing
Top Ways to Improve Healthcare Supply Chain Resilience,https://www.google.com/url?rct=j&sa=t&url=https://www.healthcaretechoutlook.com/news/top-ways-to-improve-healthcare-supply-chain-resilience-nid-2349.html&ct=ga&cd=CAIyHDc5M2E3YWM0ZTJjZTM4OWY6Y29tOmVuOlVTOlI&usg=AFQjCNGPSElwpAci5Cun2VyLg-VlPieIZQ,"Healthcare supply chains can build a holistic view of vital medical supplies by improving collaboration, knowledge sharing, and coordination among...",2021-04-27,Medical Sharing
Harry and Meghan to lead Vax Live fundraising concert,https://www.google.com/url?rct=j&sa=t&url=https://www.wbrz.com/news/harry-and-meghan-to-lead-vax-live-fundraising-concert&ct=ga&cd=CAIyHDc5M2E3YWM0ZTJjZTM4OWY6Y29tOmVuOlVTOlI&usg=AFQjCNG624iCHuQVNej1_eWktfLiMPE1fg,"Share: Prince Harry and Meghan will serve as the campaign chairs of Global Citizen""s effort to deliver COVID-19 vaccines to medical workers in the...",2021-04-27,Medical Sharing
"Harry and Meghan to lead ""Vax Live"" fundraising concert",https://www.google.com/url?rct=j&sa=t&url=http://www.wcnc.com/article/news/health/coronavirus/vaccine/harry-meghan-lead-vax-live-fundraising-concert/507-6b40cbf9-415a-442b-8dbe-c37ef8340957&ct=ga&cd=CAIyHDc5M2E3YWM0ZTJjZTM4OWY6Y29tOmVuOlVTOlI&usg=AFQjCNF3RKiMo_RfuYAKHdh5aCRDxjwUsg,... hopes to produce $19 billion to pay for the vaccines for medical workers. ... “With the European vaccine sharing mechanism via the COVAX initiative...,2021-04-27,Medical Sharing
"Harry and Meghan to lead ""Vax Live"" fundraising concert",https://www.google.com/url?rct=j&sa=t&url=https://www.seattletimes.com/business/harry-and-meghan-to-lead-vax-live-fundraising-concert/&ct=ga&cd=CAIyHDc5M2E3YWM0ZTJjZTM4OWY6Y29tOmVuOlVTOlI&usg=AFQjCNE_5fyNX_raY12IsZgppJV322zBQg,"“Last autumn, I called for the sharing of the doses ordered by our countries, to ensure both solidarity and health security,” Macron said in a statement.",2021-04-27,Medical Sharing
"Yoga For Skin: Malaika Arora Shares Three Yoga Poses For Healthy, Glowing Skin",https://www.google.com/url?rct=j&sa=t&url=https://www.ndtv.com/health/yoga-for-skin-malaika-arora-shares-three-yoga-poses-for-healthy-glowing-skin-2422983&ct=ga&cd=CAIyHDc5M2E3YWM0ZTJjZTM4OWY6Y29tOmVuOlVTOlI&usg=AFQjCNFUAnE4k1MQeYlBW-rC4N_oHzP6TQ,"In her recent video, she shared three simple Yoga asanas (poses) with her Instagram followers that will help achieve healthy skin. The video, which is...",2021-04-27,Medical Sharing
3 big challenges to team-based care during the pandemic,https://www.google.com/url?rct=j&sa=t&url=https://www.ama-assn.org/practice-management/scope-practice/3-big-challenges-team-based-care-during-pandemic&ct=ga&cd=CAIyHDc5M2E3YWM0ZTJjZTM4OWY6Y29tOmVuOlVTOlI&usg=AFQjCNFRmm8XGrgCbr8AByQuJfNOm0y5WQ,"... order, documentation inaccuracy, working in the wrong patient""s chart, inadvertently sharing protected health information with the wrong patient.",2021-04-27,Medical Sharing
"Baylor College Of Medicine Selects Sectra""s Digital Pathology Solution For Primary Diagnostics",https://www.google.com/url?rct=j&sa=t&url=https://www.prnewswire.com/news-releases/baylor-college-of-medicine-selects-sectras-digital-pathology-solution-for-primary-diagnostics-301277830.html&ct=ga&cd=CAIyHDc5M2E3YWM0ZTJjZTM4OWY6Y29tOmVuOlVTOlI&usg=AFQjCNG2v5rtTu9D_d293Fcic3Govlqjvg,"SHELTON, Conn., April 27, 2021 /PRNewswire/ -- International medical ... ""Sectra and Baylor College of Medicine have a shared vision of providing...",2021-04-27,Medical Sharing
"The Rounds Launches ResilienceRx, Highlighting the Need for Physician Mental Health and ...",https://www.google.com/url?rct=j&sa=t&url=https://finance.yahoo.com/news/rounds-launches-resiliencerx-highlighting-physician-120000098.html&ct=ga&cd=CAIyHDc5M2E3YWM0ZTJjZTM4OWY6Y29tOmVuOlVTOlI&usg=AFQjCNEt3hv3NXlWi_ZwN-KgaW1hDKP-wg,"ResilienceRx – By The Rounds, will Break Down Geographic Barriers and Provide Physicians with a Private Forum for Discussion, Sharing, Learning,...",2021-04-27,Medical Sharing
Women Get Vulgar Messages After Sharing Phone Number for COVID Help,https://www.google.com/url?rct=j&sa=t&url=https://www.sentinelassam.com/national-news/women-get-vulgar-messages-after-sharing-phone-number-for-covid-help-535753&ct=ga&cd=CAIyHDc5M2E3YWM0ZTJjZTM4OWY6Y29tOmVuOlVTOlI&usg=AFQjCNGKheC678ecj8f5hAhxcgxyR0eBXA,"There have been reports of acute shortages of hospital beds, medical oxygen, and vital life-saving drugs from across the country with needy COVID-19...",2021-04-27,Medical Sharing
Pastor sharing importance of love during pandemic,https://www.google.com/url?rct=j&sa=t&url=https://chvnradio.com/articles/pastor-sharing-importance-of-love-during-pandemic&ct=ga&cd=CAIyHDc5M2E3YWM0ZTJjZTM4OWY6Y29tOmVuOlVTOlI&usg=AFQjCNFxyA_m119UIz67I7RHL5dYhU0ZNQ,A pastor is frustrated seeing Christians use Bible verses to justify not following the Public Health Orders. People have been gathering in large groups...,2021-04-27,Medical Sharing
"Sectra""s digital pathology solution chosen by US healthcare provider for primary diagnostics",https://www.google.com/url?rct=j&sa=t&url=https://finance.yahoo.com/news/sectras-digital-pathology-solution-chosen-065400764.html&ct=ga&cd=CAIyHDc5M2E3YWM0ZTJjZTM4OWY6Y29tOmVuOlVTOlI&usg=AFQjCNGfaMslTuAY4gzA5bcjM6EhCZN8qw,"""Sectra and Baylor College of Medicine have a shared vision of providing digital pathology services without geographic limitations,"" says Vice...",2021-04-27,Medical Sharing
