title,link,item_text,date_published,google_alert_name
Can Maine Cover the Cost of Christian School Tuition? - Baptist News Global,https://www.google.com/url?rct=j&sa=t&url=https://baptistnews.com/article/can-maine-cover-the-cost-of-christian-school-tuition/&ct=ga&cd=CAIyHDBlMjQ2MGY3Y2I3NmE2NTQ6Y29tOmVuOlVTOlI&usg=AFQjCNFhjYLw-iUEwgFtpmM1DuT9sJKBKw,"... SAUs for short) contract with and pay tuition costs to another nearby school of the parents"" choice—public or private. AddThis Sharing Buttons.",2021-12-07,Christian Cost-Sharing
"Kentucky judge hits health care sharing ""ministry"" with $4.7M judgment - Courier-Journal",https://www.google.com/url?rct=j&sa=t&url=https://www.courier-journal.com/story/news/crime/2021/12/07/kentucky-judge-slaps-health-care-sharing-ministry-with-judgment/8835863002/&ct=ga&cd=CAIyHDcwNjg0ZGMwOTMxYjI0NDM6Y29tOmVuOlVTOlI&usg=AFQjCNF-zX4jRu1pBnl8JUatjc4HePk2nA,"— When Austin Willard, a committed Christian, left his job at a campus outreach ministry to start his own business and needed to find health care...",2021-12-07,Christian Health Care Sharing
"Kentucky judge hits health care sharing ""ministry"" with $4.7M judgment - Courier-Journal",https://www.google.com/url?rct=j&sa=t&url=https://www.courier-journal.com/story/news/crime/2021/12/07/kentucky-judge-slaps-health-care-sharing-ministry-with-judgment/8835863002/&ct=ga&cd=CAIyHDBlYjRmZTFlNDk3NWE4OGE6Y29tOmVuOlVTOlI&usg=AFQjCNF-zX4jRu1pBnl8JUatjc4HePk2nA,"LOUISVILLE, Ky. — When Austin Willard, a committed Christian, left his job at a campus outreach ministry to start his own business and needed to...",2021-12-08,Christian Sharing Ministry
"Police on scene of Moscow shooting that killed two, injured four | AFP - YouTube",https://www.google.com/url?rct=j&sa=t&url=https://www.youtube.com/watch%3Fv%3DNouJQ7U3qps&ct=ga&cd=CAIyHGVmMjU5ZGE1NWJkYjU0NjU6Y29tOmVuOlVTOlI&usg=AFQjCNGcyotfKS6XWcgK0Phts3pL8DxNAw,The Russian interior ministry said the attacker was a 45-year-old ... Health Care Sharing Ministries: Last Week Tonight with John Oliver (HBO).,2021-12-07,Health Care Sharing Ministry
Navy To Address Honolulu Drinking Water Fuel Contamination Issue | Kaiser Health News,https://www.google.com/url?rct=j&sa=t&url=https://khn.org/morning-breakout/navy-to-address-honolulu-drinking-water-fuel-contamination-issue/&ct=ga&cd=CAIyHGVmMjU5ZGE1NWJkYjU0NjU6Y29tOmVuOlVTOlI&usg=AFQjCNFbEi-rRJd147L63rIzZSA2x1oenw,"Willard, of Lexington, Kentucky, signed up in 2018 for what is known as a ""health care sharing ministry"" in which members of the same faith share...",2021-12-07,Health Care Sharing Ministry
"Biden""s at-home test directive will need to prevent price gouging and abuse, local health players say",https://www.google.com/url?rct=j&sa=t&url=https://www.crainsnewyork.com/health-pulse/bidens-home-test-directive-will-need-prevent-price-gouging-and-abuse-local-health&ct=ga&cd=CAIyHDQ1NzZkZjdlYTEzZTg0YTA6Y29tOmVuOlVTOlI&usg=AFQjCNG7IHDc6_e0N9c-Xe3_CNP4cKsd6Q,"15 to health plans about reimbursing individuals with private ... zero cost-sharing for covered individuals, an association spokeswoman said.",2021-12-08,Health Cost Sharing
"Deep Dive (Dec. 7): Biden Reinstates ""Remain in Mexico"" Policy - The Epoch Times",https://www.google.com/url?rct=j&sa=t&url=https://m.theepochtimes.com/deep-dive-dec-7-biden-reinstates-remain-in-mexico-policy_4144260.html&ct=ga&cd=CAIyHDQ1NzZkZjdlYTEzZTg0YTA6Y29tOmVuOlVTOlI&usg=AFQjCNFnpMam4yqLaSF9kG9uX_oFuifnZw,"... we are going to cap cost sharing of insulin at $35 per month.” Second, Biden says the bill would help people get health insurance.",2021-12-08,Health Cost Sharing
"Illinois Democrat files measure to punish unvaccinated for ""clogging up health care system""",https://www.google.com/url?rct=j&sa=t&url=https://nypost.com/2021/12/07/illinois-democrat-files-measure-to-punish-unvaccinated-for-clogging-up-health-care-system/&ct=ga&cd=CAIyHDQ1NzZkZjdlYTEzZTg0YTA6Y29tOmVuOlVTOlI&usg=AFQjCNELaxO6Mw4CM6fT6CRh5bOWqi6Qxw,"The measure, set forth by State Rep. Jonathan Carroll, comes alongside news that the average coronavirus hospitalization cost is now $24033.",2021-12-07,Health Cost Sharing
Vermont Adopts Emergency Rule Expanding Insurance Coverage for Covid-19 Rapid At ...,https://www.google.com/url?rct=j&sa=t&url=https://governor.vermont.gov/press-release/vermont-adopts-emergency-rule-expanding-insurance-coverage-covid-19-rapid-home-tests&ct=ga&cd=CAIyHDQ1NzZkZjdlYTEzZTg0YTA6Y29tOmVuOlVTOlI&usg=AFQjCNEkgBVbDtR4f7auoCT9-ZqoDRQCKA,The emergency rule requires health insurers to cover the retail purchase of most FDA-authorized COVID-19 antigen tests without cost-sharing for...,2021-12-07,Health Cost Sharing
Pro Bankruptcy Briefing: Mallinckrodt Beats Health Insurers; Health Ministry Members Hit Back,https://www.google.com/url?rct=j&sa=t&url=https://www.wsj.com/articles/pro-bankruptcy-briefing-mallinckrodt-beats-health-insurers-health-ministry-members-hit-back-sacklers-deny-bankruptcy-abuse-11638884952&ct=ga&cd=CAIyHDQ1NzZkZjdlYTEzZTg0YTA6Y29tOmVuOlVTOlI&usg=AFQjCNFs5ezhvrR6SJaRgGz5Uo-H7YUG2Q,"Members of a defunct healthcare cost-sharing group want its administrator in bankruptcy. And Purdue Pharma""s Sackler family owners denied abusing...",2021-12-07,Health Cost Sharing
Hospitals turn to fintech as reliance on patient out-of-pocket spending grows | Modern Healthcare,https://www.google.com/url?rct=j&sa=t&url=https://www.modernhealthcare.com/technology/hospitals-turn-fintech-reliance-patient-out-pocket-spending-grows&ct=ga&cd=CAIyHDQ1NzZkZjdlYTEzZTg0YTA6Y29tOmVuOlVTOlI&usg=AFQjCNGea9iK_x2N0y4iktv_jvA4Zs3pJg,Health insurance policies require patients to shoulder a greater and greater share of medical expenses out of pocket. The government is pushing...,2021-12-07,Health Cost Sharing
County-Level Analysis Finds ACA Premiums are Falling in Many Areas of the Country ...,https://www.google.com/url?rct=j&sa=t&url=https://www.kff.org/private-insurance/press-release/county-level-analysis-finds-aca-premiums-are-falling-in-many-areas-of-the-country-though-changes-vary-by-county-and-type-of-plan/&ct=ga&cd=CAIyHDQ1NzZkZjdlYTEzZTg0YTA6Y29tOmVuOlVTOlI&usg=AFQjCNHJYR41e-MfDxhRi34Ve105P5o1Xw,"Such plans typically have high cost-sharing requirements but provide ... about open enrollment, the health insurance marketplaces and the ACA.",2021-12-07,Health Cost Sharing
How ACA Marketplace Premiums Are Changing by County in 2022 | KFF,https://www.google.com/url?rct=j&sa=t&url=https://www.kff.org/private-insurance/issue-brief/how-aca-marketplace-premiums-are-changing-by-county-in-2022/&ct=ga&cd=CAIyHDQ1NzZkZjdlYTEzZTg0YTA6Y29tOmVuOlVTOlI&usg=AFQjCNHqErT5pbcybMpt4nHl-qk2s4VtGw,"In an earlier analysis of insurer rate filings, we found that health ... These low-income enrollees also qualify for additional cost-sharing...",2021-12-07,Health Cost Sharing
Michigan Health Information Network Shared Services Appoints Three New Members to ...,https://www.google.com/url?rct=j&sa=t&url=https://www.bdtonline.com/news/nation_world/michigan-health-information-network-shared-services-appoints-three-new-members-to-board-of-directors/article_2cd8b749-94be-5eb9-b4d0-74a3c0acb1f6.html&ct=ga&cd=CAIyHDQ1NzZkZjdlYTEzZTg0YTA6Y29tOmVuOlVTOlI&usg=AFQjCNGLmOKGPhVaJAOyayyVUxbEM1R0vA,"07, 2021 (GLOBE NEWSWIRE) -- Michigan Health Information Network ... by sharing electronic health information statewide, helping reduce costs for...",2021-12-07,Health Cost Sharing
"Khichdi for weight loss, insomnia, detox: Ayurveda expert on many health benefits of Khichdi",https://www.google.com/url?rct=j&sa=t&url=https://www.hindustantimes.com/lifestyle/health/how-khichdi-can-help-with-diabetes-weight-loss-sleep-ayurveda-expert-shares-101638946086045.html&ct=ga&cd=CAIyGmU4MWY4MmViNmViOTg5MTE6Y29tOmVuOlVT&usg=AFQjCNEJqicm6-gfBOfS3MIa-J1vJ355Fw,"Ayurveda expert Dr Dixa Bhavsar who keeps sharing useful home remedies, tips and Ayurveda facts on her social media took to Instagram to share how...",2021-12-08,Health Sharing
African Union calls for end to Omicron travel curbs on some African nations | Reuters,https://www.google.com/url?rct=j&sa=t&url=https://www.reuters.com/world/africa/african-union-calls-end-omicron-travel-curbs-some-african-nations-2021-12-07/&ct=ga&cd=CAIyGmU4MWY4MmViNmViOTg5MTE6Y29tOmVuOlVT&usg=AFQjCNGKaRKZQsgbzN7HXvWUAuBbA7U0Xg,"... of its member states, saying the measures effectively penalize governments for timely data sharing in line with international health regulations.",2021-12-08,Health Sharing
Rep. Ragan responds after state medical board deletes policy restricting doctors from ... - WBIR.com,https://www.google.com/url?rct=j&sa=t&url=https://www.wbir.com/article/news/politics/rep-ragan-responds-after-state-medical-board-deletes-policy-restricting-doctors-from-sharing-covid-19-misinformation/51-bc7959db-82d4-4d7b-8302-b1989422045d&ct=ga&cd=CAIyGmU4MWY4MmViNmViOTg5MTE6Y29tOmVuOlVT&usg=AFQjCNEHn2i_6l8UaCjdLb53G9V45PIp3Q,"The policy said that sharing COVID-19 vaccine misinformation contradicted that responsibility, and threatened to cause patients to distrust medical...",2021-12-08,Health Sharing
Holiday season brings a spike in mental health and addiction problems - KSN-TV,https://www.google.com/url?rct=j&sa=t&url=https://www.ksn.com/news/health/holiday-season-brings-a-spike-in-mental-health-and-addiction-problems/&ct=ga&cd=CAIyGmU4MWY4MmViNmViOTg5MTE6Y29tOmVuOlVT&usg=AFQjCNGp8axbaDQAnuYaKBmTYmb1UILpig,"According to the National Center for Health Statistics, there has been a 30% jump in Americans ... Better Health &amp; Wellness ... Share this story.",2021-12-08,Health Sharing
"Chicago Torture Justice Center Raising Funds To Move To Closed Woodlawn Clinic, Serve ...",https://www.google.com/url?rct=j&sa=t&url=https://blockclubchicago.org/2021/12/07/chicago-torture-justice-center-raising-funds-to-move-to-closed-woodlawn-clinic-serve-survivors-of-police-violence/&ct=ga&cd=CAIyGmU4MWY4MmViNmViOTg5MTE6Y29tOmVuOlVT&usg=AFQjCNFFYuSElx4oISLQvpYBqiLxKTPtag,"Woodlawn Health Center, 6337 S. Woodlawn Ave., on Dec. ... occupy about 75 percent of the Woodlawn Health Center, sharing space with Thresholds,...",2021-12-08,Health Sharing
Houston testing wastewater at 60 schools for omicron variant | khou.com,https://www.google.com/url?rct=j&sa=t&url=https://www.khou.com/article/news/health/coronavirus/houston-health-department-school-wastewater-testing/285-cbc03b40-1716-4c68-898b-00bd7ca0ab03&ct=ga&cd=CAIyGmU4MWY4MmViNmViOTg5MTE6Y29tOmVuOlVT&usg=AFQjCNFMQ6RWcBPBRzTi7Umh2-k4PTnN4A,"Houston Health Department crews testing wastewater at dozens of schools for omicron variant. They""ll also conduct tests at Houston-area nursing homes...",2021-12-08,Health Sharing
"US not sharing details on ""MPP 2.0,"" but ports of entry remain off-limits to asylum-seekers, sources say",https://www.google.com/url?rct=j&sa=t&url=https://www.wsav.com/border-report-tour/u-s-not-sharing-details-on-mpp-2-0-but-ports-of-entry-remain-off-limits-to-asylum-seekers-sources-say/&ct=ga&cd=CAIyGmU4MWY4MmViNmViOTg5MTE6Y29tOmVuOlVT&usg=AFQjCNHiHBKNlQD1c0dYw04ACu4GChGhWg,"The Biden administration kept in place the Centers for Disease Control and Prevention""s Title 42 public health order allowing CBP to immediately...",2021-12-08,Health Sharing
"Texas Sisters Launch Children""s Book Sharing Latinx Comida, Cultura, and Familia with the ...",https://www.google.com/url?rct=j&sa=t&url=https://www.prnewswire.com/news-releases/texas-sisters-launch-childrens-book-sharing-latinx-comida-cultura-and-familia-with-the-magic-of-nestle-abuelita-301438960.html&ct=ga&cd=CAIyGmU4MWY4MmViNmViOTg5MTE6Y29tOmVuOlVT&usg=AFQjCNFaJYTKUcLQvZ_-GXvh5DKlumcNtg,"PRNewswire/ -- Latinx sisters, Chef Cariño and Paloma Cortez, launch ""Camilla la Magica Makes Tamales,"" and announce a festive collaboration with...",2021-12-08,Health Sharing
"Dept. of Public Health Commissioner discusses the state""s increased COVID-19 positivity rate",https://www.google.com/url?rct=j&sa=t&url=https://www.wtnh.com/news/health/coronavirus/dept-of-public-health-commissioner-discusses-the-states-increased-covid-19-positivity-rate/&ct=ga&cd=CAIyGmU4MWY4MmViNmViOTg5MTE6Y29tOmVuOlVT&usg=AFQjCNE4NXCbeFNb35zuxuKZwB9lz2s6HA,"Connecticut""s Department of Public Health Commissioner told News 8 she isn""t surprised. “So, this higher positivity rate is ... Share this story.",2021-12-08,Health Sharing
"The December disconnect: Why COVID alone is not to blame for Manitoba""s newest ICU crisis - CBC",https://www.google.com/url?rct=j&sa=t&url=https://www.cbc.ca/news/canada/manitoba/the-december-disconnect-why-covid-alone-is-not-to-blame-for-manitoba-s-newest-icu-crisis-1.6276058&ct=ga&cd=CAIyGmU4MWY4MmViNmViOTg5MTE6Y29tOmVuOlVT&usg=AFQjCNEQeK7XfvKQhLsol8axC2QzN3eFWg,Manitoba Health Minister Audrey Gordon says Manitoba can ramp up ICU capacity well above what it is right now. Shared Health says that capacity is...,2021-12-08,Health Sharing
"Health, Community and Government Leaders to Outline Actions to Prevent Gun Violence at ...",https://www.google.com/url?rct=j&sa=t&url=https://www.businesswire.com/news/home/20211207005910/en/Health-Community-and-Government-Leaders-to-Outline-Actions-to-Prevent-Gun-Violence-at-Northwell-Health%25E2%2580%2599s-Annual-Forum&ct=ga&cd=CAIyGmU4MWY4MmViNmViOTg5MTE6Y29tOmVuOlVT&usg=AFQjCNFupRAPaBzt7q8tX376MwhMIOgLiQ,Rice will share insight around the $5 billion in the “Build Back Better” plan and how it could be used to help reduce gun deaths through hospital and...,2021-12-08,Health Sharing
"A TikTok star shared his weight loss with his followers. He was called ""fatphobic."" - NBC News",https://www.google.com/url?rct=j&sa=t&url=https://www.nbcnews.com/pop-culture/pop-culture-news/tiktok-star-shared-weight-loss-followers-was-called-fatphobic-rcna7892&ct=ga&cd=CAIyGmU4MWY4MmViNmViOTg5MTE6Y29tOmVuOlVT&usg=AFQjCNETfKpPL0lEkm7qbk51-iaYo-6lww,"“This is for my personal health and I""m not trying to take a stand on any sort of scientific evaluation or studies done,” TikTok star Mark Gaetano...",2021-12-08,Health Sharing
Sharing your story to help others: 9 Islanders complete new peer support training | CBC News,https://www.google.com/url?rct=j&sa=t&url=https://www.cbc.ca/news/canada/prince-edward-island/pei-peer-support-training-graduates-1.6276512&ct=ga&cd=CAIyGmU4MWY4MmViNmViOTg5MTE6Y29tOmVuOlVT&usg=AFQjCNHx0386bRe53ooRA9A46KPi-Hnuuw,"""We learned our proper boundaries, how to tell our story safely,"" said Belanger-Birt, who runs the program with the Canadian Mental Health...",2021-12-08,Health Sharing
"Harris pushes for expansion of maternal healthcare, Medicaid - Los Angeles Times",https://www.google.com/url?rct=j&sa=t&url=https://www.latimes.com/politics/story/2021-12-07/vice-president-harris-urges-senate-to-keep-maternal-health-in-spending-package&ct=ga&cd=CAIyGmU4MWY4MmViNmViOTg5MTE6Y29tOmVuOlVT&usg=AFQjCNFXIWO9UcDIgcni43RiWTM2MQLBTA,"Harris pushes for expansion of maternal healthcare, Medicaid postpartum coverage &middot; Facebook &middot; Twitter &middot; Show more sharing options.",2021-12-07,Health Sharing
Southwest General Health Center updates visitor restriction policy amid rise of COVID-19 ... - WKYC,https://www.google.com/url?rct=j&sa=t&url=https://www.wkyc.com/article/news/health/coronavirus/southwest-general-health-center-announces-visitation-change-amid-rise-covid-19-cases/95-b03414c3-9738-48b0-846d-e184036fd444&ct=ga&cd=CAIyGmU4MWY4MmViNmViOTg5MTE6Y29tOmVuOlVT&usg=AFQjCNFAvP-wAjzht60WZH1t_hFzqojELA,Southwest General Health Center has moved its COVID-19 visitor restriction status up to the orange level due to the rise of cases in the Northeast...,2021-12-07,Health Sharing
"Illinois Democrat files measure to punish unvaccinated for ""clogging up health care system""",https://www.google.com/url?rct=j&sa=t&url=https://nypost.com/2021/12/07/illinois-democrat-files-measure-to-punish-unvaccinated-for-clogging-up-health-care-system/&ct=ga&cd=CAIyGmU4MWY4MmViNmViOTg5MTE6Y29tOmVuOlVT&usg=AFQjCNELaxO6Mw4CM6fT6CRh5bOWqi6Qxw,... claims the unvaccinated are “clogging up the health care system” has proposed a bill ... Lady Gaga Shared This Blunt Reaction To Rittenhouse...,2021-12-07,Health Sharing
Surgeon general warns of mental health challenges confronting youth - CBS 42,https://www.google.com/url?rct=j&sa=t&url=https://www.cbs42.com/news/surgeon-general-warns-of-mental-health-challenges-confronting-youth/&ct=ga&cd=CAIyGmU4MWY4MmViNmViOTg5MTE6Y29tOmVuOlVT&usg=AFQjCNFwUisGOIQ5hYRdoUTAa-IO9q4q5w,U.S. Surgeon General Vivek Murthy has issued a public health advisory about mental health challenges young people are ... Share this story.,2021-12-07,Health Sharing
VIDANT HEALTH: 21 employees did not meet vaccine mandate deadline - WITN,https://www.google.com/url?rct=j&sa=t&url=https://www.witn.com/2021/12/07/vidant-health-21-employees-did-not-meet-vaccine-mandate-deadline/&ct=ga&cd=CAIyGmU4MWY4MmViNmViOTg5MTE6Y29tOmVuOlVT&usg=AFQjCNFetQ6RwmGEaXek-Et5WC4undDcdg,The hospital system said it could not break down which hospitals the 21 employees were employed in because the numbers were so small that sharing...,2021-12-07,Health Sharing
Joe Biden Is Dragging His Feet on Sharing Vaccine Information With the World - Jacobin,https://www.google.com/url?rct=j&sa=t&url=https://jacobinmag.com/2021/12/joe-biden-is-dragging-his-feet-on-sharing-vaccine-information-with-the-world&ct=ga&cd=CAIyGmU4MWY4MmViNmViOTg5MTE6Y29tOmVuOlVT&usg=AFQjCNFwkR8rHm7kSBnTFnq0ZZjgtnr7xA,"Experts say the US Department of Health and Human Services (HHS) has long possessed Moderna""s vaccine recipe, including step-by-step instructions for...",2021-12-07,Health Sharing
New lab to treat heart rhythm disturbances at Penn State Health St. Joseph,https://www.google.com/url?rct=j&sa=t&url=https://www.psu.edu/news/hershey/story/new-lab-treat-heart-rhythm-disturbances-penn-state-health-st-joseph/&ct=ga&cd=CAIyGmU4MWY4MmViNmViOTg5MTE6Y29tOmVuOlVT&usg=AFQjCNEE7Y8FytxgsU0yAs8poscoysd2UQ,Expanded facility is part of a $13.5 million upgrade to heart and vascular services &middot; Share to Facebook &middot; Share to Twitter &middot; Share to Email &middot; Share to...,2021-12-07,Health Sharing
Michigan Health Information Network Shared Services Appoints Three New Members to ...,https://www.google.com/url?rct=j&sa=t&url=https://www.bdtonline.com/news/nation_world/michigan-health-information-network-shared-services-appoints-three-new-members-to-board-of-directors/article_2cd8b749-94be-5eb9-b4d0-74a3c0acb1f6.html&ct=ga&cd=CAIyHDcyMWE5ZGFiNjRlZGE3MTM6Y29tOmVuOlVTOlI&usg=AFQjCNGLmOKGPhVaJAOyayyVUxbEM1R0vA,"07, 2021 (GLOBE NEWSWIRE) -- Michigan Health Information Network ... by sharing electronic health information statewide, helping reduce costs for...",2021-12-07,Healthcare Cost Sharing
How ACA Marketplace Premiums Are Changing by County in 2022 | KFF,https://www.google.com/url?rct=j&sa=t&url=https://www.kff.org/private-insurance/issue-brief/how-aca-marketplace-premiums-are-changing-by-county-in-2022/&ct=ga&cd=CAIyHDcyMWE5ZGFiNjRlZGE3MTM6Y29tOmVuOlVTOlI&usg=AFQjCNHqErT5pbcybMpt4nHl-qk2s4VtGw,"In an earlier analysis of insurer rate filings, we found that health ... These low-income enrollees also qualify for additional cost-sharing...",2021-12-07,Healthcare Cost Sharing
County-Level Analysis Finds ACA Premiums are Falling in Many Areas of the Country ...,https://www.google.com/url?rct=j&sa=t&url=https://www.kff.org/private-insurance/press-release/county-level-analysis-finds-aca-premiums-are-falling-in-many-areas-of-the-country-though-changes-vary-by-county-and-type-of-plan/&ct=ga&cd=CAIyHDcyMWE5ZGFiNjRlZGE3MTM6Y29tOmVuOlVTOlI&usg=AFQjCNHJYR41e-MfDxhRi34Ve105P5o1Xw,"Such plans typically have high cost-sharing requirements but provide ... about open enrollment, the health insurance marketplaces and the ACA.",2021-12-07,Healthcare Cost Sharing
Pro Bankruptcy Briefing: Mallinckrodt Beats Health Insurers; Health Ministry Members Hit Back,https://www.google.com/url?rct=j&sa=t&url=https://www.wsj.com/articles/pro-bankruptcy-briefing-mallinckrodt-beats-health-insurers-health-ministry-members-hit-back-sacklers-deny-bankruptcy-abuse-11638884952&ct=ga&cd=CAIyHDcyMWE5ZGFiNjRlZGE3MTM6Y29tOmVuOlVTOlI&usg=AFQjCNFs5ezhvrR6SJaRgGz5Uo-H7YUG2Q,"Members of a defunct healthcare cost-sharing group want its administrator in bankruptcy. And Purdue Pharma""s Sackler family owners denied abusing...",2021-12-07,Healthcare Cost Sharing
Hospitals turn to fintech as reliance on patient out-of-pocket spending grows | Modern Healthcare,https://www.google.com/url?rct=j&sa=t&url=https://www.modernhealthcare.com/technology/hospitals-turn-fintech-reliance-patient-out-pocket-spending-grows&ct=ga&cd=CAIyHDcyMWE5ZGFiNjRlZGE3MTM6Y29tOmVuOlVTOlI&usg=AFQjCNGea9iK_x2N0y4iktv_jvA4Zs3pJg,Health insurance policies require patients to shoulder a greater and greater share of medical expenses out of pocket. The government is pushing...,2021-12-07,Healthcare Cost Sharing
Rep. Ragan responds after state medical board deletes policy restricting doctors from ... - WBIR.com,https://www.google.com/url?rct=j&sa=t&url=https://www.wbir.com/article/news/politics/rep-ragan-responds-after-state-medical-board-deletes-policy-restricting-doctors-from-sharing-covid-19-misinformation/51-bc7959db-82d4-4d7b-8302-b1989422045d&ct=ga&cd=CAIyHDc5M2E3YWM0ZTJjZTM4OWY6Y29tOmVuOlVTOlI&usg=AFQjCNEHn2i_6l8UaCjdLb53G9V45PIp3Q,"The policy said that sharing COVID-19 vaccine misinformation contradicted that responsibility, and threatened to cause patients to distrust medical...",2021-12-08,Medical Sharing
"Harris pushes for expansion of maternal healthcare, Medicaid - Los Angeles Times",https://www.google.com/url?rct=j&sa=t&url=https://www.latimes.com/politics/story/2021-12-07/vice-president-harris-urges-senate-to-keep-maternal-health-in-spending-package&ct=ga&cd=CAIyHDc5M2E3YWM0ZTJjZTM4OWY6Y29tOmVuOlVTOlI&usg=AFQjCNFXIWO9UcDIgcni43RiWTM2MQLBTA,"Vice President Kamala Harris urges Congress to keep maternal health in the spending package, calls on states to expand Medicaid postpartum...",2021-12-07,Medical Sharing
"Faculty, staff and learners find community amid COVID-19 - Michigan Medicine Headlines",https://www.google.com/url?rct=j&sa=t&url=https://mmheadlines.org/2021/12/faculty-staff-and-learners-find-community-amid-covid-19/&ct=ga&cd=CAIyHDc5M2E3YWM0ZTJjZTM4OWY6Y29tOmVuOlVTOlI&usg=AFQjCNFZNEKmYzoq2JESy_KhwWx0QZB1AQ,“The AAPI community here at Michigan Medicine has expressed the need in ... but also in providing a space for people to share and to understand...,2021-12-07,Medical Sharing
Joe Biden Is Dragging His Feet on Sharing Vaccine Information With the World - Jacobin,https://www.google.com/url?rct=j&sa=t&url=https://jacobinmag.com/2021/12/joe-biden-is-dragging-his-feet-on-sharing-vaccine-information-with-the-world&ct=ga&cd=CAIyHDc5M2E3YWM0ZTJjZTM4OWY6Y29tOmVuOlVTOlI&usg=AFQjCNFwkR8rHm7kSBnTFnq0ZZjgtnr7xA,The Joe Biden administration is unwilling to share vaccine information that ... a four-year partnership with the National Institutes of Health.,2021-12-07,Medical Sharing
"Illinois Democrat files measure to punish unvaccinated for ""clogging up health care system""",https://www.google.com/url?rct=j&sa=t&url=https://nypost.com/2021/12/07/illinois-democrat-files-measure-to-punish-unvaccinated-for-clogging-up-health-care-system/&ct=ga&cd=CAIyHDc5M2E3YWM0ZTJjZTM4OWY6Y29tOmVuOlVTOlI&usg=AFQjCNELaxO6Mw4CM6fT6CRh5bOWqi6Qxw,Share this article: Facebook &middot; Twitter &middot; Flipboard &middot; WhatsApp &middot; Email; Copy.,2021-12-07,Medical Sharing
How bias can creep into medical databanks that drive precision health and clinical AI,https://www.google.com/url?rct=j&sa=t&url=https://labblog.uofmhealth.org/industry-dx/how-bias-can-creep-into-medical-databanks-drive-precision-health-and-clinical-ai&ct=ga&cd=CAIyHDc5M2E3YWM0ZTJjZTM4OWY6Y29tOmVuOlVTOlI&usg=AFQjCNE-F_5jjJibAsX_3dS3DHiOnG-MIg,"The authors hope that by sharing their deep-dive into differences in recruitment and consent rates, they can help other institutions, organizations...",2021-12-07,Medical Sharing
Michigan Health Information Network Shared Services Appoints Three New Members to ...,https://www.google.com/url?rct=j&sa=t&url=https://www.bdtonline.com/news/nation_world/michigan-health-information-network-shared-services-appoints-three-new-members-to-board-of-directors/article_2cd8b749-94be-5eb9-b4d0-74a3c0acb1f6.html&ct=ga&cd=CAIyHDc5M2E3YWM0ZTJjZTM4OWY6Y29tOmVuOlVTOlI&usg=AFQjCNGLmOKGPhVaJAOyayyVUxbEM1R0vA,"Lansing, Mich., Dec. 07, 2021 (GLOBE NEWSWIRE) -- Michigan Health Information Network Shared Services (MiHIN) has announced three new board of...",2021-12-07,Medical Sharing
Pro Bankruptcy Briefing: Mallinckrodt Beats Health Insurers; Health Ministry Members Hit Back,https://www.google.com/url?rct=j&sa=t&url=https://www.wsj.com/articles/pro-bankruptcy-briefing-mallinckrodt-beats-health-insurers-health-ministry-members-hit-back-sacklers-deny-bankruptcy-abuse-11638898534&ct=ga&cd=CAIyHDc5M2E3YWM0ZTJjZTM4OWY6Y29tOmVuOlVTOlI&usg=AFQjCNHP_9IVvhiHBhrHL2jhrzm9xnqqcg,"Members of a defunct healthcare cost-sharing group want its administrator in bankruptcy. And Purdue Pharma""s Sackler family owners denied abusing...",2021-12-07,Medical Sharing
Salona Global Medical Device Corporation Announces Shareholder Update Call - Yahoo Finance,https://www.google.com/url?rct=j&sa=t&url=https://www.yahoo.com/now/salona-global-medical-device-corporation-123000998.html&ct=ga&cd=CAIyHDc5M2E3YWM0ZTJjZTM4OWY6Y29tOmVuOlVTOlI&usg=AFQjCNECDGh6c9gt7FywITAzJPZew0Rl6Q,"I look forward to sharing the details of that progress as well as the expanding opportunities we see as we look into 2022,” said Les Cross, Chairman...",2021-12-07,Medical Sharing
