title,link,item_text,date_published,google_alert_name
Cost-sharing funds available for LaPointe Drain watershed in south county,https://www.google.com/url?rct=j&sa=t&url=https://www.monroenews.com/news/20201115/cost-sharing-funds-available-for-lapointe-drain-watershed-in-south-county&ct=ga&cd=CAIyHDQ1NzZkZjdlYTEzZTg0YTA6Y29tOmVuOlVTOlI&usg=AFQjCNH-cAR43Z7t27IywpBZHJQo_yzm9g,"The funding program is available to producers to implement new or enhanced precision nutrient management, erosion control and soil health...",2020-11-15,Health Cost Sharing
Christopher Tufton | The reality of universal healthcare in developing countries: the Jamaican ...,https://www.google.com/url?rct=j&sa=t&url=http://jamaica-gleaner.com/article/commentary/20201115/christopher-tufton-reality-universal-healthcare-developing-countries&ct=ga&cd=CAIyHDQ1NzZkZjdlYTEzZTg0YTA6Y29tOmVuOlVTOlI&usg=AFQjCNGIh6ak6bk7xRqAG6T18vmXDEhaSg,"Most countries with weak public-health systems generally share similar ... savings, direct subsidies, national health insurance, and cost sharing.",2020-11-15,Health Cost Sharing
The new Trump policy will force insurers to disclose prices in advance.,https://www.google.com/url?rct=j&sa=t&url=https://washingtonnewsday.com/health-wellness/the-new-trump-policy-will-force-insurers-to-disclose-prices-in-advance/&ct=ga&cd=CAIyHDQ1NzZkZjdlYTEzZTg0YTA6Y29tOmVuOlVTOlI&usg=AFQjCNFF_fpmdRefGDcxezA_UTpYQW8IaA,"Health insurers will be required to publicly announce the price of the most ... Patients will eventually have access to new information on costs, including an estimate of their cost sharing, through an Internet-based self-service tool.",2020-11-15,Health Cost Sharing
WHO chief urges global system for sharing pathogen materials,https://www.google.com/url?rct=j&sa=t&url=http://desi-box.com/bollywood/who-chief-urges-global-system-for-sharing-pathogen-materials/&ct=ga&cd=CAIyHDQ1NzZkZjdlYTEzZTg0YTA6Y29tOmVuOlVTOlI&usg=AFQjCNHgajKcOMqx7XZr8FpJKrPqorlROA,"“The time has come for a new narrative that sees health not as a cost, but an investment that is the foundation of productive, resilient and stable...",2020-11-14,Health Cost Sharing
"Sanjay Dutt spends Diwali with Maanayata, kids after health scare: Nothing better than celebrating ...",https://www.google.com/url?rct=j&sa=t&url=https://www.pinkvilla.com/entertainment/news/sanjay-dutt-spends-diwali-maanayata-kids-after-health-scare-nothing-better-celebrating-family-574766&ct=ga&cd=CAIyGmU4MWY4MmViNmViOTg5MTE6Y29tOmVuOlVT&usg=AFQjCNHoyO9-A0Ctv_s0K3MtSeVG_LA2gA,Sanjay Dutt even took to social media to share a heartfelt picture with his family as he wished fans on the auspicious occasion. Advertisement. In the...,2020-11-15,Health Sharing
"Staying mentally, physically healthy in a time of coronavirus means supporting each other",https://www.google.com/url?rct=j&sa=t&url=https://www.news-journalonline.com/story/opinion/columns/2020/11/15/we-all-need-community-support-maintain-our-mental-physical-health/6287890002/&ct=ga&cd=CAIyGmU4MWY4MmViNmViOTg5MTE6Y29tOmVuOlVT&usg=AFQjCNEfPlBp5dtMi4KmhiGcSHMjb4lzjA,"Mental health experts have been sharing that message with us over the past few months, and while we at AdventHealth know it personally rings true...",2020-11-15,Health Sharing
3 schools in Fraser Health region closing due to COVID-19 cases,https://www.google.com/url?rct=j&sa=t&url=https://bc.ctvnews.ca/3-schools-in-fraser-health-region-closing-due-to-covid-19-cases-1.5189598&ct=ga&cd=CAIyGmU4MWY4MmViNmViOTg5MTE6Y29tOmVuOlVT&usg=AFQjCNEf7JrYCejU_ngE-oQu2M8sD4eZpQ,"Surrey school district superintendent Jordan Tinney announced the Cambridge Elementary outbreak before the health authority did, sharing a letter to...",2020-11-15,Health Sharing
Knox County Health Dept. releases new advice on hosting Thanksgiving safely,https://www.google.com/url?rct=j&sa=t&url=https://www.wbir.com/article/news/health/knox-county-health-dept-releases-new-advice-on-hosting-thanksgiving-safely/51-74694a6c-2888-46d9-be3f-1685c547574a&ct=ga&cd=CAIyGmU4MWY4MmViNmViOTg5MTE6Y29tOmVuOlVT&usg=AFQjCNFJxMQv_FJ0ZaLb8KHqvC3eT3U4Vg,"Thanksgiving is getting closer and closer, and the Knox County Health Department is sharing tips on how people can enjoy a turkey dinner with guests...",2020-11-15,Health Sharing
Jeremih Hospitalized With COVID-19: On a Ventilator as Condition Worsens,https://www.google.com/url?rct=j&sa=t&url=https://heavy.com/entertainment/love-and-hip-hop/whats-wrong-with-jeremih-instagram-hitmaka/&ct=ga&cd=CAIyGmU4MWY4MmViNmViOTg5MTE6Y29tOmVuOlVT&usg=AFQjCNHCYDSbcivu4zbn7-NZLaCoo7xMUA,"... sparked concern for singer Jeremih""s health after sharing a cryptic post ... The rapper shared a photo of Jeremih, whose full name is Jeremy Phillip...",2020-11-14,Health Sharing
"Tipton Health Launches Webpage Devoted to Sharing Nurses"" COVID-19 Stories",https://www.google.com/url?rct=j&sa=t&url=https://www.prweb.com/releases/tipton_health_launches_webpage_devoted_to_sharing_nurses_covid_19_stories/prweb17542966.htm&ct=ga&cd=CAIyGmU4MWY4MmViNmViOTg5MTE6Y29tOmVuOlVT&usg=AFQjCNHrRsqy4MpF-RY7m2q8nPzxO0cqYQ,"Hero nurses share their stories about battling COVID-19 on Tipton""s new storytelling platform and in a moving webinar. NEWARK, Del. (PRWEB)...",2020-11-14,Health Sharing
"Dolby Laboratories Crushed Expectations in Q4, Sending Shares to All-Time Highs",https://www.google.com/url?rct=j&sa=t&url=https://www.nasdaq.com/articles/dolby-laboratories-crushed-expectations-in-q4-sending-shares-to-all-time-highs-2020-11-14&ct=ga&cd=CAIyGmU4MWY4MmViNmViOTg5MTE6Y29tOmVuOlVT&usg=AFQjCNFb6a5n9fI_xJEw-NGPylATGUWvgQ,"While it""s hard for a company this size to grow by leaps and bounds, CVS Health""s unique position in the center of America""s shifting healthcare system...",2020-11-14,Health Sharing
University responds to sexual violence allegations at student clinic after province-wide protests,https://www.google.com/url?rct=j&sa=t&url=https://theaquinian.net/university-responds-to-sexual-violence-allegations-after-province-wide-protests/&ct=ga&cd=CAIyGmU4MWY4MmViNmViOTg5MTE6Y29tOmVuOlVT&usg=AFQjCNF8WENzts8gLqLyV9VOg9S2AYtnKg,"Jeffrey Carleton, associate vice-president communications at STU, said the university was notified of allegations involving the health centre, a shared...",2020-11-14,Health Sharing
WHO chief urges global system for sharing pathogen materials,https://www.google.com/url?rct=j&sa=t&url=https://www.freepressjournal.in/world/who-chief-urges-global-system-for-sharing-pathogen-materials&ct=ga&cd=CAIyGmU4MWY4MmViNmViOTg5MTE6Y29tOmVuOlVT&usg=AFQjCNFiLUIx1Xuo1604XA1uZl0mWSofNw,"Tedros Adhanom Ghebreyesus, Director-General of the World Health Organization (WHO), said that the Covid-19 pandemic has shown that there is...",2020-11-14,Health Sharing
WHO Chief Urges Global System For Sharing Pathogen Materials,https://www.google.com/url?rct=j&sa=t&url=https://ommcomnews.com/world-news/who-chief-urges-global-system-for-sharing-pathogen-materials&ct=ga&cd=CAIyGmU4MWY4MmViNmViOTg5MTE6Y29tOmVuOlVT&usg=AFQjCNEAK6rcqmSLoQWHPB1XhBqSccOZug,"Geneva: Tedros Adhanom Ghebreyesus, Director-General of the World Health Organization (WHO), said that the Covid-19 pandemic has shown that...",2020-11-14,Health Sharing
WHO chief urges global system for sharing pathogen materials,https://www.google.com/url?rct=j&sa=t&url=https://menafn.com/1101124182/WHO-chief-urges-global-system-for-sharing-pathogen-materials&ct=ga&cd=CAIyGmU4MWY4MmViNmViOTg5MTE6Y29tOmVuOlVT&usg=AFQjCNGFoh8PkkS2EgrsgclRgnHHwoVfvA,"Geneva, Nov 14 (IANS) Tedros Adhanom Ghebreyesus, Director-General of the World Health Organization (WHO), said that the Covid-19 pandemic...",2020-11-14,Health Sharing
COVID-19 cases are surging again because of these dumb behaviors,https://www.google.com/url?rct=j&sa=t&url=https://bgr.com/posts/5884791/223d4b-covid-19-cases-are-surging-again-because-of-these-dumb-behaviors/&ct=ga&cd=CAIyGmU4MWY4MmViNmViOTg5MTE6Y29tOmVuOlVT&usg=AFQjCNEpCPbzLgKhrJZL3WO5R6YQeaPgHA,The message that public health experts have been sharing lately about the current state of the coronavirus pandemic in the US is as follows: It can be...,2020-11-14,Health Sharing
"WHO chief calls for global system for sharing pathogen materials, clinical samples",https://www.google.com/url?rct=j&sa=t&url=http://www.ecns.cn/news/2020-11-14/detail-ihacwpkx9604900.shtml&ct=ga&cd=CAIyGmU4MWY4MmViNmViOTg5MTE6Y29tOmVuOlVT&usg=AFQjCNFJZ5R69fQRz2uE5_QzJQ2SoMbN6Q,"The World Health Organization (WHO) chief said Friday that the COVID-19 pandemic has shown that there is ""an urgent need"" for a globally agreed...",2020-11-13,Health Sharing
R&amp;B artist Viwe Tylowana is back with a brand new fresh sound,https://www.google.com/url?rct=j&sa=t&url=https://www.iol.co.za/sundayindependent/news/r-and-b-artist-viwe-tylowana-is-back-with-a-brand-new-fresh-sound--382096e9-12bc-4aea-8761-a030a2cf8784&ct=ga&cd=CAIyGmU4MWY4MmViNmViOTg5MTE6Y29tOmVuOlVT&usg=AFQjCNEPed_o6DBgXrCOkjbgOSM8E3sk2A,The 28-year-old performing artist who was born in the Eastern Cape shared that experience has always inspired her work. “I never write about...,2020-11-13,Health Sharing
"MPA""s ""Vision Zero"" launched at inaugural MPA &amp; British Precast Health &amp; Safety Leadership ...",https://www.google.com/url?rct=j&sa=t&url=https://hub-4.com/news/mpa-s-vision-zero-launched-at-inaugural-mpa-and-british-precast-health-and-safety-leadership-conference&ct=ga&cd=CAIyGmU4MWY4MmViNmViOTg5MTE6Y29tOmVuOlVT&usg=AFQjCNEilrmqGdFC6rYQDiJiydnfeYHBxw,"Vision Zero is underpinned by a new set of shared values to help change behaviour: Empowerment; Engaged, visible and consistent leadership; Zero...",2020-11-11,Health Sharing
ANALYSIS-Bidencare or Trumpcare? Health plans will affect the US economy differently,https://www.google.com/url?rct=j&sa=t&url=https://www.nasdaq.com/articles/analysis-bidencare-or-trumpcare-health-plans-will-affect-the-u.s.-economy-differently-2020&ct=ga&cd=CAIyGmU4MWY4MmViNmViOTg5MTE6Y29tOmVuOlVT&usg=AFQjCNET5qVLNNCyNwDmM6CixjdEggmsOA,"This concluded in diluted earnings per share of $2.71, a 28% jump over the same period in 2019. Year-to-date FB stock price has increased by 43%.",2020-11-02,Health Sharing
Christopher Tufton | The reality of universal healthcare in developing countries: the Jamaican ...,https://www.google.com/url?rct=j&sa=t&url=http://jamaica-gleaner.com/article/commentary/20201115/christopher-tufton-reality-universal-healthcare-developing-countries&ct=ga&cd=CAIyHDcyMWE5ZGFiNjRlZGE3MTM6Y29tOmVuOlVTOlI&usg=AFQjCNGIh6ak6bk7xRqAG6T18vmXDEhaSg,"Most countries with weak public-health systems generally share similar ... savings, direct subsidies, national health insurance, and cost sharing.",2020-11-15,Healthcare Cost Sharing
The new Trump policy will force insurers to disclose prices in advance.,https://www.google.com/url?rct=j&sa=t&url=https://washingtonnewsday.com/health-wellness/the-new-trump-policy-will-force-insurers-to-disclose-prices-in-advance/&ct=ga&cd=CAIyHDcyMWE5ZGFiNjRlZGE3MTM6Y29tOmVuOlVTOlI&usg=AFQjCNFF_fpmdRefGDcxezA_UTpYQW8IaA,"Health insurers will be required to publicly announce the price of the most ... Patients will eventually have access to new information on costs, including an estimate of their cost sharing, through an Internet-based self-service tool.",2020-11-15,Healthcare Cost Sharing
Kourtney Kardashian Is In So Much Trouble After Posting This Mask Conspiracy--What Was She ...,https://www.google.com/url?rct=j&sa=t&url=https://www.shefinds.com/collections/kourtney-kardashian-covid-mask-conspiracy/&ct=ga&cd=CAIyHDc5M2E3YWM0ZTJjZTM4OWY6Y29tOmVuOlVTOlI&usg=AFQjCNFqHptf3qG9W79VtpWhiFejbCOO5Q,"Although that sounds scary, William Cance, chief medical and scientific officer of the ACS, told the Post that what Kourtney shared was misinformation.",2020-11-15,Medical Sharing
Ex-Ohio State prof pleads guilty to sharing work with China,https://www.google.com/url?rct=j&sa=t&url=https://www.fox44news.com/news/ex-ohio-state-prof-pleads-guilty-to-sharing-work-with-china/&ct=ga&cd=CAIyHDc5M2E3YWM0ZTJjZTM4OWY6Y29tOmVuOlVTOlI&usg=AFQjCNHcENTy46f9peOFyb2MD6VG3oi3FQ,"COLUMBUS, Ohio (AP) — A medical researcher and professor who had been working most recently at Ohio State University pleaded guilty Thursday...",2020-11-12,Medical Sharing
