title,link,item_text,date_published,google_alert_name
Fire cleanup could cost $170 million,https://www.google.com/url?rct=j&sa=t&url=http://mailtribune.com/news/top-stories/fire-cleanup-could-cost-170-million&ct=ga&cd=CAIyHDQ1NzZkZjdlYTEzZTg0YTA6Y29tOmVuOlVTOlI&usg=AFQjCNE02aH7ehoaS0ncUXcP2w5yAaWdug,"Costs to clean up and haul away hazardous debris from the Almeda fire ... property owners have started removing debris, even as health officials urge them ... Kate Brown""s office about cost-sharing ideas, basically trying to determine...",2020-09-27,Health Cost Sharing
"Newport News Rally a Reminder to Virginians that Trump Can""t Be Trusted as Campaign Heads ...",https://www.google.com/url?rct=j&sa=t&url=https://bluevirginia.us/2020/09/newport-news-rally-a-reminder-to-virginians-that-trump-cant-be-trusted-as-campaign-heads-into-debate-week&ct=ga&cd=CAIyHDQ1NzZkZjdlYTEzZTg0YTA6Y29tOmVuOlVTOlI&usg=AFQjCNFc4nU52ONftIyY2HF2IDesktBs1g,Claim: “We are bringing the price of health insurance way down. ... to losing expanded access to Medicaid or cost-sharing reductions for the individual...,2020-09-26,Health Cost Sharing
Asia-Pacific Health Insurance Market 2020-2027 Shows Astonishing Growth || Leading Players ...,https://www.google.com/url?rct=j&sa=t&url=https://themarketrecords.com/2020/09/26/asia-pacific-health-insurance-market-2020-2027-shows-astonishing-growth-leading-players-unitedhealth-group-anthem-insurance-companies-aetna-centene-corporation-cigna/&ct=ga&cd=CAIyHDQ1NzZkZjdlYTEzZTg0YTA6Y29tOmVuOlVTOlI&usg=AFQjCNHigwTSbisgoTxu3EY2FRGLqYIDcg,Health insurance offers various benefits for sharing of costs and availability of ... The cost of inpatient services is also significantly higher than that of...,2020-09-26,Health Cost Sharing
"CBO Director Issues Letter on Estimates of Enrollment in Short-Term, Limited-Duration Insurance",https://www.google.com/url?rct=j&sa=t&url=https://insurancenewsnet.com/oarticle/cbo-director-issues-letter-on-estimates-of-enrollment-in-short-term-limited-duration-insurance&ct=ga&cd=CAIyHDQ1NzZkZjdlYTEzZTg0YTA6Y29tOmVuOlVTOlI&usg=AFQjCNHlHqBBJQ5obmPqU7J4Kgk7Vqz31Q,"For example, ISPs would cover medical expenses resulting from ... such as farm bureau plans and health care sharing ministries, and CBO is very...",2020-09-26,Health Cost Sharing
Trump Admin Offers More Details on Drug Reimportation Plan,https://www.google.com/url?rct=j&sa=t&url=https://www.medpagetoday.com/washington-watch/fdageneral/88832&ct=ga&cd=CAIyHDQ1NzZkZjdlYTEzZTg0YTA6Y29tOmVuOlVTOlI&usg=AFQjCNGyiYi_4tH9Lv2709hvh3Tspw2qxA,"This could allow companies to compete through lower costs in ways that just ... Harrison also discussed a proposed rule from the Health Resources and ... $91,700 for a family of four) ""and also have a high cost-sharing requirement,...",2020-09-25,Health Cost Sharing
"HHS Announces Health IT Awardees Focused on Data Sharing to Support Clinical Care, Research ...",https://www.google.com/url?rct=j&sa=t&url=https://www.mychesco.com/%3Fp%3D394508&ct=ga&cd=CAIyGmU4MWY4MmViNmViOTg5MTE6Y29tOmVuOlVT&usg=AFQjCNHZ0ok1GNoc4KKZxShWdN-5Guk6xA,"The four new LEAP in Health IT awardees will address development and testing for data sharing functionalities to support clinical care, research, and...",2020-09-27,Health Sharing
VYVO Enables VyvoPay On Its Life Watches,https://www.google.com/url?rct=j&sa=t&url=http://www.digitaljournal.com/pr/4820043&ct=ga&cd=CAIyGmU4MWY4MmViNmViOTg5MTE6Y29tOmVuOlVT&usg=AFQjCNGFPzKIvxZT9e2ndWzf__bPIJeAgA,VyvoPay brings great benefits to VYVO Life Watch wearers and is an important step in positioning VYVO at the forefront of the Digital Health Sharing...,2020-09-27,Health Sharing
"Grieving Mother Shares Story of Sons Involved in Recent Arcata Homicide, Says She Wants ...",https://www.google.com/url?rct=j&sa=t&url=https://lostcoastoutpost.com/2020/sep/26/grieving-mother-shares-story-sons-involved-recent/&ct=ga&cd=CAIyGmU4MWY4MmViNmViOTg5MTE6Y29tOmVuOlVT&usg=AFQjCNFrOKM_zld5zuhTwkKRkBjnAUgx0A,"But mental health care was “practically impossible to find,” she said. “Everyone we spoke to agreed that Jacob was gravely disabled and desperately...",2020-09-27,Health Sharing
Bookkeeper of the year Haylee Wrenn shares her top tips to help your business survive,https://www.google.com/url?rct=j&sa=t&url=https://www.stuff.co.nz/business/prosper/advice/122891442/bookkeeper-of-the-year-haylee-wrenn-shares-her-top-tips-to-help-your-business-survive&ct=ga&cd=CAIyGmU4MWY4MmViNmViOTg5MTE6Y29tOmVuOlVT&usg=AFQjCNGHkoxu6OYWtYYnk9OPvCJVkZy74w,"“It""s important that business owners look at all aspects of their business health – and that includes their own personal physical and mental health,” she...",2020-09-27,Health Sharing
"Pets linked to maintaining better mental health and reducing loneliness during lockdown, new ...",https://www.google.com/url?rct=j&sa=t&url=https://www.sciencedaily.com/releases/2020/09/200926145210.htm&ct=ga&cd=CAIyGmU4MWY4MmViNmViOTg5MTE6Y29tOmVuOlVT&usg=AFQjCNHm-eGeoCUnwSjuK6306VeB9ZiF0w,"Sharing a home with a pet appeared to act as a buffer against psychological stress during lockdown, a new survey shows. Share: FULL STORY. Woman...",2020-09-26,Health Sharing
Delvin Breaux Opens Up about Overcoming Mental Health Struggles,https://www.google.com/url?rct=j&sa=t&url=https://www.si.com/nfl/saints/news/breaux-opens-up-about-mental-health-struggles&ct=ga&cd=CAIyGmU4MWY4MmViNmViOTg5MTE6Y29tOmVuOlVT&usg=AFQjCNGVSGxWQihWeWITq-fEJ0VEFUkhhw,"The Ed Block Courage award winner shared that he went to visit John Lucas in Houston, where he “learned it was okay to talk about your problems.” The...",2020-09-26,Health Sharing
"Healthcare Interoperability Solutions Market Seeking Excellent Growth |Industry Share, Size 2020 ...",https://www.google.com/url?rct=j&sa=t&url=https://themarketrecords.com/2020/09/26/healthcare-interoperability-solutions-market-seeking-excellent-growth-industry-share-size-2020-movements-by-growth-status-trend-analysis/&ct=ga&cd=CAIyGmU4MWY4MmViNmViOTg5MTE6Y29tOmVuOlVT&usg=AFQjCNHdxtzWo4zXFMoRlfuCnP0oejR0Rg,These solutions are designed to share healthcare information between other organizations and healthcare facilities in a more efficient manner. Focus of...,2020-09-26,Health Sharing
The important reason why Edinburgh locals and companies are sharing hearts on social media,https://www.google.com/url?rct=j&sa=t&url=https://www.edinburghlive.co.uk/news/uk-world-news/important-reason-edinburgh-locals-companies-19003732&ct=ga&cd=CAIyGmU4MWY4MmViNmViOTg5MTE6Y29tOmVuOlVT&usg=AFQjCNEdzyVM6W5Sgl96UvvYZ_w73D0Ssg,"Over 30,000 Scots are diagnosed with cancer a year and Public Health Scotland has found that the number of cases is predicted to rise to 40,000 new...",2020-09-26,Health Sharing
"CBO Director Issues Letter on Estimates of Enrollment in Short-Term, Limited-Duration Insurance",https://www.google.com/url?rct=j&sa=t&url=https://insurancenewsnet.com/oarticle/cbo-director-issues-letter-on-estimates-of-enrollment-in-short-term-limited-duration-insurance&ct=ga&cd=CAIyGmU4MWY4MmViNmViOTg5MTE6Y29tOmVuOlVT&usg=AFQjCNHlHqBBJQ5obmPqU7J4Kgk7Vqz31Q,"CBO reviews its projections of health insurance coverage annually. ... such as farm bureau plans and health care sharing ministries, and CBO is very...",2020-09-26,Health Sharing
Pets linked to better human health,https://www.google.com/url?rct=j&sa=t&url=https://www.thestatesman.com/features/pets-linked-to-better-human-health-1502926321.html&ct=ga&cd=CAIyGmU4MWY4MmViNmViOTg5MTE6Y29tOmVuOlVT&usg=AFQjCNGE5xfekEb4CQ9Y7kuyKeBXoNSqNw,The fact that they do not judge you materialistically but your ability to share and love others make them a crucial part of your mental and emotional...,2020-09-26,Health Sharing
Gigi Hadid shares photo of newborn daughter with gifts from Taylor Swift and Donatella Versace,https://www.google.com/url?rct=j&sa=t&url=https://www.independent.co.uk/life-style/health-and-families/gigi-hadid-baby-daughter-name-taylor-swift-donatella-versace-zayn-instagram-b619740.html&ct=ga&cd=CAIyGmU4MWY4MmViNmViOTg5MTE6Y29tOmVuOlVT&usg=AFQjCNG2rzEFISRRWDI5YOuW9lPrcYpf3Q,"Meanwhile, the former One Direction singer shared a second photo on his own Instagram account, writing: “Our baby girl is here, healthy and beautiful...",2020-09-26,Health Sharing
Co Donegal hotel offers €2 rooms to locals to circumvent Covid-19 outdoor dining rules,https://www.google.com/url?rct=j&sa=t&url=https://www.irishtimes.com/news/ireland/irish-news/co-donegal-hotel-offers-2-rooms-to-locals-to-circumvent-covid-19-outdoor-dining-rules-1.4365587&ct=ga&cd=CAIyGmU4MWY4MmViNmViOTg5MTE6Y29tOmVuOlVT&usg=AFQjCNEWcUtR6G87ljWGZ3wMfxU1t0LD6g,"A Co Donegal hotel has invited locals to book a room for €2 per person sharing, in order to circumvent public health rules on restaurants and permit...",2020-09-26,Health Sharing
Western quietly cancels info-sharing agreement with police,https://www.google.com/url?rct=j&sa=t&url=https://westerngazette.ca/news/western-quietly-cancels-info-sharing-agreement-with-police/article_517e4084-ff84-11ea-8cc6-2396b0c4ca40.html&ct=ga&cd=CAIyGmU4MWY4MmViNmViOTg5MTE6Y29tOmVuOlVT&usg=AFQjCNFIB8Lc2t7Z56cVHlg7x06uslgRxA,"""Since then, we have been really focused on the health and safety [of] our students, and the broader London community in the midst of the pandemic.”.",2020-09-26,Health Sharing
"If You Invested $10000 in Teladoc in January, This Is How Much You""d Have Now",https://www.google.com/url?rct=j&sa=t&url=https://www.fool.com/investing/2020/09/26/if-you-invested-10000-in-teladoc-in-january-this-i/&ct=ga&cd=CAIyGmU4MWY4MmViNmViOTg5MTE6Y29tOmVuOlVT&usg=AFQjCNFP_H8-J1CRt2KiR2s0OZl9qGS1wg,"One company that""s benefiting from these trends is Teladoc Health ... at the beginning of the year when the healthcare stock was trading at $83.",2020-09-26,Health Sharing
Assam health minister lays foundation stone of 50-bed emergency wing in Silchar Medical College ...,https://www.google.com/url?rct=j&sa=t&url=https://nenow.in/north-east-news/assam/assam-health-minister-lays-foundation-stone-of-50-bed-emergency-hospital-wing-in-silchar-medical-college-hospital.html&ct=ga&cd=CAIyGmU4MWY4MmViNmViOTg5MTE6Y29tOmVuOlVT&usg=AFQjCNHPj5okkQu61WqIm9FFcXXH9_MIVg,"SMCH has been an important centre for providing medical services in Silchar and nearby areas, said Sarma. “Pleased to share that I have inaugurated a...",2020-09-26,Health Sharing
CDC Report Analyzes Contact Tracing in Two NC Counties,https://www.google.com/url?rct=j&sa=t&url=https://spectrumlocalnews.com/nc/triangle-sandhills/news/2020/09/26/cdc-report-analyzes-contact-tracing-in-two-n-c--counties&ct=ga&cd=CAIyGmU4MWY4MmViNmViOTg5MTE6Y29tOmVuOlVT&usg=AFQjCNE0l3wm6Oi19J9zh5Y0xUHAT8_E-g,"Mecklenburg County Deputy Health Director Raynard Washington said people either didn""t have close contacts or didn""t share the information with the...",2020-09-26,Health Sharing
Ionia County still dealing with deficit for 2020,https://www.google.com/url?rct=j&sa=t&url=https://thedailynews.cc/articles/ionia-county-still-dealing-with-deficit-for-2020/&ct=ga&cd=CAIyGmU4MWY4MmViNmViOTg5MTE6Y29tOmVuOlVT&usg=AFQjCNH5AVzTnvnt5lTy2Oc-rG3_Z0J3aw,"Ionia County Health Department Officer Ken Bowen appeared before the ... of Michigan wouldn""t be reducing revenue sharing payments to counties.",2020-09-26,Health Sharing
"Australia PM on not sharing vaccine: History will be ""severe judge""",https://www.google.com/url?rct=j&sa=t&url=https://www.japantimes.co.jp/news/2020/09/26/asia-pacific/politics-diplomacy-asia-pacific/australia-coronavirus-vaccine-scott-morrison/&ct=ga&cd=CAIyGmU4MWY4MmViNmViOTg5MTE6Y29tOmVuOlVT&usg=AFQjCNE0ok3_P6RiMipTFMNiHILyRvHrrA,"President Donald Trump""s administration has given notice that the United States will pull out of the World Health Organization, calling it biased toward...",2020-09-26,Health Sharing
Coronavirus: UK pledges £500m to global vaccine-sharing scheme,https://www.google.com/url?rct=j&sa=t&url=https://www.bbc.co.uk/news/health-54303061&ct=ga&cd=CAIyGmU4MWY4MmViNmViOTg5MTE6Y29tOmVuOlVT&usg=AFQjCNF0eJkyhKxw6_69BA5E_OeXrFLi8w,The UK is to give £500m to a new global vaccine-sharing scheme designed to ... He also promised extra funding for the World Health Organization.,2020-09-25,Health Sharing
"The smaller the social circle, the better: APH",https://www.google.com/url?rct=j&sa=t&url=https://www.sootoday.com/coronavirus-covid-19-sault-ste-marie-news/the-smaller-the-social-circle-the-better-aph-2743951&ct=ga&cd=CAIyGmU4MWY4MmViNmViOTg5MTE6Y29tOmVuOlVT&usg=AFQjCNExaJWkMuYQps_iP8YFt55nKoehCQ,"... APH associate medical officer of health, in the release. “Hanging out on the same couch together, sharing a meal around a kitchen table – these are...",2020-09-25,Health Sharing
Asia-Pacific Health Insurance Market 2020-2027 Shows Astonishing Growth || Leading Players ...,https://www.google.com/url?rct=j&sa=t&url=https://themarketrecords.com/2020/09/26/asia-pacific-health-insurance-market-2020-2027-shows-astonishing-growth-leading-players-unitedhealth-group-anthem-insurance-companies-aetna-centene-corporation-cigna/&ct=ga&cd=CAIyHDcyMWE5ZGFiNjRlZGE3MTM6Y29tOmVuOlVTOlI&usg=AFQjCNHigwTSbisgoTxu3EY2FRGLqYIDcg,Health insurance offers various benefits for sharing of costs and availability of ... The cost of inpatient services is also significantly higher than that of...,2020-09-26,Healthcare Cost Sharing
"Medical Image Exchange Systems Market May See a Big Move | Life Image, Nuance ...",https://www.google.com/url?rct=j&sa=t&url=https://crypto-daily.news/news/239925/medical-image-exchange-systems-market-may-see-a-big-move-life-image-nuance-communications-lexmark-international/&ct=ga&cd=CAIyHDc5M2E3YWM0ZTJjZTM4OWY6Y29tOmVuOlVTOlI&usg=AFQjCNE3itR9OjPRVCcgbhvUrraZ0oNNng,"Medical image exchange systems enable storing, archiving, sharing and accessing images that allow the healthcare organizations to manage data...",2020-09-26,Medical Sharing
"Medical Image Exchange Systems Market May See a Big Move | Life Image, Nuance ...",https://www.google.com/url?rct=j&sa=t&url=http://crypto-daily.news/news/239925/medical-image-exchange-systems-market-may-see-a-big-move-life-image-nuance-communications-lexmark-international/&ct=ga&cd=CAIyHDc5M2E3YWM0ZTJjZTM4OWY6Y29tOmVuOlVTOlI&usg=AFQjCNG9WIPvj04IITZclK7B6lVCIjDjNw,"Medical image exchange systems enable storing, archiving, sharing and ... Medical image exchange systems allow medical images to be shared...",2020-09-26,Medical Sharing
"Ron Paul ""doing fine"" after medical episode on live stream",https://www.google.com/url?rct=j&sa=t&url=https://gephardtdaily.com/national-international/ron-paul-doing-fine-after-medical-episode-on-live-stream/&ct=ga&cd=CAIyHDc5M2E3YWM0ZTJjZTM4OWY6Y29tOmVuOlVTOlI&usg=AFQjCNHRupki8t6Hl38icCffwlH131LHEQ,"The 85-year-old tweeted an update on his condition, sharing a photo of himself in a hospital giving a thumbs-up. “I am doing fine. Thank you for your...",2020-09-26,Medical Sharing
"Ron Paul ""doing fine"" after medical episode on live stream",https://www.google.com/url?rct=j&sa=t&url=https://www.upi.com/Top_News/US/2020/09/25/Ron-Paul-doing-fine-after-medical-episode-on-live-stream/6681601074614/&ct=ga&cd=CAIyHDc5M2E3YWM0ZTJjZTM4OWY6Y29tOmVuOlVTOlI&usg=AFQjCNEFOVCWM7cBd0WZjsLS82O1IBB9ug,"The 85-year-old tweeted an update on his condition, sharing a photo of himself in a hospital giving a thumbs-up. ""I am doing fine. Thank you for your...",2020-09-25,Medical Sharing
