title,link,item_text,date_published,google_alert_name
Mobile medical clinics treat physical and spiritual needs in Thailand,https://www.google.com/url?rct=j&sa=t&url=https://www.baptistmessenger.com/mobile-medical-clinics-treat-physical-and-spiritual-needs-in-thailand/&ct=ga&cd=CAIyHDcwNjg0ZGMwOTMxYjI0NDM6Y29tOmVuOlVTOlI&usg=AFQjCNHaXU19O4fFlcd29pCVcUP3oxjsww,"A patient committed their life to Christ that day at a mobile medical clinic in ... The Derbyshires, other IMB missionaries and Thai Christians share the...",2020-11-12,Christian Health Care Sharing
"Point of View: Choosing health insurance is so complicated, 23% of workers with only two choices ...",https://www.google.com/url?rct=j&sa=t&url=https://www.palmbeachpost.com/story/opinion/columns/2020/11/16/point-view-choosing-health-insurance-complicated-23-workers-only-two-choices-pick-worse-one/6248976002/&ct=ga&cd=CAIyHDQ1NzZkZjdlYTEzZTg0YTA6Y29tOmVuOlVTOlI&usg=AFQjCNER_oV1WVqQ20tyHGLkl9XQ9GD9WA,"Our analysis found that 97% of the 2,300 employees would have been better off with the other plan, which had lower premiums but higher cost-sharing...",2020-11-16,Health Cost Sharing
Point Health Announces Plans to Acquire The Karis Group and Build the First Combined ...,https://www.google.com/url?rct=j&sa=t&url=https://www.prweb.com/releases/point_health_announces_plans_to_acquire_the_karis_group_and_build_the_first_combined_healthcare_navigation_platform_and_marketplace/prweb17540433.htm&ct=ga&cd=CAIyHDQ1NzZkZjdlYTEzZTg0YTA6Y29tOmVuOlVTOlI&usg=AFQjCNGg83k4mixZq-Cb1BSKugm10g7KXg,... Member Experience and Engagement for Health Insurers and Cost Sharing Communities. The consumer health experience needs an overhaul.,2020-11-16,Health Cost Sharing
"United States: Sunlight On Drug Prices Negotiated By Health Plans: The ""Transparency In ...",https://www.google.com/url?rct=j&sa=t&url=https://www.mondaq.com/unitedstates/healthcare/1005822/sunlight-on-drug-prices-negotiated-by-health-plans-the-transparency-in-coverage-final-rule&ct=ga&cd=CAIyHDQ1NzZkZjdlYTEzZTg0YTA6Y29tOmVuOlVTOlI&usg=AFQjCNFlkWvMcubbzJMlzxVEWrrir4IBHg,"The cost-sharing information elements are designed around the typical ""explanation of benefits"" document received after health care services are...",2020-11-16,Health Cost Sharing
"COVID-19 Initiatives from Arkansas"" Best Places to Work",https://www.google.com/url?rct=j&sa=t&url=https://www.arkansasbusiness.com/article/133502/covid-19-initiatives-from-arkansas-best-places-to-work&ct=ga&cd=CAIyHDQ1NzZkZjdlYTEzZTg0YTA6Y29tOmVuOlVTOlI&usg=AFQjCNHhWjb3ZyWIpANvN95zRfldJGbj-A,"Arkansas Hospice requested the Direct Care and Indirect Care worker ... physician telemedicine with zero cost sharing, teledentistry, 100% medical...",2020-11-16,Health Cost Sharing
Best Places to Work: USAble Life,https://www.google.com/url?rct=j&sa=t&url=https://www.arkansasbusiness.com/article/133615/best-places-to-work-usable-life&ct=ga&cd=CAIyHDQ1NzZkZjdlYTEzZTg0YTA6Y29tOmVuOlVTOlI&usg=AFQjCNEV5exJmuGIiuV28fNt7V5HxhxImg,"... including their professional growth and physical and mental health. ... physician telemedicine with zero cost sharing, teledentistry, 100% medical...",2020-11-16,Health Cost Sharing
"Medicare, Medicaid will cover the cost of the future COVID 19 vaccine under the new policy.",https://www.google.com/url?rct=j&sa=t&url=https://washingtonnewsday.com/health-wellness/medicare-medicaid-will-cover-the-cost-of-the-future-covid-19-vaccine-under-the-new-policy/&ct=ga&cd=CAIyHDQ1NzZkZjdlYTEzZTg0YTA6Y29tOmVuOlVTOlI&usg=AFQjCNHSRDIm42VOPJPi3bY9kC9hRdkhfA,"After a public health emergency, depending on the population, states may have to “evaluate the cost-sharing guidelines and, if necessary, submit state...",2020-11-15,Health Cost Sharing
Cost-sharing funds available for LaPointe Drain watershed in south county,https://www.google.com/url?rct=j&sa=t&url=https://www.monroenews.com/news/20201115/cost-sharing-funds-available-for-lapointe-drain-watershed-in-south-county&ct=ga&cd=CAIyHDQ1NzZkZjdlYTEzZTg0YTA6Y29tOmVuOlVTOlI&usg=AFQjCNH-cAR43Z7t27IywpBZHJQo_yzm9g,"The funding program is available to producers to implement new or enhanced precision nutrient management, erosion control and soil health...",2020-11-15,Health Cost Sharing
United States: Trump Administration Finalizes The Transparency In Coverage Rule,https://www.google.com/url?rct=j&sa=t&url=https://www.mondaq.com/unitedstates/healthcare/1005836/trump-administration-finalizes-the-transparency-in-coverage-rule&ct=ga&cd=CAIyHDQ1NzZkZjdlYTEzZTg0YTA6Y29tOmVuOlVTOlI&usg=AFQjCNFJD9i_PvHdhSOMD_rnCL38lCH6CQ,"... cost-sharing liability for covered items and services they might receive from a particular health care provider, so the rules require group health plans...",2020-11-15,Health Cost Sharing
"Wallingford, CT",https://www.google.com/url?rct=j&sa=t&url=https://patch.com/connecticut/wallingford/ep/1378638&ct=ga&cd=CAIyGmU4MWY4MmViNmViOTg5MTE6Y29tOmVuOlVT&usg=AFQjCNF9ZPD_Eg7qUAsgzRDuh5ucMZ0d9g,"Sharing some information from the Health Department about COVID in our town: - In all, there have been 913 cases since the start of the pandemic.",2020-11-16,Health Sharing
"From Activated Almonds To Nazi Symbolism: Tracking The Trajectory of Pete Evans"" Conspiracies",https://www.google.com/url?rct=j&sa=t&url=https://junkee.com/pete-evans-conspiracy-timeline/278694&ct=ga&cd=CAIyGmU4MWY4MmViNmViOTg5MTE6Y29tOmVuOlVT&usg=AFQjCNHj3t_YI5B7tP3vkRn89z2pHcvDYw,"... the descent of Pete Evans from sharing misleading health information to ... The following year, Evans gave out a bunch of unsafe medical advice he...",2020-11-16,Health Sharing
Leaked government review plans new law to push data sharing,https://www.google.com/url?rct=j&sa=t&url=https://www.hsj.co.uk/pharmaceuticals/leaked-government-review-plans-new-law-to-push-data-sharing/7028964.article&ct=ga&cd=CAIyGmU4MWY4MmViNmViOTg5MTE6Y29tOmVuOlVT&usg=AFQjCNHyzlwuFPqxmtsUUVWQTstdCjPH_w,"An official review carried out for the health secretary, leaked to HSJ, reveals plans to bolster the law to require greater sharing of patient data, saying it...",2020-11-16,Health Sharing
Retired teacher hopes to educate others by sharing COVID battle,https://www.google.com/url?rct=j&sa=t&url=https://www.kq2.com/content/news/Retired-teacher-hopes-to-educate-others-by-sharing-COVID-battle-573086741.html&ct=ga&cd=CAIyGmU4MWY4MmViNmViOTg5MTE6Y29tOmVuOlVT&usg=AFQjCNFweLvt3CRvPIIBeqVdBmz9EbdTLA,"She, however, was fine for about a week before her health took a serious turn. “It was day 10 and my husband came home from work and I said I think I...",2020-11-16,Health Sharing
"Dozens serve Troy community through ""Feast of Sharing""",https://www.google.com/url?rct=j&sa=t&url=https://www.kxxv.com/hometown/bell-county/dozens-serve-troy-community-through-feast-of-sharing&ct=ga&cd=CAIyGmU4MWY4MmViNmViOTg5MTE6Y29tOmVuOlVT&usg=AFQjCNEe3GJObU9wT2mfpFANAmv6CpKKxw,"Health officials warn family gatherings this holiday season could be dangerous because of the rising number COVID-19 cases, so the volunteers said...",2020-11-16,Health Sharing
How Will the Newest IRS Proposal Affect Health Care Sharing Ministries?,https://www.google.com/url?rct=j&sa=t&url=https://blog.seattlepi.com/jimtaylor/2020/11/15/how-will-the-newest-irs-proposal-affect-health-care-sharing-ministries/&ct=ga&cd=CAIyGmU4MWY4MmViNmViOTg5MTE6Y29tOmVuOlVT&usg=AFQjCNEHl39wcVJhhGq7aVIJ98Oaq1yZMg,"If you""re part of a health care sharing ministry, then you need a MEC plan as well. However, the MEC requirement can be problematic for someone...",2020-11-16,Health Sharing
"“Best in the world” Woman Shares Her Experience With M""sia""s Healthcare System After Her Mum ...",https://www.google.com/url?rct=j&sa=t&url=https://worldofbuzz.com/best-in-the-world-woman-shares-her-experience-with-msias-healthcare-system-after-her-mum-was-warded/&ct=ga&cd=CAIyGmU4MWY4MmViNmViOTg5MTE6Y29tOmVuOlVT&usg=AFQjCNHZ8qVj5uGLX86MbIAaBiUz3IsaCg,"Lee then goes on to share that the whole week of her mother""s admission made her truly appreciate the healthcare system in this country. “The doctors...",2020-11-16,Health Sharing
"Medical Terminology Sharing Market Growth, Trends, Analysis By Top Key Players- Medical ...",https://www.google.com/url?rct=j&sa=t&url=https://icotodaymagazine.com/uncategorized/100758/medical-terminology-sharing-market-growth-trends-analysis-by-top-key-players-medical-terminology-sharing-wolters-kluwer-b2i-healthcare-clinical-architecture-intelligent-medical-objects-bitac-apelon/&ct=ga&cd=CAIyGmU4MWY4MmViNmViOTg5MTE6Y29tOmVuOlVT&usg=AFQjCNFhvX1C39KXJu16uCXD3teZEna9cQ,"“Orbis Research released a new research report on title ""Global Medical Terminology Sharing Market 2020 by Company, Regions, Type and...",2020-11-16,Health Sharing
Help prevent the spread of COVID-19 this holiday season,https://www.google.com/url?rct=j&sa=t&url=https://wwmt.com/news/local/help-prevent-the-spread-of-covid-19-this-holiday-season&ct=ga&cd=CAIyGmU4MWY4MmViNmViOTg5MTE6Y29tOmVuOlVT&usg=AFQjCNExdtD3Svn-1uH1z0kiaZhCuoNI9g,"KALAMAZOO, Mich. — With holidays quickly approaching, and the COVID-19 cases surging in Michigan, health experts shared safety measures...",2020-11-16,Health Sharing
Mental health activist on making campaign public,https://www.google.com/url?rct=j&sa=t&url=https://www.newtimes.co.rw/lifestyle/mental-health-activist-making-campaign-public&ct=ga&cd=CAIyGmU4MWY4MmViNmViOTg5MTE6Y29tOmVuOlVT&usg=AFQjCNEmSsex-_6LyuoTSg8Svy9IelgF_Q,"I asked them questions on what they know about mental health and asked them to share their ideas on what they think about it,” she says. The general...",2020-11-15,Health Sharing
Clackamas Volunteers in Medicine helps patients prioritize their own health care: Season of ...,https://www.google.com/url?rct=j&sa=t&url=https://www.oregonlive.com/living/2020/11/clackamas-volunteers-in-medicine-helps-patients-prioritize-their-own-health-care-season-of-sharing-2020.html&ct=ga&cd=CAIyGmU4MWY4MmViNmViOTg5MTE6Y29tOmVuOlVT&usg=AFQjCNEwT9ei0BzDVVI0Vp_Fi7I0EQBceQ,"Clackamas Volunteers in Medicine is a beneficiary of The Oregonian/OregonLive""s 2020 Season of Sharing holiday fundraising campaign.",2020-11-15,Health Sharing
"Illinois"" fall COVID-19 surge continues as state announces 10631 new cases, another 72 deaths",https://www.google.com/url?rct=j&sa=t&url=https://chicago.suntimes.com/2020/11/15/21561588/illinois-fall-covid-19-surge-continues-as-state-announces-10631-new-cases-another-72-deaths&ct=ga&cd=CAIyGmU4MWY4MmViNmViOTg5MTE6Y29tOmVuOlVT&usg=AFQjCNFiAKxtS6_22CbeEsLI4pT8hUSCww,"On the night before Chicago""s stay-at-home advisory will go into effect, Mayor Lori Lightfoot on Sunday shared a troubling statistic: One in 18...",2020-11-15,Health Sharing
"Australia""s responses to HIV and sexual health adapt in face of COVID-19 and share lessons of ...",https://www.google.com/url?rct=j&sa=t&url=https://www.miragenews.com/australia-s-responses-to-hiv-and-sexual-health-adapt-in-face-of-covid-19-and-share-lessons-of-earlier-pandemics/&ct=ga&cd=CAIyGmU4MWY4MmViNmViOTg5MTE6Y29tOmVuOlVT&usg=AFQjCNHpM22eGm6--iLs1O5uev33nuPdvQ,"The COVID-19 pandemic has forced Australia""s top experts in HIV and sexual health to drastically re-think our national response, as clinicians,...",2020-11-15,Health Sharing
Cost-sharing funds available for LaPointe Drain watershed in south county,https://www.google.com/url?rct=j&sa=t&url=https://www.sturgisjournal.com/news/20201115/cost-sharing-funds-available-for-lapointe-drain-watershed-in-south-county&ct=ga&cd=CAIyGmU4MWY4MmViNmViOTg5MTE6Y29tOmVuOlVT&usg=AFQjCNGWRiPh5nKljjLzOxMq23JuEaw-_Q,"The funding program is available to producers to implement new or enhanced precision nutrient management, erosion control and soil health...",2020-11-15,Health Sharing
"At Neurotherapeutic Pediatric Therapies, kids get services regardless of families"" ability to pay ...",https://www.google.com/url?rct=j&sa=t&url=https://www.oregonlive.com/living/2020/11/at-neurotherapeutic-pediatric-therapies-kids-get-services-regardless-of-families-ability-to-pay-season-of-sharing-2020.html&ct=ga&cd=CAIyGmU4MWY4MmViNmViOTg5MTE6Y29tOmVuOlVT&usg=AFQjCNHk2L3mKUcIeX-dt9tuEjgYnBsRUQ,"&gt;&gt;To donate: Season of Sharing GoFundMe page ... offering physical, speech, mental health and occupational therapies to Oregon infants, kids and...",2020-11-15,Health Sharing
Webinar to discuss findings from health needs assessment,https://www.google.com/url?rct=j&sa=t&url=https://newspress.com/webinar-to-discuss-findings-from-health-needs-assessment/&ct=ga&cd=CAIyGmU4MWY4MmViNmViOTg5MTE6Y29tOmVuOlVT&usg=AFQjCNExrKtuNZ4gkO82xVduuOeSj-hOuQ,SANTA BARBARA — Cottage Center for Population Health will be sharing findings from its recent Community Health Needs Assessment at an online...,2020-11-15,Health Sharing
"US surgeon general: Loss of taste, smell helps differentiate COVID-19 from flu",https://www.google.com/url?rct=j&sa=t&url=https://nypost.com/2020/11/15/us-surgeon-general-loss-of-taste-smell-helps-differentiate-covid-19-from-flu/&ct=ga&cd=CAIyGmU4MWY4MmViNmViOTg5MTE6Y29tOmVuOlVT&usg=AFQjCNHUZLB6fVeAPI5QC4-nh4cExuuO6g,"“If you get that symptom, then you need to be reaching out to your health ... Pressed about whether the White House task force is sharing information...",2020-11-15,Health Sharing
"Sanjay Dutt spends Diwali with Maanayata, kids after health scare: Nothing better than celebrating ...",https://www.google.com/url?rct=j&sa=t&url=https://www.pinkvilla.com/entertainment/news/sanjay-dutt-spends-diwali-maanayata-kids-after-health-scare-nothing-better-celebrating-family-574766&ct=ga&cd=CAIyGmU4MWY4MmViNmViOTg5MTE6Y29tOmVuOlVT&usg=AFQjCNHoyO9-A0Ctv_s0K3MtSeVG_LA2gA,Sanjay Dutt even took to social media to share a heartfelt picture with his family as he wished fans on the auspicious occasion. Advertisement. In the...,2020-11-15,Health Sharing
Kourtney Kardashian Is In So Much Trouble After Posting This Mask Conspiracy--What Was She ...,https://www.google.com/url?rct=j&sa=t&url=https://www.shefinds.com/collections/kourtney-kardashian-covid-mask-conspiracy/&ct=ga&cd=CAIyGmU4MWY4MmViNmViOTg5MTE6Y29tOmVuOlVT&usg=AFQjCNFqHptf3qG9W79VtpWhiFejbCOO5Q,"Although that sounds scary, William Cance, chief medical and scientific officer of the ACS, told the Post that what Kourtney shared was misinformation.",2020-11-15,Health Sharing
North Little Rock Notebook,https://www.google.com/url?rct=j&sa=t&url=https://www.arkansasonline.com/news/2020/nov/15/mayor-urges-virus-safety-practices-cemetery/%3Fbusiness&ct=ga&cd=CAIyGmU4MWY4MmViNmViOTg5MTE6Y29tOmVuOlVT&usg=AFQjCNHz4gZe4R0A-UzxQpD1K3JoseS8SA,"City officials shared numbers from the Arkansas Center for Health ... so we do not overwhelm our medical facilities and staff,"" the Facebook post stated.",2020-11-15,Health Sharing
Point Health Announces Plans to Acquire The Karis Group and Build the First Combined ...,https://www.google.com/url?rct=j&sa=t&url=https://www.prweb.com/releases/point_health_announces_plans_to_acquire_the_karis_group_and_build_the_first_combined_healthcare_navigation_platform_and_marketplace/prweb17540433.htm&ct=ga&cd=CAIyHDcyMWE5ZGFiNjRlZGE3MTM6Y29tOmVuOlVTOlI&usg=AFQjCNGg83k4mixZq-Cb1BSKugm10g7KXg,"Company to Focus on Improving Member Experience and Engagement for Health Insurers and Cost Sharing Communities. AUSTIN, Texas (PRWEB)...",2020-11-16,Healthcare Cost Sharing
"United States: Sunlight On Drug Prices Negotiated By Health Plans: The ""Transparency In ...",https://www.google.com/url?rct=j&sa=t&url=https://www.mondaq.com/unitedstates/healthcare/1005822/sunlight-on-drug-prices-negotiated-by-health-plans-the-transparency-in-coverage-final-rule&ct=ga&cd=CAIyHDcyMWE5ZGFiNjRlZGE3MTM6Y29tOmVuOlVTOlI&usg=AFQjCNFlkWvMcubbzJMlzxVEWrrir4IBHg,"The cost-sharing information elements are designed around the typical ""explanation of benefits"" document received after health care services are...",2020-11-16,Healthcare Cost Sharing
United States: Trump Administration Finalizes The Transparency In Coverage Rule,https://www.google.com/url?rct=j&sa=t&url=https://www.mondaq.com/unitedstates/healthcare/1005836/trump-administration-finalizes-the-transparency-in-coverage-rule&ct=ga&cd=CAIyHDcyMWE5ZGFiNjRlZGE3MTM6Y29tOmVuOlVTOlI&usg=AFQjCNFJD9i_PvHdhSOMD_rnCL38lCH6CQ,"On October 29, 2020, the Department of Health and Human Services (""HHS""), the ... Estimated cost-sharing liability: The estimated amount, in dollars,...",2020-11-15,Healthcare Cost Sharing
How Will the Newest IRS Proposal Affect Health Care Sharing Ministries?,https://www.google.com/url?rct=j&sa=t&url=https://blog.seattlepi.com/jimtaylor/2020/11/15/how-will-the-newest-irs-proposal-affect-health-care-sharing-ministries/&ct=ga&cd=CAIyHDBhNGY1MzE5YzE5ODdjNzQ6Y29tOmVuOlVTOlI&usg=AFQjCNEHl39wcVJhhGq7aVIJ98Oaq1yZMg,"Ever since this scheme came onto the scene, there hasn""t been much ... Thanks to this new update, Health Share Programs costs will now become...",2020-11-16,Healthcare Sharing Programs
How Will the Newest IRS Proposal Affect Health Care Sharing Ministries?,https://www.google.com/url?rct=j&sa=t&url=https://blog.seattlepi.com/jimtaylor/2020/11/15/how-will-the-newest-irs-proposal-affect-health-care-sharing-ministries/&ct=ga&cd=CAIyHDBhNGY1MzE5YzE5ODdjNzQ6Y29tOmVuOlVTOlI&usg=AFQjCNEHl39wcVJhhGq7aVIJ98Oaq1yZMg,"Ever since this scheme came onto the scene, there hasn""t been much ... Thanks to this new update, Health Share Programs costs will now become...",2020-11-16,Healthcare Sharing Programs
How Will the Newest IRS Proposal Affect Health Care Sharing Ministries?,https://www.google.com/url?rct=j&sa=t&url=https://blog.seattlepi.com/jimtaylor/2020/11/15/how-will-the-newest-irs-proposal-affect-health-care-sharing-ministries/&ct=ga&cd=CAIyHDc5M2E3YWM0ZTJjZTM4OWY6Y29tOmVuOlVTOlI&usg=AFQjCNEHl39wcVJhhGq7aVIJ98Oaq1yZMg,"If you""re part of a health care sharing ministry, then you need a MEC plan as well. However, the MEC requirement can be problematic for someone...",2020-11-16,Medical Sharing
"Medical Terminology Sharing Market Growth, Trends, Analysis By Top Key Players- Medical ...",https://www.google.com/url?rct=j&sa=t&url=https://icotodaymagazine.com/uncategorized/100758/medical-terminology-sharing-market-growth-trends-analysis-by-top-key-players-medical-terminology-sharing-wolters-kluwer-b2i-healthcare-clinical-architecture-intelligent-medical-objects-bitac-apelon/&ct=ga&cd=CAIyHDc5M2E3YWM0ZTJjZTM4OWY6Y29tOmVuOlVTOlI&usg=AFQjCNFhvX1C39KXJu16uCXD3teZEna9cQ,"“Orbis Research released a new research report on title ""Global Medical Terminology Sharing Market 2020 by Company, Regions, Type and...",2020-11-16,Medical Sharing
"Illinois"" fall COVID-19 surge continues as state announces 10631 new cases, another 72 deaths",https://www.google.com/url?rct=j&sa=t&url=https://chicago.suntimes.com/2020/11/15/21561588/illinois-fall-covid-19-surge-continues-as-state-announces-10631-new-cases-another-72-deaths&ct=ga&cd=CAIyHDc5M2E3YWM0ZTJjZTM4OWY6Y29tOmVuOlVTOlI&usg=AFQjCNFiAKxtS6_22CbeEsLI4pT8hUSCww,"State health officials announced 10,631 new coronavirus infections and an additional 72 fatalities. Sunday""s new cases accounted for roughly 12.5%...",2020-11-15,Medical Sharing
"Global Specialty Medical Chairs Market 2020| Industry Size, Share, Revenue, Business Growth ...",https://www.google.com/url?rct=j&sa=t&url=https://thinkcuriouser.com/news/718168/global-specialty-medical-chairs-market-2020-industry-size-share-revenue-business-growth-demand-and-applications-market-research-report-to-2026/&ct=ga&cd=CAIyHDc5M2E3YWM0ZTJjZTM4OWY6Y29tOmVuOlVTOlI&usg=AFQjCNGY_VtVkKxIibQL61KaauDAzhF7qw,"Global Specialty Medical Chairs Market 2020| Industry Size, Share, Revenue, Business Growth, Demand And Applications Market Research Report...",2020-11-15,Medical Sharing
United States: Trump Administration Finalizes The Transparency In Coverage Rule,https://www.google.com/url?rct=j&sa=t&url=https://www.mondaq.com/unitedstates/healthcare/1005836/trump-administration-finalizes-the-transparency-in-coverage-rule&ct=ga&cd=CAIyHDc5M2E3YWM0ZTJjZTM4OWY6Y29tOmVuOlVTOlI&usg=AFQjCNFJD9i_PvHdhSOMD_rnCL38lCH6CQ,"Estimated cost-sharing liability: The estimated amount, in dollars, ... these items and services include covered prescription drugs and durable medical...",2020-11-15,Medical Sharing
Kourtney Kardashian Is In So Much Trouble After Posting This Mask Conspiracy--What Was She ...,https://www.google.com/url?rct=j&sa=t&url=https://www.shefinds.com/collections/kourtney-kardashian-covid-mask-conspiracy/&ct=ga&cd=CAIyHDc5M2E3YWM0ZTJjZTM4OWY6Y29tOmVuOlVTOlI&usg=AFQjCNFqHptf3qG9W79VtpWhiFejbCOO5Q,"Although that sounds scary, William Cance, chief medical and scientific officer of the ACS, told the Post that what Kourtney shared was misinformation.",2020-11-15,Medical Sharing
"Parisa Fitz-Henley""s MEDICAL DRAMA",https://www.google.com/url?rct=j&sa=t&url=http://www.jamaicaobserver.com/style/parisa-fitz-henley-s_205222&ct=ga&cd=CAIyHDc5M2E3YWM0ZTJjZTM4OWY6Y29tOmVuOlVTOlI&usg=AFQjCNGWLH9eKiPYfap91Foo2Zcr4baPzA,"SO: Anything else to share? PFH: As of now we""re excited to have cast Bex Taylor-Klaus and Andrew Richardson. The rest of the cast...",2020-11-15,Medical Sharing
Mobile medical clinics treat physical and spiritual needs in Thailand,https://www.google.com/url?rct=j&sa=t&url=https://www.baptistmessenger.com/mobile-medical-clinics-treat-physical-and-spiritual-needs-in-thailand/&ct=ga&cd=CAIyHDc5M2E3YWM0ZTJjZTM4OWY6Y29tOmVuOlVTOlI&usg=AFQjCNHaXU19O4fFlcd29pCVcUP3oxjsww,"Doug has found that medical care provides an inroad to sharing the Gospel. As a healthcare professional, taking care of physical needs and then...",2020-11-12,Medical Sharing
"Pharmacovigilance Market Analysis, COVID-19 Impact,Outlook, Opportunities, Size, Share ...",https://www.google.com/url?rct=j&sa=t&url=https://kyt24.com/uncategorized/251680/pharmacovigilance-market-analysis-covid-19-impactoutlook-opportunities-size-share-forecast-and-supply-demand-2021-2027trusted-business-insights/&ct=ga&cd=CAIyHDc5M2E3YWM0ZTJjZTM4OWY6Y29tOmVuOlVTOlI&usg=AFQjCNGfxIe7w_GclRFfLERBVznCyNeFHw,"For instance, the European Medicines Agency (EMA) and the U.S. Food and Drug Administration (FDA) formulate regulatory guidelines for all phases of...",2020-11-11,Medical Sharing
