title,link,item_text,date_published,google_alert_name
UHSM Unveils Epic Prizes in Social Media Sweepstakes | News | bakersfield.com,https://www.google.com/url?rct=j&sa=t&url=https://www.bakersfield.com/ap/news/uhsm-unveils-epic-prizes-in-social-media-sweepstakes/article_af33509c-3ecc-54a3-aca8-d6102a707fc9.html&ct=ga&cd=CAIyHDBlMjQ2MGY3Y2I3NmE2NTQ6Y29tOmVuOlVTOlI&usg=AFQjCNFlYZT9dMlXRm6WQ9B_U87FkrLQAA,"Moreover, members can share and give back to other Christians. ... fellow Christians, serving as a connector to administer medical cost sharing...",2021-12-16,Christian Cost-Sharing
UHSM Unveils Epic Prizes in Social Media Sweepstakes | Business Wire,https://www.google.com/url?rct=j&sa=t&url=https://www.businesswire.com/news/home/20211216005315/en/UHSM-Unveils-Epic-Prizes-in-Social-Media-Sweepstakes&ct=ga&cd=CAIyHDcwNjg0ZGMwOTMxYjI0NDM6Y29tOmVuOlVTOlI&usg=AFQjCNHFNBxh5H3pRGjMuxUFl7UquFtAXw,"UHSM (Unite Health Share Ministries), a faith-based health care nonprofit founded on Christian beliefs and values, today announced a sweepstakes...",2021-12-16,Christian Health Care Sharing
"Kidnappers release remaining hostages from US missionary group in Haiti, police say - KHOU",https://www.google.com/url?rct=j&sa=t&url=https://www.khou.com/article/news/nation-world/kidnappers-release-remaining-hostages-christian-aid-ministries-haiti/507-f1d9a2cb-0eb5-478a-93d3-5db159697770&ct=ga&cd=CAIyHDBlYjRmZTFlNDk3NWE4OGE6Y29tOmVuOlVTOlI&usg=AFQjCNET5pcjOZQt7i63yHn6dai-cwMhVg,Seventeen members of the Ohio-based missionary group Christian Aid Ministries were kidnapped two months ago. Five had been freed in earlier...,2021-12-16,Christian Sharing Ministry
"Kidnappers release remaining hostages from US missionary group in Haiti, police say - 11Alive.com",https://www.google.com/url?rct=j&sa=t&url=https://www.11alive.com/article/news/nation-world/kidnappers-release-remaining-hostages-christian-aid-ministries-haiti/507-f1d9a2cb-0eb5-478a-93d3-5db159697770&ct=ga&cd=CAIyHDBlYjRmZTFlNDk3NWE4OGE6Y29tOmVuOlVTOlI&usg=AFQjCNEybRuTT_cB1cB-60pHppQSeQHCVg,Christian Aid Ministries said in a statement. “Join us in praising God that all 17 of our loved ones are now safe.” The Ohio-based group said it hopes...,2021-12-16,Christian Sharing Ministry
UHSM Unveils Epic Prizes in Social Media Sweepstakes | News | bakersfield.com,https://www.google.com/url?rct=j&sa=t&url=https://www.bakersfield.com/ap/news/uhsm-unveils-epic-prizes-in-social-media-sweepstakes/article_af33509c-3ecc-54a3-aca8-d6102a707fc9.html&ct=ga&cd=CAIyHDBlYjRmZTFlNDk3NWE4OGE6Y29tOmVuOlVTOlI&usg=AFQjCNFlYZT9dMlXRm6WQ9B_U87FkrLQAA,"UHSM Health Share is a nonprofit, faith-based health sharing ministry that facilitates member-to-member health sharing among fellow Christians,...",2021-12-16,Christian Sharing Ministry
UHSM Unveils Epic Prizes in Social Media Sweepstakes | Business Wire,https://www.google.com/url?rct=j&sa=t&url=https://www.businesswire.com/news/home/20211216005315/en/UHSM-Unveils-Epic-Prizes-in-Social-Media-Sweepstakes&ct=ga&cd=CAIyHDBlYjRmZTFlNDk3NWE4OGE6Y29tOmVuOlVTOlI&usg=AFQjCNHFNBxh5H3pRGjMuxUFl7UquFtAXw,"UHSM (Unite Health Share Ministries), a faith-based health care nonprofit founded on Christian beliefs and values, today announced a sweepstakes...",2021-12-16,Christian Sharing Ministry
Former customers of bankrupt N.H. health care sharing ministry unlikely to get large refunds - NHPR,https://www.google.com/url?rct=j&sa=t&url=https://www.nhpr.org/nh-news/2021-12-16/sharity-ministries-bankrupt-nh-refunds-trinity-health-share&ct=ga&cd=CAIyHGVmMjU5ZGE1NWJkYjU0NjU6Y29tOmVuOlVTOlI&usg=AFQjCNH9G5MZglKjGAIUK6fCOolZwnjOTA,"Unlike traditional health insurance, members of sharing ministries pledge to uphold certain religious values, and then pay monthly premiums with the...",2021-12-16,Health Care Sharing Ministry
UHSM Unveils Epic Prizes in Social Media Sweepstakes | Business &amp; Finance | heraldchronicle.com,https://www.google.com/url?rct=j&sa=t&url=https://www.heraldchronicle.com/news/business/uhsm-unveils-epic-prizes-in-social-media-sweepstakes/article_c82f80f3-d700-5dae-8480-db709022eb48.html&ct=ga&cd=CAIyHGVmMjU5ZGE1NWJkYjU0NjU6Y29tOmVuOlVTOlI&usg=AFQjCNHhk435V6FiaO3rZZ_54fXBsuUonA,"UHSM Health Share is a nonprofit, faith-based health sharing ministry that facilitates member-to-member health sharing among fellow Christians,...",2021-12-16,Health Care Sharing Ministry
UHSM Unveils Epic Prizes in Social Media Sweepstakes | Business Wire,https://www.google.com/url?rct=j&sa=t&url=https://www.businesswire.com/news/home/20211216005315/en/UHSM-Unveils-Epic-Prizes-in-Social-Media-Sweepstakes&ct=ga&cd=CAIyHGVmMjU5ZGE1NWJkYjU0NjU6Y29tOmVuOlVTOlI&usg=AFQjCNHFNBxh5H3pRGjMuxUFl7UquFtAXw,"UHSM (Unite Health Share Ministries), a faith-based health care nonprofit founded on Christian beliefs and values, today announced a sweepstakes...",2021-12-16,Health Care Sharing Ministry
California lawmakers prepare to protect abortion access - Los Angeles Times,https://www.google.com/url?rct=j&sa=t&url=https://www.latimes.com/california/story/2021-12-17/california-plan-to-expand-abortion-access-eliminating-copays&ct=ga&cd=CAIyHDQ1NzZkZjdlYTEzZTg0YTA6Y29tOmVuOlVTOlI&usg=AFQjCNH747zVry2YAMH9YNaZjhNtbBnWSQ,... put an end to out-of-pocket costs paid by those seeking abortions. ... support SB 245 say copayments or cost-sharing required by some health...,2021-12-17,Health Cost Sharing
"""The Charges Seem Crazy"": Hospitals Impose a ""Facility Fee"" — For a Video Visit | Kaiser Health News",https://www.google.com/url?rct=j&sa=t&url=https://khn.org/news/article/telemedicine-hospital-facility-fees-video-visit/&ct=ga&cd=CAIyHDQ1NzZkZjdlYTEzZTg0YTA6Y29tOmVuOlVTOlI&usg=AFQjCNFW1S3Br_7weXyw8j7Xt-5f-n4Y7A,"Facility fees, designed to help hospitals cover the high cost of staying ... although providers can waive patient cost sharing for telehealth,...",2021-12-17,Health Cost Sharing
3 ways being unvaccinated against COVID-19 could hurt you financially in 2022 - MarketWatch,https://www.google.com/url?rct=j&sa=t&url=https://www.marketwatch.com/story/3-ways-being-unvaccinated-against-covid-19-could-hurt-you-financially-in-2022-11639692971&ct=ga&cd=CAIyHDQ1NzZkZjdlYTEzZTg0YTA6Y29tOmVuOlVTOlI&usg=AFQjCNHE17xXg6Wt7pL29OW7okDUPSoSJA,Health-insurance companies cannot charge different rates based on ... Many insurers waived cost-sharing on treatment and hospitalization in the...,2021-12-17,Health Cost Sharing
"Auditors flag improper billing at Oregon Health Plan - Becker""s Hospital Review",https://www.google.com/url?rct=j&sa=t&url=https://www.beckershospitalreview.com/payer-issues/auditors-flag-improper-billing-at-oregon-health-plan.html&ct=ga&cd=CAIyHDQ1NzZkZjdlYTEzZTg0YTA6Y29tOmVuOlVTOlI&usg=AFQjCNEtb4DYgLT3hCljJQeYfxbAiGbAiA,"An audit conducted by the Oregon Health Authority found that Oregon Health ... Health""s journey to reduced mortality and cost savings - Read Now!",2021-12-16,Health Cost Sharing
"Affordable Coronavirus Tests Are Out There, if You Look - The New York Times",https://www.google.com/url?rct=j&sa=t&url=https://www.nytimes.com/2021/12/16/health/coronavirus-testing-holidays.html&ct=ga&cd=CAIyHDQ1NzZkZjdlYTEzZTg0YTA6Y29tOmVuOlVTOlI&usg=AFQjCNFLYNRSVmCHTlHVv4hd7V--rd6h4g,"A federal plan to require health insurers to cover the cost of at-home tests is ... to cover those and waive any cost sharing,” Ms. Corlette said.",2021-12-16,Health Cost Sharing
"Build Back Better""s Drug Reforms Make American Health Care Worse - Newsmax",https://www.google.com/url?rct=j&sa=t&url=https://www.newsmax.com/sallypipes/drug-reform-healthcare-build-back-better/2021/12/16/id/1048922/&ct=ga&cd=CAIyHDQ1NzZkZjdlYTEzZTg0YTA6Y29tOmVuOlVTOlI&usg=AFQjCNHkNSHnq0hgZ2_XryiIFf5ki0IiAQ,"But they ignore the real cause of insulin""s high out-of-pocket costs — and that""s the failure of middlemen known as pharmacy benefit managers to share...",2021-12-16,Health Cost Sharing
No Surprises Act Likely Affects Consumers More than Health Insurers - Fitch Ratings,https://www.google.com/url?rct=j&sa=t&url=https://www.fitchratings.com/research/insurance/no-surprises-act-likely-affects-consumers-more-than-health-insurers-16-12-2021&ct=ga&cd=CAIyHDQ1NzZkZjdlYTEzZTg0YTA6Y29tOmVuOlVTOlI&usg=AFQjCNF7hNPpsCLQhX2uC56JAwzU1sdFzQ,"Under the NSA, the patient""s cost-sharing amounts must also be based on in-network provider rates. One-fifth of emergency claims to private...",2021-12-16,Health Cost Sharing
"COVID-19 relief led to nearly 10 percent jump in 2020 health spending | Crain""s Detroit Business",https://www.google.com/url?rct=j&sa=t&url=https://www.crainsdetroit.com/coronavirus/covid-19-relief-led-nearly-10-percent-jump-2020-health-spending&ct=ga&cd=CAIyHDQ1NzZkZjdlYTEzZTg0YTA6Y29tOmVuOlVTOlI&usg=AFQjCNHvkCP12NyZG02pOrMJ3k6AzbP2BQ,"Lower utilization and waived cost-sharing requirements for COVID-19 treatment and testing were factors, the actuaries report.",2021-12-16,Health Cost Sharing
Federal healthcare spending increased 36% in 2020 due to impact of pandemic,https://www.google.com/url?rct=j&sa=t&url=https://www.healthcarefinancenews.com/news/federal-healthcare-spending-increased-36-2020-due-impact-pandemic&ct=ga&cd=CAIyHDQ1NzZkZjdlYTEzZTg0YTA6Y29tOmVuOlVTOlI&usg=AFQjCNFdPYeS6jnakGWGAkmN8frl1dMuNA,This decrease was driven by decreased use of healthcare and little or no cost-sharing requirements for COVID-19 testing and treatment in 2020.,2021-12-16,Health Cost Sharing
"Don""t Be Surprised By The Federal ""No Surprises Act"" - Michigan State Medical Society",https://www.google.com/url?rct=j&sa=t&url=https://www.msms.org/About-MSMS/News-Media/dont-be-surprised-by-the-federal-no-surprises-act&ct=ga&cd=CAIyHDQ1NzZkZjdlYTEzZTg0YTA6Y29tOmVuOlVTOlI&usg=AFQjCNFEPVefIxYCmuIYjiAy2oyOQmJ4XQ,"Health plans are required to notify providers of the applicable in-network cost sharing amount, make an initial payment, and send the patient an...",2021-12-16,Health Cost Sharing
Dental Insurance: Coverage And Cost – Forbes Advisor,https://www.google.com/url?rct=j&sa=t&url=https://www.forbes.com/advisor/health-insurance/dental-insurance-coverage-and-cost/&ct=ga&cd=CAIyHDQ1NzZkZjdlYTEzZTg0YTA6Y29tOmVuOlVTOlI&usg=AFQjCNGyG422AsNMdbYYL3DHUnPM6BSnDw,"Dental insurance, which is separate from your primary health insurance, provides coverage to help protect you from the high costs of dental care.",2021-12-16,Health Cost Sharing
Opinion: Health-care waits are now the longest ever | Financial Post,https://www.google.com/url?rct=j&sa=t&url=https://financialpost.com/opinion/opinion-health-care-waits-are-now-the-longest-ever&ct=ga&cd=CAIyHDQ1NzZkZjdlYTEzZTg0YTA6Y29tOmVuOlVTOlI&usg=AFQjCNERl67TKz2aKiashbgYJHNZxScXpw,"Canadians are living through two health-care crises: COVID, ... incentivize responsible use of health-care resources through cost-sharing (with...",2021-12-16,Health Cost Sharing
Virtual health plans should worry us all | TheHill,https://www.google.com/url?rct=j&sa=t&url=https://thehill.com/opinion/healthcare/585883-virtual-health-plans-should-worry-us-all&ct=ga&cd=CAIyHDQ1NzZkZjdlYTEzZTg0YTA6Y29tOmVuOlVTOlI&usg=AFQjCNHYx91r6Z5nUd4NoFLA19MIZhV2FQ,Some health insurance companies are using telehealth technology for ... Many virtual plans entice consumers with lower premiums and cost-sharing.,2021-12-16,Health Cost Sharing
Health Safe Today launches gamified app to secure medical records digitally - Business Standard,https://www.google.com/url?rct=j&sa=t&url=https://www.business-standard.com/article/companies/health-safe-today-launches-gamified-app-to-secure-medical-records-digitally-121121700581_1.html&ct=ga&cd=CAIyGmU4MWY4MmViNmViOTg5MTE6Y29tOmVuOlVT&usg=AFQjCNH6tJ-wY2M1_On_8YO0S006WPN-_g,"... keep all your medical records in a secure digital format, ready for sharing with doctors, family members and other health service providers,...",2021-12-17,Health Sharing
The global oral health workforce - The Lancet,https://www.google.com/url?rct=j&sa=t&url=https://www.thelancet.com/journals/lancet/article/PIIS0140-6736(21)02336-9/fulltext&ct=ga&cd=CAIyGmU4MWY4MmViNmViOTg5MTE6Y29tOmVuOlVT&usg=AFQjCNHWAUIiJyiaAH3Rn3zOF8BE1eBsAQ,"... on there being a sufficient amount of essential, evidence-based expertise sharing and skill sharing between medical doctors and dentists.",2021-12-17,Health Sharing
Supreme Court asked by DOJ to allow health worker vaccine mandate | 13newsnow.com,https://www.google.com/url?rct=j&sa=t&url=https://www.13newsnow.com/article/news/health/coronavirus/vaccine/justice-department-asks-supreme-court-vaccine-mandate/507-99d53443-78c4-4030-aa60-6ce92ace834d&ct=ga&cd=CAIyGmU4MWY4MmViNmViOTg5MTE6Y29tOmVuOlVT&usg=AFQjCNFoPkJdaJME8RWu9RFP2AaFZwcHDA,"Two federal appeals courts have kept President Biden""s vaccine mandate for health care workers blocked in a total of 24 states.",2021-12-17,Health Sharing
Health insurance open enrollment for Massachusetts Health Connector | WWLP,https://www.google.com/url?rct=j&sa=t&url=https://www.wwlp.com/news/health/health-insurance-open-enrollment-for-massachusetts-health-connector/&ct=ga&cd=CAIyGmU4MWY4MmViNmViOTg5MTE6Y29tOmVuOlVT&usg=AFQjCNFrKdXaXFeV-3eneohy3oUWnbhXyQ,The Massachusetts Health Connector has reopened its public walk-in center in Springfield. ... Share this story. AddThis Sharing Buttons.,2021-12-17,Health Sharing
Federal COVID-19 aid fueled huge jump in national health spending last year | Healthcare Dive,https://www.google.com/url?rct=j&sa=t&url=https://www.healthcaredive.com/news/federal-covid-19-aid-national-health-spending-2020/611605/&ct=ga&cd=CAIyGmU4MWY4MmViNmViOTg5MTE6Y29tOmVuOlVT&usg=AFQjCNH2enoC5I0TWJOvtTqij63ECDJdfg,"Health spending""s share of the gross domestic product (nearly 20%) jumped the most it has in the 61-year history of CMS creating the annual...",2021-12-17,Health Sharing
"""Maine CDC believes that it is here:"" Health officials stress boosters ahead of omicron | WPFO",https://www.google.com/url?rct=j&sa=t&url=https://fox23maine.com/news/coronavirus/maine-cdc-believes-that-it-is-here-health-officials-stress-boosters-ahead-of-omicron&ct=ga&cd=CAIyGmU4MWY4MmViNmViOTg5MTE6Y29tOmVuOlVT&usg=AFQjCNGQYEqvKq1_jJKvdnvKc_M937jCPg,"This holiday season, CBS13 invites you to join us in the ""Joy of Sharing"" by donating toys to Maine children in need. CLICK HERE TO DONATE &middot; MORE...",2021-12-17,Health Sharing
"Cleveland Cavaliers"" Isaac Okoro enters NBA""s health and safety protocols - WKYC",https://www.google.com/url?rct=j&sa=t&url=https://www.wkyc.com/article/sports/nba/cavaliers/cleveland-cavaliers-isaac-okoro-nba-health-and-safety-protocols/95-aec74cc9-0edb-4ead-83be-b556a552adf3&ct=ga&cd=CAIyGmU4MWY4MmViNmViOTg5MTE6Y29tOmVuOlVT&usg=AFQjCNFwJ-0-fg_Tyhq66gcQvJmA-yZWFw,"CLEVELAND — *EDITOR""S NOTE: The above video is from a previous story. As the latest COVID-19 surge continues to rock the American sports landscape...",2021-12-17,Health Sharing
"Seven Bridges Genomics to Foster Partnerships Between Health Systems, Pharmas With ...",https://www.google.com/url?rct=j&sa=t&url=https://www.genomeweb.com/informatics/seven-bridges-genomics-foster-partnerships-between-health-systems-pharmas-new&ct=ga&cd=CAIyGmU4MWY4MmViNmViOTg5MTE6Y29tOmVuOlVT&usg=AFQjCNEp-tksllinpI50cmSuQV_yPQpiBw,"Ledbetter said there are numerous private and academic networks for sharing data from electronic health records. ""All of them, until UPN,...",2021-12-17,Health Sharing
Santa Clara County health officials push boosters with rise of omicron cases | KRON4,https://www.google.com/url?rct=j&sa=t&url=https://www.kron4.com/health/coronavirus/santa-clara-county-health-officials-push-boosters-with-rise-of-omicron-cases/&ct=ga&cd=CAIyGmU4MWY4MmViNmViOTg5MTE6Y29tOmVuOlVT&usg=AFQjCNGfKtNRdGMhCAU5ubdNL53fQ13ciQ,Health officials in Santa Clara county have confirmed 10 positive cases of the omicron variant. ... Share this story. AddThis Sharing Buttons.,2021-12-17,Health Sharing
Health and agriculture monoliths should share lessons on biosecurity - Grain Central,https://www.google.com/url?rct=j&sa=t&url=https://www.graincentral.com/news/health-and-agriculture-monoliths-should-share-lessons-on-biosecurity/&ct=ga&cd=CAIyGmU4MWY4MmViNmViOTg5MTE6Y29tOmVuOlVT&usg=AFQjCNHmKJrsRKLLBV-kxun4CYjbsfFrug,"RISING population density and mobility, growing global trade, greater loss of natural habitat and environmental degradation and the impacts of...",2021-12-17,Health Sharing
Amazon fashion finds and great deals | ABC4 Utah,https://www.google.com/url?rct=j&sa=t&url=https://www.abc4.com/gtu/amazon-fashion-finds-and-great-deals/&ct=ga&cd=CAIyGmU4MWY4MmViNmViOTg5MTE6Y29tOmVuOlVT&usg=AFQjCNGfeb3I4FA5nGEgbyFW7m9JG-126A,"... here sharing fashion finds that can arrive on your doorstep tomorrow. ... CEDAR CITY, Utah (ABC4) - Deputy Brenda Pires is the Mental Health...",2021-12-17,Health Sharing
"""Maine CDC believes that it is here:"" Health officials stress boosters ahead of omicron | WGME",https://www.google.com/url?rct=j&sa=t&url=https://wgme.com/news/local/maine-cdc-believes-that-it-is-here-health-officials-stress-boosters-ahead-of-omicron&ct=ga&cd=CAIyGmU4MWY4MmViNmViOTg5MTE6Y29tOmVuOlVT&usg=AFQjCNFkre_QihbXPCAkIku2zZnU9JCM3A,Facebook Share Icon &middot; Twitter Share Icon &middot; Email Share Icon. SOUTH PORTLAND (WGME) – Maine CDC Director Dr. Nirav Shah addressed the omicron...,2021-12-17,Health Sharing
All sixth-graders at Orange County school quarantined amid COVID outbreak - Los Angeles Times,https://www.google.com/url?rct=j&sa=t&url=https://www.latimes.com/california/story/2021-12-16/all-sixth-graders-at-orange-county-school-quarantined-amid-covid-outbreak&ct=ga&cd=CAIyGmU4MWY4MmViNmViOTg5MTE6Y29tOmVuOlVT&usg=AFQjCNG3JQueNHFpDewiTM5N6jKqU1kQmQ,"An entire sixth-grade class in Yorba Linda was quarantined after a COVID outbreak. A health official said most of those infected weren""t fully...",2021-12-17,Health Sharing
ABC 25 Local Lifestyles – Deja Vu Skin &amp; Health Center (12/16/2021) - TriStateHomepage.com,https://www.google.com/url?rct=j&sa=t&url=https://www.tristatehomepage.com/lifestyles/abc-25-local-lifestyles-deja-vu-skin-health-center-12-16-2021/&ct=ga&cd=CAIyGmU4MWY4MmViNmViOTg5MTE6Y29tOmVuOlVT&usg=AFQjCNGNLFq_PwtDe2OgWaAFB5mxXuSmgA,ABC 25 Local Lifestyles – Deja Vu Skin &amp; Health Center (12/16/2021) &middot; Share this story &middot; More Stories &middot; Top Stories &middot; Suspected drug runner arrested...,2021-12-17,Health Sharing
"Seaford man accused of sharing sexually explicit images of peers, posting them to ...",https://www.google.com/url?rct=j&sa=t&url=https://bronx.news12.com/seaford-man-accused-of-sharing-sexually-explicit-images-of-peers-posting-them-to-pornographic-website&ct=ga&cd=CAIyGmU4MWY4MmViNmViOTg5MTE6Y29tOmVuOlVT&usg=AFQjCNGfVjifwdcFMxfR9_2Pvzx1_HiiFA,"Seaford man accused of sharing sexually explicit images of peers, ... suit against Shake-A-Paw pet store for misrepresenting health of puppies.",2021-12-16,Health Sharing
AG James files suit against Shake-A-Paw pet store for misrepresenting health of puppies,https://www.google.com/url?rct=j&sa=t&url=https://bronx.news12.com/ag-james-files-suit-against-shake-a-paw-pet-store-for-misrepresenting-health-of-puppies&ct=ga&cd=CAIyGmU4MWY4MmViNmViOTg5MTE6Y29tOmVuOlVT&usg=AFQjCNGNjSUZDSTW0u8R-WRAxKe_phSaIg,"The suit claims that Shake-A-Paw fabricated health certificates and ... Seaford man accused of sharing sexually explicit images of peers,...",2021-12-16,Health Sharing
"G7 countries warn Omicron ""biggest threat to global public health"" - POLITICO",https://www.google.com/url?rct=j&sa=t&url=https://www.politico.eu/article/g7-countries-warn-omicron-biggest-threat-to-global-public-health/&ct=ga&cd=CAIyGmU4MWY4MmViNmViOTg5MTE6Y29tOmVuOlVT&usg=AFQjCNEVknFtebqCrBhWFKprvYfkPVJyBg,"Working together and sharing information will be “crucial” in responding to the rapidly growing Omicron wave, G7 health ministers agreed in the...",2021-12-16,Health Sharing
Taney County Health Department encouraging flu and COVID-19 vaccines ahead of holiday ... - KY3,https://www.google.com/url?rct=j&sa=t&url=https://www.ky3.com/2021/12/16/taney-county-health-department-encouraging-flu-covid-19-vaccines-ahead-holiday-gatherings/&ct=ga&cd=CAIyGmU4MWY4MmViNmViOTg5MTE6Y29tOmVuOlVT&usg=AFQjCNG_CmAUUgR7WelP3Ne0dBG6YNRTTQ,The health department is sharing more on the importance of monitoring your symptoms to know the difference between the different viruses going...,2021-12-16,Health Sharing
Tell us before you need us: Free profile automatically shares crucial information for critical calls,https://www.google.com/url?rct=j&sa=t&url=https://thesubtimes.com/2021/12/16/tell-us-before-you-need-us-free-profile-automatically-shares-crucial-information-for-critical-calls/&ct=ga&cd=CAIyGmU4MWY4MmViNmViOTg5MTE6Y29tOmVuOlVT&usg=AFQjCNHKgIgOHCUrZUChlmVyBe2LrzmcAA,"South Sound 911 announcement. When a caller has a registered Emergency Health Profile, crucial life-saving information is automatically shared...",2021-12-16,Health Sharing
The future of healthcare: What 2022 could bring | MobiHealthNews,https://www.google.com/url?rct=j&sa=t&url=https://www.mobihealthnews.com/projects/future-healthcare-what-2022-could-bring&ct=ga&cd=CAIyGmU4MWY4MmViNmViOTg5MTE6Y29tOmVuOlVT&usg=AFQjCNELK91OsVjJcB57c_7--e98hWJp-Q,"As the shadow of COVID-19 lingers, digital health growth continues to shine. ... health experts at HIMSS21 Middle East have been sharing practical...",2021-12-16,Health Sharing
"""The Charges Seem Crazy"": Hospitals Impose a ""Facility Fee"" — For a Video Visit | Kaiser Health News",https://www.google.com/url?rct=j&sa=t&url=https://khn.org/news/article/telemedicine-hospital-facility-fees-video-visit/&ct=ga&cd=CAIyHDcyMWE5ZGFiNjRlZGE3MTM6Y29tOmVuOlVTOlI&usg=AFQjCNFW1S3Br_7weXyw8j7Xt-5f-n4Y7A,"Facility fees, designed to help hospitals cover the high cost of staying ... although providers can waive patient cost sharing for telehealth,...",2021-12-17,Healthcare Cost Sharing
3 ways being unvaccinated against COVID-19 could hurt you financially in 2022 - MarketWatch,https://www.google.com/url?rct=j&sa=t&url=https://www.marketwatch.com/story/3-ways-being-unvaccinated-against-covid-19-could-hurt-you-financially-in-2022-11639692971&ct=ga&cd=CAIyHDcyMWE5ZGFiNjRlZGE3MTM6Y29tOmVuOlVTOlI&usg=AFQjCNHE17xXg6Wt7pL29OW7okDUPSoSJA,Health-insurance companies cannot charge different rates based on ... Many insurers waived cost-sharing on treatment and hospitalization in the...,2021-12-17,Healthcare Cost Sharing
"Build Back Better""s Drug Reforms Make American Health Care Worse - Newsmax",https://www.google.com/url?rct=j&sa=t&url=https://www.newsmax.com/sallypipes/drug-reform-healthcare-build-back-better/2021/12/16/id/1048922/&ct=ga&cd=CAIyHDcyMWE5ZGFiNjRlZGE3MTM6Y29tOmVuOlVTOlI&usg=AFQjCNHkNSHnq0hgZ2_XryiIFf5ki0IiAQ,"But they ignore the real cause of insulin""s high out-of-pocket costs — and that""s the failure of middlemen known as pharmacy benefit managers to share...",2021-12-17,Healthcare Cost Sharing
"Auditors flag improper billing at Oregon Health Plan - Becker""s Hospital Review",https://www.google.com/url?rct=j&sa=t&url=https://www.beckershospitalreview.com/payer-issues/auditors-flag-improper-billing-at-oregon-health-plan.html&ct=ga&cd=CAIyHDcyMWE5ZGFiNjRlZGE3MTM6Y29tOmVuOlVTOlI&usg=AFQjCNEtb4DYgLT3hCljJQeYfxbAiGbAiA,"An audit conducted by the Oregon Health Authority found that Oregon Health ... Health""s journey to reduced mortality and cost savings - Read Now!",2021-12-16,Healthcare Cost Sharing
Federal healthcare spending increased 36% in 2020 due to impact of pandemic,https://www.google.com/url?rct=j&sa=t&url=https://www.healthcarefinancenews.com/news/federal-healthcare-spending-increased-36-2020-due-impact-pandemic&ct=ga&cd=CAIyHDcyMWE5ZGFiNjRlZGE3MTM6Y29tOmVuOlVTOlI&usg=AFQjCNFdPYeS6jnakGWGAkmN8frl1dMuNA,This decrease was driven by decreased use of healthcare and little or no cost-sharing requirements for COVID-19 testing and treatment in 2020.,2021-12-16,Healthcare Cost Sharing
Virtual health plans should worry us all | TheHill,https://www.google.com/url?rct=j&sa=t&url=https://thehill.com/opinion/healthcare/585883-virtual-health-plans-should-worry-us-all&ct=ga&cd=CAIyHDcyMWE5ZGFiNjRlZGE3MTM6Y29tOmVuOlVTOlI&usg=AFQjCNHYx91r6Z5nUd4NoFLA19MIZhV2FQ,Some health insurance companies are using telehealth technology for ... Many virtual plans entice consumers with lower premiums and cost-sharing.,2021-12-16,Healthcare Cost Sharing
"Seven Bridges Genomics to Foster Partnerships Between Health Systems, Pharmas With ...",https://www.google.com/url?rct=j&sa=t&url=https://www.genomeweb.com/informatics/seven-bridges-genomics-foster-partnerships-between-health-systems-pharmas-new&ct=ga&cd=CAIyHDBhNGY1MzE5YzE5ODdjNzQ6Y29tOmVuOlVTOlI&usg=AFQjCNEp-tksllinpI50cmSuQV_yPQpiBw,"The US National Institutes of Health""s All of Us program, ... for sharing deidentified clinical and genomics data among multiple health systems,...",2021-12-17,Healthcare Sharing Programs
UHSM Unveils Epic Prizes in Social Media Sweepstakes | Business Wire,https://www.google.com/url?rct=j&sa=t&url=https://www.businesswire.com/news/home/20211216005315/en/UHSM-Unveils-Epic-Prizes-in-Social-Media-Sweepstakes&ct=ga&cd=CAIyHDBhNGY1MzE5YzE5ODdjNzQ6Y29tOmVuOlVTOlI&usg=AFQjCNHFNBxh5H3pRGjMuxUFl7UquFtAXw,"UHSM Health Share is a nonprofit, faith-based health sharing ministry that ... offers its members simple, fair, and friendly healthcare programs.",2021-12-16,Healthcare Sharing Programs
"Seven Bridges Genomics to Foster Partnerships Between Health Systems, Pharmas With ...",https://www.google.com/url?rct=j&sa=t&url=https://www.genomeweb.com/informatics/seven-bridges-genomics-foster-partnerships-between-health-systems-pharmas-new&ct=ga&cd=CAIyHDBhNGY1MzE5YzE5ODdjNzQ6Y29tOmVuOlVTOlI&usg=AFQjCNEp-tksllinpI50cmSuQV_yPQpiBw,"The US National Institutes of Health""s All of Us program, ... for sharing deidentified clinical and genomics data among multiple health systems,...",2021-12-17,Healthcare Sharing Programs
