title,link,item_text,date_published,google_alert_name
"""The moment you play the baby""s heartbeat"": Local fertility specialist shares what keeps her going",https://www.google.com/url?rct=j&sa=t&url=https://www.news24.com/parent/fertility/trying_to_conceive/the-moment-you-play-the-babys-heartbeat-local-fertility-specialist-shares-what-keeps-her-going-20210816&ct=ga&cd=CAIyHDc5M2E3YWM0ZTJjZTM4OWY6Y29tOmVuOlVTOlI&usg=AFQjCNE3XnWC91SzeyZQBH_p0Vek_q1XgA,"Dr Oosthuizen works as a reproductive medicine specialist at Cape Fertility in Cape Town, in the Western Cape. Her special interests include fertility,...",2021-08-16,Medical Sharing
HIPAA at 25 Remains a Work in Progress,https://www.google.com/url?rct=j&sa=t&url=https://www.theregreview.org/2021/08/16/allen-hipaa-at-25-remains-a-work-in-progress/&ct=ga&cd=CAIyHDc5M2E3YWM0ZTJjZTM4OWY6Y29tOmVuOlVTOlI&usg=AFQjCNHdUJJgRW9GeZAfwrIsHZhfob898g,"... greater health information privacy—turns 25, U.S. health disclosure norms are changing, with openness and sharing becoming more commonplace.",2021-08-16,Medical Sharing
These Funny Quotes From Patients Under Anesthesia Will Make Your Stomach Hurt From Laughter,https://www.google.com/url?rct=j&sa=t&url=https://www.buzzfeed.com/feynman12/medical-professionals-and-patients-share-their-funniest&ct=ga&cd=CAIyHDc5M2E3YWM0ZTJjZTM4OWY6Y29tOmVuOlVTOlI&usg=AFQjCNHwdLDKPsMY6s5E1oU_t8kfMa0Jcw,"As medical professionals, we had to hold in the laughter but that didn""t stop patients from turning into hyenas."" A man farting while his son and pet dog...",2021-08-15,Medical Sharing
Tuskegee Legacy Campaign Encourages COVID-19 Vaccination,https://www.google.com/url?rct=j&sa=t&url=https://thepinkreportnews.com/2021/08/15/tuskegee-legacy-campaign-encourages-covid-19-vaccination/&ct=ga&cd=CAIyHDc5M2E3YWM0ZTJjZTM4OWY6Y29tOmVuOlVTOlI&usg=AFQjCNGutDihmGFH-_WuDlaLm0rivBi_Bg,"... daughter Carmen Head Thornton, a public health administrator, in sharing ... For some unvaccinated people, concerns around medical racism and...",2021-08-15,Medical Sharing
"Refuse to get a vaccine? You might be hit with expensive medical bills, employer mandates",https://www.google.com/url?rct=j&sa=t&url=https://news.yahoo.com/refuse-vaccine-might-hit-expensive-080017749.html&ct=ga&cd=CAIyHDc5M2E3YWM0ZTJjZTM4OWY6Y29tOmVuOlVTOlI&usg=AFQjCNEenBV26LgyVH2dduMnFnfxxBiJ9w,"... have not yet been fully immunized against the virus, a new tactic is being pushed: making the unvaccinated pay a larger share of their medical bills.",2021-08-14,Medical Sharing
