title,link,item_text,date_published,google_alert_name
How President Biden Can Make The ACA An Even Bigger Deal,https://www.google.com/url?rct=j&sa=t&url=https://www.healthaffairs.org/do/10.1377/hblog20210125.264314/full/&ct=ga&cd=CAIyHDcyMWE5ZGFiNjRlZGE3MTM6Y29tOmVuOlVTOlI&usg=AFQjCNF3ewOm2FKCtHZ1YMOP-wIDLrFNOA,"However, the 36 states that depend on Healthcare.gov have been shut out of this ... for identifying and sharing the most promising technology innovations. ... in making premiums more affordable and reducing cost-sharing burdens.",2021-01-25,Healthcare Cost Sharing
Not so fast: Pending HHS rules subject to 60-day pause,https://www.google.com/url?rct=j&sa=t&url=https://www.benefitspro.com/2021/01/25/not-so-fast-pending-hhs-rules-subject-to-60-day-pause/&ct=ga&cd=CAIyHDcyMWE5ZGFiNjRlZGE3MTM6Y29tOmVuOlVTOlI&usg=AFQjCNHCY_de0DoEH9cYnfYeirBQN9sc7A,... health plans that were in existence before Obamacare took effect. The rule provides more flexibility to make changes to cost-sharing requirements...,2021-01-25,Healthcare Cost Sharing
"Health Payer Unveils Virtual Care Plan, Telehealth Care Access",https://www.google.com/url?rct=j&sa=t&url=https://healthpayerintelligence.com/news/health-payer-unveils-virtual-care-plan-telehealth-care-access&ct=ga&cd=CAIyHDcyMWE5ZGFiNjRlZGE3MTM6Y29tOmVuOlVTOlI&usg=AFQjCNF3oQlHzucLIz18QgNc32cmNIynrw,"Health Payer Unveils Virtual Care Plan, Telehealth Care Access ... members will shoulder little to zero cost-sharing in the Virtual Primary Care service.",2021-01-25,Healthcare Cost Sharing
"Where price transparency compliance stands at Mayo Clinic, Providence + 6 other systems",https://www.google.com/url?rct=j&sa=t&url=https://www.beckershospitalreview.com/finance/where-price-transparency-compliance-stands-at-mayo-clinic-providence-6-other-systems.html&ct=ga&cd=CAIyHDcyMWE5ZGFiNjRlZGE3MTM6Y29tOmVuOlVTOlI&usg=AFQjCNFj7MK4rpatxeuQKTFVx0IUNShYdw,"""In 2016, we introduced a healthcare cost estimation telephone consultation service, then added a self-service ... estimate of their out-of-pocket costs for common clinical services as well as expected costs for their prescription drugs.",2021-01-25,Healthcare Cost Sharing
"How Top Payers Are Providing COVID-19 Vaccine Coverage, Support",https://www.google.com/url?rct=j&sa=t&url=https://healthpayerintelligence.com/news/how-top-payers-are-providing-covid-19-vaccine-coverage-support&ct=ga&cd=CAIyHDcyMWE5ZGFiNjRlZGE3MTM6Y29tOmVuOlVTOlI&usg=AFQjCNHL7x9GgVDOppRVI3B77n-3vEWWqw,"Aetna waived COVID-19 vaccine cost-sharing for commercial and Medicaid members in compliance with the CARES Act. Meanwhile, the health plan""s...",2021-01-25,Healthcare Cost Sharing
New Poll: Virginians Want More Transparency in State Health Insurance Regulatory Practices,https://www.google.com/url?rct=j&sa=t&url=https://www.emporiaindependentmessenger.com/news/article_87c414a4-5cde-11eb-96bd-cfeb9e2047ad.html&ct=ga&cd=CAIyHDcyMWE5ZGFiNjRlZGE3MTM6Y29tOmVuOlVTOlI&usg=AFQjCNEAAO4mcyRXEBjB4i7uNXc_5ROebw,Deductibles and other cost sharing have also increased over this period.” Those findings are consistent with an analysis done by the Kaiser Family...,2021-01-23,Healthcare Cost Sharing
"""Our Sputnik moment"": How Biden can rebuild America""s medical diplomacy",https://www.google.com/url?rct=j&sa=t&url=https://www.fastcompany.com/90595865/our-sputnik-moment-how-biden-can-rebuild-americas-medical-diplomacy&ct=ga&cd=CAIyHDBhNGY1MzE5YzE5ODdjNzQ6Y29tOmVuOlVTOlI&usg=AFQjCNFvVd_9JrQTzXEtCUjfmjtNGP_Fow,"... programs such as PEPFAR, diplomatic exchange programs, and satellite programs in partnership with leading American academic medical centers.",2021-01-26,Healthcare Sharing Programs
"""Our Sputnik moment"": How Biden can rebuild America""s medical diplomacy",https://www.google.com/url?rct=j&sa=t&url=https://www.fastcompany.com/90595865/our-sputnik-moment-how-biden-can-rebuild-americas-medical-diplomacy&ct=ga&cd=CAIyHDBhNGY1MzE5YzE5ODdjNzQ6Y29tOmVuOlVTOlI&usg=AFQjCNFvVd_9JrQTzXEtCUjfmjtNGP_Fow,"... programs such as PEPFAR, diplomatic exchange programs, and satellite programs in partnership with leading American academic medical centers.",2021-01-26,Healthcare Sharing Programs
Industry Voices—Personal health records are a lynchpin to COVID-19 strategies,https://www.google.com/url?rct=j&sa=t&url=https://www.fiercehealthcare.com/tech/industry-voices-personal-health-records-are-a-lynchpin-to-covid-19-strategies&ct=ga&cd=CAIyHDc5M2E3YWM0ZTJjZTM4OWY6Y29tOmVuOlVTOlI&usg=AFQjCNFxXw88_0KRgYN8PuxlNsn5C1eTdg,This is because many patient records are controlled by healthcare organizations and traditionally live in siloes that prevent physicians from sharing...,2021-01-26,Medical Sharing
"Why Second Sight Medical""s Stock Is Trading Higher Today",https://www.google.com/url?rct=j&sa=t&url=https://www.benzinga.com/news/21/01/19325060/why-second-sight-medicals-stock-is-trading-higher-today&ct=ga&cd=CAIyHDc5M2E3YWM0ZTJjZTM4OWY6Y29tOmVuOlVTOlI&usg=AFQjCNFwbjG7BuEes-o51RK8hgRDqCx5TA,Second Sight Medical Products shares traded up 18.17% to $2.47. The stock has a 52-week high of $6.40 and a 52-week low of 69 cents. Where to put...,2021-01-26,Medical Sharing
Healthcare map maker Komodo Health inks data sharing deal with Blue Health Intelligence,https://www.google.com/url?rct=j&sa=t&url=https://www.fiercebiotech.com/medtech/healthcare-mapmaker-komodo-health-inks-data-sharing-deal-blue-health-intelligence&ct=ga&cd=CAIyHDc5M2E3YWM0ZTJjZTM4OWY6Y29tOmVuOlVTOlI&usg=AFQjCNFAejBDwdUJeehNazasVZNV4Qdz3A,"Digital cartographer Komodo Health has inked a multiyear deal to import Blue Health Intelligence""s real-world patient data into its map of the U.S....",2021-01-26,Medical Sharing
Standard Technology Presents Opportunities for Medical Record Data Extraction,https://www.google.com/url?rct=j&sa=t&url=https://www.pewtrusts.org/en/research-and-analysis/reports/2021/01/standard-technology-presents-opportunities-for-medical-record-data-extraction&ct=ga&cd=CAIyHDc5M2E3YWM0ZTJjZTM4OWY6Y29tOmVuOlVTOlI&usg=AFQjCNHrxBYxj69N16stuzL3U9ytofH1HQ,"Yet when it comes to accessing and sharing their health information, hospitals and physician""s offices can frequently ask patients to go through...",2021-01-26,Medical Sharing
PatientsLikeMe Partners With Takeda to Empower Patients and Elevate Patient Voice to the Level ...,https://www.google.com/url?rct=j&sa=t&url=https://finance.yahoo.com/news/patientslikeme-partners-takeda-empower-patients-140000554.html&ct=ga&cd=CAIyHDc5M2E3YWM0ZTJjZTM4OWY6Y29tOmVuOlVTOlI&usg=AFQjCNGJZW-UrY-adE7IRy9_PHKCVFwIIQ,PatientsLikeMe will also work with Takeda in improving shared decision making between patients and healthcare providers through research focused...,2021-01-26,Medical Sharing
"HCA forms COVID-19 research consortium with AHRQ, universities",https://www.google.com/url?rct=j&sa=t&url=https://www.modernhealthcare.com/hospital-systems/hca-forms-covid-19-research-consortium-ahrq-universities&ct=ga&cd=CAIyHDc5M2E3YWM0ZTJjZTM4OWY6Y29tOmVuOlVTOlI&usg=AFQjCNERTwsLQi6IrFV79Y4Yqd9ucASZhA,"HCA Healthcare announced Tuesday that it""s sharing its own clinical data with select institutions to be used for research about the coronavirus.",2021-01-26,Medical Sharing
Federal action on surprise medical bills: What doctors should know,https://www.google.com/url?rct=j&sa=t&url=https://www.ama-assn.org/delivering-care/patient-support-advocacy/federal-action-surprise-medical-bills-what-doctors-should&ct=ga&cd=CAIyHDc5M2E3YWM0ZTJjZTM4OWY6Y29tOmVuOlVTOlI&usg=AFQjCNESmzoCECBjW39A0sVAm7DrzuDHpQ,"... insurer-market dominance, and as patients face unexpected cost sharing through benefit design such as high-deductible health plans,” said Marilyn...",2021-01-26,Medical Sharing
Is telemedicine for dentists?,https://www.google.com/url?rct=j&sa=t&url=http://exclusive.multibriefs.com/content/is-telemedicine-for-dentists/communications&ct=ga&cd=CAIyHDc5M2E3YWM0ZTJjZTM4OWY6Y29tOmVuOlVTOlI&usg=AFQjCNGP-PAg8Z0C2uFuGfara09D9kBX_g,Telemedicine allows healthcare professionals to connect with patients ... Using unfamiliar tech for video conferencing and sharing files can be...,2021-01-26,Medical Sharing
"J&amp;J Pops On Quarterly Beat, Will ""Soon"" Release Covid Vaccine Test Results",https://www.google.com/url?rct=j&sa=t&url=https://www.investors.com/news/technology/jnj-stock-johnson-johnson-earnings-q4-2020/&ct=ga&cd=CAIyHDc5M2E3YWM0ZTJjZTM4OWY6Y29tOmVuOlVTOlI&usg=AFQjCNFLVe9afK771y9TJ0n7TCP1xPDQjQ,"The Dow Jones pharmaceutical company is working on a highly anticipated ... candidate and look forward to sharing details from our Phase 3 study soon,"" ... Meanwhile, consumer health sales eked out a 1.4% gain and medical...",2021-01-26,Medical Sharing
"""Our Sputnik moment"": How Biden can rebuild America""s medical diplomacy",https://www.google.com/url?rct=j&sa=t&url=https://www.fastcompany.com/90595865/our-sputnik-moment-how-biden-can-rebuild-americas-medical-diplomacy&ct=ga&cd=CAIyHDc5M2E3YWM0ZTJjZTM4OWY6Y29tOmVuOlVTOlI&usg=AFQjCNFvVd_9JrQTzXEtCUjfmjtNGP_Fow,"As a nation, America has sadly fallen short in terms of sharing and exporting our medical expertise to other nations during this pandemic.",2021-01-26,Medical Sharing
KMU Initiates the First VR and AR Oral Health Care Lab,https://www.google.com/url?rct=j&sa=t&url=https://qswownews.com/kmu-initiates-the-first-vr-and-ar-oral-health-care-lab/&ct=ga&cd=CAIyHDc5M2E3YWM0ZTJjZTM4OWY6Y29tOmVuOlVTOlI&usg=AFQjCNGhyBcfBOudTIgfNLEGVvjJ-ZCXWA,"... to other Asian countries to achieve technology sharing and medical resources"" sharing, to ultimately improve the quality of global oral health care.",2021-01-26,Medical Sharing
Israel Secures COVID-19 Vaccine Doses By Agreeing To Share Medical Data On Israelis,https://www.google.com/url?rct=j&sa=t&url=https://www.npr.org/transcripts/960465917&ct=ga&cd=CAIyHDc5M2E3YWM0ZTJjZTM4OWY6Y29tOmVuOlVTOlI&usg=AFQjCNHfDyFpZXOqUoLxddzXJAd9CqQZmA,"In order to secure the coronavirus vaccine for its people, Israel made a deal that leverages its population""s health data, which concerns some privacy...",2021-01-26,Medical Sharing
"Here""s why you shouldn""t share links for COVID-19 vaccine appointments",https://www.google.com/url?rct=j&sa=t&url=https://www.ksdk.com/article/news/health/coronavirus/vaccine/why-you-shouldnt-share-links-for-covid-vaccine-appointments/63-3735985f-2d83-4d44-9c09-872df4a4512b&ct=ga&cd=CAIyHDc5M2E3YWM0ZTJjZTM4OWY6Y29tOmVuOlVTOlI&usg=AFQjCNGELNKyrWX5RADHd78bjPgv7XzX2w,Mercy is the only health system in the St. Louis area offering vaccines to high-risk people outside healthcare. Their booking system is full until they...,2021-01-26,Medical Sharing
Crisis in our mental health services,https://www.google.com/url?rct=j&sa=t&url=https://www.irishtimes.com/opinion/letters/crisis-in-our-mental-health-services-1.4467514&ct=ga&cd=CAIyHDc5M2E3YWM0ZTJjZTM4OWY6Y29tOmVuOlVTOlI&usg=AFQjCNFDO6I32seFaITA33Vflq4EGlz85g,"Mental health in Ireland is a Cinderella speciality. As your reporter points out, the allocation of funds as a percentage of the total health budget to...",2021-01-26,Medical Sharing
Israel Secures COVID-19 Vaccine Doses By Agreeing To Share Medical Data On Israelis,https://www.google.com/url?rct=j&sa=t&url=https://www.kclu.org/post/israel-secures-covid-19-vaccine-doses-agreeing-share-medical-data-israelis&ct=ga&cd=CAIyHDc5M2E3YWM0ZTJjZTM4OWY6Y29tOmVuOlVTOlI&usg=AFQjCNHN4kWTAR0pdFmxp9ec3EHUfxVvRg,"AILSA CHANG, HOST: In order to secure the coronavirus vaccine for its people, Israel made a deal that leverages its population""s health data, which...",2021-01-25,Medical Sharing
"Sharing Medical Imaging Data to Enhance Care Quality, Efficiency",https://www.google.com/url?rct=j&sa=t&url=https://healthitanalytics.com/news/sharing-medical-imaging-data-to-enhance-care-quality-efficiency&ct=ga&cd=CAIyHDc5M2E3YWM0ZTJjZTM4OWY6Y29tOmVuOlVTOlI&usg=AFQjCNHES4x8bgegPECrup4rTY4OIDRAsA,Carequality and the Radiological Society of North America have started an initiative to share medical imaging data and improve care quality during the...,2021-01-25,Medical Sharing
Onyx and AMA Innovations Partner to Rethink Ways FHIR-based Technology Can Improve Links ...,https://www.google.com/url?rct=j&sa=t&url=https://www.galvnews.com/news_ap/business/article_490aa70d-22f2-57c6-9028-db1dd93e18e9.html&ct=ga&cd=CAIyHDc5M2E3YWM0ZTJjZTM4OWY6Y29tOmVuOlVTOlI&usg=AFQjCNH5jL-21RiOd_bIM9W2D1FU9HI0hQ,“Most stakeholders in the health community already understand the ... of health data sharing while complying with applicable privacy law and best...,2021-01-25,Medical Sharing
What Medical Data Is Israel Sharing With Pfizer - and Is It Protected?,https://www.google.com/url?rct=j&sa=t&url=https://www.haaretz.com/israel-news/.premium-what-medical-data-is-israel-sharing-with-pfizer-and-is-it-protected-1.9480691&ct=ga&cd=CAIyHDc5M2E3YWM0ZTJjZTM4OWY6Y29tOmVuOlVTOlI&usg=AFQjCNEoTVN35gAsl4Lw_ncySYzjLlBxNQ,"In light of the data-sharing agreement between Israel""s Health Ministry and Pfizer for its COVID-19 vaccine, considerable attention has been paid in...",2021-01-25,Medical Sharing
