title,link,item_text,date_published,google_alert_name
"Don""t let private health insurance be a coronavirus victim",https://www.google.com/url?rct=j&sa=t&url=https://www.washingtonexaminer.com/opinion/dont-let-private-health-insurance-be-a-coronavirus-victim&ct=ga&cd=CAIyHGVmMjU5ZGE1NWJkYjU0NjU6Y29tOmVuOlVTOlI&usg=AFQjCNFWwBzkKtniKwg1WHOmOB0jU--1ug,"... unrestricted healthcare vouchers to purchase whatever health coverage they would like, be it COBRA, a short-term plan, a health-sharing ministry,...",2020-05-24,Health Care Sharing Ministry
Got Medicare? Get a no-cost test for COVID-19,https://www.google.com/url?rct=j&sa=t&url=https://tucson.com/lifestyles/health-med-fit/got-medicare-get-a-no-cost-test-for-covid-19/article_54d8ab92-d92f-5c86-ac69-26b5eb4bf6e7.html&ct=ga&cd=CAIyHDQ1NzZkZjdlYTEzZTg0YTA6Y29tOmVuOlVTOlI&usg=AFQjCNGf4_xnM93n91JZvdW08KKBKTDHPw,"Medicare covers tests with no out-of-pocket costs. ... a Medicare Advantage health plan, your plan generally cannot charge you cost-sharing (including...",2020-05-24,Health Cost Sharing
Lawmakers deal with telehealth bills,https://www.google.com/url?rct=j&sa=t&url=https://www.thetelegraph.com/news/article/Lawmakers-deal-with-telehealth-bills-15292316.php&ct=ga&cd=CAIyHDQ1NzZkZjdlYTEzZTg0YTA6Y29tOmVuOlVTOlI&usg=AFQjCNFQ5g6P3vYuDkop12_cJWir99BSLA,SPRINGFIELD — A pair of health care bills expanding telehealth resources during the COVID-19 pandemic ... Those services would also have been exempt in most cases from cost-sharing measures like copayments or deductibles.,2020-05-24,Health Cost Sharing
"New Mexico Delegation Calls On FEMA To Waive State""s Cost-Share Requirements For COVID-19 ...",https://www.google.com/url?rct=j&sa=t&url=https://ladailypost.com/new-mexico-delegation-calls-on-fema-to-waive-states-cost-share-requirements-for-covid-19-response-efforts/&ct=ga&cd=CAIyHDQ1NzZkZjdlYTEzZTg0YTA6Y29tOmVuOlVTOlI&usg=AFQjCNH6UeOSkImi34Lxaj2OJ3Vz2HjaAw,Tribal nations are taking on enormous and unprecedented costs to protect the health and safety of their communities. Closure of Tribally-owned...,2020-05-24,Health Cost Sharing
"Congress Said COVID-19 Tests Should Be Free — But Who""s Paying?",https://www.google.com/url?rct=j&sa=t&url=https://www.wmfe.org/congress-said-covid-19-tests-should-be-free-but-whos-paying/154712&ct=ga&cd=CAIyHDQ1NzZkZjdlYTEzZTg0YTA6Y29tOmVuOlVTOlI&usg=AFQjCNGuxlBc2wM2zMDtnTq-0yBv3QnKCw,"NYU Langone Health and Cleveland Clinic said they won""t bill patients any cost sharing for testing, even if that means they have to bear the cost. The...",2020-05-22,Health Cost Sharing
Contact tracing for COVID-19 will be the most complex health investigation ever,https://www.google.com/url?rct=j&sa=t&url=https://www.nationalgeographic.com/science/2020/05/coronavirus-contact-tracing-covid-19-complex-health-investigation/&ct=ga&cd=CAIyGmU4MWY4MmViNmViOTg5MTE6Y29tOmVuOlVT&usg=AFQjCNE4E5C4pHKhPVFEomUElQoB_18zWw,"Within days, she and a granddaughter who shared her tenement were dead. Soon, health officials would confirm their worst fears: “Mrs. B” had...",2020-05-24,Health Sharing
Mental health apps draw wave of new users as experts call for more oversight,https://www.google.com/url?rct=j&sa=t&url=https://www.cnbc.com/2020/05/24/mental-health-apps-draw-wave-of-users-as-experts-call-for-oversight.html&ct=ga&cd=CAIyGmU4MWY4MmViNmViOTg5MTE6Y29tOmVuOlVT&usg=AFQjCNEC01plos3hC-VGC4SFl0z2FSEn3g,"Sharing data with third parties is ubiquitous across mental health apps. In 2019, when researchers examined data practices of 36 top-ranked apps for...",2020-05-24,Health Sharing
COLLECTION OF SHORT FILMS SHARED TO BOOST HEALTH AND WELLBEING,https://www.google.com/url?rct=j&sa=t&url=https://www.islandecho.co.uk/collection-of-short-films-shared-to-boost-health-and-wellbeing/&ct=ga&cd=CAIyGmU4MWY4MmViNmViOTg5MTE6Y29tOmVuOlVT&usg=AFQjCNG4qSpqJvG2mQ5rC3kfBSPMcFJF_Q,"The Isle of Wight Trust is sharing a collection of short films titled ""Day by Day"" to help boost the health and wellbeing of Islanders during the...",2020-05-24,Health Sharing
New York and Fukushima hospitals share coronavirus treatment guidelines,https://www.google.com/url?rct=j&sa=t&url=https://www.japantimes.co.jp/news/2020/05/24/national/science-health/new-york-fukushima-hospitals-share-coronavirus-treatment-guidelines/&ct=ga&cd=CAIyGmU4MWY4MmViNmViOTg5MTE6Y29tOmVuOlVT&usg=AFQjCNHz03Da8q75KaZruDiASkGmdSMmcQ,Fukushima Medical University has translated the guidelines and manual into Japanese to share information among its workers. Shunichi Yamashita...,2020-05-24,Health Sharing
Greater transparency sought in nursing home deaths,https://www.google.com/url?rct=j&sa=t&url=https://www.capecodtimes.com/news/20200524/greater-transparency-sought-in-cape-cod-nursing-home-deaths&ct=ga&cd=CAIyGmU4MWY4MmViNmViOTg5MTE6Y29tOmVuOlVT&usg=AFQjCNHpl-28k7C1e0iRWNqI9-P4jXXzjw,Not every nursing home or town health director is sharing information with the public about fatalities or positive tests in individual nursing homes.,2020-05-24,Health Sharing
Charley Webb reveals hardest thing about her three pregnancies in candid post,https://www.google.com/url?rct=j&sa=t&url=https://www.hellomagazine.com/healthandbeauty/mother-and-baby/2020052490346/charley-webb-shares-mental-health-struggles-sons-instagram/&ct=ga&cd=CAIyGmU4MWY4MmViNmViOTg5MTE6Y29tOmVuOlVT&usg=AFQjCNGhkItk7xlpgOYT7BS_dHANn8gMIg,"Sharing a new family photo taken in the hospital shortly after she gave birth to Ace, she ... WATCH: Charley Webb shares rare video of baby Ace ... about their mental health in a bid to raise money for the charity Pandas Foundation.",2020-05-24,Health Sharing
ECO Animal Health Group plc (LON:EAH) Stock Has Shown Weakness Lately But Financials Look ...,https://www.google.com/url?rct=j&sa=t&url=https://simplywall.st/stocks/gb/pharmaceuticals-biotech/aim-eah/eco-animal-health-group-shares/news/eco-animal-health-group-plc-loneah-stock-has-shown-weakness-lately-but-financials-look-strong-should-prospective-shareholders-make-the-leap/&ct=ga&cd=CAIyGmU4MWY4MmViNmViOTg5MTE6Y29tOmVuOlVT&usg=AFQjCNH5AWxM8BJu0DvTp7SJHYu6qM8mSA,"It is hard to get excited after looking at ECO Animal Health Group""s (LON:EAH) recent performance, when its stock has declined 18% over the past...",2020-05-24,Health Sharing
Indore: SAIMS ordered to share Covid-19 test results,https://www.google.com/url?rct=j&sa=t&url=https://timesofindia.indiatimes.com/city/indore/indore-saims-ordered-to-share-covid-19-test-results/articleshow/75936914.cms&ct=ga&cd=CAIyGmU4MWY4MmViNmViOTg5MTE6Y29tOmVuOlVT&usg=AFQjCNEPsBN8uCZ-QMFJv-n3bwlkiBCgcA,INDORE: The district health department has directed Sri Aurbindo Institute of Medical Sciences (SAIMS) hospital to share details of Covid-19 tests...,2020-05-24,Health Sharing
"New Mexico Delegation Calls On FEMA To Waive State""s Cost-Share Requirements For COVID-19 ...",https://www.google.com/url?rct=j&sa=t&url=https://ladailypost.com/new-mexico-delegation-calls-on-fema-to-waive-states-cost-share-requirements-for-covid-19-response-efforts/&ct=ga&cd=CAIyGmU4MWY4MmViNmViOTg5MTE6Y29tOmVuOlVT&usg=AFQjCNH6UeOSkImi34Lxaj2OJ3Vz2HjaAw,Tribal nations are taking on enormous and unprecedented costs to protect the health and safety of their communities. Closure of Tribally-owned...,2020-05-24,Health Sharing
"Don""t let private health insurance be a coronavirus victim",https://www.google.com/url?rct=j&sa=t&url=https://www.washingtonexaminer.com/opinion/dont-let-private-health-insurance-be-a-coronavirus-victim&ct=ga&cd=CAIyGmU4MWY4MmViNmViOTg5MTE6Y29tOmVuOlVT&usg=AFQjCNFWwBzkKtniKwg1WHOmOB0jU--1ug,"... unrestricted healthcare vouchers to purchase whatever health coverage they would like, be it COBRA, a short-term plan, a health-sharing ministry,...",2020-05-24,Health Sharing
Tippecanoe County Health Dept. releases plan for summer sports leagues,https://www.google.com/url?rct=j&sa=t&url=https://www.wlfi.com/content/news/Tippecanoe-County-Health-Dept-releases-plan-for-summer-sports-leagues-570725881.html&ct=ga&cd=CAIyGmU4MWY4MmViNmViOTg5MTE6Y29tOmVuOlVT&usg=AFQjCNEAozO8NqW6bXuFaPbiESyK6Tos3A,Drinks should not be shared. Examples from the NFHS Guidance for Opening High School Athletics/Activities Sports Med Advisory Committee: A...,2020-05-23,Health Sharing
Unable to load video.,https://www.google.com/url?rct=j&sa=t&url=https://www.newscentermaine.com/video/news/health/coronavirus/reason-to-smile-bored-pastor-aims-to-make-people-laugh-and-share-a-unique-message/97-f0f580ab-afc9-427b-8de1-21306750c0c2&ct=ga&cd=CAIyGmU4MWY4MmViNmViOTg5MTE6Y29tOmVuOlVT&usg=AFQjCNEU53l19xOvYHFc8k2QH2L9YvVUIg,Local &middot; Money &middot; Entertainment &middot; Nation World &middot; Health &middot; Politics &middot; Life &middot; Investigative &middot; Community. Weather &amp; Traffic. Current Weather &middot; Radar &middot; Maps.,2020-05-23,Health Sharing
"Social Bubble and Work Groups, Another Outbreak, Mendocino Officials Discuss This and More in ...",https://www.google.com/url?rct=j&sa=t&url=https://kymkemp.com/2020/05/23/social-bubble-and-work-groups-a-another-outbreak/&ct=ga&cd=CAIyGmU4MWY4MmViNmViOTg5MTE6Y29tOmVuOlVT&usg=AFQjCNGzoCqlRBKZJ1TxKNQJb7Ayh0odBQ,I am your full-time health officer. I do not have any other employment at this time which I want to share with you to be clear that the public health officer...,2020-05-23,Health Sharing
"Prince William Opens Up About Parenting Prince George, Princess Charlotte, and Prince Louis",https://www.google.com/url?rct=j&sa=t&url=https://www.townandcountrymag.com/society/tradition/a32649319/prince-william-george-louis-princess-charlotte-emotion-fatherhood-quote/&ct=ga&cd=CAIyGmU4MWY4MmViNmViOTg5MTE6Y29tOmVuOlVT&usg=AFQjCNEgobvSgf7KaGHc1yyogHFz-Hwk7g,"Marvin, who retired from soccer last year at age 28, shared how his mental health was affected while playing the sport professionally. Speaking to...",2020-05-23,Health Sharing
Rolling Stones Guitarist Ronnie Wood Shares Crucial Mental Health Struggles Message For ...,https://www.google.com/url?rct=j&sa=t&url=https://metalheadzone.com/rolling-stones-guitarist-ronnie-wood-shares-crucial-mental-health-struggles-message-for-awareness/&ct=ga&cd=CAIyGmU4MWY4MmViNmViOTg5MTE6Y29tOmVuOlVT&usg=AFQjCNHw_jaf6XsscYEjF-hxsEel-dq33A,"... Ronnie Wood, shared a recent video on his verified Instagram account today and took fans"" attention to the ""Mental Health Awareness Week"" once...",2020-05-23,Health Sharing
"Chicago Couple Share Distance ""Date Nights"" From Hospital Window While Pregnant Wife Awaits ...",https://www.google.com/url?rct=j&sa=t&url=https://wbbm780.radio.com/articles/husband-share-distance-date-nights-from-hospital-window&ct=ga&cd=CAIyGmU4MWY4MmViNmViOTg5MTE6Y29tOmVuOlVT&usg=AFQjCNGBAMaWC0CRd4A-lvRAIS5H_rLfXg,"Shona Moeller, six months pregnant, has been on bed rest at AMITA Health Adventist Medical Center in Hinsdale since April 13, awaiting the birth of...",2020-05-23,Health Sharing
"From Camping To Dining Out: Here""s How Experts Rate The Risks Of 14 Summer Activities",https://www.google.com/url?rct=j&sa=t&url=https://www.npr.org/sections/health-shots/2020/05/23/861325631/from-camping-to-dining-out-heres-how-experts-rate-the-risks-of-14-summer-activit&ct=ga&cd=CAIyGmU4MWY4MmViNmViOTg5MTE6Y29tOmVuOlVT&usg=AFQjCNFvhWEu4tVsraPmu0VPzxgSoVIrmg,"... a panel of infectious disease and public health experts to rate the risk of summer activities, from backyard gatherings to a day at the pool to sharing a...",2020-05-23,Health Sharing
"President Trump""s Private Banking Information May Have Been Accidentally Shared During a ...",https://www.google.com/url?rct=j&sa=t&url=https://time.com/5841849/trump-banking-information-check-kayleigh-mcenany/&ct=ga&cd=CAIyGmU4MWY4MmViNmViOTg5MTE6Y29tOmVuOlVT&usg=AFQjCNH__90U8vtMpaLlNPGIF8m5nHMMNA,"... press briefing, when White House Press Secretary Kayleigh McEnany announced the President would donate his salary to the Department of Health...",2020-05-23,Health Sharing
Sudan to establish police force to protect health workers,https://www.google.com/url?rct=j&sa=t&url=https://www.startribune.com/sudan-to-establish-police-force-to-protect-health-workers/570721252/&ct=ga&cd=CAIyGmU4MWY4MmViNmViOTg5MTE6Y29tOmVuOlVT&usg=AFQjCNF1WXkKWm__HQSIbj808vVG4S03-w,"However, military-backed health authorities say only 87 died, including security forces. Later, the generals and the protesters reached a power-sharing...",2020-05-23,Health Sharing
"Happy Eid 2020: Eid al-Fitr Chand Mubarak msgs, photos and wishes to share with your loved ones",https://www.google.com/url?rct=j&sa=t&url=https://www.timesnownews.com/spiritual/religion/article/eid-2020-eid-al-fitr-chand-mubarak-messages-photos-and-wishes-to-share-with-your-loved-ones/595764&ct=ga&cd=CAIyGmU4MWY4MmViNmViOTg5MTE6Y29tOmVuOlVT&usg=AFQjCNHmxkIqeew3G-8mxOZpiO7Uv0lrCg,"As the Eid ka Chand illuminates the sky, may your life be always filled with light, love, happiness and good health. May the light of the moon fall...",2020-05-23,Health Sharing
"Telehealth expansion package passes Illinois House, heads to Senate",https://www.google.com/url?rct=j&sa=t&url=https://www.lincolncourier.com/news/20200523/telehealth-expansion-package-passes-illinois-house-heads-to-senate&ct=ga&cd=CAIyHDcyMWE5ZGFiNjRlZGE3MTM6Y29tOmVuOlVTOlI&usg=AFQjCNEfNUoLyHuKUZisg091vEvWi3-auw,A pair of health care bills expanding telehealth resources during the ... in most cases from cost-sharing measures like copayments or deductibles.,2020-05-24,Healthcare Cost Sharing
"Europe Home Healthcare Software Market 2020-2025 Key Player, Demand, Growth, Opportunities ...",https://www.google.com/url?rct=j&sa=t&url=https://jewishlifenews.com/uncategorized/europe-home-healthcare-software-market-2020-2025-key-player-demand-growth-opportunities-and-analysis-forecast/&ct=ga&cd=CAIyHDcyMWE5ZGFiNjRlZGE3MTM6Y29tOmVuOlVTOlI&usg=AFQjCNHhK6_vDsSNHtaTHMJi2GZHll8ikA,"Global Home Healthcare Software Market research report provides detail ... Software Market Size Covers Global Industry Analysis, Size, Share, CAGR, Trends, ... of home healthcare services to reduce the growing healthcare costs,...",2020-05-23,Healthcare Cost Sharing
"Medical Terminology Sharing Market Size | Global Industry Analysis, Segments, Top Key Players ...",https://www.google.com/url?rct=j&sa=t&url=https://bulletinline.com/2020/05/23/medical-terminology-sharing-market-size-global-industry-analysis-segments-top-key-players-drivers-and-trends-to-2025/&ct=ga&cd=CAIyHDc5M2E3YWM0ZTJjZTM4OWY6Y29tOmVuOlVTOlI&usg=AFQjCNFhTtAHEp2UBD3ROapsnP3fGHaMxg,"As per the Medical Terminology Sharing market report, the industry is likely to amass significant returns while recording a lucrative annual growth rate...",2020-05-23,Medical Sharing
California should eliminate cost-sharing for abortion during COVID-19 pandemic,https://www.google.com/url?rct=j&sa=t&url=https://calmatters.org/commentary/california-should-eliminate-cost-sharing-for-aborion-during-covid-19-pandemic/&ct=ga&cd=CAIyHDc5M2E3YWM0ZTJjZTM4OWY6Y29tOmVuOlVTOlI&usg=AFQjCNGXyCZVkZskkoTaLwDvGun99H2vAg,Health care costs that are prohibitively expensive and inconsistent are unacceptable. I hope that you will support my effort to turn this bill into law next...,2020-05-23,Medical Sharing
Zimbabwean president hails Chinese medical team for support in fighting COVID-19 pandemic,https://www.google.com/url?rct=j&sa=t&url=https://www.pmldaily.com/news/world/2020/05/zimbabwean-president-hails-chinese-medical-team-for-support-in-fighting-covid-19-pandemic.html&ct=ga&cd=CAIyHDc5M2E3YWM0ZTJjZTM4OWY6Y29tOmVuOlVTOlI&usg=AFQjCNFUq4rg8xRDs9Z2l4jInCm1cHyOJw,"During its visit, the 12-member team of Chinese medical experts toured four of the country""s 10 provinces to share their experience with local medical...",2020-05-22,Medical Sharing
COVID-19 data sharing with law enforcement sparks concern,https://www.google.com/url?rct=j&sa=t&url=https://www.heraldpalladium.com/news/wire/covid-19-data-sharing-with-law-enforcement-sparks-concern/article_75658f34-a48b-58ec-8129-cae19c0869b6.html&ct=ga&cd=CAIyHDc5M2E3YWM0ZTJjZTM4OWY6Y29tOmVuOlVTOlI&usg=AFQjCNFFf2SUcdu54FcCBeEAgIAfRt3EUw,"Sharing information about people who have tested positive or been exposed to COVID-19 with first responders does not violate medical privacy laws,...",2020-05-19,Medical Sharing
