title,link,item_text,date_published,google_alert_name
Christian Care Ministry/Medi-Share Earns 2021 Great Place to Work Certification™,https://www.google.com/url?rct=j&sa=t&url=https://www.digitaljournal.com/pr/christian-care-ministry-medi-share-earns-2021-great-place-to-work-certification&ct=ga&cd=CAIyHDcwNjg0ZGMwOTMxYjI0NDM6Y29tOmVuOlVTOlI&usg=AFQjCNG14I4qOdBkgO0T6NdM4_zfhcVaoA,"Christian Care Ministry/ Medi-Share, the nation""s leading health care sharing ministry, is proud to be a Certified™ by Great Place to Work®. Christian...",2021-05-18,Christian Health Care Sharing
Medi-Share welcomes staff as they return onsite to offices after more than a year of working remotely,https://www.google.com/url?rct=j&sa=t&url=https://www.digitaljournal.com/pr/medi-share-welcomes-staff-as-they-return-onsite-to-offices-after-more-than-a-year-of-working-remotely&ct=ga&cd=CAIyHDcwNjg0ZGMwOTMxYjI0NDM6Y29tOmVuOlVTOlI&usg=AFQjCNH7Pl5Ii6pg4pmHDaLpxHD_9PJsLA,"Christian Care Ministry (CCM), a not-for-profit 501(c)(3) corporation, based in Melbourne, FL, operates the Medi-Share program, a Christian health...",2021-05-17,Christian Health Care Sharing
Christian Care Ministry/Medi-Share Earns 2021 Great Place to Work Certification™,https://www.google.com/url?rct=j&sa=t&url=https://www.digitaljournal.com/pr/christian-care-ministry-medi-share-earns-2021-great-place-to-work-certification&ct=ga&cd=CAIyHDBlYjRmZTFlNDk3NWE4OGE6Y29tOmVuOlVTOlI&usg=AFQjCNG14I4qOdBkgO0T6NdM4_zfhcVaoA,"Christian Care Ministry/ Medi-Share, the nation""s leading health care sharing ministry, is proud to be a Certified™ by Great Place to Work®. Christian...",2021-05-18,Christian Sharing Ministry
Africa: Financing Healthcare in Nigeria is Beyond Allocating 15% of National Budget To Health,https://www.google.com/url?rct=j&sa=t&url=https://allafrica.com/stories/202105190548.html&ct=ga&cd=CAIyHDQ1NzZkZjdlYTEzZTg0YTA6Y29tOmVuOlVTOlI&usg=AFQjCNHVepZtFjFfpEXzBorlNXGSJ5oiVw,"Health insurance based on the principle of risk pooling and cost-sharing offers a way out for the prevalent out-of-pocket expenditure in Nigeria, which...",2021-05-19,Health Cost Sharing
"A Proclamation on National Hepatitis Testing Day, 2021",https://www.google.com/url?rct=j&sa=t&url=https://www.whitehouse.gov/briefing-room/presidential-actions/2021/05/18/a-proclamation-on-national-hepatitis-testing-day-2021/&ct=ga&cd=CAIyHDQ1NzZkZjdlYTEzZTg0YTA6Y29tOmVuOlVTOlI&usg=AFQjCNGpI54WugdCmDwdwfxrUxcyAQQHHw,"Viral hepatitis is a serious, preventable public health threat that puts people who are infected at ... Because of the Affordable Care Act, most health insurance plans must cover hepatitis B and hepatitis C testing with no cost-sharing.",2021-05-18,Health Cost Sharing
Nashville-area Providers to Launch New Clinically Integrated Network to Improve Patient Outcomes,https://www.google.com/url?rct=j&sa=t&url=https://www.streetinsider.com/Business%2BWire/Nashville-area%2BProviders%2Bto%2BLaunch%2BNew%2BClinically%2BIntegrated%2BNetwork%2Bto%2BImprove%2BPatient%2BOutcomes/18438661.html&ct=ga&cd=CAIyHDQ1NzZkZjdlYTEzZTg0YTA6Y29tOmVuOlVTOlI&usg=AFQjCNGhjLazWm3m3MmZVnQcpIy0DHe7Uw,"The new affiliation is being created to improve patient health outcomes through ... In addition, by aligning as a CIN, we can share resources, knowledge and ... treatment plan, which will result in better health outcomes at a lower cost.",2021-05-18,Health Cost Sharing
Novus Reports First Quarter 2021 Results,https://www.google.com/url?rct=j&sa=t&url=https://finance.yahoo.com/news/novus-reports-first-quarter-2021-130000177.html&ct=ga&cd=CAIyHDQ1NzZkZjdlYTEzZTg0YTA6Y29tOmVuOlVTOlI&usg=AFQjCNEHUK11nHSi5QZy3l7B8oGFQo44nA,Oneshare: A medical cost-sharing provider an ACA-exempt path to healthcare. Its health-based sharing membership plan focuses on Catastrophic...,2021-05-18,Health Cost Sharing
Statewide Collaboration Leads the Way in Closing Gaps in Vaccine Administration Tracking and ...,https://www.google.com/url?rct=j&sa=t&url=https://www.streetinsider.com/Business%2BWire/Statewide%2BCollaboration%2BLeads%2Bthe%2BWay%2Bin%2BClosing%2BGaps%2Bin%2BVaccine%2BAdministration%2BTracking%2Band%2BMonitoring%2BThrough%2BState%2BImmunization%2BRegistry%2BIntegration/18437989.html&ct=ga&cd=CAIyHDQ1NzZkZjdlYTEzZTg0YTA6Y29tOmVuOlVTOlI&usg=AFQjCNE33CWYP4yp1h_CXwBXoUTKKUte9w,HIT Commons is partnering with Oregon Health Authority (OHA) Public ... “The data sharing partnership using the Collective Platform has helped us ... Vaccine Population Report data will help us increase vaccination rates and help...,2021-05-18,Health Cost Sharing
Colorado health option bill still awaiting action from Senate committee,https://www.google.com/url?rct=j&sa=t&url=https://www.coloradopolitics.com/news/colorado-health-option-bill-still-awaiting-action-from-senate-committee/article_25ea83b2-b788-11eb-8441-731e25485d49.html&ct=ga&cd=CAIyHDQ1NzZkZjdlYTEzZTg0YTA6Y29tOmVuOlVTOlI&usg=AFQjCNE0BsA_pE8T8aWTCTDagK1jcXpXxA,"The bill requires health insurers, doctors and hospitals to reduce the cost of health care, as reflected in insurance ... People weren""t sharing stories of their grandchildren; they were sharing stories about how they had to pay for...",2021-05-18,Health Cost Sharing
"Worldwide Flea and Tick Product Market Opportunities, Demand-Supply Chain, Cost Revenue ...",https://www.google.com/url?rct=j&sa=t&url=https://www.mccourier.com/worldwide-flea-and-tick-product-market-opportunities-demand-supply-chain-cost-revenue-sales-structure-market-analysis-2020-eli-lilly-and-co-bayer-ag-wellmark-international-merial-animal-health/&ct=ga&cd=CAIyHDQ1NzZkZjdlYTEzZTg0YTA6Y29tOmVuOlVTOlI&usg=AFQjCNFkCAb0joEuU6ulHsctpxj9iwlnpw,"Eli Lilly and Co, Bayer AG, Wellmark International, Merial Animal Health Ltd, The Hartz Mountain Corp, Merck Animal Health, Ceva Sante Animale S. A...",2021-05-18,Health Cost Sharing
HHS to reimburse providers who administer COVID-19 vaccines to underinsured patients,https://www.google.com/url?rct=j&sa=t&url=https://www.ada.org/en/publications/ada-news/2021-archive/may/hhs-to-reimburse-providers-who-administer-covid-19-vaccines-to-underinsured-patients&ct=ga&cd=CAIyHDQ1NzZkZjdlYTEzZTg0YTA6Y29tOmVuOlVTOlI&usg=AFQjCNFxge2Qy_8saFaVqoDAkinkJWancg,"May 17, 2021 Health care providers who administer COVID-19 vaccines to ... that either do not cover vaccination fees or cover them with patient cost-sharing. ... While the vaccine must come at no out-of-pocket cost to the recipient,...",2021-05-17,Health Cost Sharing
"Anthem, Epic team to enhance data sharing with providers",https://www.google.com/url?rct=j&sa=t&url=https://www.fiercehealthcare.com/payer/anthem-epic-team-to-enhance-data-sharing-providers&ct=ga&cd=CAIyGmU4MWY4MmViNmViOTg5MTE6Y29tOmVuOlVT&usg=AFQjCNEmbD4-G9Ju0GWCWFeRcFjd2vh7tg,"Ashok Chennuru, chief data and insights officer at Anthem, told Fierce Healthcare that, for example, when a patient is discharged from the hospital,...",2021-05-19,Health Sharing
"""Deeply regrettable"" if patient data being shared online, says Ryan",https://www.google.com/url?rct=j&sa=t&url=https://www.rte.ie/news/health/2021/0519/1222478-hse-cyber-attack-latest/&ct=ga&cd=CAIyGmU4MWY4MmViNmViOTg5MTE6Y29tOmVuOlVT&usg=AFQjCNHfYtXCADJ8pIedp8u_niode7GksQ,"The Health Service Executive was last week forced to shut down all of its IT systems following a ""significant"" ransomware attack, which focused on...",2021-05-19,Health Sharing
"Nursing homes prioritize health data-sharing, but challenges remain",https://www.google.com/url?rct=j&sa=t&url=https://www.mcknights.com/news/clinical-news/nursing-homes-prioritize-health-data-sharing-but-challenges-remain/&ct=ga&cd=CAIyGmU4MWY4MmViNmViOTg5MTE6Y29tOmVuOlVT&usg=AFQjCNGLRVPbxfvxb-GMN-l4Uj2WC9lN7g,"Although health data-sharing brings significant benefits for patients and residents as well as providers alike, a study published in the May issue of...",2021-05-19,Health Sharing
"UNHCR warns against “exporting” asylum, calls for responsibility sharing for refugees, not burden ...",https://www.google.com/url?rct=j&sa=t&url=https://www.unhcr.org/news/press/2021/5/60a2751813/unhcr-warns-against-exporting-asylum-calls-responsibility-sharing-refugees.html&ct=ga&cd=CAIyGmU4MWY4MmViNmViOTg5MTE6Y29tOmVuOlVT&usg=AFQjCNE3Tjmh1Z4uS-cbg8aRTSxjxC095w,"Some of these safeguards include protection against refoulement, access to fair and efficient asylum procedures, health care, employment, education,...",2021-05-19,Health Sharing
Game of Thrones Actor Hafþór Júlíus Björnsson Reveals 110-Pound Weight Loss and Body ...,https://www.google.com/url?rct=j&sa=t&url=https://people.com/health/game-of-thrones-actor-hafthor-julius-bjornsson-shares-110-pound-weight-loss-transformation/&ct=ga&cd=CAIyGmU4MWY4MmViNmViOTg5MTE6Y29tOmVuOlVT&usg=AFQjCNF9meqHWmlBbvIfFErACizMDygqRg,"Right now my heart tells me that I need to be healthy for my family and do what""s best for them!"" Björnsson shares a son — who was born in September...",2021-05-19,Health Sharing
Unpublished hospital patient safety reports exposed,https://www.google.com/url?rct=j&sa=t&url=https://www.bbc.com/news/health-57144923&ct=ga&cd=CAIyGmU4MWY4MmViNmViOTg5MTE6Y29tOmVuOlVT&usg=AFQjCNFHynfx6VQKzmoGzlx6MXvwy4AeQg,"... written by medical royal colleges, which NHS trusts have a duty to share. Eighty reports were given to the BBC but only 26 had been shared in full...",2021-05-18,Health Sharing
Herd immunity sought,https://www.google.com/url?rct=j&sa=t&url=https://www.roanoke-chowannewsherald.com/2021/05/18/herd-immunity-sought/&ct=ga&cd=CAIyGmU4MWY4MmViNmViOTg5MTE6Y29tOmVuOlVT&usg=AFQjCNFh6OumJyNZnYkKF3k8PvIkoIl_sA,"That""s why local healthcare providers are working to share information and ... Representatives from Roanoke Chowan Community Health Center...",2021-05-18,Health Sharing
Access to personal electronic health records during covid-19,https://www.google.com/url?rct=j&sa=t&url=https://blogs.bmj.com/bmj/2021/05/18/access-to-personal-electronic-health-records-during-covid-19/&ct=ga&cd=CAIyGmU4MWY4MmViNmViOTg5MTE6Y29tOmVuOlVT&usg=AFQjCNF8mX6SJ3UmOqL-ZCCdD_6ZeKTlCw,"This use falls short of sharing all information as the ePHR is not integrated with our hospital""s electronic patient record (EPR) and consultation details are...",2021-05-18,Health Sharing
Could a vaccine-sharing plan get the US-Canada border reopened?,https://www.google.com/url?rct=j&sa=t&url=https://www.wcax.com/2021/05/18/could-a-vaccine-sharing-plan-get-the-us-canada-border-reopened/&ct=ga&cd=CAIyGmU4MWY4MmViNmViOTg5MTE6Y29tOmVuOlVT&usg=AFQjCNHxAP4d8-zTRd0v2gizRsnYhhIJxQ,"Jones says local health organizations are on board but can""t move forward without the state""s approval. “The conversations are happening informally but...",2021-05-18,Health Sharing
"Opening UpLili Reinhart Feels ""Defeated by Depression"": The ""Riverdale"" Star""s Quotes About ...",https://www.google.com/url?rct=j&sa=t&url=https://www.j-14.com/posts/lili-reinharts-quotes-about-mental-health-depression-anxiety/&ct=ga&cd=CAIyGmU4MWY4MmViNmViOTg5MTE6Y29tOmVuOlVT&usg=AFQjCNHGPuEYgNy_B6bGnucvIkAHa0JJIA,"Aside from sharing her struggles with fans on social media, the CW personality ... our gallery to read Lili""s most candid quotes about her mental health.",2021-05-18,Health Sharing
Resources for talking to your children about mental health,https://www.google.com/url?rct=j&sa=t&url=https://whnt.com/community/children-and-mental-health/resources-for-talking-to-your-children-about-mental-health/&ct=ga&cd=CAIyGmU4MWY4MmViNmViOTg5MTE6Y29tOmVuOlVT&usg=AFQjCNHTejmjztVfF7z9xUgt_6pnAHCzSA,"Dr. Penland says, “I usually tell parents, you can share whatever you feel comfortable with your child, as long as you are there to explain it to them. If you...",2021-05-18,Health Sharing
"Cyberspace, Digital Technologies, and Reform of Global Health Governance",https://www.google.com/url?rct=j&sa=t&url=https://www.cfr.org/blog/cyberspace-digital-technologies-and-reform-global-health-governance&ct=ga&cd=CAIyGmU4MWY4MmViNmViOTg5MTE6Y29tOmVuOlVT&usg=AFQjCNEZx-Tdxe7uR4ik0XyKDsZNUsfFWA,The IHR operationalizes a precautionary approach and does not give governments a veto over information sharing. The WHO can receive information...,2021-05-18,Health Sharing
India vaccine-maker hopes to share shots by end of the year,https://www.google.com/url?rct=j&sa=t&url=https://www.aljazeera.com/news/2021/5/18/india-unlikely-to-resume-covid-jab-exports-until-october-report&ct=ga&cd=CAIyGmU4MWY4MmViNmViOTg5MTE6Y29tOmVuOlVT&usg=AFQjCNH2H2P25qso1muO5n8fGwYc0sFeow,"A healthcare worker gives a dose of vaccine to a woman inside a classroom of a school, which has been converted into a temporary vaccination centre,...",2021-05-18,Health Sharing
"Tallulah Willis ""resented"" looking like dad Bruce: How she copes with body dysmorphic disorder",https://www.google.com/url?rct=j&sa=t&url=https://www.usatoday.com/story/life/health-wellness/2021/05/18/tallulah-willis-body-dysmorphic-disorder-looking-like-dad-bruce/5144850001/&ct=ga&cd=CAIyGmU4MWY4MmViNmViOTg5MTE6Y29tOmVuOlVT&usg=AFQjCNF5lvCGq8qBKHiwBEsgNBxa4hWOKw,"Willis also shared her tips for coping with the disorder: ... More:Demi Moore and Bruce Willis"" daughter Tallulah gets real about mental health struggles.",2021-05-18,Health Sharing
Health Fusion: Should you let your dog sleep in your bed at night?,https://www.google.com/url?rct=j&sa=t&url=https://www.duluthnewstribune.com/newsmd/wellness/7032141-Health-Fusion-Should-you-let-your-dog-sleep-in-your-bed-at-night&ct=ga&cd=CAIyGmU4MWY4MmViNmViOTg5MTE6Y29tOmVuOlVT&usg=AFQjCNFgNsStvjyr40Sklusq5QK-PTFelA,"In this episode of NewsMD""s podcast, ""Health Fusion,"" Viv Williams ... She and her colleagues wanted to find out if sharing your bed with a dog...",2021-05-18,Health Sharing
"Number of virus cases in Arkansas schools exceeds 30000, health agency says",https://www.google.com/url?rct=j&sa=t&url=https://www.arkansasonline.com/news/2021/may/18/number-covid-cases-arkansas-schools-reaches-30000-/%3Fnews-arkansas&ct=ga&cd=CAIyGmU4MWY4MmViNmViOTg5MTE6Y29tOmVuOlVT&usg=AFQjCNHNvyXfY3Zf5tg1gl6pkt8lLAk2Qg,Our comment area is provided to give users an opportunity to express their opinions and share their ideas and information in a civil manner. So please:.,2021-05-18,Health Sharing
Universal health care must be a priority — even amid COVID,https://www.google.com/url?rct=j&sa=t&url=https://www.nature.com/articles/d41586-021-01313-3&ct=ga&cd=CAIyGmU4MWY4MmViNmViOTg5MTE6Y29tOmVuOlVT&usg=AFQjCNG3G-h4gKIxnwR58kG0VKFqPkF_7A,A lack of easily accessible health care — and of health systems for sharing information — has impeded the detection and monitoring of COVID-19...,2021-05-18,Health Sharing
"AMA""s Return on Health",https://www.google.com/url?rct=j&sa=t&url=https://www.ama-assn.org/practice-management/digital/amas-return-health&ct=ga&cd=CAIyGmU4MWY4MmViNmViOTg5MTE6Y29tOmVuOlVT&usg=AFQjCNEZWEHdl0T6c7Gs8G-b6SyNv3zL5w,Collaborate with the AMA. Share how you are measuring value for digitally enabled care in your practice setting. Contact Us...,2021-05-18,Health Sharing
Shawn Mendes &amp; Camilla Cabello Are Sharing Their Mental Health Journeys On Calm,https://www.google.com/url?rct=j&sa=t&url=https://www.bustle.com/wellness/shawn-mendez-camila-cabello-joining-calm&ct=ga&cd=CAIyGmU4MWY4MmViNmViOTg5MTE6Y29tOmVuOlVT&usg=AFQjCNGhMS863RFDm5E19ff3V-s6-N0iLw,Shawn Mendes &amp; Camilla Cabello Are Sharing Their Mental Health Journeys On Calm. The stars have created a series to discuss the benefits of...,2021-05-18,Health Sharing
Shawn Mendes And Camila Cabello Share Personal Journey For Mental Health Awareness Month,https://www.google.com/url?rct=j&sa=t&url=https://www.republicworld.com/entertainment-news/hollywood-news/shawn-mendes-and-camila-cabello-share-personal-journey-for-mental-health-awareness-month.html&ct=ga&cd=CAIyGmU4MWY4MmViNmViOTg5MTE6Y29tOmVuOlVT&usg=AFQjCNE2TG5BnGuckC84fj6z_NhyNORchw,"They will be sharing personal experiences to help their fans foster gratitude and overcome anxiety. Shawn Mendes"" initiative for Mental Health...",2021-05-18,Health Sharing
Africa: Financing Healthcare in Nigeria is Beyond Allocating 15% of National Budget To Health,https://www.google.com/url?rct=j&sa=t&url=https://allafrica.com/stories/202105190548.html&ct=ga&cd=CAIyHDcyMWE5ZGFiNjRlZGE3MTM6Y29tOmVuOlVTOlI&usg=AFQjCNHVepZtFjFfpEXzBorlNXGSJ5oiVw,"The country""s out of pocket expenditure as a percentage of total health ... Health insurance based on the principle of risk pooling and cost-sharing...",2021-05-19,Healthcare Cost Sharing
Novus Reports First Quarter 2021 Results,https://www.google.com/url?rct=j&sa=t&url=https://finance.yahoo.com/news/novus-reports-first-quarter-2021-130000177.html&ct=ga&cd=CAIyHDcyMWE5ZGFiNjRlZGE3MTM6Y29tOmVuOlVTOlI&usg=AFQjCNEHUK11nHSi5QZy3l7B8oGFQo44nA,Oneshare: A medical cost-sharing provider an ACA-exempt path to healthcare. Its health-based sharing membership plan focuses on Catastrophic...,2021-05-18,Healthcare Cost Sharing
Statewide Collaboration Leads the Way in Closing Gaps in Vaccine Administration Tracking and ...,https://www.google.com/url?rct=j&sa=t&url=https://www.streetinsider.com/Business%2BWire/Statewide%2BCollaboration%2BLeads%2Bthe%2BWay%2Bin%2BClosing%2BGaps%2Bin%2BVaccine%2BAdministration%2BTracking%2Band%2BMonitoring%2BThrough%2BState%2BImmunization%2BRegistry%2BIntegration/18437989.html&ct=ga&cd=CAIyHDcyMWE5ZGFiNjRlZGE3MTM6Y29tOmVuOlVTOlI&usg=AFQjCNE33CWYP4yp1h_CXwBXoUTKKUte9w,HIT Commons is partnering with Oregon Health Authority (OHA) Public ... “The data sharing partnership using the Collective Platform has helped us ... Vaccine Population Report data will help us increase vaccination rates and help...,2021-05-18,Healthcare Cost Sharing
"Anthem, Epic team to enhance data sharing with providers",https://www.google.com/url?rct=j&sa=t&url=https://www.fiercehealthcare.com/payer/anthem-epic-team-to-enhance-data-sharing-providers&ct=ga&cd=CAIyHDc5M2E3YWM0ZTJjZTM4OWY6Y29tOmVuOlVTOlI&usg=AFQjCNEmbD4-G9Ju0GWCWFeRcFjd2vh7tg,"Ashok Chennuru, chief data and insights officer at Anthem, told Fierce Healthcare that, for example, when a patient is discharged from the hospital,...",2021-05-19,Medical Sharing
"Medical Terminology Sharing Market Is Booming Worldwide | Wolters Kluwer, Intelligent Medical ...",https://www.google.com/url?rct=j&sa=t&url=https://www.mccourier.com/medical-terminology-sharing-market-is-booming-worldwide-wolters-kluwer-intelligent-medical-objects-apelon-clinical-architecture/&ct=ga&cd=CAIyHDc5M2E3YWM0ZTJjZTM4OWY6Y29tOmVuOlVTOlI&usg=AFQjCNF8GnID_7CtZumtzlXnn8bXFXzxXg,"Medical Terminology Sharing Market Is Booming Worldwide | Wolters Kluwer, Intelligent Medical Objects, Apelon, Clinical Architecture. Medical...",2021-05-19,Medical Sharing
HSE cyber attack: Patients personal medical information posted online,https://www.google.com/url?rct=j&sa=t&url=https://www.newstalk.com/news/hse-cyberattack-hackers-begin-sharing-personal-medical-information-online-1197155&ct=ga&cd=CAIyHDc5M2E3YWM0ZTJjZTM4OWY6Y29tOmVuOlVTOlI&usg=AFQjCNGrl0WE-YRr4MRqD8Rhb-ucXf2-4w,"Personal medical information stolen during last week""s cyber attack on the HSE has reportedly been shared online. The Financial Times reports that...",2021-05-19,Medical Sharing
How Technology Is Transforming Workplace Training In 2021,https://www.google.com/url?rct=j&sa=t&url=https://www.forbes.com/sites/shamahyder/2021/05/18/how-technology-is-transforming-workplace-training-in-2021/&ct=ga&cd=CAIyHDc5M2E3YWM0ZTJjZTM4OWY6Y29tOmVuOlVTOlI&usg=AFQjCNGMBead2n8c11_2_TacFmTTxdaRrQ,"Here, clinicians can share their case-based medical knowledge in real-time to better diagnose and treat patients. The platform connects medical...",2021-05-18,Medical Sharing
Med School Applicants: How to Address Illness,https://www.google.com/url?rct=j&sa=t&url=https://www.usnews.com/education/blogs/medical-school-admissions-doctor/articles/dos-and-donts-for-medical-school-applicants-when-addressing-personal-experiences-with-illness&ct=ga&cd=CAIyHDc5M2E3YWM0ZTJjZTM4OWY6Y29tOmVuOlVTOlI&usg=AFQjCNF6z1f841CY8j7vKLriNF8CcOL8rg,"In the application process, don""t seek pity and avoid criticizing health care ... Sometimes when medical school applicants share an experience with...",2021-05-18,Medical Sharing
"Study shows Pinterest users pin healthy recipes, are more likely to make unhealthy ones",https://www.google.com/url?rct=j&sa=t&url=https://www.eurekalert.org/pub_releases/2021-05/gmu-ssp051721.php&ct=ga&cd=CAIyHDc5M2E3YWM0ZTJjZTM4OWY6Y29tOmVuOlVTOlI&usg=AFQjCNE_nMxvXyhW3tLiS0jd0BDyNo44sA,"When it comes sharing recipes on social media, what users post, and what they cook may be two entirely different things. That""s the conclusion of a...",2021-05-18,Medical Sharing
Novus Reports First Quarter 2021 Results,https://www.google.com/url?rct=j&sa=t&url=https://finance.yahoo.com/news/novus-reports-first-quarter-2021-130000177.html&ct=ga&cd=CAIyHDc5M2E3YWM0ZTJjZTM4OWY6Y29tOmVuOlVTOlI&usg=AFQjCNEHUK11nHSi5QZy3l7B8oGFQo44nA,Oneshare: A medical cost-sharing provider an ACA-exempt path to healthcare. Its health-based sharing membership plan focuses on Catastrophic...,2021-05-18,Medical Sharing
"Pandemic""s Second Wave Inundates Rural Areas in India | Voice of America - English",https://www.google.com/url?rct=j&sa=t&url=https://www.voanews.com/covid-19-pandemic/pandemics-second-wave-inundates-rural-areas-india&ct=ga&cd=CAIyHDc5M2E3YWM0ZTJjZTM4OWY6Y29tOmVuOlVTOlI&usg=AFQjCNHpCLwkb_dA434724wNSqsr3HsyJQ,"... hospitals — people sharing beds and shortages of medical oxygen that had battered even some of the country""s biggest hospitals earlier this month.",2021-05-18,Medical Sharing
Statewide Collaboration Leads the Way in Closing Gaps in Vaccine Administration Tracking and ...,https://www.google.com/url?rct=j&sa=t&url=https://www.streetinsider.com/Business%2BWire/Statewide%2BCollaboration%2BLeads%2Bthe%2BWay%2Bin%2BClosing%2BGaps%2Bin%2BVaccine%2BAdministration%2BTracking%2Band%2BMonitoring%2BThrough%2BState%2BImmunization%2BRegistry%2BIntegration/18437989.html&ct=ga&cd=CAIyHDc5M2E3YWM0ZTJjZTM4OWY6Y29tOmVuOlVTOlI&usg=AFQjCNE33CWYP4yp1h_CXwBXoUTKKUte9w,"--(BUSINESS WIRE)-- HIT Commons today announced a partnership that will use existing information-sharing pathways among Oregon""s health plans...",2021-05-18,Medical Sharing
"11 Health Care Stocks Moving In Tuesday""s Pre-Market Session",https://www.google.com/url?rct=j&sa=t&url=https://www.benzinga.com/pre-market-outlook/21/05/21173039/11-health-care-stocks-moving-in-tuesdays-pre-market-session&ct=ga&cd=CAIyHDc5M2E3YWM0ZTJjZTM4OWY6Y29tOmVuOlVTOlI&usg=AFQjCNH3e9VksXrN2ApcOIVrHDYDH-7r6g,Venus Concept (NASDAQ:VERO) stock moved upwards by 8.51% to $2.04. The market value of their outstanding shares is at $110.3 million. As per the...,2021-05-18,Medical Sharing
KLAS and Censinet Announce Partnership Momentum and Strategic Plan to Help Modernize ...,https://www.google.com/url?rct=j&sa=t&url=https://www.streetinsider.com/Business%2BWire/KLAS%2Band%2BCensinet%2BAnnounce%2BPartnership%2BMomentum%2Band%2BStrategic%2BPlan%2Bto%2BHelp%2BModernize%2BCybersecurity%2Bin%2BHealthcare/18437060.html&ct=ga&cd=CAIyHDc5M2E3YWM0ZTJjZTM4OWY6Y29tOmVuOlVTOlI&usg=AFQjCNEVU04khcEimbqvhTHjzhyL5k2w6g,"SALT LAKE CITY &amp; BOSTON--(BUSINESS WIRE)-- KLAS, a healthcare ... in healthcare by improving information sharing between healthcare sector...",2021-05-18,Medical Sharing
Williston Fire Department is sharing life saving demonstrations for EMS Week,https://www.google.com/url?rct=j&sa=t&url=https://www.mychamplainvalley.com/news/williston-fire-department-is-sharing-life-saving-demonstrations-for-ems-week/&ct=ga&cd=CAIyHDc5M2E3YWM0ZTJjZTM4OWY6Y29tOmVuOlVTOlI&usg=AFQjCNHLwcSrNfSs4esgSokN3VE6X4Q6OA,The Williston Fire Department is sharing emergency medical demonstrations on their social media for the next few days to celebrate EMS Week.,2021-05-18,Medical Sharing
"The Latest: Biden adviser cites son, asks young to get shots",https://www.google.com/url?rct=j&sa=t&url=https://abcnews.go.com/Health/wireStory/latest-india-reports-record-single-day-virus-deaths-77748816&ct=ga&cd=CAIyHDc5M2E3YWM0ZTJjZTM4OWY6Y29tOmVuOlVTOlI&usg=AFQjCNFTHDXFKBR8mlmDY5FOj_kupPx42Q,"... the coronavirus is encouraging young people to get vaccinated, sharing his ... The CDC says public health departments should work with doctors,...",2021-05-18,Medical Sharing
