title,link,item_text,date_published,google_alert_name
"Russian Christians surprise healthcare heroes, families with ""Love in Action""",https://www.google.com/url?rct=j&sa=t&url=https://religionnews.com/2020/07/16/russian-christians-surprise-healthcare-heroes-families-with-love-in-action/&ct=ga&cd=CAIyHDBlYjRmZTFlNDk3NWE4OGE6Y29tOmVuOlVTOlI&usg=AFQjCNE0PAgEhaGypI8Qd1NDaTcNwFD0LA,"In Russia, medical staff often work in terrible conditions and are typically paid less than schoolteachers. This “love in action” ministry is part of the “Christ...",2020-07-16,Christian Sharing Ministry
"7 Options When You""ve Lost Your Job-Sponsored Health Insurance",https://www.google.com/url?rct=j&sa=t&url=https://www.newsmax.com/finance/streettalk/health-coverage-job-sponsored/2020/07/17/id/977734&ct=ga&cd=CAIyHGVmMjU5ZGE1NWJkYjU0NjU6Y29tOmVuOlVTOlI&usg=AFQjCNEgo_1WQQw23YBdZWgRABej-FkHsQ,"Healthcare sharing ministries typically limit the amount of coverage they""ll provide, with most capping how much coverage you can receive per month,...",2020-07-17,Health Care Sharing Ministry
"Russian Christians surprise healthcare heroes, families with ""Love in Action""",https://www.google.com/url?rct=j&sa=t&url=https://religionnews.com/2020/07/16/russian-christians-surprise-healthcare-heroes-families-with-love-in-action/&ct=ga&cd=CAIyHGVmMjU5ZGE1NWJkYjU0NjU6Y29tOmVuOlVTOlI&usg=AFQjCNE0PAgEhaGypI8Qd1NDaTcNwFD0LA,"Russian Christians surprise healthcare heroes, families with ""Love in Action"" ... This “love in action” ministry is part of the “Christ Over COVID” global campaign ... The local believers shared the Gospel with Natalya and her husband""s...",2020-07-16,Health Care Sharing Ministry
This Week in Coronavirus: July 10 to July 16,https://www.google.com/url?rct=j&sa=t&url=https://www.kff.org/coronavirus-policy-watch/this-week-in-coronavirus-july-10-to-july-16/&ct=ga&cd=CAIyHDQ1NzZkZjdlYTEzZTg0YTA6Y29tOmVuOlVTOlI&usg=AFQjCNEv40bQPo9bNJMg6XR6VWBZxLOlyQ,"State COVID-19 Health Policy Actions (Includes Washington D.C.). Waive Cost Sharing for COVID-19 Treatment: 3 states require, state-insurer...",2020-07-17,Health Cost Sharing
How much will a coronavirus vaccine cost?,https://www.google.com/url?rct=j&sa=t&url=https://www.marketplace.org/2020/07/17/how-much-will-coronavirus-vaccine-cost/&ct=ga&cd=CAIyHDQ1NzZkZjdlYTEzZTg0YTA6Y29tOmVuOlVTOlI&usg=AFQjCNHIojG3bBbB_lBw1JY5JKcp1IdyuQ,"“The Affordable Care Act requires insurance to cover recommended vaccines with no cost sharing passed along to patients, so that opens the...",2020-07-17,Health Cost Sharing
"7 Options When You""ve Lost Your Job-Sponsored Health Insurance",https://www.google.com/url?rct=j&sa=t&url=https://www.newsmax.com/finance/streettalk/health-coverage-job-sponsored/2020/07/17/id/977734&ct=ga&cd=CAIyHDQ1NzZkZjdlYTEzZTg0YTA6Y29tOmVuOlVTOlI&usg=AFQjCNEgo_1WQQw23YBdZWgRABej-FkHsQ,"And, unfortunately, most of your options will be costly. The challenge of ... You might also consider signing up for a healthcare sharing ministry. But be...",2020-07-17,Health Cost Sharing
Healthcare IT Market to Witness Growth Acceleration During 2017-2025,https://www.google.com/url?rct=j&sa=t&url=https://dailyresearchchronicles.com/2020/07/17/healthcare-it-market-to-witness-growth-acceleration-during-2017-2025/&ct=ga&cd=CAIyHDQ1NzZkZjdlYTEzZTg0YTA6Y29tOmVuOlVTOlI&usg=AFQjCNHemj5Pwbs4sxPjT64SZ47MG3PQ-w,"Healthcare IT provides secured sharing of patient information for healthcare ... Healthcare IT uses electronic health records (EHRs) in place of paper ... Apart from improved medical care and lower costs, these systems that are...",2020-07-17,Health Cost Sharing
COVID-19 Impact Enterprise File Synchronization &amp; Sharing (EFSS) Market Advanced Technology ...,https://www.google.com/url?rct=j&sa=t&url=https://jewishlifenews.com/uncategorized/covid-19-impact-enterprise-file-synchronization-sharing-efss-market-advanced-technology-potential-revenue-cost-structure-analysis-and-key-players-global-future-prospects-2025/&ct=ga&cd=CAIyHDQ1NzZkZjdlYTEzZTg0YTA6Y29tOmVuOlVTOlI&usg=AFQjCNEcebeScosFlmS2yvNo5yQX6Qdw9g,"... Sharing (EFSS) Market Advanced Technology, Potential Revenue, Cost ... We comprehend that this health crisis has brought an unprecedented...",2020-07-17,Health Cost Sharing
"Impoverishing Women: Supreme Court Upholds Trump Administration""s Religious and Moral ...",https://www.google.com/url?rct=j&sa=t&url=https://verdict.justia.com/2020/07/17/impoverishing-women-supreme-court-upholds-trump-administrations-religious-and-moral-exemptions-to-contraceptive-mandate&ct=ga&cd=CAIyHDQ1NzZkZjdlYTEzZTg0YTA6Y29tOmVuOlVTOlI&usg=AFQjCNEakpB4F-MQKWfDk-phqx7OMw9DPQ,"The conclusion that birth control is an essential aspect of health care ... But even then, insurers imposed co-pays and other cost-sharing devices that...",2020-07-17,Health Cost Sharing
Coronavirus Live Updates,https://www.google.com/url?rct=j&sa=t&url=https://www.kqed.org/coronavirusliveupdates/arts/13883464/bottlerock-music-festival-postponed-to-2021-as-covid-numbers-rise&ct=ga&cd=CAIyHDQ1NzZkZjdlYTEzZTg0YTA6Y29tOmVuOlVTOlI&usg=AFQjCNEtMCKlEr4z_6utUA6pz4qsJnLRvg,"DMHC says requiring health insurers to pay for tests without co-pays or cost sharing will give vulnerable populations and people who can""t physically...",2020-07-16,Health Cost Sharing
North Carolina Independent Dermatology Collaboration Announces Accelerated Recognition,https://www.google.com/url?rct=j&sa=t&url=https://pronewsreport.com/2020/07/16/north-carolina-independent-dermatology-collaboration-announces-accelerated-recognition/&ct=ga&cd=CAIyHDQ1NzZkZjdlYTEzZTg0YTA6Y29tOmVuOlVTOlI&usg=AFQjCNHp6T0U3iNsu4ejtMwJkbbl-QVahQ,"... by our partners for sharing responsibility, lowering costs, and elevating care. ... support to value-based care–high-quality care at an acceptable cost.",2020-07-16,Health Cost Sharing
Enrollment Extension Extensión de inscripción,https://www.google.com/url?rct=j&sa=t&url=https://www.manhattantimesnews.com/enrollment-extensionextension-de-inscripcion/&ct=ga&cd=CAIyHDQ1NzZkZjdlYTEzZTg0YTA6Y29tOmVuOlVTOlI&usg=AFQjCNFBsAUEU4qgE97fv2L_pe1Gpu4OXw,"... and Child Health Plus — can enroll year-round. As per the Governor""s office, all New York insurers have waived cost sharing for COVID-19 testing.",2020-07-16,Health Cost Sharing
NCDHHS to deploy up to 300 free COVID-19 testing sites in underserved communities,https://www.google.com/url?rct=j&sa=t&url=https://mountainx.com/blogwire/ncdhhs-to-deploy-up-to-300-free-covid-19-testing-sites-in-underserved-communities/&ct=ga&cd=CAIyHDQ1NzZkZjdlYTEzZTg0YTA6Y29tOmVuOlVTOlI&usg=AFQjCNHxdSYYhcW5plWWZG5TBaPHAkINaw,"The North Carolina Department of Health and Human Services today ... Insurance, if available, will be billed but no co-pays or cost-sharing will be...",2020-07-07,Health Cost Sharing
"APSU launches ""If Austin Peay Could Talk"" project, to share personal stories of racism",https://www.google.com/url?rct=j&sa=t&url=https://clarksvillenow.com/local/apsu-launches-if-austin-peay-could-talk-project-to-share-personal-stories-of-racism/&ct=ga&cd=CAIyGmU4MWY4MmViNmViOTg5MTE6Y29tOmVuOlVT&usg=AFQjCNE-sVrLNmfnVkaMHTk7qMeZP1NNwA,"Several mental health doctors who interviewed him for psychiatric evaluations after his arrest described him as having a history with multiple drugs,...",2020-07-17,Health Sharing
Health department to share latest coronavirus cases after more counties enter red level,https://www.google.com/url?rct=j&sa=t&url=https://abc6onyourside.com/news/local/july-17-coronavirus-in-ohio-update&ct=ga&cd=CAIyGmU4MWY4MmViNmViOTg5MTE6Y29tOmVuOlVT&usg=AFQjCNFMuaAbeIXR3t2mQKsEBqv0xTIN5Q,"COLUMBUS, Ohio (WSYX/WTTE) — The Ohio Department of Health is sharing new coronavirus data after more counties entered the ""red"" level for...",2020-07-17,Health Sharing
Groups launch legal action against Ontario for sharing COVID-19 data with police,https://www.google.com/url?rct=j&sa=t&url=https://toronto.ctvnews.ca/groups-launch-legal-action-against-ontario-for-sharing-covid-19-data-with-police-1.5028583&ct=ga&cd=CAIyGmU4MWY4MmViNmViOTg5MTE6Y29tOmVuOlVT&usg=AFQjCNGNsKe1YULt0hQRWl5dHxs8qgYeVA,"Deshman added that sharing COVID-19 test results with police is “not necessary, and in fact undermines an effective public health approach to this...",2020-07-17,Health Sharing
LSR7 Update: Sharing preliminary Fall 2020 plans,https://www.google.com/url?rct=j&sa=t&url=https://lstribune.net/index.php/2020/07/17/lsr7-update-sharing-preliminary-fall-2020-plans/&ct=ga&cd=CAIyGmU4MWY4MmViNmViOTg5MTE6Y29tOmVuOlVT&usg=AFQjCNHKIVBNKSrMU9L6ipDMQ-G4wY_jdA,Our plans have been built around the need for flexibility in order to align with evolving public health guidance and include recommendations primarily...,2020-07-17,Health Sharing
COVID-19 disproportionately affecting Latinos; woman shares heartbreaking story of losing her father,https://www.google.com/url?rct=j&sa=t&url=https://fox6now.com/2020/07/17/covid-19-disproportionately-affecting-latinos-woman-shares-heartbreaking-story-of-losing-her-father/&ct=ga&cd=CAIyGmU4MWY4MmViNmViOTg5MTE6Y29tOmVuOlVT&usg=AFQjCNGzvB7I3DXgsF-CkBP5V-clgnc6Og,"Health officials also say Latinos are dying in higher numbers than any other ethnicity, particularly because many of them are frontline essential...",2020-07-17,Health Sharing
TX Health Information Exchange Joins Nationwide eHealth Exchange,https://www.google.com/url?rct=j&sa=t&url=https://ehrintelligence.com/news/tx-health-information-exchange-joins-nationwide-ehealth-exchange&ct=ga&cd=CAIyGmU4MWY4MmViNmViOTg5MTE6Y29tOmVuOlVT&usg=AFQjCNHN3y2e3XiGWF-h9rauybHzCZwkug,"Now connected to the nationwide HIE, HASA has access to the largest secure health data sharing network in the country, including the Department of...",2020-07-17,Health Sharing
"Healthcare Analytics Market Break Down By Leading Companies, Countries, Applications ...",https://www.google.com/url?rct=j&sa=t&url=https://3wnews.org/industry-analytics/2814473/healthcare-analytics-market-break-down-by-leading-companies-countries-applications-challenges-opportunities-and-forecast-2020-2026-2/&ct=ga&cd=CAIyGmU4MWY4MmViNmViOTg5MTE6Y29tOmVuOlVT&usg=AFQjCNG4gp2MpkIYW21vu7_Q60Ck9xQSCg,"Increasing usage of data sharing platforms such as social media platforms, blogs, and professional networks has allowed sharing health related...",2020-07-17,Health Sharing
The Stories We Share: A Social Justice Campaign,https://www.google.com/url?rct=j&sa=t&url=https://labblog.uofmhealth.org/med-u/stories-we-share-a-social-justice-campaign&ct=ga&cd=CAIyGmU4MWY4MmViNmViOTg5MTE6Y29tOmVuOlVT&usg=AFQjCNG_6MOSZTgVFRU15VVgmokbycPA1w,"The United Asian American Medical Student Association unveils a social media campaign designed to amplify diverse voices in support of diversity,...",2020-07-17,Health Sharing
How the response to the pandemic is shaping the future of healthcare,https://www.google.com/url?rct=j&sa=t&url=https://www.healtheuropa.eu/pandemic-is-shaping-the-future-of-the-healthcare/101540/&ct=ga&cd=CAIyGmU4MWY4MmViNmViOTg5MTE6Y29tOmVuOlVT&usg=AFQjCNHYBofeifsCTNWQV9y-O7kD36I5UA,The pandemic has been a call to action for hospitals to adopt more efficient yet transparent platforms to share information that will likely stay in place...,2020-07-17,Health Sharing
Virtual care will revolutionize Canadian health care,https://www.google.com/url?rct=j&sa=t&url=https://financialpost.com/opinion/virtual-care-will-revolutionize-canadian-health-care&ct=ga&cd=CAIyGmU4MWY4MmViNmViOTg5MTE6Y29tOmVuOlVT&usg=AFQjCNE02XNL_hEby4QdnHP39UnrpuG0Bg,"In the U.S., leading health centres such as the Mayo Clinic have entered into agreements with insurers to share de-identified patient data, creating...",2020-07-17,Health Sharing
The Global Network powers healthcare collaboration,https://www.google.com/url?rct=j&sa=t&url=https://www.geektime.com/global-network-collaboration-improve-healthcare/&ct=ga&cd=CAIyGmU4MWY4MmViNmViOTg5MTE6Y29tOmVuOlVT&usg=AFQjCNGKXNdLcXNDnAGNOUcQM40231Cjjw,"New Global Network provides healthcare personnel with a platform to share treatments and medical insight, and it""s all powered by Israeli healthcare...",2020-07-17,Health Sharing
"Faster health data exchange starts with addressing health IT""s control concerns",https://www.google.com/url?rct=j&sa=t&url=https://medcitynews.com/2020/07/faster-health-data-exchange-starts-with-addressing-health-its-control-concerns/&ct=ga&cd=CAIyGmU4MWY4MmViNmViOTg5MTE6Y29tOmVuOlVT&usg=AFQjCNGq7PPfnHh3WBqUOfz7vxdRUOfLBQ,"This outbreak has shown us that we need to be much faster, more nimble and better prepared to confidently share health data across organizations.",2020-07-17,Health Sharing
X-rays of male genitalia may have been shared online by central Pa. imaging employee: police,https://www.google.com/url?rct=j&sa=t&url=https://www.pennlive.com/crime/2020/07/x-rays-of-male-genitalia-may-have-been-shared-online-by-central-pa-imaging-employee-police.html&ct=ga&cd=CAIyGmU4MWY4MmViNmViOTg5MTE6Y29tOmVuOlVT&usg=AFQjCNFk6C7BjwvPHGkitubPrH3m1-ihkA,"However, health care workers are prohibited from talking about or sharing the bulk of a patient""s medical information under the federal Health...",2020-07-17,Health Sharing
Covid Drug Hoarding Raises Demand for Better Supply Data Sharing,https://www.google.com/url?rct=j&sa=t&url=https://news.bloomberglaw.com/health-law-and-business/covid-drug-hoarding-raises-demand-for-better-supply-data-sharing&ct=ga&cd=CAIyGmU4MWY4MmViNmViOTg5MTE6Y29tOmVuOlVT&usg=AFQjCNEPZH5qNZAC5v3EDxTKmo1fViG1vA,"What""s the Latest: A centralized database would enable providers and health officials to fill in information gaps and direct supplies to the neediest...",2020-07-17,Health Sharing
"Is AMETEK, Inc.""s (NYSE:AME) Latest Stock Performance A Reflection Of Its Financial Health?",https://www.google.com/url?rct=j&sa=t&url=https://finance.yahoo.com/news/ametek-inc-nyse-ame-latest-103115240.html&ct=ga&cd=CAIyGmU4MWY4MmViNmViOTg5MTE6Y29tOmVuOlVT&usg=AFQjCNH2SBIk-rJMhaJbBWjs2XAzp_K18w,Help shape the future of investing tools and earn a $40 gift card! AMETEK (NYSE:AME) has had a great run on the share market with its stock up by a...,2020-07-17,Health Sharing
Introducing The COVID Files,https://www.google.com/url?rct=j&sa=t&url=https://www.dmu.ac.uk/about-dmu/news/2020/july/introducing-the-covid-files.aspx&ct=ga&cd=CAIyGmU4MWY4MmViNmViOTg5MTE6Y29tOmVuOlVT&usg=AFQjCNFF8CAGTb6fwPkk919DzYWHojzEOw,... (SLRC) has prided itself on sharing impact-oriented research that explores ... Health inequalities have also been highlighted how BAME patients are...,2020-07-17,Health Sharing
"Anupam Kher shares health update of his COVID 19 positive mother, brother &amp; family with a happy ...",https://www.google.com/url?rct=j&sa=t&url=https://www.pinkvilla.com/entertainment/news/anupam-kher-shares-health-update-his-covid-19-positive-mother-brother-family-happy-throwback-pic-550003&ct=ga&cd=CAIyGmU4MWY4MmViNmViOTg5MTE6Y29tOmVuOlVT&usg=AFQjCNEJerdkQPvtANE8q6D1nNpW18nOew,"Today, he shared an update about their health. Written By Pinkvilla Desk 2896 reads Mumbai Published: July 17, 2020 11:50 am.",2020-07-17,Health Sharing
"""No distancing, no mask-wearing"": Customers sharing concern over San Jose nightclub parties met ...",https://www.google.com/url?rct=j&sa=t&url=https://abc7news.com/health/coronavirus-customers-concerned-over-parties-at-sj-nightclub/6321311/&ct=ga&cd=CAIyGmU4MWY4MmViNmViOTg5MTE6Y29tOmVuOlVT&usg=AFQjCNGTjuXfdo0a5S_kfSmaQaGpTxDsLw,"As it stands, current County Public Health orders allow outdoor dining with mandatory directives. However, long-time Aura patrons shared growing...",2020-07-17,Health Sharing
"Jan and Earl Robinson break down barriers, sharing mental health experiences to help others",https://www.google.com/url?rct=j&sa=t&url=https://www.townsvillebulletin.com.au/news/townsville/regional/charters-towers/jan-and-earl-robinson-break-down-barriers-sharing-mental-health-experiences-to-help-others/news-story/c13e1475abd839ea60cfa49f80514d38&ct=ga&cd=CAIyGmU4MWY4MmViNmViOTg5MTE6Y29tOmVuOlVT&usg=AFQjCNHQlQHQY3HOQKu3CjtU4E_wB-gytw,"Several sessions later, and much time spent ""just talking"", Earl and Jan are now vocal advocates for getting help with your health, no matter what the...",2020-07-17,Health Sharing
"Alex Trebek gives health update amid pancreatic cancer battle: ""My numbers are good""",https://www.google.com/url?rct=j&sa=t&url=https://ew.com/tv/alex-trebek-health-update-pancreatic-cancer-retrospective-episodes/&ct=ga&cd=CAIyGmU4MWY4MmViNmViOTg5MTE6Y29tOmVuOlVT&usg=AFQjCNH1cDlmo6Y-5Gm4njVDan8ZSkpqbA,Alex Trebek is sharing some positive news about his health as he continues treatment for stage...,2020-07-17,Health Sharing
"7 Options When You""ve Lost Your Job-Sponsored Health Insurance",https://www.google.com/url?rct=j&sa=t&url=https://www.newsmax.com/finance/streettalk/health-coverage-job-sponsored/2020/07/17/id/977734&ct=ga&cd=CAIyHDcyMWE5ZGFiNjRlZGE3MTM6Y29tOmVuOlVTOlI&usg=AFQjCNEgo_1WQQw23YBdZWgRABej-FkHsQ,"And, unfortunately, most of your options will be costly. ... Healthcare sharing ministries are faith-based nonprofits that pool the money of their members.",2020-07-17,Healthcare Cost Sharing
Healthcare IT Market to Witness Growth Acceleration During 2017-2025,https://www.google.com/url?rct=j&sa=t&url=https://dailyresearchchronicles.com/2020/07/17/healthcare-it-market-to-witness-growth-acceleration-during-2017-2025/&ct=ga&cd=CAIyHDcyMWE5ZGFiNjRlZGE3MTM6Y29tOmVuOlVTOlI&usg=AFQjCNHemj5Pwbs4sxPjT64SZ47MG3PQ-w,"Healthcare IT provides secured sharing of patient information for healthcare ... Healthcare IT uses electronic health records (EHRs) in place of paper ... Apart from improved medical care and lower costs, these systems that are...",2020-07-17,Healthcare Cost Sharing
COVID-19 Impact Enterprise File Synchronization &amp; Sharing (EFSS) Market Advanced Technology ...,https://www.google.com/url?rct=j&sa=t&url=https://jewishlifenews.com/uncategorized/covid-19-impact-enterprise-file-synchronization-sharing-efss-market-advanced-technology-potential-revenue-cost-structure-analysis-and-key-players-global-future-prospects-2025/&ct=ga&cd=CAIyHDcyMWE5ZGFiNjRlZGE3MTM6Y29tOmVuOlVTOlI&usg=AFQjCNEcebeScosFlmS2yvNo5yQX6Qdw9g,"... Sharing (EFSS) Market Advanced Technology, Potential Revenue, Cost ... We comprehend that this health crisis has brought an unprecedented...",2020-07-17,Healthcare Cost Sharing
"7 Options When You""ve Lost Your Job-Sponsored Health Insurance",https://www.google.com/url?rct=j&sa=t&url=https://www.newsmax.com/finance/streettalk/health-coverage-job-sponsored/2020/07/17/id/977734&ct=ga&cd=CAIyHDBhNGY1MzE5YzE5ODdjNzQ6Y29tOmVuOlVTOlI&usg=AFQjCNEgo_1WQQw23YBdZWgRABej-FkHsQ,These marketplaces -- which you can find at HealthCare.gov -- offer ... Many states expanded their Medicaid programs under the Affordable Care Act.,2020-07-17,Healthcare Sharing Programs
"7 Options When You""ve Lost Your Job-Sponsored Health Insurance",https://www.google.com/url?rct=j&sa=t&url=https://www.newsmax.com/finance/streettalk/health-coverage-job-sponsored/2020/07/17/id/977734&ct=ga&cd=CAIyHDBhNGY1MzE5YzE5ODdjNzQ6Y29tOmVuOlVTOlI&usg=AFQjCNEgo_1WQQw23YBdZWgRABej-FkHsQ,These marketplaces -- which you can find at HealthCare.gov -- offer ... Many states expanded their Medicaid programs under the Affordable Care Act.,2020-07-17,Healthcare Sharing Programs
"Dell Children""s Medical Center in Austin may soon offer heart transplants for kids",https://www.google.com/url?rct=j&sa=t&url=https://www.kxan.com/news/local/austin/dell-childrens-medical-center-in-austin-may-soon-offer-heart-transplants-for-kids/&ct=ga&cd=CAIyHDc5M2E3YWM0ZTJjZTM4OWY6Y29tOmVuOlVTOlI&usg=AFQjCNHIlq-imwS84AI0YbvR25oyJcKJ1g,"AUSTIN (KXAN) — Dell Children""s Medical Center will soon learn if the United Network for Organ Sharing will approve its application to perform...",2020-07-17,Medical Sharing
"7 Options When You""ve Lost Your Job-Sponsored Health Insurance",https://www.google.com/url?rct=j&sa=t&url=https://www.newsmax.com/finance/personal-finance/health-coverage-job-sponsored/2020/07/17/id/977734/&ct=ga&cd=CAIyHDc5M2E3YWM0ZTJjZTM4OWY6Y29tOmVuOlVTOlI&usg=AFQjCNE9RJ03Sy_dymsCTjla4dXmGIxOnQ,"""Member-to-member sharing health care is not for everyone, but those of faith who qualify can get quality healthcare while saving considerably on health...",2020-07-17,Medical Sharing
The Stories We Share: A Social Justice Campaign,https://www.google.com/url?rct=j&sa=t&url=https://labblog.uofmhealth.org/med-u/stories-we-share-a-social-justice-campaign&ct=ga&cd=CAIyHDc5M2E3YWM0ZTJjZTM4OWY6Y29tOmVuOlVTOlI&usg=AFQjCNG_6MOSZTgVFRU15VVgmokbycPA1w,"The United Asian American Medical Student Association unveils a social media campaign designed to amplify diverse voices in support of diversity,...",2020-07-17,Medical Sharing
The Global Network powers healthcare collaboration,https://www.google.com/url?rct=j&sa=t&url=https://www.geektime.com/global-network-collaboration-improve-healthcare/&ct=ga&cd=CAIyHDc5M2E3YWM0ZTJjZTM4OWY6Y29tOmVuOlVTOlI&usg=AFQjCNGKXNdLcXNDnAGNOUcQM40231Cjjw,"New Global Network provides healthcare personnel with a platform to share treatments and medical insight, and it""s all powered by Israeli healthcare...",2020-07-17,Medical Sharing
"Faster health data exchange starts with addressing health IT""s control concerns",https://www.google.com/url?rct=j&sa=t&url=https://medcitynews.com/2020/07/faster-health-data-exchange-starts-with-addressing-health-its-control-concerns/&ct=ga&cd=CAIyHDc5M2E3YWM0ZTJjZTM4OWY6Y29tOmVuOlVTOlI&usg=AFQjCNGq7PPfnHh3WBqUOfz7vxdRUOfLBQ,"Healthcare IT organizations are already overloaded with use cases that demand better operational and clinical value of healthcare data, pushing them to...",2020-07-17,Medical Sharing
Sharing our stories shows great kindness,https://www.google.com/url?rct=j&sa=t&url=https://www.brainerddispatch.com/lifestyle/family/6575712-Sharing-our-stories-shows-great-kindness&ct=ga&cd=CAIyHDc5M2E3YWM0ZTJjZTM4OWY6Y29tOmVuOlVTOlI&usg=AFQjCNHINM7WSl5JT4gwjNnKi4HY69oaGw,"... tests, surgeries and medical facilities. Matt was only 3. ""It didn""t take long for me to realize why Paul""s parents had the courage to share their story.",2020-07-17,Medical Sharing
"19 Healthcare Stocks Moving In Friday""s Pre-Market Session",https://www.google.com/url?rct=j&sa=t&url=https://www.benzinga.com/pre-market-outlook/20/07/16667581/19-healthcare-stocks-moving-in-fridays-pre-market-session&ct=ga&cd=CAIyHDc5M2E3YWM0ZTJjZTM4OWY6Y29tOmVuOlVTOlI&usg=AFQjCNGFJrF11tRiq4kNtpZjowX-VTiFQg,"(NASDAQ:NBRV) stock moved upwards by 16.47% to $0.98. • Heat Biologics, Inc. (NASDAQ:HTBX) shares increased by 15.73% to $2.28. • Tenax...",2020-07-17,Medical Sharing
"""No distancing, no mask-wearing"": Customers sharing concern over San Jose nightclub met with ...",https://www.google.com/url?rct=j&sa=t&url=https://www.msn.com/en-us/health/medical/no-distancing-no-mask-wearing-customers-sharing-concern-over-san-jose-nightclub-met-with-confrontation/ar-BB16QBjH%3Focid%3Dhplocalnews&ct=ga&cd=CAIyHDc5M2E3YWM0ZTJjZTM4OWY6Y29tOmVuOlVTOlI&usg=AFQjCNGgp3ArtORjazGebo-Plame9JgIRA,"In the South Bay, there""s continued push back against a Downtown San Jose venue. Click to expand. Hide pop-up video player for 24 hours. Hide.",2020-07-17,Medical Sharing
