title,link,item_text,date_published,google_alert_name
Column: New health clinic on Ingalls campus in Harvey designed to meet needs of Black women ...,https://www.google.com/url?rct=j&sa=t&url=https://www.chicagotribune.com/suburbs/daily-southtown/opinion/ct-sta-knowles-column-st-0126-20210125-4ft6navgzrbflcd2ow23lfyexy-story.html&ct=ga&cd=CAIyHDcwNjg0ZGMwOTMxYjI0NDM6Y29tOmVuOlVTOlI&usg=AFQjCNE06lR0g0G61YDM9UhsqV5KPa8RvA,"The Family Christian Health Center Maternal and Child Health Center will ... Access is key, she stressed, while sharing some hospital experiences.",2021-01-25,Christian Health Care Sharing
"Docuseries ""Healthy Long Life"" explores how ""God-made foods"" can protect against ""lifestyle diseases""",https://www.google.com/url?rct=j&sa=t&url=https://www.christianpost.com/news/healthy-long-life-explores-how-god-made-foods-fight-diseases.html&ct=ga&cd=CAIyHDcwNjg0ZGMwOTMxYjI0NDM6Y29tOmVuOlVTOlI&usg=AFQjCNEdiJK4rMi88m0vVXsfj1d1OTfnRg,"Last year, the U.S. Departments of Agriculture and Health and Human Services ... Dr. Caldwell Esselstyn Jr. shared multiple studies from the Cleveland Clinic that ... CP: The series featured a Christian father who cried out to Jesus.",2021-01-24,Christian Health Care Sharing
What Medical Data Is Israel Sharing With Pfizer - and Is It Protected?,https://www.google.com/url?rct=j&sa=t&url=https://www.haaretz.com/israel-news/.premium-what-medical-data-is-israel-sharing-with-pfizer-and-is-it-protected-1.9480691&ct=ga&cd=CAIyHGVmMjU5ZGE1NWJkYjU0NjU6Y29tOmVuOlVTOlI&usg=AFQjCNEoTVN35gAsl4Lw_ncySYzjLlBxNQ,"In light of the data-sharing agreement between Israel""s Health Ministry and Pfizer for its COVID-19 vaccine, considerable attention has been paid in...",2021-01-25,Health Care Sharing Ministry
"AHIP""s Eyles: Health policy priorities for insurers to watch in 2021",https://www.google.com/url?rct=j&sa=t&url=https://www.fiercehealthcare.com/payer/ahip-s-eyles-health-policy-priorities-for-insurers-to-watch-2021&ct=ga&cd=CAIyHDQ1NzZkZjdlYTEzZTg0YTA6Y29tOmVuOlVTOlI&usg=AFQjCNFdrn8vEjhBo0PcT4jyFDVHsVW9IQ,"America""s Health Insurance Plans (AHIP) is ""hopeful"" that the Biden ... will force health insurers to post negotiated rates and cost-sharing data online,...",2021-01-26,Health Cost Sharing
Compliance with ONC and CMS rules could offer growth opportunity,https://www.google.com/url?rct=j&sa=t&url=https://www.healthcareitnews.com/news/compliance-onc-and-cms-rules-could-offer-growth-opportunity&ct=ga&cd=CAIyHDQ1NzZkZjdlYTEzZTg0YTA6Y29tOmVuOlVTOlI&usg=AFQjCNEKwcIDLCP3PmxqlrNfteG4w12F6Q,"""Organizations are required to publish standard charges and negotiated rates with health plans for certain services and share patient data seamlessly...",2021-01-26,Health Cost Sharing
Healthcare map maker Komodo Health inks data sharing deal with Blue Health Intelligence,https://www.google.com/url?rct=j&sa=t&url=https://www.fiercebiotech.com/medtech/healthcare-mapmaker-komodo-health-inks-data-sharing-deal-blue-health-intelligence&ct=ga&cd=CAIyHDQ1NzZkZjdlYTEzZTg0YTA6Y29tOmVuOlVTOlI&usg=AFQjCNFAejBDwdUJeehNazasVZNV4Qdz3A,"Previously, Blue Health signed a data partnership with the Health Care Cost Institute to gain access to data from Blue Cross Blue Shield Association...",2021-01-26,Health Cost Sharing
Clearing up Vaccine Cost Confusion,https://www.google.com/url?rct=j&sa=t&url=https://www.wthitv.com/content/news/Clearing-up-Vaccine-Cost-Confusion-573663681.html&ct=ga&cd=CAIyHDQ1NzZkZjdlYTEzZTg0YTA6Y29tOmVuOlVTOlI&usg=AFQjCNEZdtwQcP-ah2fgyE96vL5YRJgBjg,"""I think everyone""s used to having a co-pay or some sort of cost-share when they""re getting their healthcare, and so that""s probably why they""re thinking...",2021-01-26,Health Cost Sharing
Naturally Slim Predicts New 2021 Trends for Employee Benefits and the Digital Health Market,https://www.google.com/url?rct=j&sa=t&url=https://www.streetinsider.com/Business%2BWire/Naturally%2BSlim%2BPredicts%2BNew%2B2021%2BTrends%2Bfor%2BEmployee%2BBenefits%2Band%2Bthe%2BDigital%2BHealth%2BMarket/17862846.html&ct=ga&cd=CAIyHDQ1NzZkZjdlYTEzZTg0YTA6Y29tOmVuOlVTOlI&usg=AFQjCNEqT7mtmDG4GIy_rD6vxuStLSpo4w,"Heading into the new year, Naturally Slim executives share perspectives on what""s on the horizon for workplace wellness, benefits and digital health ... engagement and start sharing incentive costs for their employees to do so.",2021-01-26,Health Cost Sharing
Federal action on surprise medical bills: What doctors should know,https://www.google.com/url?rct=j&sa=t&url=https://www.ama-assn.org/delivering-care/patient-support-advocacy/federal-action-surprise-medical-bills-what-doctors-should&ct=ga&cd=CAIyHDQ1NzZkZjdlYTEzZTg0YTA6Y29tOmVuOlVTOlI&usg=AFQjCNESmzoCECBjW39A0sVAm7DrzuDHpQ,"... insurer-market dominance, and as patients face unexpected cost sharing through benefit design such as high-deductible health plans,” said Marilyn...",2021-01-26,Health Cost Sharing
"Traveler""s Diarrhea Treatment Market Research and Analysis 2021 to 2025 | Bausch Health ...",https://www.google.com/url?rct=j&sa=t&url=https://www.mccourier.com/travelers-diarrhea-treatment-market-research-and-analysis-2021-to-2025-bausch-health-companies-inc-salix-pharmaceuticals-bristol-myers-squibb-company-cosmo-pharmaceuticals-nv-immuron/&ct=ga&cd=CAIyHDQ1NzZkZjdlYTEzZTg0YTA6Y29tOmVuOlVTOlI&usg=AFQjCNHRHCx4wOecf7Rg2WBhTPGdfAF68w,The costs for these studies will be shared based upon the cost-sharing outlined in the terms of the original collaboration agreement. Also as part of the...,2021-01-26,Health Cost Sharing
We Can Improve Health Care. It Just Takes Compromise.,https://www.google.com/url?rct=j&sa=t&url=https://www.nytimes.com/2021/01/26/opinion/healthcare-biden-congress.html&ct=ga&cd=CAIyHDQ1NzZkZjdlYTEzZTg0YTA6Y29tOmVuOlVTOlI&usg=AFQjCNFs7yNS4_P5zUcj_bRdNIN9uITlTw,A big impediment to cutting costs is that consumers often have little incentive to find lower-priced options for services because their cost-sharing does not...,2021-01-26,Health Cost Sharing
MedPAC may recommend pilot coverage for telehealth post-PHE,https://www.google.com/url?rct=j&sa=t&url=https://www.bioworld.com/articles/502785-medpac-may-recommend-pilot-coverage-for-telehealth-post-phe&ct=ga&cd=CAIyHDQ1NzZkZjdlYTEzZTg0YTA6Y29tOmVuOlVTOlI&usg=AFQjCNEcxEouFfmBILBG_t6dJVlc5C-ETA,"One of the areas of interest is in allowing additional flexibilities for health care professionals that take part in alternative ... while these participants can also waive a beneficiary""s cost-sharing responsibility for telehealth appointments.",2021-01-26,Health Cost Sharing
COVID-19 Update: Global Bike-Sharing Service Market is Expected to Grow at a Healthy CAGR ...,https://www.google.com/url?rct=j&sa=t&url=https://murphyshockeylaw.net/uncategorized/1470748/covid-19-update-global-bike-sharing-service-market-is-expected-to-grow-at-a-healthy-cagr-with-top-players-jump-bikes-citi-bike-limebike-capital-bikeshare-divvy-bikes-etc-inforgrowth/&ct=ga&cd=CAIyHDQ1NzZkZjdlYTEzZTg0YTA6Y29tOmVuOlVTOlI&usg=AFQjCNFq7QZA-K3W91yARb0zhJjRE29InA,"This report also states import/export, supply and consumption figures as well as cost, price, revenue and gross margin by regions. Get Exclusive Free...",2021-01-25,Health Cost Sharing
Bernie Sanders Gets It. We Should All Have Free Health Care During the Pandemic.,https://www.google.com/url?rct=j&sa=t&url=https://www.jacobinmag.com/2021/01/bernie-sanders-health-care-emergency-guarantee-act-coronavirus-hcega&ct=ga&cd=CAIyHDQ1NzZkZjdlYTEzZTg0YTA6Y29tOmVuOlVTOlI&usg=AFQjCNH4aRM8f6Dw6JRod5Zu9wxnU-u30g,"The legislation would also halt medical debt collections, prohibit private insurance companies from increasing cost-sharing, and require ongoing data...",2021-01-25,Health Cost Sharing
How President Biden Can Make The ACA An Even Bigger Deal,https://www.google.com/url?rct=j&sa=t&url=https://www.healthaffairs.org/do/10.1377/hblog20210125.264314/full&ct=ga&cd=CAIyHDQ1NzZkZjdlYTEzZTg0YTA6Y29tOmVuOlVTOlI&usg=AFQjCNE4BcR8hc-uXLX_96SLUT3eEz4TJQ,"However, the 36 states that depend on Healthcare.gov have been shut out of this ... for identifying and sharing the most promising technology innovations. ... in making premiums more affordable and reducing cost-sharing burdens.",2021-01-25,Health Cost Sharing
Not so fast: Pending HHS rules subject to 60-day pause,https://www.google.com/url?rct=j&sa=t&url=https://www.benefitspro.com/2021/01/25/not-so-fast-pending-hhs-rules-subject-to-60-day-pause/&ct=ga&cd=CAIyHDQ1NzZkZjdlYTEzZTg0YTA6Y29tOmVuOlVTOlI&usg=AFQjCNHCY_de0DoEH9cYnfYeirBQN9sc7A,... health plans that were in existence before Obamacare took effect. The rule provides more flexibility to make changes to cost-sharing requirements...,2021-01-25,Health Cost Sharing
"How Top Payers Are Providing COVID-19 Vaccine Coverage, Support",https://www.google.com/url?rct=j&sa=t&url=https://healthpayerintelligence.com/news/how-top-payers-are-providing-covid-19-vaccine-coverage-support&ct=ga&cd=CAIyHDQ1NzZkZjdlYTEzZTg0YTA6Y29tOmVuOlVTOlI&usg=AFQjCNHL7x9GgVDOppRVI3B77n-3vEWWqw,"Aetna waived COVID-19 vaccine cost-sharing for commercial and Medicaid members in compliance with the CARES Act. Meanwhile, the health plan""s...",2021-01-25,Health Cost Sharing
"Where price transparency compliance stands at Mayo Clinic, Providence + 6 other systems",https://www.google.com/url?rct=j&sa=t&url=https://www.beckershospitalreview.com/finance/where-price-transparency-compliance-stands-at-mayo-clinic-providence-6-other-systems.html&ct=ga&cd=CAIyHDQ1NzZkZjdlYTEzZTg0YTA6Y29tOmVuOlVTOlI&usg=AFQjCNFj7MK4rpatxeuQKTFVx0IUNShYdw,"""In 2016, we introduced a healthcare cost estimation telephone consultation service, then added a self-service ... estimate of their out-of-pocket costs for common clinical services as well as expected costs for their prescription drugs.",2021-01-25,Health Cost Sharing
House Ways &amp; Means Committee Issues Report on Improving Chronic Care Management Act,https://www.google.com/url?rct=j&sa=t&url=https://insurancenewsnet.com/oarticle/house-ways-means-committee-issues-report-on-improving-chronic-care-management-act&ct=ga&cd=CAIyHDQ1NzZkZjdlYTEzZTg0YTA6Y29tOmVuOlVTOlI&usg=AFQjCNExacuwOGk-8ZOt6qogsT9ZnrJuNA,"1395l) to eliminate Medicare beneficiary cost-sharing for covered chronic care management (CCM) services provided under Part B beginning January 1,...",2021-01-25,Health Cost Sharing
The Health 202: Hospitals drag feet on new regulations to disclose costs of medical services,https://www.google.com/url?rct=j&sa=t&url=https://www.washingtonpost.com/politics/2021/01/25/health-202-hospitals-drag-feet-new-regulations-disclose-costs-medical-services/&ct=ga&cd=CAIyHDQ1NzZkZjdlYTEzZTg0YTA6Y29tOmVuOlVTOlI&usg=AFQjCNGZdEHqRatPRvu1vNxdq_leXbiKOA,The rules also require hospitals to provide cost-sharing estimates for commonly used procedures in an easily navigable format. A health insurance claim...,2021-01-25,Health Cost Sharing
New Poll: Virginians Want More Transparency in State Health Insurance Regulatory Practices,https://www.google.com/url?rct=j&sa=t&url=https://www.emporiaindependentmessenger.com/news/article_87c414a4-5cde-11eb-96bd-cfeb9e2047ad.html&ct=ga&cd=CAIyHDQ1NzZkZjdlYTEzZTg0YTA6Y29tOmVuOlVTOlI&usg=AFQjCNEAAO4mcyRXEBjB4i7uNXc_5ROebw,Deductibles and other cost sharing have also increased over this period.” Those findings are consistent with an analysis done by the Kaiser Family...,2021-01-23,Health Cost Sharing
Did COVID undo years of health plan cost-containment gains?,https://www.google.com/url?rct=j&sa=t&url=https://www.benefitspro.com/2021/01/26/did-covid-undo-years-of-health-plan-cost-containment-gains/&ct=ga&cd=CAIyHDQ1NzZkZjdlYTEzZTg0YTA6Y29tOmVuOlVTOlI&usg=AFQjCNEHOsIFH1BdP-fQXFEnxCg50hrQ9A,More co-sharing on drug costs; Emphasis on consumerism and health literacy; More creative virtual enrollment and feedback tools connecting plan...,2021-01-01,Health Cost Sharing
Free professional resource-sharing event goes virtual this year,https://www.google.com/url?rct=j&sa=t&url=https://www.thenewsherald.com/news/free-professional-resource-sharing-event-goes-virtual-this-year/article_8e3eb87e-5fff-11eb-bceb-d7d793a480ff.html&ct=ga&cd=CAIyGmU4MWY4MmViNmViOTg5MTE6Y29tOmVuOlVT&usg=AFQjCNH2Ya4gA6Ivmkpc2prntRBWysFqPQ,"It""s a free professional resource-sharing event, designed especially for ... Health, who is also a member of the Healthy Downriver Community Team.",2021-01-26,Health Sharing
"Megan Thee Stallion Shared Her Simple, Yet Effective Secret to Eating Healthy",https://www.google.com/url?rct=j&sa=t&url=https://www.shape.com/celebrities/news/megan-thee-stallion-secret-eating-healthy&ct=ga&cd=CAIyGmU4MWY4MmViNmViOTg5MTE6Y29tOmVuOlVT&usg=AFQjCNE-lBCpdKOKvq95DbYPr1Vdrr1Vgw,"In each post, she""s shown tackling different workouts and making adjustments to her diet, sharing updates with fans along the way. When Megan first...",2021-01-26,Health Sharing
"Matt Hancock: world must reject ""protectionism and narrow nationalism""",https://www.google.com/url?rct=j&sa=t&url=https://www.telegraph.co.uk/global-health/science-and-disease/matt-hancock-world-must-reject-protectionism-narrow-nationalism/&ct=ga&cd=CAIyGmU4MWY4MmViNmViOTg5MTE6Y29tOmVuOlVT&usg=AFQjCNE2WIm-FqhZ5Hjmq07Qfkp5alTeIg,"Health secretary calls for greater international collaboration and pledges to share the UK""s genetic expertise. By Anne Gulland, global health security...",2021-01-26,Health Sharing
Industry Voices—Personal health records are a lynchpin to COVID-19 strategies,https://www.google.com/url?rct=j&sa=t&url=https://www.fiercehealthcare.com/tech/industry-voices-personal-health-records-are-a-lynchpin-to-covid-19-strategies&ct=ga&cd=CAIyGmU4MWY4MmViNmViOTg5MTE6Y29tOmVuOlVT&usg=AFQjCNFxXw88_0KRgYN8PuxlNsn5C1eTdg,This is because many patient records are controlled by healthcare organizations and traditionally live in siloes that prevent physicians from sharing...,2021-01-26,Health Sharing
Healthcare map maker Komodo Health inks data sharing deal with Blue Health Intelligence,https://www.google.com/url?rct=j&sa=t&url=https://www.fiercebiotech.com/medtech/healthcare-mapmaker-komodo-health-inks-data-sharing-deal-blue-health-intelligence&ct=ga&cd=CAIyGmU4MWY4MmViNmViOTg5MTE6Y29tOmVuOlVT&usg=AFQjCNFAejBDwdUJeehNazasVZNV4Qdz3A,"Blue Health Intelligence maintains a large, longitudinal data set built from medical and pharmacy commercial claims that Komodo hopes to integrate...",2021-01-26,Health Sharing
Health Gorilla Contributes 3 Million COVID-19 Test Results to Carequality,https://www.google.com/url?rct=j&sa=t&url=https://www.prnewswire.com/news-releases/health-gorilla-contributes-3-million-covid-19-test-results-to-carequality-301214347.html&ct=ga&cd=CAIyGmU4MWY4MmViNmViOTg5MTE6Y29tOmVuOlVT&usg=AFQjCNEOrAAciMAJbv0GFZG2IiHUzGAAmw,Diagnostic vendors are working with Health Gorilla to share lab results electronically to a national network of providers in a cost-effective way. Health...,2021-01-26,Health Sharing
Standard Technology Presents Opportunities for Medical Record Data Extraction,https://www.google.com/url?rct=j&sa=t&url=https://www.pewtrusts.org/en/research-and-analysis/reports/2021/01/standard-technology-presents-opportunities-for-medical-record-data-extraction&ct=ga&cd=CAIyGmU4MWY4MmViNmViOTg5MTE6Y29tOmVuOlVT&usg=AFQjCNHrxBYxj69N16stuzL3U9ytofH1HQ,"Yet when it comes to accessing and sharing their health information, hospitals and physician""s offices can frequently ask patients to go through...",2021-01-26,Health Sharing
"Parks Associates"" Eighth Annual Connected Health Summit: Consumer Engagement and ...",https://www.google.com/url?rct=j&sa=t&url=https://finance.yahoo.com/news/parks-associates-eighth-annual-connected-142100691.html&ct=ga&cd=CAIyGmU4MWY4MmViNmViOTg5MTE6Y29tOmVuOlVT&usg=AFQjCNEtNFMSOrzNiEmx4reO9Zy0ftomwA,"""With 34% of US broadband households very interested in telehealth services that would allow them to share data from their medical devices, including...",2021-01-26,Health Sharing
Consumers Open to Sharing Personal Data with Insurers But Worry About Data Security,https://www.google.com/url?rct=j&sa=t&url=https://www.insurancejournal.com/news/national/2021/01/26/598872.htm&ct=ga&cd=CAIyGmU4MWY4MmViNmViOTg5MTE6Y29tOmVuOlVT&usg=AFQjCNFTmaQ2Yd3OAURYFbyvbbkaFOt8Fg,The number of consumers willing to share significant data on their health and lifestyle habits with their insurer to reduce premiums has grown over the...,2021-01-26,Health Sharing
Naturally Slim Predicts New 2021 Trends for Employee Benefits and the Digital Health Market,https://www.google.com/url?rct=j&sa=t&url=https://www.streetinsider.com/Business%2BWire/Naturally%2BSlim%2BPredicts%2BNew%2B2021%2BTrends%2Bfor%2BEmployee%2BBenefits%2Band%2Bthe%2BDigital%2BHealth%2BMarket/17862846.html&ct=ga&cd=CAIyGmU4MWY4MmViNmViOTg5MTE6Y29tOmVuOlVT&usg=AFQjCNEqT7mtmDG4GIy_rD6vxuStLSpo4w,"Heading into the new year, Naturally Slim executives share perspectives on what""s on the horizon for workplace wellness, benefits and digital health.",2021-01-26,Health Sharing
PatientsLikeMe Partners With Takeda to Empower Patients and Elevate Patient Voice to the Level ...,https://www.google.com/url?rct=j&sa=t&url=https://finance.yahoo.com/news/patientslikeme-partners-takeda-empower-patients-140000554.html&ct=ga&cd=CAIyGmU4MWY4MmViNmViOTg5MTE6Y29tOmVuOlVT&usg=AFQjCNGJZW-UrY-adE7IRy9_PHKCVFwIIQ,PatientsLikeMe will also work with Takeda in improving shared decision making between patients and healthcare providers through research focused...,2021-01-26,Health Sharing
"Sharing Citizens"" Health Data Without Their Informed Consent Infringes Right To Privacy Under ...",https://www.google.com/url?rct=j&sa=t&url=https://www.livelaw.in/news-updates/karnataka-high-court-privacy-article-21-constitution-aarogya-setu-app-168950&ct=ga&cd=CAIyGmU4MWY4MmViNmViOTg5MTE6Y29tOmVuOlVT&usg=AFQjCNF0SfM61j7MtX9PVnHzVvP0hRMP3Q,"""The sharing of health data of a citizen without his/her consent will necessarily infringe his/her right of privacy under Article 21 of the Constitution of...",2021-01-26,Health Sharing
County health department sponsors radio show for Spanish-speaking residents to share ...,https://www.google.com/url?rct=j&sa=t&url=https://www.eastoregonian.com/coronavirus/county-health-department-sponsors-radio-show-for-spanish-speaking-residents-to-share-experiences-with-covid/article_2abf4246-5dc0-11eb-925f-8734bdb53940.html&ct=ga&cd=CAIyGmU4MWY4MmViNmViOTg5MTE6Y29tOmVuOlVT&usg=AFQjCNGUvK4plAqQaWTBWr2eLj8weZHD4A,"The Umatilla County Public Health Department recently allocated new funding to sponsor the radio show, which broadcasts out of Kennewick,...",2021-01-26,Health Sharing
"HCA forms COVID-19 research consortium with AHRQ, universities",https://www.google.com/url?rct=j&sa=t&url=https://www.modernhealthcare.com/hospital-systems/hca-forms-covid-19-research-consortium-ahrq-universities&ct=ga&cd=CAIyGmU4MWY4MmViNmViOTg5MTE6Y29tOmVuOlVT&usg=AFQjCNERTwsLQi6IrFV79Y4Yqd9ucASZhA,"HCA Healthcare announced Tuesday that it""s sharing its own clinical data with select institutions to be used for research about the coronavirus.",2021-01-26,Health Sharing
Federal action on surprise medical bills: What doctors should know,https://www.google.com/url?rct=j&sa=t&url=https://www.ama-assn.org/delivering-care/patient-support-advocacy/federal-action-surprise-medical-bills-what-doctors-should&ct=ga&cd=CAIyGmU4MWY4MmViNmViOTg5MTE6Y29tOmVuOlVT&usg=AFQjCNESmzoCECBjW39A0sVAm7DrzuDHpQ,"... that stem from insurer-market dominance, and as patients face unexpected cost sharing through benefit design such as high-deductible health plans...",2021-01-26,Health Sharing
Is telemedicine for dentists?,https://www.google.com/url?rct=j&sa=t&url=http://exclusive.multibriefs.com/content/is-telemedicine-for-dentists/communications&ct=ga&cd=CAIyGmU4MWY4MmViNmViOTg5MTE6Y29tOmVuOlVT&usg=AFQjCNGP-PAg8Z0C2uFuGfara09D9kBX_g,Telemedicine allows healthcare professionals to connect with patients ... Using unfamiliar tech for video conferencing and sharing files can be...,2021-01-26,Health Sharing
"J&amp;J Pops On Quarterly Beat, Will ""Soon"" Release Covid Vaccine Test Results",https://www.google.com/url?rct=j&sa=t&url=https://www.investors.com/news/technology/jnj-stock-johnson-johnson-earnings-q4-2020/&ct=ga&cd=CAIyGmU4MWY4MmViNmViOTg5MTE6Y29tOmVuOlVT&usg=AFQjCNFLVe9afK771y9TJ0n7TCP1xPDQjQ,"In premarket trading on the stock market today, JNJ stock jumped 1.9% ... Johnson &amp; Johnson noted the consumer health division was impacted by...",2021-01-26,Health Sharing
"J&amp;J 4Q sales rise despite pandemic, but charges cut profits",https://www.google.com/url?rct=j&sa=t&url=https://www.startribune.com/j-j-4q-sales-rise-despite-pandemic-but-charges-cut-profits/600015148/&ct=ga&cd=CAIyGmU4MWY4MmViNmViOTg5MTE6Y29tOmVuOlVT&usg=AFQjCNF3Atf7odhASVoeuZYSV7ht_Dj31g,"The world""s biggest maker of health care products had a net income of $1.74 billion, or 65 cents per share. That was down from $4.01 billion, or $1.50...",2021-01-26,Health Sharing
CT OBGYN sheds light on important female health topics through social media,https://www.google.com/url?rct=j&sa=t&url=https://www.fox61.com/article/news/local/morning-show/tribe-called-v-norwalk-connecticut-obgyn-pregnancy-parenting/520-747b2dbb-90d5-4433-b19b-afef86e8d6bc&ct=ga&cd=CAIyGmU4MWY4MmViNmViOTg5MTE6Y29tOmVuOlVT&usg=AFQjCNHl06COFjpVGcSO5U7YcG_QPULXOQ,"... sharing videos of short, clear, and casual conversations on often misunderstood health issues like STDs, sex, infertility, pregnancy, and postpartum.",2021-01-26,Health Sharing
"German health minister calls for Europe""s fair share of AstraZeneca vaccine",https://www.google.com/url?rct=j&sa=t&url=https://edition.cnn.com/world/live-news/coronavirus-pandemic-vaccine-updates-01-26-21/h_736a7b9e78ac6c731bc074bd79658624&ct=ga&cd=CAIyGmU4MWY4MmViNmViOTg5MTE6Y29tOmVuOlVT&usg=AFQjCNG6MVjA4DvDpaPzrxtrDbIlbKOPaw,German Health Minister Jens Spahn is throwing his support behind a possible export limit for vaccines manufactured within the European Union amid...,2021-01-26,Health Sharing
"AHIP""s Eyles: Health policy priorities for insurers to watch in 2021",https://www.google.com/url?rct=j&sa=t&url=https://www.fiercehealthcare.com/payer/ahip-s-eyles-health-policy-priorities-for-insurers-to-watch-2021&ct=ga&cd=CAIyHDcyMWE5ZGFiNjRlZGE3MTM6Y29tOmVuOlVTOlI&usg=AFQjCNFdrn8vEjhBo0PcT4jyFDVHsVW9IQ,"America""s Health Insurance Plans (AHIP) is ""hopeful"" that the Biden ... will force health insurers to post negotiated rates and cost-sharing data online,...",2021-01-26,Healthcare Cost Sharing
AHIP launches resource page dedicated to COVID-19 vaccines,https://www.google.com/url?rct=j&sa=t&url=https://www.healthcarefinancenews.com/news/ahip-launches-resource-page-dedicated-covid-19-vaccines&ct=ga&cd=CAIyHDcyMWE5ZGFiNjRlZGE3MTM6Y29tOmVuOlVTOlI&usg=AFQjCNFs0_wkIjfd5K__wDSNnLLfPrSOKg,"Also, private insurers must cover the vaccine without cost sharing from both in and out-of-network providers during the course of the public health...",2021-01-26,Healthcare Cost Sharing
Compliance with ONC and CMS rules could offer growth opportunity,https://www.google.com/url?rct=j&sa=t&url=https://www.healthcareitnews.com/news/compliance-onc-and-cms-rules-could-offer-growth-opportunity&ct=ga&cd=CAIyHDcyMWE5ZGFiNjRlZGE3MTM6Y29tOmVuOlVTOlI&usg=AFQjCNEKwcIDLCP3PmxqlrNfteG4w12F6Q,"""Organizations are required to publish standard charges and negotiated rates with health plans for certain services and share patient data seamlessly...",2021-01-26,Healthcare Cost Sharing
Clearing up Vaccine Cost Confusion,https://www.google.com/url?rct=j&sa=t&url=https://www.wthitv.com/content/news/Clearing-up-Vaccine-Cost-Confusion-573663681.html&ct=ga&cd=CAIyHDcyMWE5ZGFiNjRlZGE3MTM6Y29tOmVuOlVTOlI&usg=AFQjCNEZdtwQcP-ah2fgyE96vL5YRJgBjg,"""I think everyone""s used to having a co-pay or some sort of cost-share when they""re getting their healthcare, and so that""s probably why they""re thinking...",2021-01-26,Healthcare Cost Sharing
Healthcare map maker Komodo Health inks data sharing deal with Blue Health Intelligence,https://www.google.com/url?rct=j&sa=t&url=https://www.fiercebiotech.com/medtech/healthcare-mapmaker-komodo-health-inks-data-sharing-deal-blue-health-intelligence&ct=ga&cd=CAIyHDcyMWE5ZGFiNjRlZGE3MTM6Y29tOmVuOlVTOlI&usg=AFQjCNFAejBDwdUJeehNazasVZNV4Qdz3A,"Previously, Blue Health signed a data partnership with the Health Care Cost Institute to gain access to data from Blue Cross Blue Shield Association...",2021-01-26,Healthcare Cost Sharing
We Can Improve Health Care. It Just Takes Compromise.,https://www.google.com/url?rct=j&sa=t&url=https://www.nytimes.com/2021/01/26/opinion/healthcare-biden-congress.html&ct=ga&cd=CAIyHDcyMWE5ZGFiNjRlZGE3MTM6Y29tOmVuOlVTOlI&usg=AFQjCNFs7yNS4_P5zUcj_bRdNIN9uITlTw,A big impediment to cutting costs is that consumers often have little incentive to find lower-priced options for services because their cost-sharing does not...,2021-01-26,Healthcare Cost Sharing
How Has Pandemic Affected Croatian Healthcare System?,https://www.google.com/url?rct=j&sa=t&url=https://www.total-croatia-news.com/lifestyle/50011-croatian-healthcare-system&ct=ga&cd=CAIyHDcyMWE5ZGFiNjRlZGE3MTM6Y29tOmVuOlVTOlI&usg=AFQjCNFIR7Uvzq6YWziKTpB3ib2k_Ojtdw,"Croatia is the country with the lowest spending on healthcare, although in relative terms it is in third place in terms of its share in GDP, following both...",2021-01-25,Healthcare Cost Sharing
5 Things to Know About the Biden Plan for Older Americans,https://www.google.com/url?rct=j&sa=t&url=https://www.newsmax.com/finance/chrisorestis/seniors-healthcare-medicare-social-security/2021/01/25/id/1007119/&ct=ga&cd=CAIyHDcyMWE5ZGFiNjRlZGE3MTM6Y29tOmVuOlVTOlI&usg=AFQjCNFmw1O7dmuroOhgRWhZWD-gydKj7Q,"Also, allowing drug importation of lower cost alternatives from other ... This practice is not healthy and actually exacerbates the costs of healthcare because ... for eligibility ages, increased cost sharing for Medicare participants, but no...",2021-01-25,Healthcare Cost Sharing
