title,link,item_text,date_published,google_alert_name
Pay More for Your House Than Your Health Care,https://www.google.com/url?rct=j&sa=t&url=https://www.cnsnews.com/index.php/commentary/dr-chad-savage/pay-more-your-house-your-health-care&ct=ga&cd=CAIyHDBlYjRmZTFlNDk3NWE4OGE6Y29tOmVuOlVTOlI&usg=AFQjCNFYWd3A8pYnWT9N-gMyzwIIm5xM3Q,"... I discovered health care sharing ministries. These innovative organizations are based on the Christian principle of sharing each other""s burdens.",2020-09-21,Christian Sharing Ministry
Pay More for Your House Than Your Health Care,https://www.google.com/url?rct=j&sa=t&url=https://www.cnsnews.com/commentary/dr-chad-savage/pay-more-your-house-your-health-care&ct=ga&cd=CAIyHGVmMjU5ZGE1NWJkYjU0NjU6Y29tOmVuOlVTOlI&usg=AFQjCNEbT7Xl4ohimmMgrLYxpjFlpCho2g,"Members share each other""s medical expenses by sending monthly ... Combining a health care sharing ministry with a Direct Primary Care frees the...",2020-09-21,Health Care Sharing Ministry
"The future of Obamacare is at risk again. Here""s what""s at stake",https://www.google.com/url?rct=j&sa=t&url=http://www.wicz.com/story/42660381/the-future-of-obamacare-is-at-risk-again-heres-whats-at-stake&ct=ga&cd=CAIyHDQ1NzZkZjdlYTEzZTg0YTA6Y29tOmVuOlVTOlI&usg=AFQjCNEiKobQJ7KyZ2vk4GtaLjUg_la5Rg,"The Affordable Care Act has meant lower premiums, deductibles and cost-sharing for the more than 60 million senior citizens and disabled Americans...",2020-09-21,Health Cost Sharing
"The future of Obamacare is at risk again. Here""s what""s at stake",https://www.google.com/url?rct=j&sa=t&url=https://www.wral.com/the-future-of-obamacare-is-at-risk-again-heres-whats-at-stake/19297908/&ct=ga&cd=CAIyHDQ1NzZkZjdlYTEzZTg0YTA6Y29tOmVuOlVTOlI&usg=AFQjCNFV2YaIaB53E8xjbCBsV7rRx3bBlQ,"... Care Act has meant lower premiums, deductibles and cost-sharing for the more ... But law did result in higher costs for more affluent beneficiaries.",2020-09-21,Health Cost Sharing
"Humana""s CMO on how COVID pushed the company to ""rethink our role"" with MA members",https://www.google.com/url?rct=j&sa=t&url=https://www.fiercehealthcare.com/payer/humana-s-cmo-how-covid-pushed-company-to-rethink-our-role-ma-members&ct=ga&cd=CAIyHDQ1NzZkZjdlYTEzZTg0YTA6Y29tOmVuOlVTOlI&usg=AFQjCNGVSovPUuMvoxSqfuPtil7rg6FVUQ,"Humana, as well as other insurers, waived cost-sharing for testing for COVID-19, as well urgent care visits and ER visits where COVID tests are...",2020-09-21,Health Cost Sharing
"Lower Costs, Better Outcomes in NJ Shared Accountability Arrangement",https://www.google.com/url?rct=j&sa=t&url=https://njbmagazine.com/njb-news-now/horizon-bcbsnj-atlantic-health-celebrate-success-of-shared-accountability-arrangement/&ct=ga&cd=CAIyHDQ1NzZkZjdlYTEzZTg0YTA6Y29tOmVuOlVTOlI&usg=AFQjCNFQsScTOJTi9IBlg7ACjx8AMLmvtw,"In this innovative model, Atlantic Health shares with Horizon BCBSNJ financial accountability for the health, quality of outcomes, and total cost of care...",2020-09-21,Health Cost Sharing
Tennessee insurers send premium rebates to 143000 members,https://www.google.com/url?rct=j&sa=t&url=https://www.beckershospitalreview.com/payer-issues/tennessee-insurers-send-premium-rebates-to-143-000-members.html&ct=ga&cd=CAIyHDQ1NzZkZjdlYTEzZTg0YTA6Y29tOmVuOlVTOlI&usg=AFQjCNFrsuF_N8_VCoJaCaJ_aT450i26tw,... are issuing rebate checks to Tennessee residents because their healthcare costs were ... When telehealth cost-sharing waivers expire for 5 payers,2020-09-21,Health Cost Sharing
"Time to ditch ""the free care in ER"" guy",https://www.google.com/url?rct=j&sa=t&url=https://azcapitoltimes.com/news/2020/09/21/time-to-ditch-the-free-care-in-er-guy/&ct=ga&cd=CAIyHDQ1NzZkZjdlYTEzZTg0YTA6Y29tOmVuOlVTOlI&usg=AFQjCNEKTGrP53n5vODoU0W0yt5k0QHZ8Q,"Schweikert writes, “Attempting to stay well-informed on healthcare policy ... Cost Sharing, Essential Health Benefits, and bans on annual and lifetime...",2020-09-21,Health Cost Sharing
Sandoz working to overcome barriers to greater biosimilars uptake in US,https://www.google.com/url?rct=j&sa=t&url=https://www.biopharma-reporter.com/Article/2020/09/21/Sandoz-working-to-overcome-barriers-to-greater-biosimilars-uptake-in-US&ct=ga&cd=CAIyHDQ1NzZkZjdlYTEzZTg0YTA6Y29tOmVuOlVTOlI&usg=AFQjCNHEACsua9gciBAmmF8TBBh2IK9AtQ,"The US health system has saved US$1.1bn with the availability of ... market can provide significant cost savings to overburdened health systems and, ... to being the first to overtake the innovator in terms of market share a couple of...",2020-09-21,Health Cost Sharing
Novel Type 2 Diabetes Drugs Incur High Costs in Medicare,https://www.google.com/url?rct=j&sa=t&url=https://www.medscape.com/viewarticle/937732&ct=ga&cd=CAIyHDQ1NzZkZjdlYTEzZTg0YTA6Y29tOmVuOlVTOlI&usg=AFQjCNE-EAsqhCdznQYu9wr43zjMHMopkA,"The researchers examined price and cost-sharing data for six classes of ... ""Because higher copayments lead to poorer adherence and worse health...",2020-09-21,Health Cost Sharing
Pay More for Your House Than Your Health Care,https://www.google.com/url?rct=j&sa=t&url=https://www.cnsnews.com/commentary/dr-chad-savage/pay-more-your-house-your-health-care&ct=ga&cd=CAIyHDQ1NzZkZjdlYTEzZTg0YTA6Y29tOmVuOlVTOlI&usg=AFQjCNEbT7Xl4ohimmMgrLYxpjFlpCho2g,"Members share each other""s medical expenses by sending monthly “shares” directly to fellow participants who are sick. Direct sharing keeps...",2020-09-21,Health Cost Sharing
JOEL MEKLER: Will Medicare cover grief counseling?,https://www.google.com/url?rct=j&sa=t&url=https://www.ncnewsonline.com/news/lifestyles/joel-mekler-will-medicare-cover-grief-counseling/article_9461f307-67b3-5b4d-a708-4e522d8cf28e.html&ct=ga&cd=CAIyHDQ1NzZkZjdlYTEzZTg0YTA6Y29tOmVuOlVTOlI&usg=AFQjCNHU22takZqkSIH3J34a1F7MznzyHg,Both types of plans can lower out-of-pocket costs for mental health services. Medigap plans pick up all or some of the cost-sharing expenses Medicare...,2020-09-21,Health Cost Sharing
3 Software Stocks Share This 1 Key to Success,https://www.google.com/url?rct=j&sa=t&url=https://www.nasdaq.com/articles/3-software-stocks-share-this-1-key-to-success-2020-09-20&ct=ga&cd=CAIyHDQ1NzZkZjdlYTEzZTg0YTA6Y29tOmVuOlVTOlI&usg=AFQjCNHwali7ZHUGT-VCSmke16ncZwjSxA,"While traditional medical imaging systems cost $1 million to $3 million, Nano-X will be dramatically undercutting this market on price.",2020-09-20,Health Cost Sharing
Digital Health Market Current Trends and Future Aspect Analysis 2017 – 2025,https://www.google.com/url?rct=j&sa=t&url=https://insurancenewsnet.com/oarticle/digital-health-market-current-trends-and-future-aspect-analysis-2017-2025&ct=ga&cd=CAIyHDQ1NzZkZjdlYTEzZTg0YTA6Y29tOmVuOlVTOlI&usg=AFQjCNE-53nOAP40lgy-O4_XAY0dDo7fWw,Players are striving hard to provide advanced technology that is also cost effective. Digital technologies help in sharing patient information with other...,2020-09-11,Health Cost Sharing
AMA COVID-19 daily video update: Gender equity issues in health care and during the pandemic,https://www.google.com/url?rct=j&sa=t&url=https://www.ama-assn.org/practice-management/physician-diversity/ama-covid-19-daily-video-update-gender-equity-issues-health&ct=ga&cd=CAIyGmU4MWY4MmViNmViOTg5MTE6Y29tOmVuOlVT&usg=AFQjCNGHTKB4v4LZVlHoA7RydPXu81ndAg,"I""d to share with you, I am exhausted and tired. Dr. Maybank: Yeah, exactly. Unger: Dr. Hammoud, will you continue? Dr. Maybank is really speaking to...",2020-09-21,Health Sharing
Police officers get 2 new bikes for sisters sharing 1,https://www.google.com/url?rct=j&sa=t&url=https://www.wsaz.com/2020/09/21/police-officers-get-2-new-bikes-for-sisters-sharing-1/&ct=ga&cd=CAIyGmU4MWY4MmViNmViOTg5MTE6Y29tOmVuOlVT&usg=AFQjCNHyRPCRp5FHF-VJU9wDYjTI1MQVPw,"Airport officials say they""re “working with the Kanawha-Charleston Health Department to ensure all proper protocols are being followed.”.",2020-09-21,Health Sharing
Elections Saskatchewan to share COVID-19 best practices to municipalities,https://www.google.com/url?rct=j&sa=t&url=https://www.humboldtjournal.ca/news/elections-saskatchewan-to-share-covid-19-best-practices-to-municipalities-1.24206818&ct=ga&cd=CAIyGmU4MWY4MmViNmViOTg5MTE6Y29tOmVuOlVT&usg=AFQjCNGdvBRjou4qzvTpFmCeDdIMf3X0NA,"Dr. Michael Boda, Saskatchewan""s chief electoral officer, said he""s been working closely with Dr. Saqib Shahab, the province""s chief medical health...",2020-09-21,Health Sharing
Joint Statement: KCSD Makes Responsible Decision in Protecting Student and Staff Confidentiality,https://www.google.com/url?rct=j&sa=t&url=https://www.kniakrls.com/2020/09/21/joint-statement-kcsd-makes-responsible-decision-in-protecting-student-and-staff-confidentiality/&ct=ga&cd=CAIyGmU4MWY4MmViNmViOTg5MTE6Y29tOmVuOlVT&usg=AFQjCNGCVmoj9eKr1lH5sND0VETOVE3kbg,"... District""s (KCSD) policy of sharing specific data about COVID-19 cases. ... to share confidential health information about students and staff members.",2020-09-21,Health Sharing
The US balked at this vaccine-sharing effort — but Canada is in,https://www.google.com/url?rct=j&sa=t&url=https://www.thestar.com/news/canada/2020/09/16/the-us-balked-at-this-vaccine-sharing-effort-but-canada-is-in.html&ct=ga&cd=CAIyGmU4MWY4MmViNmViOTg5MTE6Y29tOmVuOlVT&usg=AFQjCNEQWYvGgA7nddstD_3Szc2jU5I6EQ,"It was launched this spring by the World Health Organization and the Bill &amp; Melinda Gates Foundation""s Gavi alliance, among others. While Canada...",2020-09-21,Health Sharing
"Lower Costs, Better Outcomes in NJ Shared Accountability Arrangement",https://www.google.com/url?rct=j&sa=t&url=https://njbmagazine.com/njb-news-now/horizon-bcbsnj-atlantic-health-celebrate-success-of-shared-accountability-arrangement/&ct=ga&cd=CAIyGmU4MWY4MmViNmViOTg5MTE6Y29tOmVuOlVT&usg=AFQjCNFQsScTOJTi9IBlg7ACjx8AMLmvtw,"In this innovative model, Atlantic Health shares with Horizon BCBSNJ financial accountability for the health, quality of outcomes, and total cost of care...",2020-09-21,Health Sharing
Inside the program teaching influencers to talk about mental health,https://www.google.com/url?rct=j&sa=t&url=https://mashable.com/article/social-media-influencers-mental-health/&ct=ga&cd=CAIyGmU4MWY4MmViNmViOTg5MTE6Y29tOmVuOlVT&usg=AFQjCNFUYyYVUh_xLMrN7vfpyMNOKRqfVg,"Finally, they learn about how to share personal stories about their mental health and the importance of including resources in such posts. The digital...",2020-09-21,Health Sharing
Gearing Up for Cold &amp; Flu Season: Registered Dietitian Shares How to Support Immune Health,https://www.google.com/url?rct=j&sa=t&url=http://news4sanantonio.com/sa-living/gearing-up-for-cold-flu-season-registered-dietitian-shares-how-to-support-immune-health&ct=ga&cd=CAIyGmU4MWY4MmViNmViOTg5MTE6Y29tOmVuOlVT&usg=AFQjCNHfrV0gWbIl6PnbJigyUaDvNkOpPw,Stock your pantry with electrolyte-rich options to rehydrate. Get moving: Regular exercise has many health benefits that improve the circulation of...,2020-09-21,Health Sharing
"COVID-19 Update: TechTown""s Toast of the Town Benefit Goes Virtual, Michigan Health Insurers to ...",https://www.google.com/url?rct=j&sa=t&url=https://www.dbusiness.com/daily-news/covid-19-update-techtowns-toast-of-the-town-benefit-goes-virtual-michigan-health-insurers-to-provide-free-virus-testing-and-treatment-through-2020-and-more/&ct=ga&cd=CAIyGmU4MWY4MmViNmViOTg5MTE6Y29tOmVuOlVT&usg=AFQjCNECDKevz27XB6MTDg7m1duqLwe6sw,"To share a business or nonprofit story, please send us a message. By. Tim Keenan and R.J. King. -. September 21, 2020.",2020-09-21,Health Sharing
Gándara Center finds new ways to engage with patients in need of mental health services during ...,https://www.google.com/url?rct=j&sa=t&url=https://www.masslive.com/news/2020/09/gandara-center-finds-new-ways-to-engage-with-patients-in-need-of-mental-health-services-during-covid-19-pandemic.html&ct=ga&cd=CAIyGmU4MWY4MmViNmViOTg5MTE6Y29tOmVuOlVT&usg=AFQjCNGsccU0YWhMD5umwXuEwKNal_Fhqw,"Charlie Baker were both sharing information with us,” said Lois Nesci, CEO of Gándara Center. “There were directives and guidelines we had to...",2020-09-21,Health Sharing
Watch: ICMR Was Blocked From Sharing Sero-Survey Data From COVID-19 Hotspots,https://www.google.com/url?rct=j&sa=t&url=https://thewire.in/health/watch-icmr-was-blocked-from-sharing-sero-survey-data-from-covid-19-hotspots&ct=ga&cd=CAIyGmU4MWY4MmViNmViOTg5MTE6Y29tOmVuOlVT&usg=AFQjCNGItml8I8kSTKUZQ9aT7plFYUu3JA,Sources told The Telegraph that the director-general of the Indian Council of Medical Research (ICMR) Balram Bhargava had asked researchers to...,2020-09-21,Health Sharing
How are you staying active and healthy during the pandemic? Share tips with other Plano residents,https://www.google.com/url?rct=j&sa=t&url=https://www.dallasnews.com/news/healthy-living/2020/09/21/how-are-you-staying-active-and-healthy-during-the-pandemic-share-tips-with-other-plano-residents/&ct=ga&cd=CAIyGmU4MWY4MmViNmViOTg5MTE6Y29tOmVuOlVT&usg=AFQjCNH5e5q6RBBAKoKdogaVla6zRBphVg,The city also plans to share tips and information on how to maintain a healthy lifestyle every day. The social media event is leading up to the National...,2020-09-21,Health Sharing
"Md. health experts share safety tips to stop COVID spread for Halloween, fall celebrations",https://www.google.com/url?rct=j&sa=t&url=http://wjla.com/news/local/md-health-officials-safety-tips-to-stop-covid-spread-for-halloween-fall-celebrations&ct=ga&cd=CAIyGmU4MWY4MmViNmViOTg5MTE6Y29tOmVuOlVT&usg=AFQjCNFy5T2acB-8EZNQ7Ggziv-WDUrR1Q,"With Halloween and fall celebrations starting soon, Howard County health officials are sharing helpful tips to prevent the spread of COVID to keep...",2020-09-21,Health Sharing
"During Recovery Month, and pandemic, fight addiction and overdoses and support recovery",https://www.google.com/url?rct=j&sa=t&url=https://www.desmoinesregister.com/story/opinion/columnists/iowa-view/2020/09/21/covid-19-fight-addiction-and-overdoses/5824247002/&ct=ga&cd=CAIyGmU4MWY4MmViNmViOTg5MTE6Y29tOmVuOlVT&usg=AFQjCNHJq1VPhItKtNN9DjxSSazda8RAIw,Consider your friends and neighbors who may be struggling with mental health and substance use disorders and take steps to share knowledge and...,2020-09-21,Health Sharing
"All-star mental health, social justice radio broadcast announced",https://www.google.com/url?rct=j&sa=t&url=https://themusicuniverse.com/all-star-mental-health-social-justice-radio-broadcast-announced/&ct=ga&cd=CAIyGmU4MWY4MmViNmViOTg5MTE6Y29tOmVuOlVT&usg=AFQjCNER1SA5p_WxJuqQbG-i7FwsPiqIuQ,"Listeners are encouraged to call in for advice or to share a story. Jon Bon Jovi, DJ Khaled, Guns and Roses"" Duff McKagan, Cage the Elephant""s Brad...",2020-09-21,Health Sharing
Duke to lead $1M effort exploring ways to keep patient data secure in days of AI,https://www.google.com/url?rct=j&sa=t&url=https://www.wraltechwire.com/2020/09/21/duke-to-lead-1m-effort-exploring-ways-to-keep-patient-data-secure-in-days-of-ai/&ct=ga&cd=CAIyGmU4MWY4MmViNmViOTg5MTE6Y29tOmVuOlVT&usg=AFQjCNFv525F_sVF9KMYzAL46qKTxVGDfw,... National Science Foundation (NSF) Convergence Accelerator grant to develop a health model sharing and learning platform named LEARNER.,2020-09-21,Health Sharing
"OLLY Announces Nicole Richie As Latest Ambassador, Launches New Female Health Focused ...",https://www.google.com/url?rct=j&sa=t&url=https://www.prnewswire.com/news-releases/olly-announces-nicole-richie-as-latest-ambassador-launches-new-female-health-focused-collection-301134420.html&ct=ga&cd=CAIyGmU4MWY4MmViNmViOTg5MTE6Y29tOmVuOlVT&usg=AFQjCNG_eFba0WS1-soJQnoI9vnBLygyww,"... dialogue about common experiences women can have with their female health, sharing light-hearted and honest moments with their followers.",2020-09-21,Health Sharing
"Scientists don""t share their findings for fun – they want their research to make a difference",https://www.google.com/url?rct=j&sa=t&url=https://theconversation.com/scientists-dont-share-their-findings-for-fun-they-want-their-research-to-make-a-difference-146267&ct=ga&cd=CAIyGmU4MWY4MmViNmViOTg5MTE6Y29tOmVuOlVT&usg=AFQjCNGur1kfBl3ZSb8QPfYUalbCIwndlA,"Scientists don""t share their findings for fun – they want their research to make ... Scientists don""t take time away from their research to share their expertise ... In just one recent week, American President Donald Trump said top health...",2020-09-21,Health Sharing
"I""m Listening: Julia Michaels Shares That Anxiety and Depression Aren""t Her, Just a Part of Her",https://www.google.com/url?rct=j&sa=t&url=https://www.radio.com/im-listening/julia-michaels-anxiety-and-depression-are-just-a-part-of-me&ct=ga&cd=CAIyGmU4MWY4MmViNmViOTg5MTE6Y29tOmVuOlVT&usg=AFQjCNG69m95Zk9pnXiHmfzeycAFqqBtkA,"You are not alone, and by sharing stories, and having healthy conversations around the topic of mental health, it helps achieve our goal. For the...",2020-09-21,Health Sharing
"The Stock Market Is Tanking. Here""s What""s Going Wrong.",https://www.google.com/url?rct=j&sa=t&url=https://www.barrons.com/articles/the-stock-market-is-tanking-heres-whats-going-wrong-51600689538&ct=ga&cd=CAIyGmU4MWY4MmViNmViOTg5MTE6Y29tOmVuOlVT&usg=AFQjCNFp8O8iqqosU7MYKiXPnqyt-OFpig,"Health and Human Services Secretary Alex Azar has moved to bar any health agency from signing new rules on vaccines, medicines, medical devices,...",2020-09-21,Health Sharing
"Humana""s CMO on how COVID pushed the company to ""rethink our role"" with MA members",https://www.google.com/url?rct=j&sa=t&url=https://www.fiercehealthcare.com/payer/humana-s-cmo-how-covid-pushed-company-to-rethink-our-role-ma-members&ct=ga&cd=CAIyHDcyMWE5ZGFiNjRlZGE3MTM6Y29tOmVuOlVTOlI&usg=AFQjCNGVSovPUuMvoxSqfuPtil7rg6FVUQ,"Humana, as well as other insurers, waived cost-sharing for testing for COVID-19, as well urgent care visits and ER visits where COVID tests are...",2020-09-21,Healthcare Cost Sharing
"Lower Costs, Better Outcomes in NJ Shared Accountability Arrangement",https://www.google.com/url?rct=j&sa=t&url=https://njbmagazine.com/njb-news-now/horizon-bcbsnj-atlantic-health-celebrate-success-of-shared-accountability-arrangement/&ct=ga&cd=CAIyHDcyMWE5ZGFiNjRlZGE3MTM6Y29tOmVuOlVTOlI&usg=AFQjCNFQsScTOJTi9IBlg7ACjx8AMLmvtw,"In this innovative model, Atlantic Health shares with Horizon BCBSNJ financial accountability for the health, quality of outcomes, and total cost of care...",2020-09-21,Healthcare Cost Sharing
Tennessee insurers send premium rebates to 143000 members,https://www.google.com/url?rct=j&sa=t&url=https://www.beckershospitalreview.com/payer-issues/tennessee-insurers-send-premium-rebates-to-143-000-members.html&ct=ga&cd=CAIyHDcyMWE5ZGFiNjRlZGE3MTM6Y29tOmVuOlVTOlI&usg=AFQjCNFrsuF_N8_VCoJaCaJ_aT450i26tw,... are issuing rebate checks to Tennessee residents because their healthcare costs were ... When telehealth cost-sharing waivers expire for 5 payers,2020-09-21,Healthcare Cost Sharing
"COVID-19 Update: TechTown""s Toast of the Town Benefit Goes Virtual, Michigan Health Insurers to ...",https://www.google.com/url?rct=j&sa=t&url=https://www.dbusiness.com/daily-news/covid-19-update-techtowns-toast-of-the-town-benefit-goes-virtual-michigan-health-insurers-to-provide-free-virus-testing-and-treatment-through-2020-and-more/&ct=ga&cd=CAIyHDcyMWE5ZGFiNjRlZGE3MTM6Y29tOmVuOlVTOlI&usg=AFQjCNECDKevz27XB6MTDg7m1duqLwe6sw,Total Health Care. The waived cost-sharing applies to commercial health insurance products from the insurers named in the state agreement.,2020-09-21,Healthcare Cost Sharing
"Time to ditch ""the free care in ER"" guy",https://www.google.com/url?rct=j&sa=t&url=https://azcapitoltimes.com/news/2020/09/21/time-to-ditch-the-free-care-in-er-guy/&ct=ga&cd=CAIyHDcyMWE5ZGFiNjRlZGE3MTM6Y29tOmVuOlVTOlI&usg=AFQjCNEKTGrP53n5vODoU0W0yt5k0QHZ8Q,"Schweikert writes, “Attempting to stay well-informed on healthcare policy ... Cost Sharing, Essential Health Benefits, and bans on annual and lifetime...",2020-09-21,Healthcare Cost Sharing
Sandoz working to overcome barriers to greater biosimilars uptake in US,https://www.google.com/url?rct=j&sa=t&url=https://www.biopharma-reporter.com/Article/2020/09/21/Sandoz-working-to-overcome-barriers-to-greater-biosimilars-uptake-in-US&ct=ga&cd=CAIyHDcyMWE5ZGFiNjRlZGE3MTM6Y29tOmVuOlVTOlI&usg=AFQjCNHEACsua9gciBAmmF8TBBh2IK9AtQ,"The US health system has saved US$1.1bn with the availability of ... market can provide significant cost savings to overburdened health systems and, ... to being the first to overtake the innovator in terms of market share a couple of...",2020-09-21,Healthcare Cost Sharing
Pay More for Your House Than Your Health Care,https://www.google.com/url?rct=j&sa=t&url=https://www.cnsnews.com/commentary/dr-chad-savage/pay-more-your-house-your-health-care&ct=ga&cd=CAIyHDcyMWE5ZGFiNjRlZGE3MTM6Y29tOmVuOlVTOlI&usg=AFQjCNEbT7Xl4ohimmMgrLYxpjFlpCho2g,"Members share each other""s medical expenses by sending monthly “shares” directly to fellow participants who are sick. Direct sharing keeps...",2020-09-21,Healthcare Cost Sharing
AMA COVID-19 daily video update: Gender equity issues in health care and during the pandemic,https://www.google.com/url?rct=j&sa=t&url=https://www.ama-assn.org/practice-management/physician-diversity/ama-covid-19-daily-video-update-gender-equity-issues-health&ct=ga&cd=CAIyHDc5M2E3YWM0ZTJjZTM4OWY6Y29tOmVuOlVTOlI&usg=AFQjCNGHTKB4v4LZVlHoA7RydPXu81ndAg,"I""d to share with you, I am exhausted and tired. Dr. Maybank: Yeah, exactly. Unger: Dr. Hammoud, will you continue? Dr. Maybank is really speaking to...",2020-09-21,Medical Sharing
"Home sharing a modern-day housing solution, alternative to assisted living",https://www.google.com/url?rct=j&sa=t&url=https://gazette.com/pikespeakcourier/home-sharing-a-modern-day-housing-solution-alternative-to-assisted-living/article_b47506e8-f83e-11ea-94fd-5bc5357b2f73.html&ct=ga&cd=CAIyHDc5M2E3YWM0ZTJjZTM4OWY6Y29tOmVuOlVTOlI&usg=AFQjCNH_4LHcQU5FNTXwvyyry6yWfwy4sQ,The shared housing is a creative alternative to formal senior housing that they believe could work for others. The three seniors faced serious medical...,2020-09-21,Medical Sharing
Pay More for Your House Than Your Health Care,https://www.google.com/url?rct=j&sa=t&url=https://www.cnsnews.com/index.php/commentary/dr-chad-savage/pay-more-your-house-your-health-care&ct=ga&cd=CAIyHDc5M2E3YWM0ZTJjZTM4OWY6Y29tOmVuOlVTOlI&usg=AFQjCNFYWd3A8pYnWT9N-gMyzwIIm5xM3Q,"Members share each other""s medical expenses by sending monthly “shares” directly to fellow participants who are sick. Direct sharing keeps...",2020-09-21,Medical Sharing
